[I 2024-12-23 18:31:56,154] Trial 17 finished with value: 1.3279722935933798 and parameters: {'n_units_0': 40, 'dropout_1': 0.25, 'run': 3, 'epochs_1': 50, 'epochs_2': 30, 'lr_1': 0.0003179137026688628, 'lr_2': 2.760137217665175e-05, 'batch_size': 12, 'regularization': 'l2', 'reg_alpha_1': 4.640949328625899e-05}. Best is trial 0 with value: 1.0150131668973232.
Statistics value = 29.0 p-value = 0.4609375
1/1 [==============================] - ETA: 0s1/1 [==============================] - 0s 445ms/step
1/1 [==============================] - ETA: 0s1/1 [==============================] - 0s 435ms/step
Statistics value = 10.0 p-value = 0.875
1/1 [==============================] - ETA: 0s1/1 [==============================] - 0s 431ms/step
1/1 [==============================] - ETA: 0s1/1 [==============================] - 0s 405ms/step
Statistics value = 20.0 p-value = 0.7841796875
1/1 [==============================] - ETA: 0s1/1 [==============================] - 0s 384ms/step
1/1 [==============================] - ETA: 0s1/1 [==============================] - 0s 374ms/step
Statistics value = 31.0 p-value = 0.0390625
1/1 [==============================] - ETA: 0s1/1 [==============================] - 0s 400ms/step
1/1 [==============================] - ETA: 0s1/1 [==============================] - 0s 394ms/step
1/1 [==============================] - ETA: 0s1/1 [==============================] - 0s 433ms/step
1/1 [==============================] - ETA: 0s1/1 [==============================] - 0s 393ms/step
1/1 [==============================] - ETA: 0s1/1 [==============================] - 0s 43ms/step
1/1 [==============================] - ETA: 0s1/1 [==============================] - 0s 42ms/step
[I 2024-12-23 18:32:16,517] Trial 19 finished with value: 0.43274512318146885 and parameters: {'n_units_0': 32, 'dropout_1': 0.25, 'run': 2, 'epochs_1': 60, 'epochs_2': 30, 'lr_1': 0.004012134830494741, 'lr_2': 0.00043423797010243954, 'batch_size': 12, 'regularization': 'l1_l2', 'reg_alpha_1': 3.6646764060036446e-05, 'reg_alpha_2': 1.4399587275592257e-05}. Best is trial 15 with value: 0.2879360122905802.
1/1 [==============================] - ETA: 0s1/1 [==============================] - 0s 425ms/step
1/1 [==============================] - ETA: 0s1/1 [==============================] - 0s 401ms/step
1/1 [==============================] - ETA: 0s1/1 [==============================] - 0s 421ms/step
1/1 [==============================] - ETA: 0s1/1 [==============================] - 0s 396ms/step
1/1 [==============================] - ETA: 0s1/1 [==============================] - 0s 50ms/step
1/1 [==============================] - ETA: 0s1/1 [==============================] - 0s 41ms/step
1/1 [==============================] - ETA: 0s1/1 [==============================] - 0s 365ms/step
[I 2024-12-23 18:32:23,775] Trial 19 finished with value: 0.5579859550211059 and parameters: {'n_units_0': 48, 'dropout_1': 0.15000000000000002, 'run': 2, 'epochs_1': 90, 'epochs_2': 80, 'lr_1': 0.009926773324262698, 'lr_2': 0.0004685469795289565, 'batch_size': 12, 'regularization': 'l1_l2', 'reg_alpha_1': 1.5540870379397035e-05, 'reg_alpha_2': 1.0319246113648101e-05}. Best is trial 11 with value: 0.5344313182365734.
1/1 [==============================] - ETA: 0s1/1 [==============================] - 0s 377ms/step
1/1 [==============================] - ETA: 0s1/1 [==============================] - 0s 402ms/step
1/1 [==============================] - ETA: 0s1/1 [==============================] - 0s 462ms/step
1/1 [==============================] - ETA: 0s1/1 [==============================] - 0s 57ms/step
1/1 [==============================] - ETA: 0s1/1 [==============================] - 0s 51ms/step
1/1 [==============================] - ETA: 0s1/1 [==============================] - 0s 407ms/step
1/1 [==============================] - ETA: 0s1/1 [==============================] - 0s 391ms/step
1/1 [==============================] - ETA: 0s1/1 [==============================] - 0s 49ms/step
1/1 [==============================] - ETA: 0s1/1 [==============================] - 0s 41ms/step
Statistics value = 40.0 p-value = 0.1162109375
1/1 [==============================] - ETA: 0s1/1 [==============================] - 0s 364ms/step
1/1 [==============================] - ETA: 0s1/1 [==============================] - 0s 345ms/step
Statistics value = 31.0 p-value = 0.384765625
1/1 [==============================] - ETA: 0s1/1 [==============================] - 0s 364ms/step
1/1 [==============================] - ETA: 0s1/1 [==============================] - 0s 321ms/step
1/1 [==============================] - ETA: 0s1/1 [==============================] - 0s 366ms/step
1/1 [==============================] - ETA: 0s1/1 [==============================] - 0s 327ms/step
1/1 [==============================] - ETA: 0s1/1 [==============================] - 0s 310ms/step
1/1 [==============================] - ETA: 0s1/1 [==============================] - 0s 328ms/step
1/1 [==============================] - ETA: 0s1/1 [==============================] - 0s 359ms/step
1/1 [==============================] - ETA: 0s1/1 [==============================] - 0s 340ms/step
1/1 [==============================] - ETA: 0s1/1 [==============================] - 0s 36ms/step
1/1 [==============================] - ETA: 0s1/1 [==============================] - 0s 32ms/step
[I 2024-12-23 18:33:06,990] Trial 18 finished with value: 0.23669964814460898 and parameters: {'n_units_0': 20, 'dropout_1': 0.1, 'run': 3, 'epochs_1': 60, 'epochs_2': 50, 'lr_1': 0.0003206356209898668, 'lr_2': 0.0001357410577775049, 'batch_size': 12, 'regularization': 'l1_l2', 'reg_alpha_1': 6.0538478325208484e-05, 'reg_alpha_2': 1.4533550875819813e-05}. Best is trial 12 with value: 0.23302035011907202.
1/1 [==============================] - ETA: 0s1/1 [==============================] - 0s 343ms/step
1/1 [==============================] - ETA: 0s1/1 [==============================] - 0s 324ms/step
1/1 [==============================] - ETA: 0s1/1 [==============================] - 0s 34ms/step
1/1 [==============================] - ETA: 0s1/1 [==============================] - 0s 28ms/step
[I 2024-12-23 18:33:13,952] Trial 18 finished with value: 1.4980944374465113 and parameters: {'n_units_0': 24, 'dropout_1': 0.1, 'run': 3, 'epochs_1': 40, 'epochs_2': 50, 'lr_1': 0.0006289111532007969, 'lr_2': 0.0004971475238811887, 'batch_size': 8, 'regularization': 'l1_l2', 'reg_alpha_1': 4.5164594450094275e-05, 'reg_alpha_2': 1.4533550875819813e-05}. Best is trial 0 with value: 1.0150131668973232.
Statistics value = 6.0 p-value = 0.9609375
1/1 [==============================] - ETA: 0s1/1 [==============================] - 0s 355ms/step
1/1 [==============================] - ETA: 0s1/1 [==============================] - 0s 346ms/step
Statistics value = 34.0 p-value = 0.01171875
1/1 [==============================] - ETA: 0s1/1 [==============================] - 0s 355ms/step
1/1 [==============================] - ETA: 0s1/1 [==============================] - 0s 337ms/step
1/1 [==============================] - ETA: 0s1/1 [==============================] - 0s 329ms/step
1/1 [==============================] - ETA: 0s1/1 [==============================] - 0s 431ms/step
1/1 [==============================] - ETA: 0s1/1 [==============================] - 0s 30ms/step
1/1 [==============================] - ETA: 0s1/1 [==============================] - 0s 28ms/step
1/1 [==============================] - ETA: 0s1/1 [==============================] - 0s 335ms/step
1/1 [==============================] - ETA: 0s1/1 [==============================] - 0s 344ms/step
1/1 [==============================] - ETA: 0s1/1 [==============================] - 0s 35ms/step
1/1 [==============================] - ETA: 0s1/1 [==============================] - 0s 30ms/step
Statistics value = 8.0 p-value = 0.9814453125
1/1 [==============================] - ETA: 0s1/1 [==============================] - 0s 349ms/step
1/1 [==============================] - ETA: 0s1/1 [==============================] - 0s 329ms/step
Statistics value = 31.0 p-value = 0.384765625
1/1 [==============================] - ETA: 0s1/1 [==============================] - 0s 352ms/step
1/1 [==============================] - ETA: 0s1/1 [==============================] - 0s 353ms/step
1/1 [==============================] - ETA: 0s1/1 [==============================] - 0s 361ms/step
1/1 [==============================] - ETA: 0s1/1 [==============================] - 0s 349ms/step
1/1 [==============================] - ETA: 0s1/1 [==============================] - 0s 35ms/step
1/1 [==============================] - ETA: 0s1/1 [==============================] - 0s 27ms/step
[I 2024-12-23 18:33:46,276] Trial 19 finished with value: 0.26800181437227466 and parameters: {'n_units_0': 4, 'dropout_1': 0.25, 'run': 2, 'epochs_1': 80, 'epochs_2': 20, 'lr_1': 0.00010197428507077253, 'lr_2': 7.770288806392488e-05, 'batch_size': 12, 'regularization': 'None'}. Best is trial 12 with value: 0.23302035011907202.
1/1 [==============================] - ETA: 0s1/1 [==============================] - 0s 313ms/step
1/1 [==============================] - ETA: 0s1/1 [==============================] - 0s 352ms/step
1/1 [==============================] - ETA: 0s1/1 [==============================] - 0s 33ms/step
1/1 [==============================] - ETA: 0s1/1 [==============================] - 0s 28ms/step
[I 2024-12-23 18:33:52,790] Trial 19 finished with value: 1.1962709712671016 and parameters: {'n_units_0': 16, 'dropout_1': 0.15000000000000002, 'run': 2, 'epochs_1': 90, 'epochs_2': 20, 'lr_1': 0.00018871645923980687, 'lr_2': 1.780331729716588e-05, 'batch_size': 16, 'regularization': 'None'}. Best is trial 0 with value: 1.0150131668973232.
Statistics value = 7.0 p-value = 0.9453125
Statistics value = 23.0 p-value = 0.2734375
Statistics value = 16.0 p-value = 0.62890625
Statistics value = 1.0 p-value = 0.99609375

EVER Study Best parameters:
{'n_units_0': 36, 'dropout_1': 0.25, 'run': 3, 'epochs_1': 40, 'epochs_2': 20, 'lr_1': 0.00010779497125564444, 'lr_2': 0.00023980757674358714, 'batch_size': 12, 'regularization': 'None'}
Best value (Average MSE): 0.23302035011907202

EV Study Best parameters:
{'n_units_0': 24, 'dropout_1': 0.3, 'run': 3, 'epochs_1': 70, 'epochs_2': 30, 'lr_1': 0.00020511104188433984, 'lr_2': 1.3066739238053272e-05, 'batch_size': 16, 'regularization': 'None'}
Best value (Average MSE): 1.0150131668973232

PHEV Study Best parameters:
{'n_units_0': 32, 'dropout_1': 0.1, 'run': 2, 'epochs_1': 80, 'epochs_2': 100, 'lr_1': 0.008234579469570416, 'lr_2': 0.0003641686745841244, 'batch_size': 12, 'regularization': 'None'}
Best value (Average MSE): 0.5344313182365734

FUEL Study Best parameters:
{'n_units_0': 20, 'dropout_1': 0.25, 'run': 2, 'epochs_1': 40, 'epochs_2': 70, 'lr_1': 0.00010132245891005802, 'lr_2': 9.029245888295042e-05, 'batch_size': 12, 'regularization': 'l1_l2', 'reg_alpha_1': 1.2068605164306045e-05, 'reg_alpha_2': 0.00010362161015212055}
Best value (Average MSE): 0.2879360122905802
