[I 2024-12-23 16:15:55,824] Trial 18 finished with value: 0.6338471859216879 and parameters: {'n_units_0': 24, 'dropout_1': 0.1, 'run': 3, 'epochs_1': 40, 'epochs_2': 50, 'lr_1': 0.0006289111532007969, 'lr_2': 0.0004971475238811887, 'batch_size': 8, 'regularization': 'l1_l2', 'reg_alpha_1': 4.5164594450094275e-05, 'reg_alpha_2': 1.4533550875819813e-05}. Best is trial 0 with value: 0.5606847346796215.
1/1 [==============================] - ETA: 0s1/1 [==============================] - 0s 419ms/step
1/1 [==============================] - ETA: 0s1/1 [==============================] - 0s 399ms/step
1/1 [==============================] - ETA: 0s1/1 [==============================] - 0s 46ms/step
1/1 [==============================] - ETA: 0s1/1 [==============================] - 0s 48ms/step
Statistics value = 19.0 p-value = 0.47265625
1/1 [==============================] - ETA: 0s1/1 [==============================] - 0s 415ms/step
1/1 [==============================] - ETA: 0s1/1 [==============================] - 0s 380ms/step
Statistics value = 47.0 p-value = 0.0244140625
1/1 [==============================] - ETA: 0s1/1 [==============================] - 0s 419ms/step
1/1 [==============================] - ETA: 0s1/1 [==============================] - 0s 394ms/step
1/1 [==============================] - ETA: 0s1/1 [==============================] - 0s 392ms/step
1/1 [==============================] - ETA: 0s1/1 [==============================] - 0s 400ms/step
1/1 [==============================] - ETA: 0s1/1 [==============================] - 0s 39ms/step
1/1 [==============================] - ETA: 0s1/1 [==============================] - 0s 46ms/step
1/1 [==============================] - ETA: 0s1/1 [==============================] - 0s 423ms/step
1/1 [==============================] - ETA: 0s1/1 [==============================] - 0s 410ms/step
Statistics value = 44.0 p-value = 0.052734375
1/1 [==============================] - ETA: 0s1/1 [==============================] - 0s 394ms/step
1/1 [==============================] - ETA: 0s1/1 [==============================] - 0s 46ms/step
1/1 [==============================] - ETA: 0s1/1 [==============================] - 0s 44ms/step
1/1 [==============================] - ETA: 0s1/1 [==============================] - 0s 399ms/step
[I 2024-12-23 16:16:35,088] Trial 19 finished with value: 1.160407520804037 and parameters: {'n_units_0': 16, 'dropout_1': 0.15000000000000002, 'run': 2, 'epochs_1': 90, 'epochs_2': 20, 'lr_1': 0.00018871645923980687, 'lr_2': 0.00016751333576213952, 'batch_size': 16, 'regularization': 'None'}. Best is trial 8 with value: 1.0949065907374003.
1/1 [==============================] - ETA: 0s1/1 [==============================] - 0s 400ms/step
1/1 [==============================] - ETA: 0s1/1 [==============================] - 0s 400ms/step
1/1 [==============================] - ETA: 0s1/1 [==============================] - 0s 55ms/step
1/1 [==============================] - ETA: 0s1/1 [==============================] - 0s 41ms/step
[I 2024-12-23 16:16:48,497] Trial 19 finished with value: 0.6218826079520288 and parameters: {'n_units_0': 16, 'dropout_1': 0.15000000000000002, 'run': 2, 'epochs_1': 90, 'epochs_2': 20, 'lr_1': 0.00018871645923980687, 'lr_2': 1.780331729716588e-05, 'batch_size': 16, 'regularization': 'None'}. Best is trial 0 with value: 0.5606847346796215.
Statistics value = 26.0 p-value = 0.15625
Statistics value = 31.0 p-value = 0.0390625
Statistics value = 28.0 p-value = 0.09765625
Statistics value = 25.0 p-value = 0.19140625

EVER Study Best parameters:
{'n_units_0': 16, 'dropout_1': 0.2, 'run': 3, 'epochs_1': 40, 'epochs_2': 20, 'lr_1': 0.0003797544798678418, 'lr_2': 2.101079931010355e-05, 'batch_size': 16, 'regularization': 'l2', 'reg_alpha_1': 3.6283583803549155e-05}
Best value (Average MSE): 0.23274445376694547

EV Study Best parameters:
{'n_units_0': 16, 'dropout_1': 0.2, 'run': 3, 'epochs_1': 40, 'epochs_2': 20, 'lr_1': 0.0003797544798678418, 'lr_2': 2.101079931010355e-05, 'batch_size': 16, 'regularization': 'l2', 'reg_alpha_1': 3.6283583803549155e-05}
Best value (Average MSE): 1.0949065907374003

PHEV Study Best parameters:
{'n_units_0': 24, 'dropout_1': 0.3, 'run': 3, 'epochs_1': 70, 'epochs_2': 30, 'lr_1': 0.00020511104188433984, 'lr_2': 1.3066739238053272e-05, 'batch_size': 16, 'regularization': 'None'}
Best value (Average MSE): 0.5606847346796215

FUEL Study Best parameters:
{'n_units_0': 16, 'dropout_1': 0.2, 'run': 2, 'epochs_1': 30, 'epochs_2': 70, 'lr_1': 0.00021930485556643703, 'lr_2': 1.3492834268013232e-05, 'batch_size': 16, 'regularization': 'l1_l2', 'reg_alpha_1': 0.0011290133559092666, 'reg_alpha_2': 0.00020914981329035596}
Best value (Average MSE): 0.28403899835733204
