[I 2024-12-23 16:16:10,204] Trial 18 finished with value: 0.24044375315092104 and parameters: {'n_units_0': 16, 'dropout_1': 0.15000000000000002, 'run': 3, 'epochs_1': 30, 'epochs_2': 50, 'lr_1': 0.0008190190944943499, 'lr_2': 2.2321056191513992e-05, 'batch_size': 8, 'regularization': 'l1', 'reg_alpha_1': 6.122335615802093e-05}. Best is trial 8 with value: 0.23325338811708746.
Statistics value = 14.0 p-value = 0.7265625
1/1 [==============================] - ETA: 0s1/1 [==============================] - 0s 427ms/step
1/1 [==============================] - ETA: 0s1/1 [==============================] - 0s 417ms/step
1/1 [==============================] - ETA: 0s1/1 [==============================] - 0s 472ms/step
1/1 [==============================] - ETA: 0s1/1 [==============================] - 0s 449ms/step
1/1 [==============================] - ETA: 0s1/1 [==============================] - 0s 430ms/step
1/1 [==============================] - ETA: 0s1/1 [==============================] - 0s 423ms/step
1/1 [==============================] - ETA: 0s1/1 [==============================] - 0s 44ms/step
1/1 [==============================] - ETA: 0s1/1 [==============================] - 0s 39ms/step
Statistics value = 42.0 p-value = 0.080078125
1/1 [==============================] - ETA: 0s1/1 [==============================] - 0s 419ms/step
1/1 [==============================] - ETA: 0s1/1 [==============================] - 0s 413ms/step
1/1 [==============================] - ETA: 0s1/1 [==============================] - 0s 421ms/step
1/1 [==============================] - ETA: 0s1/1 [==============================] - 0s 398ms/step
1/1 [==============================] - ETA: 0s1/1 [==============================] - 0s 419ms/step
1/1 [==============================] - ETA: 0s1/1 [==============================] - 0s 404ms/step
1/1 [==============================] - ETA: 0s1/1 [==============================] - 0s 54ms/step
1/1 [==============================] - ETA: 0s1/1 [==============================] - 0s 46ms/step
[I 2024-12-23 16:17:38,658] Trial 19 finished with value: 0.24084572178297003 and parameters: {'n_units_0': 32, 'dropout_1': 0.1, 'run': 3, 'epochs_1': 60, 'epochs_2': 70, 'lr_1': 0.0001071623979726951, 'lr_2': 7.057125580710732e-05, 'batch_size': 16, 'regularization': 'l2', 'reg_alpha_1': 1.1880859974359409e-05}. Best is trial 8 with value: 0.23325338811708746.
Statistics value = 33.0 p-value = 0.01953125
Statistics value = 23.0 p-value = 0.2734375
Statistics value = 20.0 p-value = 0.421875
Statistics value = 23.0 p-value = 0.2734375

EVER Study Best parameters:
{'n_units_0': 16, 'dropout_1': 0.2, 'run': 3, 'epochs_1': 40, 'epochs_2': 20, 'lr_1': 0.0003797544798678418, 'lr_2': 2.101079931010355e-05, 'batch_size': 16, 'regularization': 'l2', 'reg_alpha_1': 3.6283583803549155e-05}
Best value (Average MSE): 0.23325338811708746

EV Study Best parameters:
{'n_units_0': 44, 'dropout_1': 0.25, 'run': 2, 'epochs_1': 50, 'epochs_2': 20, 'lr_1': 0.00012427889293047006, 'lr_2': 0.00017340750366137944, 'batch_size': 12, 'regularization': 'l1', 'reg_alpha_1': 0.0010614983432824354}
Best value (Average MSE): 1.1668980868801901

PHEV Study Best parameters:
{'n_units_0': 24, 'dropout_1': 0.3, 'run': 3, 'epochs_1': 70, 'epochs_2': 30, 'lr_1': 0.00020511104188433984, 'lr_2': 1.3066739238053272e-05, 'batch_size': 16, 'regularization': 'None'}
Best value (Average MSE): 0.48275019641177624

FUEL Study Best parameters:
{'n_units_0': 16, 'dropout_1': 0.2, 'run': 2, 'epochs_1': 30, 'epochs_2': 70, 'lr_1': 0.00021930485556643703, 'lr_2': 1.3492834268013232e-05, 'batch_size': 16, 'regularization': 'l1_l2', 'reg_alpha_1': 0.0011290133559092666, 'reg_alpha_2': 0.00020914981329035596}
Best value (Average MSE): 0.28805260021606854
