[I 2024-12-23 20:44:22,394] Trial 8 finished with value: 0.2377995074766222 and parameters: {'n_units_0': 16, 'dropout_1': 0.2, 'run': 3, 'epochs_1': 40, 'epochs_2': 20, 'lr_1': 0.0003797544798678418, 'lr_2': 2.101079931010355e-05, 'batch_size': 16, 'regularization': 'l2', 'reg_alpha_1': 3.6283583803549155e-05}. Best is trial 5 with value: 0.2324022591686981.
Statistics value = 17.0 p-value = 0.8623046875
1/1 [==============================] - ETA: 0s1/1 [==============================] - 0s 460ms/step
1/1 [==============================] - ETA: 0s1/1 [==============================] - 0s 410ms/step
1/1 [==============================] - ETA: 0s1/1 [==============================] - 1s 635ms/step
1/1 [==============================] - ETA: 0s1/1 [==============================] - 1s 605ms/step
Statistics value = 7.0 p-value = 0.9453125
1/1 [==============================] - ETA: 0s1/1 [==============================] - 0s 477ms/step
Statistics value = 15.0 p-value = 0.6796875
1/1 [==============================] - ETA: 0s1/1 [==============================] - 0s 419ms/step
Statistics value = 23.0 p-value = 0.2734375
1/1 [==============================] - ETA: 0s1/1 [==============================] - 1s 559ms/step
1/1 [==============================] - ETA: 0s1/1 [==============================] - 0s 424ms/step
1/1 [==============================] - ETA: 0s1/1 [==============================] - 0s 425ms/step
1/1 [==============================] - ETA: 0s1/1 [==============================] - 0s 428ms/step
1/1 [==============================] - ETA: 0s1/1 [==============================] - 0s 457ms/step
1/1 [==============================] - ETA: 0s1/1 [==============================] - 0s 454ms/step
1/1 [==============================] - ETA: 0s1/1 [==============================] - 0s 56ms/step
1/1 [==============================] - ETA: 0s1/1 [==============================] - 0s 47ms/step
[I 2024-12-23 20:44:50,317] Trial 8 finished with value: 0.5444094279064726 and parameters: {'n_units_0': 16, 'dropout_1': 0.2, 'run': 3, 'epochs_1': 40, 'epochs_2': 20, 'lr_1': 0.0003797544798678418, 'lr_2': 2.101079931010355e-05, 'batch_size': 16, 'regularization': 'l2', 'reg_alpha_1': 3.6283583803549155e-05}. Best is trial 8 with value: 0.5444094279064726.
1/1 [==============================] - ETA: 0s1/1 [==============================] - 0s 443ms/step
1/1 [==============================] - ETA: 0s1/1 [==============================] - 0s 426ms/step
1/1 [==============================] - ETA: 0s1/1 [==============================] - 1s 522ms/step
1/1 [==============================] - ETA: 0s1/1 [==============================] - 0s 388ms/step
1/1 [==============================] - ETA: 0s1/1 [==============================] - 0s 406ms/step
1/1 [==============================] - ETA: 0s1/1 [==============================] - 0s 398ms/step
Statistics value = 2.0 p-value = 0.9921875
1/1 [==============================] - ETA: 0s1/1 [==============================] - 1s 502ms/step
1/1 [==============================] - ETA: 0s1/1 [==============================] - 0s 427ms/step
1/1 [==============================] - ETA: 0s1/1 [==============================] - 0s 423ms/step
1/1 [==============================] - ETA: 0s1/1 [==============================] - 0s 473ms/step
1/1 [==============================] - ETA: 0s1/1 [==============================] - 1s 565ms/step
1/1 [==============================] - ETA: 0s1/1 [==============================] - 0s 413ms/step
1/1 [==============================] - ETA: 0s1/1 [==============================] - 0s 421ms/step
1/1 [==============================] - ETA: 0s1/1 [==============================] - 0s 433ms/step
1/1 [==============================] - ETA: 0s1/1 [==============================] - 0s 49ms/step
1/1 [==============================] - ETA: 0s1/1 [==============================] - 0s 99ms/step
1/1 [==============================] - ETA: 0s1/1 [==============================] - 0s 101ms/step
1/1 [==============================] - ETA: 0s1/1 [==============================] - 0s 107ms/step
1/1 [==============================] - ETA: 0s1/1 [==============================] - 0s 147ms/step
1/1 [==============================] - ETA: 0s1/1 [==============================] - 0s 114ms/step
1/1 [==============================] - ETA: 0s1/1 [==============================] - 0s 439ms/step
1/1 [==============================] - ETA: 0s1/1 [==============================] - 0s 396ms/step
Statistics value = 31.0 p-value = 0.384765625
1/1 [==============================] - ETA: 0s1/1 [==============================] - 1s 520ms/step
Statistics value = 47.0 p-value = 0.0244140625
1/1 [==============================] - ETA: 0s1/1 [==============================] - 1s 535ms/step
Statistics value = 37.0 p-value = 0.1875
1/1 [==============================] - ETA: 0s1/1 [==============================] - 0s 458ms/step
1/1 [==============================] - ETA: 0s1/1 [==============================] - 0s 414ms/step
1/1 [==============================] - ETA: 0s1/1 [==============================] - 0s 416ms/step
1/1 [==============================] - ETA: 0s1/1 [==============================] - 0s 468ms/step
1/1 [==============================] - ETA: 0s1/1 [==============================] - 0s 454ms/step
1/1 [==============================] - ETA: 0s1/1 [==============================] - 0s 411ms/step
1/1 [==============================] - ETA: 0s1/1 [==============================] - 0s 54ms/step
1/1 [==============================] - ETA: 0s1/1 [==============================] - 0s 47ms/step
1/1 [==============================] - ETA: 0s1/1 [==============================] - 0s 474ms/step
1/1 [==============================] - ETA: 0s1/1 [==============================] - 1s 527ms/step
1/1 [==============================] - ETA: 0s1/1 [==============================] - 0s 430ms/step
1/1 [==============================] - ETA: 0s1/1 [==============================] - 0s 424ms/step
1/1 [==============================] - ETA: 0s1/1 [==============================] - 0s 463ms/step
1/1 [==============================] - ETA: 0s1/1 [==============================] - 0s 464ms/step
Statistics value = 34.0 p-value = 0.2783203125
1/1 [==============================] - ETA: 0s1/1 [==============================] - 0s 409ms/step
1/1 [==============================] - ETA: 0s1/1 [==============================] - 0s 377ms/step
1/1 [==============================] - ETA: 0s1/1 [==============================] - 0s 451ms/step
1/1 [==============================] - ETA: 0s1/1 [==============================] - 0s 456ms/step
1/1 [==============================] - ETA: 0s1/1 [==============================] - 0s 493ms/step
1/1 [==============================] - ETA: 0s1/1 [==============================] - 0s 479ms/step
1/1 [==============================] - ETA: 0s1/1 [==============================] - 0s 426ms/step
1/1 [==============================] - ETA: 0s1/1 [==============================] - 0s 482ms/step
1/1 [==============================] - ETA: 0s1/1 [==============================] - 0s 49ms/step
1/1 [==============================] - ETA: 0s1/1 [==============================] - 0s 44ms/step
1/1 [==============================] - ETA: 0s1/1 [==============================] - 0s 53ms/step
1/1 [==============================] - ETA: 0s1/1 [==============================] - 0s 83ms/step
1/1 [==============================] - ETA: 0s1/1 [==============================] - 0s 48ms/step
1/1 [==============================] - ETA: 0s1/1 [==============================] - 0s 97ms/step
[I 2024-12-23 20:46:10,500] Trial 9 finished with value: 0.33593987669561964 and parameters: {'n_units_0': 60, 'dropout_1': 0.2, 'run': 3, 'epochs_1': 100, 'epochs_2': 40, 'lr_1': 0.00016599837974449222, 'lr_2': 2.8567374298471872e-05, 'batch_size': 12, 'regularization': 'l1', 'reg_alpha_1': 0.000178744632562384}. Best is trial 2 with value: 0.2846803112753509.
[I 2024-12-23 20:46:10,517] Trial 9 finished with value: 1.4679541360099344 and parameters: {'n_units_0': 60, 'dropout_1': 0.2, 'run': 3, 'epochs_1': 100, 'epochs_2': 40, 'lr_1': 0.00016599837974449222, 'lr_2': 2.8567374298471872e-05, 'batch_size': 12, 'regularization': 'l1', 'reg_alpha_1': 0.000178744632562384}. Best is trial 8 with value: 1.0469849464594678.
[I 2024-12-23 20:46:10,600] Trial 9 finished with value: 0.24170560294901128 and parameters: {'n_units_0': 60, 'dropout_1': 0.2, 'run': 3, 'epochs_1': 100, 'epochs_2': 40, 'lr_1': 0.00016599837974449222, 'lr_2': 2.8567374298471872e-05, 'batch_size': 12, 'regularization': 'l1', 'reg_alpha_1': 0.000178744632562384}. Best is trial 5 with value: 0.2324022591686981.
1/1 [==============================] - ETA: 0s1/1 [==============================] - 0s 467ms/step
1/1 [==============================] - ETA: 0s1/1 [==============================] - 0s 413ms/step
Statistics value = 35.0 p-value = 0.0078125
1/1 [==============================] - ETA: 0s1/1 [==============================] - 0s 457ms/step
Statistics value = 8.0 p-value = 0.92578125
1/1 [==============================] - ETA: 0s1/1 [==============================] - 0s 439ms/step
Statistics value = 21.0 p-value = 0.37109375
1/1 [==============================] - ETA: 0s1/1 [==============================] - 1s 501ms/step
1/1 [==============================] - ETA: 0s1/1 [==============================] - 0s 472ms/step
1/1 [==============================] - ETA: 0s1/1 [==============================] - 0s 459ms/step
1/1 [==============================] - ETA: 0s1/1 [==============================] - 0s 49ms/step
1/1 [==============================] - ETA: 0s1/1 [==============================] - 0s 61ms/step
1/1 [==============================] - ETA: 0s1/1 [==============================] - 0s 438ms/step
1/1 [==============================] - ETA: 0s1/1 [==============================] - 0s 381ms/step
1/1 [==============================] - ETA: 0s1/1 [==============================] - 0s 384ms/step
1/1 [==============================] - ETA: 0s1/1 [==============================] - 0s 52ms/step
1/1 [==============================] - ETA: 0s1/1 [==============================] - 0s 63ms/step
[I 2024-12-23 20:46:34,829] Trial 9 finished with value: 0.6357882314176752 and parameters: {'n_units_0': 60, 'dropout_1': 0.2, 'run': 3, 'epochs_1': 100, 'epochs_2': 40, 'lr_1': 0.00016599837974449222, 'lr_2': 2.8567374298471872e-05, 'batch_size': 12, 'regularization': 'l1', 'reg_alpha_1': 0.000178744632562384}. Best is trial 8 with value: 0.5444094279064726.
Statistics value = 7.0 p-value = 0.986328125
1/1 [==============================] - ETA: 0s1/1 [==============================] - 0s 404ms/step
1/1 [==============================] - ETA: 0s1/1 [==============================] - 0s 427ms/step
1/1 [==============================] - ETA: 0s1/1 [==============================] - 0s 52ms/step
1/1 [==============================] - ETA: 0s1/1 [==============================] - 0s 57ms/step
[I 2024-12-23 20:46:48,683] Trial 10 finished with value: 0.2646087863433655 and parameters: {'n_units_0': 36, 'dropout_1': 0.1, 'run': 1, 'epochs_1': 80, 'epochs_2': 100, 'lr_1': 0.006536264082965737, 'lr_2': 0.0002888908524619867, 'batch_size': 12, 'regularization': 'l2', 'reg_alpha_1': 1.0887633888418048e-05}. Best is trial 5 with value: 0.2324022591686981.
1/1 [==============================] - ETA: 0s1/1 [==============================] - 0s 433ms/step
1/1 [==============================] - ETA: 0s1/1 [==============================] - 0s 408ms/step
1/1 [==============================] - ETA: 0s1/1 [==============================] - 0s 45ms/step
1/1 [==============================] - ETA: 0s1/1 [==============================] - 0s 470ms/step
1/1 [==============================] - ETA: 0s1/1 [==============================] - 0s 59ms/step
1/1 [==============================] - ETA: 0s1/1 [==============================] - 0s 407ms/step
1/1 [==============================] - ETA: 0s1/1 [==============================] - 0s 44ms/step
1/1 [==============================] - ETA: 0s1/1 [==============================] - 0s 67ms/step
Statistics value = 20.0 p-value = 0.421875
1/1 [==============================] - ETA: 0s1/1 [==============================] - 0s 469ms/step
1/1 [==============================] - ETA: 0s1/1 [==============================] - 0s 437ms/step
Statistics value = 5.0 p-value = 0.97265625
1/1 [==============================] - ETA: 0s1/1 [==============================] - 0s 457ms/step
1/1 [==============================] - ETA: 0s1/1 [==============================] - 0s 399ms/step
Statistics value = 6.0 p-value = 0.990234375
1/1 [==============================] - ETA: 0s1/1 [==============================] - 0s 385ms/step
1/1 [==============================] - ETA: 0s1/1 [==============================] - 0s 421ms/step
Statistics value = 24.0 p-value = 0.65234375
1/1 [==============================] - ETA: 0s1/1 [==============================] - 0s 407ms/step
1/1 [==============================] - ETA: 0s1/1 [==============================] - 0s 468ms/step
1/1 [==============================] - ETA: 0s1/1 [==============================] - 1s 524ms/step
1/1 [==============================] - ETA: 0s1/1 [==============================] - 0s 405ms/step
1/1 [==============================] - ETA: 0s1/1 [==============================] - 0s 48ms/step
1/1 [==============================] - ETA: 0s1/1 [==============================] - 0s 52ms/step
1/1 [==============================] - ETA: 0s1/1 [==============================] - 1s 511ms/step
1/1 [==============================] - ETA: 0s1/1 [==============================] - 1s 506ms/step
1/1 [==============================] - ETA: 0s1/1 [==============================] - 0s 451ms/step
1/1 [==============================] - ETA: 0s1/1 [==============================] - 1s 531ms/step
1/1 [==============================] - ETA: 0s1/1 [==============================] - 0s 42ms/step
1/1 [==============================] - ETA: 0s1/1 [==============================] - 0s 59ms/step
1/1 [==============================] - ETA: 0s1/1 [==============================] - 0s 42ms/step
1/1 [==============================] - ETA: 0s1/1 [==============================] - 0s 59ms/step
1/1 [==============================] - ETA: 0s1/1 [==============================] - 1s 629ms/step
[I 2024-12-23 20:47:21,707] Trial 10 finished with value: 2.974200950224423 and parameters: {'n_units_0': 36, 'dropout_1': 0.1, 'run': 2, 'epochs_1': 80, 'epochs_2': 90, 'lr_1': 0.006536264082965737, 'lr_2': 0.0003400662576138287, 'batch_size': 12, 'regularization': 'l2', 'reg_alpha_1': 1.095292710677685e-05}. Best is trial 8 with value: 1.0469849464594678.
1/1 [==============================] - ETA: 0s1/1 [==============================] - 0s 392ms/step
1/1 [==============================] - ETA: 0s1/1 [==============================] - 0s 39ms/step
1/1 [==============================] - ETA: 0s1/1 [==============================] - 0s 50ms/step
