[I 2024-12-23 18:27:16,306] Trial 13 finished with value: 1.5427265366495149 and parameters: {'n_units_0': 44, 'dropout_1': 0.25, 'run': 3, 'epochs_1': 60, 'epochs_2': 20, 'lr_1': 0.00034330953139189325, 'lr_2': 0.0008106561872514704, 'batch_size': 16, 'regularization': 'l2', 'reg_alpha_1': 1.095017215723929e-05}. Best is trial 0 with value: 1.0150131668973232.
1/1 [==============================] - ETA: 0s1/1 [==============================] - 0s 412ms/step
1/1 [==============================] - ETA: 0s1/1 [==============================] - 0s 389ms/step
1/1 [==============================] - ETA: 0s1/1 [==============================] - 0s 424ms/step
Statistics value = 3.0 p-value = 0.98828125
1/1 [==============================] - ETA: 0s1/1 [==============================] - 0s 405ms/step
1/1 [==============================] - ETA: 0s1/1 [==============================] - 0s 388ms/step
1/1 [==============================] - ETA: 0s1/1 [==============================] - 0s 51ms/step
1/1 [==============================] - ETA: 0s1/1 [==============================] - 0s 415ms/step
1/1 [==============================] - ETA: 0s1/1 [==============================] - 0s 55ms/step
1/1 [==============================] - ETA: 0s1/1 [==============================] - 0s 414ms/step
1/1 [==============================] - ETA: 0s1/1 [==============================] - 0s 400ms/step
1/1 [==============================] - ETA: 0s1/1 [==============================] - 0s 58ms/step
Statistics value = 33.0 p-value = 0.01953125
1/1 [==============================] - ETA: 0s1/1 [==============================] - 0s 410ms/step
1/1 [==============================] - ETA: 0s1/1 [==============================] - 0s 41ms/step
1/1 [==============================] - ETA: 0s1/1 [==============================] - 0s 390ms/step
[I 2024-12-23 18:27:32,106] Trial 14 finished with value: 0.40621708842395887 and parameters: {'n_units_0': 64, 'dropout_1': 0.15000000000000002, 'run': 3, 'epochs_1': 30, 'epochs_2': 50, 'lr_1': 0.001841347660097828, 'lr_2': 2.2254614713958383e-05, 'batch_size': 16, 'regularization': 'l1_l2', 'reg_alpha_1': 5.847983270337971e-05, 'reg_alpha_2': 0.0007708764500743201}. Best is trial 4 with value: 0.28874593518049796.
1/1 [==============================] - ETA: 0s1/1 [==============================] - 0s 434ms/step
1/1 [==============================] - ETA: 0s1/1 [==============================] - 0s 391ms/step
1/1 [==============================] - ETA: 0s1/1 [==============================] - 0s 54ms/step
1/1 [==============================] - ETA: 0s1/1 [==============================] - 0s 48ms/step
Statistics value = 22.0 p-value = 0.7216796875
1/1 [==============================] - ETA: 0s1/1 [==============================] - 0s 432ms/step
1/1 [==============================] - ETA: 0s1/1 [==============================] - 0s 388ms/step
1/1 [==============================] - ETA: 0s1/1 [==============================] - 0s 443ms/step
1/1 [==============================] - ETA: 0s1/1 [==============================] - 0s 389ms/step
1/1 [==============================] - ETA: 0s1/1 [==============================] - 0s 44ms/step
1/1 [==============================] - ETA: 0s1/1 [==============================] - 0s 48ms/step
Statistics value = 26.0 p-value = 0.15625
1/1 [==============================] - ETA: 0s1/1 [==============================] - 0s 387ms/step
1/1 [==============================] - ETA: 0s1/1 [==============================] - 0s 381ms/step
Statistics value = 5.0 p-value = 0.9931640625
1/1 [==============================] - ETA: 0s1/1 [==============================] - 0s 390ms/step
1/1 [==============================] - ETA: 0s1/1 [==============================] - 0s 378ms/step
1/1 [==============================] - ETA: 0s1/1 [==============================] - 0s 427ms/step
1/1 [==============================] - ETA: 0s1/1 [==============================] - 0s 369ms/step
1/1 [==============================] - ETA: 0s1/1 [==============================] - 0s 44ms/step
1/1 [==============================] - ETA: 0s1/1 [==============================] - 0s 43ms/step
[I 2024-12-23 18:27:57,848] Trial 14 finished with value: 0.6431311981943375 and parameters: {'n_units_0': 40, 'dropout_1': 0.1, 'run': 2, 'epochs_1': 80, 'epochs_2': 100, 'lr_1': 0.0033535432966308332, 'lr_2': 0.0002722691581074087, 'batch_size': 8, 'regularization': 'None'}. Best is trial 11 with value: 0.5344313182365734.
Statistics value = 46.0 p-value = 0.0322265625
1/1 [==============================] - ETA: 0s1/1 [==============================] - 0s 410ms/step
1/1 [==============================] - ETA: 0s1/1 [==============================] - 0s 401ms/step
1/1 [==============================] - ETA: 0s1/1 [==============================] - 0s 431ms/step
1/1 [==============================] - ETA: 0s1/1 [==============================] - 0s 468ms/step
1/1 [==============================] - ETA: 0s1/1 [==============================] - 0s 40ms/step
1/1 [==============================] - ETA: 0s1/1 [==============================] - 0s 54ms/step
1/1 [==============================] - ETA: 0s1/1 [==============================] - 0s 424ms/step
1/1 [==============================] - ETA: 0s1/1 [==============================] - 0s 392ms/step
1/1 [==============================] - ETA: 0s1/1 [==============================] - 0s 41ms/step
1/1 [==============================] - ETA: 0s1/1 [==============================] - 0s 50ms/step
[I 2024-12-23 18:28:06,580] Trial 14 finished with value: 0.2747644127732116 and parameters: {'n_units_0': 44, 'dropout_1': 0.25, 'run': 2, 'epochs_1': 50, 'epochs_2': 100, 'lr_1': 0.0015473340756509248, 'lr_2': 0.00022447190529630113, 'batch_size': 16, 'regularization': 'None'}. Best is trial 12 with value: 0.23302035011907202.
Statistics value = 28.0 p-value = 0.5
1/1 [==============================] - ETA: 0s1/1 [==============================] - 0s 376ms/step
1/1 [==============================] - ETA: 0s1/1 [==============================] - 0s 359ms/step
Statistics value = 8.0 p-value = 0.92578125
1/1 [==============================] - ETA: 0s1/1 [==============================] - 0s 418ms/step
1/1 [==============================] - ETA: 0s1/1 [==============================] - 0s 405ms/step
1/1 [==============================] - ETA: 0s1/1 [==============================] - 0s 443ms/step
1/1 [==============================] - ETA: 0s1/1 [==============================] - 0s 431ms/step
1/1 [==============================] - ETA: 0s1/1 [==============================] - 0s 46ms/step
1/1 [==============================] - ETA: 0s1/1 [==============================] - 0s 42ms/step
[I 2024-12-23 18:28:25,227] Trial 14 finished with value: 1.2720246729221616 and parameters: {'n_units_0': 20, 'dropout_1': 0.15000000000000002, 'run': 2, 'epochs_1': 50, 'epochs_2': 100, 'lr_1': 0.00011664749929951677, 'lr_2': 2.143446078970349e-05, 'batch_size': 16, 'regularization': 'l2', 'reg_alpha_1': 1.7889107850235667e-05}. Best is trial 0 with value: 1.0150131668973232.
1/1 [==============================] - ETA: 0s1/1 [==============================] - 0s 413ms/step
1/1 [==============================] - ETA: 0s1/1 [==============================] - 0s 401ms/step
1/1 [==============================] - ETA: 0s1/1 [==============================] - 0s 52ms/step
1/1 [==============================] - ETA: 0s1/1 [==============================] - 0s 42ms/step
[I 2024-12-23 18:28:27,168] Trial 15 finished with value: 0.2879360122905802 and parameters: {'n_units_0': 20, 'dropout_1': 0.25, 'run': 2, 'epochs_1': 40, 'epochs_2': 70, 'lr_1': 0.00010132245891005802, 'lr_2': 9.029245888295042e-05, 'batch_size': 12, 'regularization': 'l1_l2', 'reg_alpha_1': 1.2068605164306045e-05, 'reg_alpha_2': 0.00010362161015212055}. Best is trial 15 with value: 0.2879360122905802.
Statistics value = 4.0 p-value = 0.98046875
1/1 [==============================] - ETA: 0s1/1 [==============================] - 0s 354ms/step
1/1 [==============================] - ETA: 0s1/1 [==============================] - 0s 349ms/step
1/1 [==============================] - ETA: 0s1/1 [==============================] - 0s 352ms/step
1/1 [==============================] - ETA: 0s1/1 [==============================] - 0s 355ms/step
1/1 [==============================] - ETA: 0s1/1 [==============================] - 0s 31ms/step
1/1 [==============================] - ETA: 0s1/1 [==============================] - 0s 38ms/step
Statistics value = 25.0 p-value = 0.19140625
1/1 [==============================] - ETA: 0s1/1 [==============================] - 0s 402ms/step
1/1 [==============================] - ETA: 0s1/1 [==============================] - 0s 354ms/step
1/1 [==============================] - ETA: 0s1/1 [==============================] - 0s 361ms/step
1/1 [==============================] - ETA: 0s1/1 [==============================] - 0s 343ms/step
1/1 [==============================] - ETA: 0s1/1 [==============================] - 0s 45ms/step
1/1 [==============================] - ETA: 0s1/1 [==============================] - 0s 32ms/step
Statistics value = 36.0 p-value = 0.2158203125
1/1 [==============================] - ETA: 0s1/1 [==============================] - 0s 386ms/step
1/1 [==============================] - ETA: 0s1/1 [==============================] - 0s 389ms/step
Statistics value = 14.0 p-value = 0.7265625
1/1 [==============================] - ETA: 0s1/1 [==============================] - 0s 406ms/step
1/1 [==============================] - ETA: 0s1/1 [==============================] - 0s 422ms/step
1/1 [==============================] - ETA: 0s1/1 [==============================] - 0s 413ms/step
1/1 [==============================] - ETA: 0s1/1 [==============================] - 0s 429ms/step
1/1 [==============================] - ETA: 0s1/1 [==============================] - 0s 48ms/step
1/1 [==============================] - ETA: 0s1/1 [==============================] - 0s 38ms/step
Statistics value = 30.0 p-value = 0.4228515625
1/1 [==============================] - ETA: 0s1/1 [==============================] - 0s 401ms/step
1/1 [==============================] - ETA: 0s1/1 [==============================] - 0s 418ms/step
1/1 [==============================] - ETA: 0s1/1 [==============================] - 0s 423ms/step
1/1 [==============================] - ETA: 0s1/1 [==============================] - 0s 412ms/step
1/1 [==============================] - ETA: 0s1/1 [==============================] - 0s 48ms/step
1/1 [==============================] - ETA: 0s1/1 [==============================] - 0s 56ms/step
[I 2024-12-23 18:28:57,705] Trial 15 finished with value: 0.6055534782676957 and parameters: {'n_units_0': 28, 'dropout_1': 0.15000000000000002, 'run': 2, 'epochs_1': 90, 'epochs_2': 80, 'lr_1': 0.00929774831859175, 'lr_2': 0.0003748031156589105, 'batch_size': 12, 'regularization': 'None'}. Best is trial 11 with value: 0.5344313182365734.
Statistics value = 38.0 p-value = 0.1611328125
1/1 [==============================] - ETA: 0s1/1 [==============================] - 0s 433ms/step
1/1 [==============================] - ETA: 0s1/1 [==============================] - 0s 417ms/step
1/1 [==============================] - ETA: 0s1/1 [==============================] - 0s 380ms/step
1/1 [==============================] - ETA: 0s1/1 [==============================] - 0s 391ms/step
1/1 [==============================] - ETA: 0s1/1 [==============================] - 0s 44ms/step
1/1 [==============================] - ETA: 0s1/1 [==============================] - 0s 41ms/step
1/1 [==============================] - ETA: 0s1/1 [==============================] - 0s 392ms/step
1/1 [==============================] - ETA: 0s1/1 [==============================] - 0s 394ms/step
1/1 [==============================] - ETA: 0s1/1 [==============================] - 0s 48ms/step
1/1 [==============================] - ETA: 0s1/1 [==============================] - 0s 45ms/step
[I 2024-12-23 18:29:04,656] Trial 15 finished with value: 0.24974101618137629 and parameters: {'n_units_0': 28, 'dropout_1': 0.15000000000000002, 'run': 2, 'epochs_1': 40, 'epochs_2': 50, 'lr_1': 0.00040713451340141895, 'lr_2': 0.0005028860960238347, 'batch_size': 12, 'regularization': 'l2', 'reg_alpha_1': 2.259758223557652e-05}. Best is trial 12 with value: 0.23302035011907202.
1/1 [==============================] - ETA: 0s1/1 [==============================] - 0s 395ms/step
1/1 [==============================] - ETA: 0s1/1 [==============================] - 0s 404ms/step
1/1 [==============================] - ETA: 0s1/1 [==============================] - 0s 44ms/step
1/1 [==============================] - ETA: 0s1/1 [==============================] - 0s 53ms/step
Statistics value = 31.0 p-value = 0.384765625
1/1 [==============================] - ETA: 0s1/1 [==============================] - 0s 374ms/step
[I 2024-12-23 18:29:13,140] Trial 15 finished with value: 1.155025760767567 and parameters: {'n_units_0': 4, 'dropout_1': 0.15000000000000002, 'run': 2, 'epochs_1': 80, 'epochs_2': 30, 'lr_1': 0.003327528914795913, 'lr_2': 0.00014622504526962896, 'batch_size': 12, 'regularization': 'None'}. Best is trial 0 with value: 1.0150131668973232.
1/1 [==============================] - ETA: 0s1/1 [==============================] - 0s 449ms/step
Statistics value = 6.0 p-value = 0.9609375
1/1 [==============================] - ETA: 0s1/1 [==============================] - 0s 414ms/step
1/1 [==============================] - ETA: 0s1/1 [==============================] - 0s 415ms/step
Statistics value = 8.0 p-value = 0.92578125
1/1 [==============================] - ETA: 0s1/1 [==============================] - 0s 419ms/step
1/1 [==============================] - ETA: 0s1/1 [==============================] - 0s 421ms/step
1/1 [==============================] - ETA: 0s1/1 [==============================] - 1s 516ms/step
1/1 [==============================] - ETA: 0s1/1 [==============================] - 0s 380ms/step
1/1 [==============================] - ETA: 0s1/1 [==============================] - 0s 41ms/step
1/1 [==============================] - ETA: 0s1/1 [==============================] - 0s 46ms/step
Statistics value = 9.0 p-value = 0.90234375
1/1 [==============================] - ETA: 0s1/1 [==============================] - 0s 391ms/step
1/1 [==============================] - ETA: 0s1/1 [==============================] - 0s 377ms/step
