2024-12-23 17:49:06.641669: E external/local_xla/xla/stream_executor/cuda/cuda_dnn.cc:9261] Unable to register cuDNN factory: Attempting to register factory for plugin cuDNN when one has already been registered
2024-12-23 17:49:06.641789: E external/local_xla/xla/stream_executor/cuda/cuda_fft.cc:607] Unable to register cuFFT factory: Attempting to register factory for plugin cuFFT when one has already been registered
2024-12-23 17:49:06.645033: E external/local_xla/xla/stream_executor/cuda/cuda_blas.cc:1515] Unable to register cuBLAS factory: Attempting to register factory for plugin cuBLAS when one has already been registered
2024-12-23 17:49:06.658208: I tensorflow/core/platform/cpu_feature_guard.cc:182] This TensorFlow binary is optimized to use available CPU instructions in performance-critical operations.
To enable the following instructions: AVX2 AVX512F AVX512_VNNI AVX512_BF16 AVX_VNNI AMX_TILE AMX_INT8 AMX_BF16 FMA, in other operations, rebuild TensorFlow with the appropriate compiler flags.
2024-12-23 17:49:07.998670: W tensorflow/compiler/tf2tensorrt/utils/py_utils.cc:38] TF-TRT Warning: Could not find TensorRT
[I 2024-12-23 17:49:09,876] A new study created in memory with name: EVER_STUDY
[I 2024-12-23 17:49:09,876] A new study created in memory with name: EV_STUDY
[I 2024-12-23 17:49:09,877] A new study created in memory with name: PHEV_STUDY
[I 2024-12-23 17:49:09,877] A new study created in memory with name: FUEL_STUDY
Current PID: 544564
2024-12-23 17:49:14.567533: I tensorflow/core/common_runtime/gpu/gpu_device.cc:1929] Created device /job:localhost/replica:0/task:0/device:GPU:0 with 21823 MB memory:  -> device: 0, name: NVIDIA GeForce RTX 4090 D, pci bus id: 0000:28:00.0, compute capability: 8.9
2024-12-23 17:49:14.605337: I tensorflow/core/common_runtime/gpu/gpu_device.cc:1929] Created device /job:localhost/replica:0/task:0/device:GPU:0 with 20197 MB memory:  -> device: 0, name: NVIDIA GeForce RTX 4090 D, pci bus id: 0000:28:00.0, compute capability: 8.9
2024-12-23 17:49:14.610992: I tensorflow/core/common_runtime/gpu/gpu_device.cc:1929] Created device /job:localhost/replica:0/task:0/device:GPU:0 with 20197 MB memory:  -> device: 0, name: NVIDIA GeForce RTX 4090 D, pci bus id: 0000:28:00.0, compute capability: 8.9
2024-12-23 17:49:14.611529: I tensorflow/core/common_runtime/gpu/gpu_device.cc:1929] Created device /job:localhost/replica:0/task:0/device:GPU:0 with 20197 MB memory:  -> device: 0, name: NVIDIA GeForce RTX 4090 D, pci bus id: 0000:28:00.0, compute capability: 8.9
2024-12-23 17:49:17.266306: I external/local_xla/xla/stream_executor/cuda/cuda_dnn.cc:454] Loaded cuDNN version 8900
2024-12-23 17:49:17.322712: I external/local_xla/xla/stream_executor/cuda/cuda_dnn.cc:454] Loaded cuDNN version 8900
2024-12-23 17:49:18.754105: I external/local_xla/xla/stream_executor/cuda/cuda_dnn.cc:454] Loaded cuDNN version 8900
2024-12-23 17:49:18.767817: I external/local_xla/xla/stream_executor/cuda/cuda_dnn.cc:454] Loaded cuDNN version 8900
1/1 [==============================] - ETA: 0s1/1 [==============================] - 0s 414ms/step
1/1 [==============================] - ETA: 0s1/1 [==============================] - 0s 439ms/step
1/1 [==============================] - ETA: 0s1/1 [==============================] - 0s 396ms/step
1/1 [==============================] - ETA: 0s1/1 [==============================] - 0s 494ms/step
1/1 [==============================] - ETA: 0s1/1 [==============================] - 0s 413ms/step
1/1 [==============================] - ETA: 0s1/1 [==============================] - 0s 379ms/step
1/1 [==============================] - ETA: 0s1/1 [==============================] - 0s 351ms/step
1/1 [==============================] - ETA: 0s1/1 [==============================] - 0s 384ms/step
1/1 [==============================] - ETA: 0s1/1 [==============================] - 0s 387ms/step
1/1 [==============================] - ETA: 0s1/1 [==============================] - 0s 397ms/step
1/1 [==============================] - ETA: 0s1/1 [==============================] - 0s 362ms/step
1/1 [==============================] - ETA: 0s1/1 [==============================] - 0s 387ms/step
1/1 [==============================] - ETA: 0s1/1 [==============================] - 0s 391ms/step
1/1 [==============================] - ETA: 0s1/1 [==============================] - 0s 354ms/step
1/1 [==============================] - ETA: 0s1/1 [==============================] - 0s 366ms/step
1/1 [==============================] - ETA: 0s1/1 [==============================] - 0s 392ms/step
WARNING:tensorflow:5 out of the last 5 calls to <function Model.make_predict_function.<locals>.predict_function at 0x7f91fc19cca0> triggered tf.function retracing. Tracing is expensive and the excessive number of tracings could be due to (1) creating @tf.function repeatedly in a loop, (2) passing tensors with different shapes, (3) passing Python objects instead of tensors. For (1), please define your @tf.function outside of the loop. For (2), @tf.function has reduce_retracing=True option that can avoid unnecessary retracing. For (3), please refer to https://www.tensorflow.org/guide/function#controlling_retracing and https://www.tensorflow.org/api_docs/python/tf/function for  more details.
2024-12-23 17:49:56,464 - tensorflow - WARNING - 5 out of the last 5 calls to <function Model.make_predict_function.<locals>.predict_function at 0x7f91fc19cca0> triggered tf.function retracing. Tracing is expensive and the excessive number of tracings could be due to (1) creating @tf.function repeatedly in a loop, (2) passing tensors with different shapes, (3) passing Python objects instead of tensors. For (1), please define your @tf.function outside of the loop. For (2), @tf.function has reduce_retracing=True option that can avoid unnecessary retracing. For (3), please refer to https://www.tensorflow.org/guide/function#controlling_retracing and https://www.tensorflow.org/api_docs/python/tf/function for  more details.
1/1 [==============================] - ETA: 0s1/1 [==============================] - 0s 411ms/step
WARNING:tensorflow:5 out of the last 5 calls to <function Model.make_predict_function.<locals>.predict_function at 0x7f91f819cca0> triggered tf.function retracing. Tracing is expensive and the excessive number of tracings could be due to (1) creating @tf.function repeatedly in a loop, (2) passing tensors with different shapes, (3) passing Python objects instead of tensors. For (1), please define your @tf.function outside of the loop. For (2), @tf.function has reduce_retracing=True option that can avoid unnecessary retracing. For (3), please refer to https://www.tensorflow.org/guide/function#controlling_retracing and https://www.tensorflow.org/api_docs/python/tf/function for  more details.
2024-12-23 17:49:56,871 - tensorflow - WARNING - 5 out of the last 5 calls to <function Model.make_predict_function.<locals>.predict_function at 0x7f91f819cca0> triggered tf.function retracing. Tracing is expensive and the excessive number of tracings could be due to (1) creating @tf.function repeatedly in a loop, (2) passing tensors with different shapes, (3) passing Python objects instead of tensors. For (1), please define your @tf.function outside of the loop. For (2), @tf.function has reduce_retracing=True option that can avoid unnecessary retracing. For (3), please refer to https://www.tensorflow.org/guide/function#controlling_retracing and https://www.tensorflow.org/api_docs/python/tf/function for  more details.
1/1 [==============================] - ETA: 0s1/1 [==============================] - 0s 400ms/step
WARNING:tensorflow:5 out of the last 5 calls to <function Model.make_predict_function.<locals>.predict_function at 0x7f920c17cca0> triggered tf.function retracing. Tracing is expensive and the excessive number of tracings could be due to (1) creating @tf.function repeatedly in a loop, (2) passing tensors with different shapes, (3) passing Python objects instead of tensors. For (1), please define your @tf.function outside of the loop. For (2), @tf.function has reduce_retracing=True option that can avoid unnecessary retracing. For (3), please refer to https://www.tensorflow.org/guide/function#controlling_retracing and https://www.tensorflow.org/api_docs/python/tf/function for  more details.
WARNING:tensorflow:6 out of the last 6 calls to <function Model.make_predict_function.<locals>.predict_function at 0x7f91b84a6ca0> triggered tf.function retracing. Tracing is expensive and the excessive number of tracings could be due to (1) creating @tf.function repeatedly in a loop, (2) passing tensors with different shapes, (3) passing Python objects instead of tensors. For (1), please define your @tf.function outside of the loop. For (2), @tf.function has reduce_retracing=True option that can avoid unnecessary retracing. For (3), please refer to https://www.tensorflow.org/guide/function#controlling_retracing and https://www.tensorflow.org/api_docs/python/tf/function for  more details.
2024-12-23 17:49:56,942 - tensorflow - WARNING - 5 out of the last 5 calls to <function Model.make_predict_function.<locals>.predict_function at 0x7f920c17cca0> triggered tf.function retracing. Tracing is expensive and the excessive number of tracings could be due to (1) creating @tf.function repeatedly in a loop, (2) passing tensors with different shapes, (3) passing Python objects instead of tensors. For (1), please define your @tf.function outside of the loop. For (2), @tf.function has reduce_retracing=True option that can avoid unnecessary retracing. For (3), please refer to https://www.tensorflow.org/guide/function#controlling_retracing and https://www.tensorflow.org/api_docs/python/tf/function for  more details.
2024-12-23 17:49:56,943 - tensorflow - WARNING - 6 out of the last 6 calls to <function Model.make_predict_function.<locals>.predict_function at 0x7f91b84a6ca0> triggered tf.function retracing. Tracing is expensive and the excessive number of tracings could be due to (1) creating @tf.function repeatedly in a loop, (2) passing tensors with different shapes, (3) passing Python objects instead of tensors. For (1), please define your @tf.function outside of the loop. For (2), @tf.function has reduce_retracing=True option that can avoid unnecessary retracing. For (3), please refer to https://www.tensorflow.org/guide/function#controlling_retracing and https://www.tensorflow.org/api_docs/python/tf/function for  more details.
1/1 [==============================] - ETA: 0s1/1 [==============================] - ETA: 0s1/1 [==============================] - 0s 375ms/step
1/1 [==============================] - 0s 370ms/step
WARNING:tensorflow:5 out of the last 5 calls to <function Model.make_predict_function.<locals>.predict_function at 0x7f91f418fca0> triggered tf.function retracing. Tracing is expensive and the excessive number of tracings could be due to (1) creating @tf.function repeatedly in a loop, (2) passing tensors with different shapes, (3) passing Python objects instead of tensors. For (1), please define your @tf.function outside of the loop. For (2), @tf.function has reduce_retracing=True option that can avoid unnecessary retracing. For (3), please refer to https://www.tensorflow.org/guide/function#controlling_retracing and https://www.tensorflow.org/api_docs/python/tf/function for  more details.
2024-12-23 17:49:56,944 - tensorflow - WARNING - 5 out of the last 5 calls to <function Model.make_predict_function.<locals>.predict_function at 0x7f91f418fca0> triggered tf.function retracing. Tracing is expensive and the excessive number of tracings could be due to (1) creating @tf.function repeatedly in a loop, (2) passing tensors with different shapes, (3) passing Python objects instead of tensors. For (1), please define your @tf.function outside of the loop. For (2), @tf.function has reduce_retracing=True option that can avoid unnecessary retracing. For (3), please refer to https://www.tensorflow.org/guide/function#controlling_retracing and https://www.tensorflow.org/api_docs/python/tf/function for  more details.
1/1 [==============================] - ETA: 0s1/1 [==============================] - 0s 387ms/step
1/1 [==============================] - ETA: 0s1/1 [==============================] - 0s 53ms/step
1/1 [==============================] - ETA: 0s1/1 [==============================] - 0s 43ms/step
WARNING:tensorflow:6 out of the last 6 calls to <function Model.make_predict_function.<locals>.predict_function at 0x7f91cc4a5ca0> triggered tf.function retracing. Tracing is expensive and the excessive number of tracings could be due to (1) creating @tf.function repeatedly in a loop, (2) passing tensors with different shapes, (3) passing Python objects instead of tensors. For (1), please define your @tf.function outside of the loop. For (2), @tf.function has reduce_retracing=True option that can avoid unnecessary retracing. For (3), please refer to https://www.tensorflow.org/guide/function#controlling_retracing and https://www.tensorflow.org/api_docs/python/tf/function for  more details.
2024-12-23 17:49:57,427 - tensorflow - WARNING - 6 out of the last 6 calls to <function Model.make_predict_function.<locals>.predict_function at 0x7f91cc4a5ca0> triggered tf.function retracing. Tracing is expensive and the excessive number of tracings could be due to (1) creating @tf.function repeatedly in a loop, (2) passing tensors with different shapes, (3) passing Python objects instead of tensors. For (1), please define your @tf.function outside of the loop. For (2), @tf.function has reduce_retracing=True option that can avoid unnecessary retracing. For (3), please refer to https://www.tensorflow.org/guide/function#controlling_retracing and https://www.tensorflow.org/api_docs/python/tf/function for  more details.
1/1 [==============================] - ETA: 0s1/1 [==============================] - 0s 391ms/step
WARNING:tensorflow:6 out of the last 6 calls to <function Model.make_predict_function.<locals>.predict_function at 0x7f91bc4a6ca0> triggered tf.function retracing. Tracing is expensive and the excessive number of tracings could be due to (1) creating @tf.function repeatedly in a loop, (2) passing tensors with different shapes, (3) passing Python objects instead of tensors. For (1), please define your @tf.function outside of the loop. For (2), @tf.function has reduce_retracing=True option that can avoid unnecessary retracing. For (3), please refer to https://www.tensorflow.org/guide/function#controlling_retracing and https://www.tensorflow.org/api_docs/python/tf/function for  more details.
2024-12-23 17:49:57,474 - tensorflow - WARNING - 6 out of the last 6 calls to <function Model.make_predict_function.<locals>.predict_function at 0x7f91bc4a6ca0> triggered tf.function retracing. Tracing is expensive and the excessive number of tracings could be due to (1) creating @tf.function repeatedly in a loop, (2) passing tensors with different shapes, (3) passing Python objects instead of tensors. For (1), please define your @tf.function outside of the loop. For (2), @tf.function has reduce_retracing=True option that can avoid unnecessary retracing. For (3), please refer to https://www.tensorflow.org/guide/function#controlling_retracing and https://www.tensorflow.org/api_docs/python/tf/function for  more details.
1/1 [==============================] - ETA: 0s1/1 [==============================] - 0s 377ms/step
WARNING:tensorflow:6 out of the last 6 calls to <function Model.make_predict_function.<locals>.predict_function at 0x7f91b44a4ca0> triggered tf.function retracing. Tracing is expensive and the excessive number of tracings could be due to (1) creating @tf.function repeatedly in a loop, (2) passing tensors with different shapes, (3) passing Python objects instead of tensors. For (1), please define your @tf.function outside of the loop. For (2), @tf.function has reduce_retracing=True option that can avoid unnecessary retracing. For (3), please refer to https://www.tensorflow.org/guide/function#controlling_retracing and https://www.tensorflow.org/api_docs/python/tf/function for  more details.
2024-12-23 17:49:57,477 - tensorflow - WARNING - 6 out of the last 6 calls to <function Model.make_predict_function.<locals>.predict_function at 0x7f91b44a4ca0> triggered tf.function retracing. Tracing is expensive and the excessive number of tracings could be due to (1) creating @tf.function repeatedly in a loop, (2) passing tensors with different shapes, (3) passing Python objects instead of tensors. For (1), please define your @tf.function outside of the loop. For (2), @tf.function has reduce_retracing=True option that can avoid unnecessary retracing. For (3), please refer to https://www.tensorflow.org/guide/function#controlling_retracing and https://www.tensorflow.org/api_docs/python/tf/function for  more details.
1/1 [==============================] - ETA: 0s1/1 [==============================] - 0s 380ms/step
1/1 [==============================] - ETA: 0s1/1 [==============================] - 0s 42ms/step
1/1 [==============================] - ETA: 0s1/1 [==============================] - 0s 55ms/step
1/1 [==============================] - ETA: 0s1/1 [==============================] - 0s 57ms/step
1/1 [==============================] - ETA: 0s1/1 [==============================] - 0s 79ms/step
1/1 [==============================] - ETA: 0s1/1 [==============================] - 0s 46ms/step
1/1 [==============================] - ETA: 0s1/1 [==============================] - 0s 60ms/step
Statistics value = 24.0 p-value = 0.65234375
1/1 [==============================] - ETA: 0s1/1 [==============================] - 0s 370ms/step
Statistics value = 48.0 p-value = 0.0185546875
1/1 [==============================] - ETA: 0s1/1 [==============================] - 0s 382ms/step
Statistics value = 26.0 p-value = 0.5771484375
1/1 [==============================] - ETA: 0s1/1 [==============================] - 0s 359ms/step
Statistics value = 22.0 p-value = 0.7216796875
1/1 [==============================] - ETA: 0s1/1 [==============================] - 0s 378ms/step
1/1 [==============================] - ETA: 0s1/1 [==============================] - 0s 390ms/step
1/1 [==============================] - ETA: 0s1/1 [==============================] - 0s 443ms/step
1/1 [==============================] - ETA: 0s1/1 [==============================] - 0s 376ms/step
1/1 [==============================] - ETA: 0s1/1 [==============================] - 0s 389ms/step
1/1 [==============================] - ETA: 0s1/1 [==============================] - 0s 379ms/step
1/1 [==============================] - ETA: 0s1/1 [==============================] - 0s 362ms/step
1/1 [==============================] - ETA: 0s1/1 [==============================] - 0s 358ms/step
1/1 [==============================] - ETA: 0s1/1 [==============================] - 0s 366ms/step
1/1 [==============================] - ETA: 0s1/1 [==============================] - 0s 361ms/step
1/1 [==============================] - ETA: 0s1/1 [==============================] - 0s 353ms/step
1/1 [==============================] - ETA: 0s1/1 [==============================] - 0s 361ms/step
1/1 [==============================] - ETA: 0s1/1 [==============================] - 0s 365ms/step
1/1 [==============================] - ETA: 0s1/1 [==============================] - 0s 411ms/step
1/1 [==============================] - ETA: 0s1/1 [==============================] - 0s 394ms/step
1/1 [==============================] - ETA: 0s