[I 2024-12-23 19:29:14,557] Trial 10 finished with value: 2.403027314527434 and parameters: {'n_units_0': 36, 'dropout_1': 0.1, 'run': 2, 'epochs_1': 80, 'epochs_2': 100, 'lr_1': 0.006536264082965737, 'lr_2': 0.0002888908524619867, 'batch_size': 12, 'regularization': 'l1_l2', 'reg_alpha_1': 1.0887633888418048e-05, 'reg_alpha_2': 3.242310994927044e-05}. Best is trial 2 with value: 1.0765693127262415.
Statistics value = 2.0 p-value = 0.998046875
1/1 [==============================] - ETA: 0s1/1 [==============================] - 0s 464ms/step
1/1 [==============================] - ETA: 0s1/1 [==============================] - 0s 431ms/step
Statistics value = 5.0 p-value = 0.97265625
1/1 [==============================] - ETA: 0s1/1 [==============================] - 0s 426ms/step
1/1 [==============================] - ETA: 0s1/1 [==============================] - 0s 414ms/step
Statistics value = 16.0 p-value = 0.62890625
1/1 [==============================] - ETA: 0s1/1 [==============================] - 0s 460ms/step
1/1 [==============================] - ETA: 0s1/1 [==============================] - 0s 382ms/step
Statistics value = 23.0 p-value = 0.2734375
1/1 [==============================] - ETA: 0s1/1 [==============================] - 0s 436ms/step
1/1 [==============================] - ETA: 0s1/1 [==============================] - 0s 393ms/step
1/1 [==============================] - ETA: 0s1/1 [==============================] - 0s 420ms/step
1/1 [==============================] - ETA: 0s1/1 [==============================] - 0s 455ms/step
1/1 [==============================] - ETA: 0s1/1 [==============================] - 0s 426ms/step
1/1 [==============================] - ETA: 0s1/1 [==============================] - 0s 408ms/step
1/1 [==============================] - ETA: 0s1/1 [==============================] - 0s 42ms/step
1/1 [==============================] - ETA: 0s1/1 [==============================] - 0s 44ms/step
1/1 [==============================] - ETA: 0s1/1 [==============================] - 0s 423ms/step
1/1 [==============================] - ETA: 0s1/1 [==============================] - 0s 396ms/step
1/1 [==============================] - ETA: 0s1/1 [==============================] - 0s 46ms/step
1/1 [==============================] - ETA: 0s1/1 [==============================] - 0s 45ms/step
[I 2024-12-23 19:29:47,033] Trial 11 finished with value: 0.6617930583621059 and parameters: {'n_units_0': 28, 'dropout_1': 0.3, 'run': 2, 'epochs_1': 80, 'epochs_2': 80, 'lr_1': 0.00011106039801844555, 'lr_2': 0.0002099004242056526, 'batch_size': 16, 'regularization': 'None'}. Best is trial 5 with value: 0.5386896307269354.
1/1 [==============================] - ETA: 0s1/1 [==============================] - 0s 361ms/step
1/1 [==============================] - ETA: 0s1/1 [==============================] - 0s 412ms/step
1/1 [==============================] - ETA: 0s1/1 [==============================] - 0s 45ms/step
1/1 [==============================] - ETA: 0s1/1 [==============================] - 0s 55ms/step
Statistics value = 32.0 p-value = 0.34765625
1/1 [==============================] - ETA: 0s1/1 [==============================] - 0s 392ms/step
1/1 [==============================] - ETA: 0s1/1 [==============================] - 0s 390ms/step
1/1 [==============================] - ETA: 0s1/1 [==============================] - 0s 402ms/step
1/1 [==============================] - ETA: 0s1/1 [==============================] - 0s 372ms/step
1/1 [==============================] - ETA: 0s1/1 [==============================] - 0s 40ms/step
1/1 [==============================] - ETA: 0s1/1 [==============================] - 0s 47ms/step
Statistics value = 23.0 p-value = 0.2734375
1/1 [==============================] - ETA: 0s1/1 [==============================] - 0s 398ms/step
Statistics value = 49.0 p-value = 0.013671875
1/1 [==============================] - ETA: 0s1/1 [==============================] - 0s 373ms/step
1/1 [==============================] - ETA: 0s1/1 [==============================] - 0s 376ms/step
1/1 [==============================] - ETA: 0s1/1 [==============================] - 0s 348ms/step
1/1 [==============================] - ETA: 0s1/1 [==============================] - 0s 352ms/step
1/1 [==============================] - ETA: 0s1/1 [==============================] - 0s 370ms/step
1/1 [==============================] - ETA: 0s1/1 [==============================] - 0s 49ms/step
1/1 [==============================] - ETA: 0s1/1 [==============================] - 0s 42ms/step
[I 2024-12-23 19:30:06,283] Trial 11 finished with value: 0.3169937824026241 and parameters: {'n_units_0': 36, 'dropout_1': 0.25, 'run': 2, 'epochs_1': 50, 'epochs_2': 20, 'lr_1': 0.00012427889293047006, 'lr_2': 0.00017340750366137944, 'batch_size': 12, 'regularization': 'l1', 'reg_alpha_1': 0.0010614983432824354}. Best is trial 4 with value: 0.2871657447935647.
Statistics value = 36.0 p-value = 0.2158203125
1/1 [==============================] - ETA: 0s1/1 [==============================] - 0s 417ms/step
1/1 [==============================] - ETA: 0s1/1 [==============================] - 0s 390ms/step
1/1 [==============================] - ETA: 0s1/1 [==============================] - 0s 404ms/step
1/1 [==============================] - ETA: 0s1/1 [==============================] - 0s 402ms/step
1/1 [==============================] - ETA: 0s1/1 [==============================] - 0s 53ms/step
1/1 [==============================] - ETA: 0s1/1 [==============================] - 0s 41ms/step
[I 2024-12-23 19:30:14,407] Trial 11 finished with value: 1.2250560944700282 and parameters: {'n_units_0': 40, 'dropout_1': 0.25, 'run': 2, 'epochs_1': 30, 'epochs_2': 70, 'lr_1': 0.0001055467102927026, 'lr_2': 0.000214529409721754, 'batch_size': 12, 'regularization': 'l1_l2', 'reg_alpha_1': 0.001068853786687612, 'reg_alpha_2': 0.00011712111399381304}. Best is trial 2 with value: 1.0765693127262415.
1/1 [==============================] - ETA: 0s1/1 [==============================] - 0s 405ms/step
1/1 [==============================] - ETA: 0s1/1 [==============================] - 0s 410ms/step
1/1 [==============================] - ETA: 0s1/1 [==============================] - 0s 43ms/step
1/1 [==============================] - ETA: 0s1/1 [==============================] - 0s 43ms/step
1/1 [==============================] - ETA: 0s1/1 [==============================] - 0s 387ms/step
Statistics value = 18.0 p-value = 0.52734375
1/1 [==============================] - ETA: 0s1/1 [==============================] - 0s 407ms/step
1/1 [==============================] - ETA: 0s1/1 [==============================] - 0s 385ms/step
1/1 [==============================] - ETA: 0s1/1 [==============================] - 0s 398ms/step
Statistics value = 28.0 p-value = 0.09765625
1/1 [==============================] - ETA: 0s1/1 [==============================] - 0s 404ms/step
1/1 [==============================] - ETA: 0s1/1 [==============================] - 0s 377ms/step
1/1 [==============================] - ETA: 0s1/1 [==============================] - 0s 387ms/step
Statistics value = 32.0 p-value = 0.34765625
1/1 [==============================] - ETA: 0s1/1 [==============================] - 0s 402ms/step
1/1 [==============================] - ETA: 0s1/1 [==============================] - 0s 416ms/step
1/1 [==============================] - ETA: 0s1/1 [==============================] - 0s 46ms/step
1/1 [==============================] - ETA: 0s1/1 [==============================] - 0s 42ms/step
1/1 [==============================] - ETA: 0s1/1 [==============================] - 0s 414ms/step
1/1 [==============================] - ETA: 0s1/1 [==============================] - 0s 389ms/step
[I 2024-12-23 19:30:32,451] Trial 11 finished with value: 0.24235589478992758 and parameters: {'n_units_0': 28, 'dropout_1': 0.25, 'run': 3, 'epochs_1': 70, 'epochs_2': 20, 'lr_1': 0.0004842080300729574, 'lr_2': 0.00021032955196042668, 'batch_size': 16, 'regularization': 'None'}. Best is trial 0 with value: 0.23177230325555293.
1/1 [==============================] - ETA: 0s1/1 [==============================] - 0s 380ms/step
1/1 [==============================] - ETA: 0s1/1 [==============================] - 0s 54ms/step
1/1 [==============================] - ETA: 0s1/1 [==============================] - 0s 46ms/step
1/1 [==============================] - ETA: 0s1/1 [==============================] - 0s 418ms/step
1/1 [==============================] - ETA: 0s1/1 [==============================] - 0s 387ms/step
1/1 [==============================] - ETA: 0s1/1 [==============================] - 0s 44ms/step
1/1 [==============================] - ETA: 0s1/1 [==============================] - 0s 41ms/step
Statistics value = 27.0 p-value = 0.5390625
1/1 [==============================] - ETA: 0s1/1 [==============================] - 0s 409ms/step
1/1 [==============================] - ETA: 0s1/1 [==============================] - 0s 379ms/step
Statistics value = 8.0 p-value = 0.92578125
1/1 [==============================] - ETA: 0s1/1 [==============================] - 1s 576ms/step
1/1 [==============================] - ETA: 0s1/1 [==============================] - 0s 441ms/step
1/1 [==============================] - ETA: 0s1/1 [==============================] - 0s 396ms/step
1/1 [==============================] - ETA: 0s1/1 [==============================] - 0s 390ms/step
1/1 [==============================] - ETA: 0s1/1 [==============================] - 0s 51ms/step
1/1 [==============================] - ETA: 0s1/1 [==============================] - 0s 56ms/step
[I 2024-12-23 19:30:47,779] Trial 12 finished with value: 0.6841423394386352 and parameters: {'n_units_0': 32, 'dropout_1': 0.3, 'run': 2, 'epochs_1': 80, 'epochs_2': 90, 'lr_1': 0.0004035126955751914, 'lr_2': 0.0008538648795388481, 'batch_size': 16, 'regularization': 'None'}. Best is trial 5 with value: 0.5386896307269354.
Statistics value = 34.0 p-value = 0.2783203125
1/1 [==============================] - ETA: 0s1/1 [==============================] - 0s 420ms/step
1/1 [==============================] - ETA: 0s1/1 [==============================] - 0s 376ms/step
1/1 [==============================] - ETA: 0s1/1 [==============================] - 0s 422ms/step
1/1 [==============================] - ETA: 0s1/1 [==============================] - 0s 377ms/step
1/1 [==============================] - ETA: 0s1/1 [==============================] - 0s 47ms/step
1/1 [==============================] - ETA: 0s1/1 [==============================] - 0s 56ms/step
[I 2024-12-23 19:30:54,297] Trial 12 finished with value: 0.38878971955719166 and parameters: {'n_units_0': 28, 'dropout_1': 0.25, 'run': 2, 'epochs_1': 30, 'epochs_2': 50, 'lr_1': 0.0004957547237088648, 'lr_2': 0.0008538648795388481, 'batch_size': 12, 'regularization': 'l1', 'reg_alpha_1': 0.00089752676716181}. Best is trial 4 with value: 0.2871657447935647.
1/1 [==============================] - ETA: 0s1/1 [==============================] - 1s 572ms/step
1/1 [==============================] - ETA: 0s1/1 [==============================] - 0s 399ms/step
Statistics value = 21.0 p-value = 0.37109375
1/1 [==============================] - ETA: 0s1/1 [==============================] - 0s 404ms/step
1/1 [==============================] - ETA: 0s1/1 [==============================] - 0s 404ms/step
1/1 [==============================] - ETA: 0s1/1 [==============================] - 0s 55ms/step
1/1 [==============================] - ETA: 0s1/1 [==============================] - 0s 43ms/step
1/1 [==============================] - ETA: 0s1/1 [==============================] - 0s 410ms/step
1/1 [==============================] - ETA: 0s1/1 [==============================] - 0s 446ms/step
1/1 [==============================] - ETA: 0s1/1 [==============================] - 0s 56ms/step
1/1 [==============================] - ETA: 0s1/1 [==============================] - 0s 50ms/step
[I 2024-12-23 19:31:05,102] Trial 12 finished with value: 1.6139461090291876 and parameters: {'n_units_0': 28, 'dropout_1': 0.15000000000000002, 'run': 2, 'epochs_1': 30, 'epochs_2': 60, 'lr_1': 0.00010525521998095273, 'lr_2': 0.0008607419445086135, 'batch_size': 12, 'regularization': 'None'}. Best is trial 2 with value: 1.0765693127262415.
Statistics value = 24.0 p-value = 0.23046875
1/1 [==============================] - ETA: 0s1/1 [==============================] - 0s 411ms/step
1/1 [==============================] - ETA: 0s1/1 [==============================] - 0s 408ms/step
1/1 [==============================] - ETA: 0s1/1 [==============================] - 0s 422ms/step
1/1 [==============================] - ETA: 0s1/1 [==============================] - 0s 417ms/step
1/1 [==============================] - ETA: 0s1/1 [==============================] - 0s 51ms/step
1/1 [==============================] - ETA: 0s1/1 [==============================] - 0s 46ms/step
Statistics value = 48.0 p-value = 0.0185546875
1/1 [==============================] - ETA: 0s1/1 [==============================] - 0s 424ms/step
1/1 [==============================] - ETA: 0s1/1 [==============================] - 0s 364ms/step
1/1 [==============================] - ETA: 0s1/1 [==============================] - 0s 51ms/step
1/1 [==============================] - ETA: 0s1/1 [==============================] - 0s 42ms/step
