[I 2024-12-23 20:39:52,482] Trial 4 finished with value: 0.2908132939311565 and parameters: {'n_units_0': 60, 'dropout_1': 0.2, 'run': 3, 'epochs_1': 30, 'epochs_2': 30, 'lr_1': 0.00012315571723666037, 'lr_2': 4.473636174621264e-05, 'batch_size': 12, 'regularization': 'l1', 'reg_alpha_1': 0.00042470585622618684}. Best is trial 4 with value: 0.2908132939311565.
Statistics value = 18.0 p-value = 0.52734375
1/1 [==============================] - ETA: 0s1/1 [==============================] - 0s 359ms/step
1/1 [==============================] - ETA: 0s1/1 [==============================] - 1s 542ms/step
1/1 [==============================] - ETA: 0s1/1 [==============================] - 0s 62ms/step
1/1 [==============================] - ETA: 0s1/1 [==============================] - 0s 43ms/step
Statistics value = 47.0 p-value = 0.0244140625
1/1 [==============================] - ETA: 0s1/1 [==============================] - 0s 448ms/step
Statistics value = 32.0 p-value = 0.34765625
1/1 [==============================] - ETA: 0s1/1 [==============================] - 0s 460ms/step
Statistics value = 24.0 p-value = 0.65234375
1/1 [==============================] - ETA: 0s1/1 [==============================] - 0s 477ms/step
1/1 [==============================] - ETA: 0s1/1 [==============================] - 0s 424ms/step
1/1 [==============================] - ETA: 0s1/1 [==============================] - 0s 461ms/step
1/1 [==============================] - ETA: 0s1/1 [==============================] - 1s 534ms/step
1/1 [==============================] - ETA: 0s1/1 [==============================] - 0s 83ms/step
1/1 [==============================] - ETA: 0s1/1 [==============================] - 0s 93ms/step
1/1 [==============================] - ETA: 0s1/1 [==============================] - 0s 97ms/step
1/1 [==============================] - ETA: 0s1/1 [==============================] - 0s 93ms/step
1/1 [==============================] - ETA: 0s1/1 [==============================] - 0s 86ms/step
1/1 [==============================] - ETA: 0s1/1 [==============================] - 0s 43ms/step
[I 2024-12-23 20:40:14,046] Trial 5 finished with value: 0.5664516986133916 and parameters: {'n_units_0': 12, 'dropout_1': 0.3, 'run': 1, 'epochs_1': 100, 'epochs_2': 80, 'lr_1': 0.00024970737145052745, 'lr_2': 1.0257563974185649e-05, 'batch_size': 16, 'regularization': 'l2', 'reg_alpha_1': 0.0001189589673755355}. Best is trial 5 with value: 0.5664516986133916.
[I 2024-12-23 20:40:14,069] Trial 5 finished with value: 1.5076020696647063 and parameters: {'n_units_0': 12, 'dropout_1': 0.3, 'run': 1, 'epochs_1': 100, 'epochs_2': 80, 'lr_1': 0.00024970737145052745, 'lr_2': 1.0257563974185649e-05, 'batch_size': 16, 'regularization': 'l2', 'reg_alpha_1': 0.0001189589673755355}. Best is trial 0 with value: 1.0444465735040338.
[I 2024-12-23 20:40:14,149] Trial 5 finished with value: 0.2329356537185829 and parameters: {'n_units_0': 12, 'dropout_1': 0.3, 'run': 1, 'epochs_1': 100, 'epochs_2': 80, 'lr_1': 0.00024970737145052745, 'lr_2': 1.0257563974185649e-05, 'batch_size': 16, 'regularization': 'l2', 'reg_alpha_1': 0.0001189589673755355}. Best is trial 5 with value: 0.2329356537185829.
Statistics value = 20.0 p-value = 0.421875
1/1 [==============================] - ETA: 0s1/1 [==============================] - 0s 414ms/step
Statistics value = 0.0 p-value = 1.0
1/1 [==============================] - ETA: 0s1/1 [==============================] - 0s 416ms/step
Statistics value = 12.0 p-value = 0.80859375
1/1 [==============================] - ETA: 0s1/1 [==============================] - 0s 406ms/step
1/1 [==============================] - ETA: 0s1/1 [==============================] - 0s 380ms/step
1/1 [==============================] - ETA: 0s1/1 [==============================] - 0s 371ms/step
1/1 [==============================] - ETA: 0s1/1 [==============================] - 0s 436ms/step
Statistics value = 21.0 p-value = 0.75390625
1/1 [==============================] - ETA: 0s1/1 [==============================] - 0s 474ms/step
1/1 [==============================] - ETA: 0s1/1 [==============================] - 1s 501ms/step
1/1 [==============================] - ETA: 0s1/1 [==============================] - 0s 65ms/step
1/1 [==============================] - ETA: 0s1/1 [==============================] - 0s 37ms/step
[I 2024-12-23 20:40:31,637] Trial 5 finished with value: 0.3195413834151217 and parameters: {'n_units_0': 12, 'dropout_1': 0.3, 'run': 1, 'epochs_1': 100, 'epochs_2': 80, 'lr_1': 0.00024970737145052745, 'lr_2': 1.0257563974185649e-05, 'batch_size': 16, 'regularization': 'l2', 'reg_alpha_1': 0.0001189589673755355}. Best is trial 4 with value: 0.2908132939311565.
1/1 [==============================] - ETA: 0s1/1 [==============================] - 0s 400ms/step
1/1 [==============================] - ETA: 0s1/1 [==============================] - 0s 488ms/step
1/1 [==============================] - ETA: 0s1/1 [==============================] - 0s 500ms/step
1/1 [==============================] - ETA: 0s1/1 [==============================] - 0s 490ms/step
1/1 [==============================] - ETA: 0s1/1 [==============================] - 0s 429ms/step
1/1 [==============================] - ETA: 0s1/1 [==============================] - 0s 481ms/step
1/1 [==============================] - ETA: 0s1/1 [==============================] - 0s 91ms/step
1/1 [==============================] - ETA: 0s1/1 [==============================] - 0s 41ms/step
1/1 [==============================] - ETA: 0s1/1 [==============================] - 0s 87ms/step
1/1 [==============================] - ETA: 0s1/1 [==============================] - 0s 99ms/step
1/1 [==============================] - ETA: 0s1/1 [==============================] - 0s 64ms/step
1/1 [==============================] - ETA: 0s1/1 [==============================] - 0s 41ms/step
Statistics value = 20.0 p-value = 0.421875
1/1 [==============================] - ETA: 0s1/1 [==============================] - 0s 418ms/step
1/1 [==============================] - ETA: 0s1/1 [==============================] - 0s 490ms/step
Statistics value = 6.0 p-value = 0.990234375
1/1 [==============================] - ETA: 0s1/1 [==============================] - 0s 396ms/step
Statistics value = 33.0 p-value = 0.3125
1/1 [==============================] - ETA: 0s1/1 [==============================] - 0s 416ms/step
Statistics value = 48.0 p-value = 0.0185546875
1/1 [==============================] - ETA: 0s1/1 [==============================] - 0s 398ms/step
1/1 [==============================] - ETA: 0s1/1 [==============================] - 0s 435ms/step
1/1 [==============================] - ETA: 0s1/1 [==============================] - 0s 401ms/step
1/1 [==============================] - ETA: 0s1/1 [==============================] - 0s 385ms/step
1/1 [==============================] - ETA: 0s1/1 [==============================] - 0s 386ms/step
1/1 [==============================] - ETA: 0s1/1 [==============================] - 0s 359ms/step
1/1 [==============================] - ETA: 0s1/1 [==============================] - 0s 106ms/step
1/1 [==============================] - ETA: 0s1/1 [==============================] - 0s 41ms/step
1/1 [==============================] - ETA: 0s1/1 [==============================] - 0s 403ms/step
1/1 [==============================] - ETA: 0s1/1 [==============================] - 0s 400ms/step
1/1 [==============================] - ETA: 0s1/1 [==============================] - 0s 440ms/step
1/1 [==============================] - ETA: 0s1/1 [==============================] - 0s 450ms/step
1/1 [==============================] - ETA: 0s1/1 [==============================] - 0s 405ms/step
1/1 [==============================] - ETA: 0s1/1 [==============================] - 0s 468ms/step
1/1 [==============================] - ETA: 0s1/1 [==============================] - 0s 47ms/step
1/1 [==============================] - ETA: 0s1/1 [==============================] - 0s 61ms/step
1/1 [==============================] - ETA: 0s1/1 [==============================] - 0s 59ms/step
1/1 [==============================] - ETA: 0s1/1 [==============================] - 0s 100ms/step
1/1 [==============================] - ETA: 0s1/1 [==============================] - 0s 93ms/step
1/1 [==============================] - ETA: 0s1/1 [==============================] - 0s 99ms/step
[I 2024-12-23 20:41:07,487] Trial 6 finished with value: 1.0410745631037184 and parameters: {'n_units_0': 8, 'dropout_1': 0.3, 'run': 2, 'epochs_1': 50, 'epochs_2': 20, 'lr_1': 0.0004187594718900631, 'lr_2': 4.4706085467784903e-05, 'batch_size': 16, 'regularization': 'l1', 'reg_alpha_1': 0.0013795402040204172}. Best is trial 6 with value: 1.0410745631037184.
[I 2024-12-23 20:41:07,501] Trial 6 finished with value: 0.4575695149894752 and parameters: {'n_units_0': 8, 'dropout_1': 0.3, 'run': 2, 'epochs_1': 50, 'epochs_2': 20, 'lr_1': 0.0004187594718900631, 'lr_2': 4.4706085467784903e-05, 'batch_size': 16, 'regularization': 'l1', 'reg_alpha_1': 0.0013795402040204172}. Best is trial 6 with value: 0.4575695149894752.
[I 2024-12-23 20:41:07,518] Trial 6 finished with value: 0.2528437987293326 and parameters: {'n_units_0': 8, 'dropout_1': 0.3, 'run': 2, 'epochs_1': 50, 'epochs_2': 20, 'lr_1': 0.0004187594718900631, 'lr_2': 4.4706085467784903e-05, 'batch_size': 16, 'regularization': 'l1', 'reg_alpha_1': 0.0013795402040204172}. Best is trial 5 with value: 0.2329356537185829.
Statistics value = 25.0 p-value = 0.615234375
1/1 [==============================] - ETA: 0s1/1 [==============================] - 0s 409ms/step
1/1 [==============================] - ETA: 0s1/1 [==============================] - 0s 452ms/step
1/1 [==============================] - ETA: 0s1/1 [==============================] - 0s 426ms/step
1/1 [==============================] - ETA: 0s1/1 [==============================] - 0s 428ms/step
1/1 [==============================] - ETA: 0s1/1 [==============================] - 0s 47ms/step
1/1 [==============================] - ETA: 0s1/1 [==============================] - 0s 50ms/step
