[I 2024-12-23 19:43:34,367] Trial 3 finished with value: 0.4218320488645301 and parameters: {'n_units_0': 8, 'dropout_1': 0.2, 'run': 1, 'epochs_1': 100, 'epochs_2': 40, 'lr_1': 0.0021137059440645744, 'lr_2': 4.201672054372529e-05, 'batch_size': 12, 'regularization': 'l2', 'reg_alpha_1': 0.006584106160121612}. Best is trial 2 with value: 0.2943790059069996.
1/1 [==============================] - ETA: 0s1/1 [==============================] - 0s 32ms/step
1/1 [==============================] - ETA: 0s1/1 [==============================] - 0s 33ms/step
1/1 [==============================] - ETA: 0s1/1 [==============================] - 0s 36ms/step
[I 2024-12-23 19:43:34,945] Trial 3 finished with value: 0.6552140747812942 and parameters: {'n_units_0': 8, 'dropout_1': 0.2, 'run': 1, 'epochs_1': 100, 'epochs_2': 40, 'lr_1': 0.0021137059440645744, 'lr_2': 4.201672054372529e-05, 'batch_size': 12, 'regularization': 'l2', 'reg_alpha_1': 0.006584106160121612}. Best is trial 0 with value: 0.6015049808642206.
[I 2024-12-23 19:43:34,964] Trial 3 finished with value: 1.6914190650031649 and parameters: {'n_units_0': 8, 'dropout_1': 0.2, 'run': 1, 'epochs_1': 100, 'epochs_2': 40, 'lr_1': 0.0021137059440645744, 'lr_2': 4.201672054372529e-05, 'batch_size': 12, 'regularization': 'l2', 'reg_alpha_1': 0.006584106160121612}. Best is trial 2 with value: 1.1027120758181013.
[I 2024-12-23 19:43:34,986] Trial 3 finished with value: 0.26028271582328766 and parameters: {'n_units_0': 8, 'dropout_1': 0.2, 'run': 1, 'epochs_1': 100, 'epochs_2': 40, 'lr_1': 0.0021137059440645744, 'lr_2': 4.201672054372529e-05, 'batch_size': 12, 'regularization': 'l2', 'reg_alpha_1': 0.006584106160121612}. Best is trial 0 with value: 0.2343506395186418.
Statistics value = 24.0 p-value = 0.23046875
1/1 [==============================] - ETA: 0s1/1 [==============================] - 0s 327ms/step
1/1 [==============================] - ETA: 0s1/1 [==============================] - 0s 326ms/step
Statistics value = 7.0 p-value = 0.9453125
1/1 [==============================] - ETA: 0s1/1 [==============================] - 0s 358ms/step
Statistics value = 31.0 p-value = 0.0390625
1/1 [==============================] - ETA: 0s1/1 [==============================] - 0s 352ms/step
Statistics value = 22.0 p-value = 0.3203125
1/1 [==============================] - ETA: 0s1/1 [==============================] - 0s 355ms/step
1/1 [==============================] - ETA: 0s1/1 [==============================] - 0s 320ms/step
1/1 [==============================] - ETA: 0s1/1 [==============================] - 0s 350ms/step
1/1 [==============================] - ETA: 0s1/1 [==============================] - 0s 341ms/step
1/1 [==============================] - ETA: 0s1/1 [==============================] - 0s 346ms/step
1/1 [==============================] - ETA: 0s1/1 [==============================] - 0s 345ms/step
1/1 [==============================] - ETA: 0s1/1 [==============================] - 0s 347ms/step
1/1 [==============================] - ETA: 0s1/1 [==============================] - 0s 352ms/step
1/1 [==============================] - ETA: 0s1/1 [==============================] - 0s 371ms/step
1/1 [==============================] - ETA: 0s1/1 [==============================] - 0s 389ms/step
1/1 [==============================] - ETA: 0s1/1 [==============================] - 0s 386ms/step
1/1 [==============================] - ETA: 0s1/1 [==============================] - 0s 398ms/step
1/1 [==============================] - ETA: 0s1/1 [==============================] - 0s 367ms/step
1/1 [==============================] - ETA: 0s1/1 [==============================] - 0s 370ms/step
1/1 [==============================] - ETA: 0s1/1 [==============================] - 0s 42ms/step
1/1 [==============================] - ETA: 0s1/1 [==============================] - 0s 426ms/step
1/1 [==============================] - ETA: 0s1/1 [==============================] - 0s 50ms/step
1/1 [==============================] - ETA: 0s1/1 [==============================] - 0s 425ms/step
1/1 [==============================] - ETA: 0s1/1 [==============================] - 0s 468ms/step
1/1 [==============================] - ETA: 0s1/1 [==============================] - 0s 422ms/step
1/1 [==============================] - ETA: 0s1/1 [==============================] - 0s 381ms/step
1/1 [==============================] - ETA: 0s1/1 [==============================] - 0s 389ms/step
1/1 [==============================] - ETA: 0s1/1 [==============================] - 0s 71ms/step
1/1 [==============================] - ETA: 0s1/1 [==============================] - 0s 52ms/step
1/1 [==============================] - ETA: 0s1/1 [==============================] - 0s 53ms/step
1/1 [==============================] - ETA: 0s1/1 [==============================] - 0s 42ms/step
1/1 [==============================] - ETA: 0s1/1 [==============================] - 0s 48ms/step
1/1 [==============================] - ETA: 0s1/1 [==============================] - 0s 40ms/step
Statistics value = 24.0 p-value = 0.65234375
1/1 [==============================] - ETA: 0s1/1 [==============================] - 0s 363ms/step
1/1 [==============================] - ETA: 0s1/1 [==============================] - 0s 366ms/step
Statistics value = 18.0 p-value = 0.8388671875
1/1 [==============================] - ETA: 0s1/1 [==============================] - 0s 413ms/step
Statistics value = 30.0 p-value = 0.4228515625
1/1 [==============================] - ETA: 0s1/1 [==============================] - 0s 362ms/step
Statistics value = 53.0 p-value = 0.0029296875
1/1 [==============================] - ETA: 0s1/1 [==============================] - 0s 364ms/step
1/1 [==============================] - ETA: 0s1/1 [==============================] - 0s 385ms/step
1/1 [==============================] - ETA: 0s1/1 [==============================] - 0s 407ms/step
1/1 [==============================] - ETA: 0s1/1 [==============================] - 0s 353ms/step
1/1 [==============================] - ETA: 0s1/1 [==============================] - 0s 348ms/step
1/1 [==============================] - ETA: 0s1/1 [==============================] - 0s 354ms/step
1/1 [==============================] - ETA: 0s1/1 [==============================] - 0s 399ms/step
1/1 [==============================] - ETA: 0s1/1 [==============================] - 0s 386ms/step
1/1 [==============================] - ETA: 0s1/1 [==============================] - 0s 369ms/step
1/1 [==============================] - ETA: 0s1/1 [==============================] - 0s 373ms/step
1/1 [==============================] - ETA: 0s1/1 [==============================] - 0s 376ms/step
1/1 [==============================] - ETA: 0s1/1 [==============================] - 0s 355ms/step
1/1 [==============================] - ETA: 0s1/1 [==============================] - 0s 375ms/step
1/1 [==============================] - ETA: 0s1/1 [==============================] - 0s 385ms/step
1/1 [==============================] - ETA: 0s1/1 [==============================] - 0s 428ms/step
1/1 [==============================] - ETA: 0s1/1 [==============================] - 0s 43ms/step
1/1 [==============================] - ETA: 0s1/1 [==============================] - 0s 396ms/step
1/1 [==============================] - ETA: 0s1/1 [==============================] - 0s 403ms/step
1/1 [==============================] - ETA: 0s1/1 [==============================] - 0s 41ms/step
1/1 [==============================] - ETA: 0s1/1 [==============================] - 0s 459ms/step
1/1 [==============================] - ETA: 0s1/1 [==============================] - 0s 408ms/step
1/1 [==============================] - ETA: 0s1/1 [==============================] - 0s 423ms/step
1/1 [==============================] - ETA: 0s1/1 [==============================] - 0s 64ms/step
1/1 [==============================] - ETA: 0s1/1 [==============================] - 0s 66ms/step
1/1 [==============================] - ETA: 0s1/1 [==============================] - 0s 69ms/step
1/1 [==============================] - ETA: 0s1/1 [==============================] - 0s 46ms/step
1/1 [==============================] - ETA: 0s1/1 [==============================] - 0s 47ms/step
1/1 [==============================] - ETA: 0s1/1 [==============================] - 0s 45ms/step
[I 2024-12-23 19:44:43,254] Trial 4 finished with value: 0.29393199113053897 and parameters: {'n_units_0': 60, 'dropout_1': 0.2, 'run': 3, 'epochs_1': 30, 'epochs_2': 30, 'lr_1': 0.00012315571723666037, 'lr_2': 4.473636174621264e-05, 'batch_size': 12, 'regularization': 'l1', 'reg_alpha_1': 0.00042470585622618684}. Best is trial 4 with value: 0.29393199113053897.
[I 2024-12-23 19:44:43,971] Trial 4 finished with value: 0.2343318639556331 and parameters: {'n_units_0': 60, 'dropout_1': 0.2, 'run': 3, 'epochs_1': 30, 'epochs_2': 30, 'lr_1': 0.00012315571723666037, 'lr_2': 4.473636174621264e-05, 'batch_size': 12, 'regularization': 'l1', 'reg_alpha_1': 0.00042470585622618684}. Best is trial 4 with value: 0.2343318639556331.
[I 2024-12-23 19:44:43,992] Trial 4 finished with value: 1.1875000726778646 and parameters: {'n_units_0': 60, 'dropout_1': 0.2, 'run': 3, 'epochs_1': 30, 'epochs_2': 30, 'lr_1': 0.00012315571723666037, 'lr_2': 4.473636174621264e-05, 'batch_size': 12, 'regularization': 'l1', 'reg_alpha_1': 0.00042470585622618684}. Best is trial 2 with value: 1.1027120758181013.
[I 2024-12-23 19:44:44,006] Trial 4 finished with value: 0.5383573575346521 and parameters: {'n_units_0': 60, 'dropout_1': 0.2, 'run': 3, 'epochs_1': 30, 'epochs_2': 30, 'lr_1': 0.00012315571723666037, 'lr_2': 4.473636174621264e-05, 'batch_size': 12, 'regularization': 'l1', 'reg_alpha_1': 0.00042470585622618684}. Best is trial 4 with value: 0.5383573575346521.
Statistics value = 20.0 p-value = 0.421875
1/1 [==============================] - ETA: 0s1/1 [==============================] - 0s 421ms/step
Statistics value = 26.0 p-value = 0.15625
1/1 [==============================] - ETA: 0s1/1 [==============================] - 0s 387ms/step
Statistics value = 1.0 p-value = 0.99609375
1/1 [==============================] - ETA: 0s1/1 [==============================] - 0s 391ms/step
Statistics value = 32.0 p-value = 0.02734375
1/1 [==============================] - ETA: 0s1/1 [==============================] - 0s 470ms/step
1/1 [==============================] - ETA: 0s1/1 [==============================] - 0s 386ms/step
1/1 [==============================] - ETA: 0s1/1 [==============================] - 0s 79ms/step
1/1 [==============================] - ETA: 0s1/1 [==============================] - 0s 416ms/step
1/1 [==============================] - ETA: 0s1/1 [==============================] - 0s 414ms/step
1/1 [==============================] - ETA: 0s1/1 [==============================] - 0s 399ms/step
1/1 [==============================] - ETA: 0s1/1 [==============================] - 0s 81ms/step
1/1 [==============================] - ETA: 0s1/1 [==============================] - 0s 78ms/step
1/1 [==============================] - ETA: 0s1/1 [==============================] - 0s 84ms/step
1/1 [==============================] - ETA: 0s1/1 [==============================] - 0s 59ms/step
1/1 [==============================] - ETA: 0s1/1 [==============================] - 0s 42ms/step
1/1 [==============================] - ETA: 0s1/1 [==============================] - 0s 40ms/step
1/1 [==============================] - ETA: 0s1/1 [==============================] - 0s 44ms/step
Statistics value = 27.0 p-value = 0.5390625
1/1 [==============================] - ETA: 0s1/1 [==============================] - 0s 386ms/step
Statistics value = 37.0 p-value = 0.1875
1/1 [==============================] - ETA: 0s1/1 [==============================] - 0s 392ms/step
Statistics value = 8.0 p-value = 0.9814453125
1/1 [==============================] - ETA: 0s1/1 [==============================] - 0s 410ms/step
1/1 [==============================] - ETA: 0s1/1 [==============================] - 0s 366ms/step
Statistics value = 24.0 p-value = 0.65234375
1/1 [==============================] - ETA: 0s1/1 [==============================] - 0s 404ms/step
1/1 [==============================] - ETA: 0s1/1 [==============================] - 0s 65ms/step
1/1 [==============================] - ETA: 0s1/1 [==============================] - 0s 43ms/step
1/1 [==============================] - ETA: 0s1/1 [==============================] - 0s 436ms/step
1/1 [==============================] - ETA: 0s1/1 [==============================] - 0s 443ms/step
1/1 [==============================] - ETA: 0s1/1 [==============================] - 0s 442ms/step
1/1 [==============================] - ETA: 0s1/1 [==============================] - 0s 71ms/step
1/1 [==============================] - ETA: 0s1/1 [==============================] - 0s 51ms/step
1/1 [==============================] - ETA: 0s1/1 [==============================] - 0s 51ms/step
1/1 [==============================] - ETA: 0s1/1 [==============================] - 0s 64ms/step
1/1 [==============================] - ETA: 0s1/1 [==============================] - 0s 62ms/step
1/1 [==============================] - ETA: 0s1/1 [==============================] - 0s 44ms/step
[I 2024-12-23 19:45:20,102] Trial 5 finished with value: 0.3068443113896909 and parameters: {'n_units_0': 12, 'dropout_1': 0.3, 'run': 1, 'epochs_1': 100, 'epochs_2': 80, 'lr_1': 0.00024970737145052745, 'lr_2': 1.0257563974185649e-05, 'batch_size': 16, 'regularization': 'l2', 'reg_alpha_1': 0.0001189589673755355}. Best is trial 4 with value: 0.29393199113053897.
[I 2024-12-23 19:45:20,558] Trial 5 finished with value: 0.2329452302304132 and parameters: {'n_units_0': 12, 'dropout_1': 0.3, 'run': 1, 'epochs_1': 100, 'epochs_2': 80, 'lr_1': 0.00024970737145052745, 'lr_2': 1.0257563974185649e-05, 'batch_size': 16, 'regularization': 'l2', 'reg_alpha_1': 0.0001189589673755355}. Best is trial 5 with value: 0.2329452302304132.
[I 2024-12-23 19:45:20,591] Trial 5 finished with value: 1.1921887515109173 and parameters: {'n_units_0': 12, 'dropout_1': 0.3, 'run': 1, 'epochs_1': 100, 'epochs_2': 80, 'lr_1': 0.00024970737145052745, 'lr_2': 1.0257563974185649e-05, 'batch_size': 16, 'regularization': 'l2', 'reg_alpha_1': 0.0001189589673755355}. Best is trial 2 with value: 1.1027120758181013.
