[I 2024-12-23 19:31:04,663] Trial 12 finished with value: 1.5318199294203119 and parameters: {'n_units_0': 32, 'dropout_1': 0.25, 'run': 2, 'epochs_1': 30, 'epochs_2': 70, 'lr_1': 0.0009621244305713834, 'lr_2': 0.00020046179107204468, 'batch_size': 16, 'regularization': 'l1_l2', 'reg_alpha_1': 0.0016120292702693332, 'reg_alpha_2': 0.0001618399410450636}. Best is trial 11 with value: 1.1287452033991863.
1/1 [==============================] - ETA: 0s1/1 [==============================] - 0s 429ms/step
1/1 [==============================] - ETA: 0s1/1 [==============================] - 0s 485ms/step
1/1 [==============================] - ETA: 0s1/1 [==============================] - 0s 375ms/step
1/1 [==============================] - ETA: 0s1/1 [==============================] - 0s 377ms/step
1/1 [==============================] - ETA: 0s1/1 [==============================] - 0s 43ms/step
1/1 [==============================] - ETA: 0s1/1 [==============================] - 0s 40ms/step
1/1 [==============================] - ETA: 0s1/1 [==============================] - 0s 48ms/step
1/1 [==============================] - ETA: 0s1/1 [==============================] - 0s 45ms/step
1/1 [==============================] - ETA: 0s1/1 [==============================] - 0s 373ms/step
1/1 [==============================] - ETA: 0s1/1 [==============================] - 0s 367ms/step
1/1 [==============================] - ETA: 0s1/1 [==============================] - 0s 46ms/step
1/1 [==============================] - ETA: 0s1/1 [==============================] - 0s 47ms/step
Statistics value = 10.0 p-value = 0.9677734375
1/1 [==============================] - ETA: 0s1/1 [==============================] - 0s 401ms/step
Statistics value = 33.0 p-value = 0.3125
1/1 [==============================] - ETA: 0s1/1 [==============================] - 0s 390ms/step
1/1 [==============================] - ETA: 0s1/1 [==============================] - 0s 362ms/step
Statistics value = 35.0 p-value = 0.0078125
1/1 [==============================] - ETA: 0s1/1 [==============================] - 0s 353ms/step
1/1 [==============================] - ETA: 0s1/1 [==============================] - 0s 369ms/step
1/1 [==============================] - ETA: 0s1/1 [==============================] - 0s 371ms/step
1/1 [==============================] - ETA: 0s1/1 [==============================] - 0s 488ms/step
1/1 [==============================] - ETA: 0s1/1 [==============================] - 0s 484ms/step
1/1 [==============================] - ETA: 0s1/1 [==============================] - 0s 420ms/step
1/1 [==============================] - ETA: 0s1/1 [==============================] - 0s 436ms/step
Statistics value = 33.0 p-value = 0.3125
1/1 [==============================] - ETA: 0s1/1 [==============================] - 0s 426ms/step
1/1 [==============================] - ETA: 0s1/1 [==============================] - 0s 423ms/step
1/1 [==============================] - ETA: 0s1/1 [==============================] - 1s 514ms/step
1/1 [==============================] - ETA: 0s1/1 [==============================] - 0s 477ms/step
1/1 [==============================] - ETA: 0s1/1 [==============================] - 0s 49ms/step
1/1 [==============================] - ETA: 0s1/1 [==============================] - 0s 54ms/step
1/1 [==============================] - ETA: 0s1/1 [==============================] - 0s 395ms/step
1/1 [==============================] - ETA: 0s1/1 [==============================] - 1s 501ms/step
1/1 [==============================] - ETA: 0s1/1 [==============================] - 0s 402ms/step
1/1 [==============================] - ETA: 0s1/1 [==============================] - 0s 441ms/step
1/1 [==============================] - ETA: 0s1/1 [==============================] - 0s 45ms/step
1/1 [==============================] - ETA: 0s1/1 [==============================] - 0s 46ms/step
1/1 [==============================] - ETA: 0s1/1 [==============================] - 0s 53ms/step
1/1 [==============================] - ETA: 0s1/1 [==============================] - 0s 42ms/step
[I 2024-12-23 19:31:47,927] Trial 12 finished with value: 0.4037620776055537 and parameters: {'n_units_0': 28, 'dropout_1': 0.15000000000000002, 'run': 3, 'epochs_1': 40, 'epochs_2': 50, 'lr_1': 0.0004957547237088648, 'lr_2': 0.0008538648795388481, 'batch_size': 12, 'regularization': 'l1', 'reg_alpha_1': 2.9440111623882405e-05}. Best is trial 4 with value: 0.2935738766159764.
[I 2024-12-23 19:31:48,051] Trial 12 finished with value: 0.27453269401592373 and parameters: {'n_units_0': 28, 'dropout_1': 0.15000000000000002, 'run': 3, 'epochs_1': 40, 'epochs_2': 50, 'lr_1': 0.0004957547237088648, 'lr_2': 0.0008538648795388481, 'batch_size': 12, 'regularization': 'l1', 'reg_alpha_1': 2.9440111623882405e-05}. Best is trial 4 with value: 0.23212443231328786.
1/1 [==============================] - ETA: 0s1/1 [==============================] - 0s 435ms/step
1/1 [==============================] - ETA: 0s1/1 [==============================] - 0s 402ms/step
1/1 [==============================] - ETA: 0s1/1 [==============================] - 0s 48ms/step
1/1 [==============================] - ETA: 0s1/1 [==============================] - 0s 43ms/step
[I 2024-12-23 19:31:51,611] Trial 13 finished with value: 0.6753454632509062 and parameters: {'n_units_0': 40, 'dropout_1': 0.25, 'run': 2, 'epochs_1': 50, 'epochs_2': 60, 'lr_1': 0.0022118702914464255, 'lr_2': 2.6885431803887616e-05, 'batch_size': 16, 'regularization': 'l2', 'reg_alpha_1': 0.001283622594897186}. Best is trial 6 with value: 0.46996822402344646.
Statistics value = 15.0 p-value = 0.9033203125
1/1 [==============================] - ETA: 0s1/1 [==============================] - 0s 413ms/step
1/1 [==============================] - ETA: 0s1/1 [==============================] - 0s 383ms/step
Statistics value = 4.0 p-value = 0.98046875
1/1 [==============================] - ETA: 0s1/1 [==============================] - 0s 402ms/step
Statistics value = 22.0 p-value = 0.3203125
1/1 [==============================] - ETA: 0s1/1 [==============================] - 0s 381ms/step
1/1 [==============================] - ETA: 0s1/1 [==============================] - 0s 379ms/step
1/1 [==============================] - ETA: 0s1/1 [==============================] - 0s 404ms/step
Statistics value = 22.0 p-value = 0.3203125
1/1 [==============================] - ETA: 0s1/1 [==============================] - 0s 430ms/step
1/1 [==============================] - ETA: 0s1/1 [==============================] - 0s 407ms/step
1/1 [==============================] - ETA: 0s1/1 [==============================] - 0s 402ms/step
1/1 [==============================] - ETA: 0s1/1 [==============================] - 0s 403ms/step
1/1 [==============================] - ETA: 0s1/1 [==============================] - 0s 52ms/step
1/1 [==============================] - ETA: 0s1/1 [==============================] - 0s 44ms/step
[I 2024-12-23 19:32:08,318] Trial 13 finished with value: 2.125881502575369 and parameters: {'n_units_0': 24, 'dropout_1': 0.25, 'run': 2, 'epochs_1': 50, 'epochs_2': 80, 'lr_1': 0.002743233561416628, 'lr_2': 0.0009818247569037461, 'batch_size': 16, 'regularization': 'l1_l2', 'reg_alpha_1': 0.0009537124931984189, 'reg_alpha_2': 0.00024385253899402906}. Best is trial 11 with value: 1.1287452033991863.
1/1 [==============================] - ETA: 0s1/1 [==============================] - 0s 407ms/step
1/1 [==============================] - ETA: 0s1/1 [==============================] - 0s 410ms/step
1/1 [==============================] - ETA: 0s1/1 [==============================] - 0s 421ms/step
1/1 [==============================] - ETA: 0s1/1 [==============================] - 0s 409ms/step
1/1 [==============================] - ETA: 0s1/1 [==============================] - 0s 439ms/step
1/1 [==============================] - ETA: 0s1/1 [==============================] - 0s 397ms/step
Statistics value = 35.0 p-value = 0.0078125
1/1 [==============================] - ETA: 0s1/1 [==============================] - 0s 410ms/step
1/1 [==============================] - ETA: 0s1/1 [==============================] - 0s 392ms/step
1/1 [==============================] - ETA: 0s1/1 [==============================] - 0s 439ms/step
1/1 [==============================] - ETA: 0s1/1 [==============================] - 0s 395ms/step
1/1 [==============================] - ETA: 0s1/1 [==============================] - 0s 434ms/step
1/1 [==============================] - ETA: 0s1/1 [==============================] - 0s 406ms/step
1/1 [==============================] - ETA: 0s1/1 [==============================] - 0s 60ms/step
1/1 [==============================] - ETA: 0s1/1 [==============================] - 0s 43ms/step
1/1 [==============================] - ETA: 0s1/1 [==============================] - 0s 41ms/step
1/1 [==============================] - ETA: 0s1/1 [==============================] - 0s 44ms/step
1/1 [==============================] - ETA: 0s1/1 [==============================] - 0s 482ms/step
1/1 [==============================] - ETA: 0s1/1 [==============================] - 0s 466ms/step
1/1 [==============================] - ETA: 0s1/1 [==============================] - 0s 50ms/step
1/1 [==============================] - ETA: 0s1/1 [==============================] - 0s 43ms/step
1/1 [==============================] - ETA: 0s1/1 [==============================] - 0s 389ms/step
1/1 [==============================] - ETA: 0s1/1 [==============================] - 0s 395ms/step
1/1 [==============================] - ETA: 0s1/1 [==============================] - 0s 48ms/step
1/1 [==============================] - ETA: 0s1/1 [==============================] - 0s 46ms/step
Statistics value = 28.0 p-value = 0.5
1/1 [==============================] - ETA: 0s1/1 [==============================] - 0s 389ms/step
Statistics value = 52.0 p-value = 0.0048828125
1/1 [==============================] - ETA: 0s1/1 [==============================] - 0s 410ms/step
1/1 [==============================] - ETA: 0s1/1 [==============================] - 0s 411ms/step
1/1 [==============================] - ETA: 0s1/1 [==============================] - 0s 398ms/step
Statistics value = 29.0 p-value = 0.4609375
1/1 [==============================] - ETA: 0s1/1 [==============================] - 0s 422ms/step
1/1 [==============================] - ETA: 0s1/1 [==============================] - 0s 429ms/step
Statistics value = 33.0 p-value = 0.3125
1/1 [==============================] - ETA: 0s1/1 [==============================] - 0s 430ms/step
1/1 [==============================] - ETA: 0s1/1 [==============================] - 0s 413ms/step
1/1 [==============================] - ETA: 0s1/1 [==============================] - 0s 425ms/step
1/1 [==============================] - ETA: 0s1/1 [==============================] - 0s 423ms/step
1/1 [==============================] - ETA: 0s1/1 [==============================] - 0s 400ms/step
1/1 [==============================] - ETA: 0s1/1 [==============================] - 1s 530ms/step
1/1 [==============================] - ETA: 0s1/1 [==============================] - 0s 427ms/step
1/1 [==============================] - ETA: 0s1/1 [==============================] - 0s 467ms/step
1/1 [==============================] - ETA: 0s1/1 [==============================] - 0s 43ms/step
1/1 [==============================] - ETA: 0s1/1 [==============================] - 0s 47ms/step
[I 2024-12-23 19:33:00,488] Trial 14 finished with value: 1.3047780126186166 and parameters: {'n_units_0': 40, 'dropout_1': 0.25, 'run': 2, 'epochs_1': 30, 'epochs_2': 60, 'lr_1': 0.0004387304793788129, 'lr_2': 0.00019763507678196164, 'batch_size': 12, 'regularization': 'l1_l2', 'reg_alpha_1': 3.7256445928690834e-05, 'reg_alpha_2': 4.813270990765419e-05}. Best is trial 11 with value: 1.1287452033991863.
1/1 [==============================] - ETA: 0s1/1 [==============================] - 0s 423ms/step
1/1 [==============================] - ETA: 0s1/1 [==============================] - 0s 398ms/step
1/1 [==============================] - ETA: 0s1/1 [==============================] - 0s 428ms/step
1/1 [==============================] - ETA: 0s1/1 [==============================] - 1s 508ms/step
1/1 [==============================] - ETA: 0s1/1 [==============================] - 0s 435ms/step
1/1 [==============================] - ETA: 0s1/1 [==============================] - 0s 384ms/step
1/1 [==============================] - ETA: 0s1/1 [==============================] - 0s 51ms/step
1/1 [==============================] - ETA: 0s1/1 [==============================] - 0s 52ms/step
1/1 [==============================] - ETA: 0s1/1 [==============================] - 0s 40ms/step
1/1 [==============================] - ETA: 0s1/1 [==============================] - 0s 38ms/step
[I 2024-12-23 19:33:06,577] Trial 13 finished with value: 0.23325958734814073 and parameters: {'n_units_0': 40, 'dropout_1': 0.25, 'run': 3, 'epochs_1': 50, 'epochs_2': 20, 'lr_1': 0.00011440652293717112, 'lr_2': 2.6885431803887616e-05, 'batch_size': 8, 'regularization': 'l2', 'reg_alpha_1': 3.595664962278216e-05}. Best is trial 4 with value: 0.23212443231328786.
[I 2024-12-23 19:33:06,588] Trial 13 finished with value: 0.31614942976487115 and parameters: {'n_units_0': 40, 'dropout_1': 0.25, 'run': 3, 'epochs_1': 50, 'epochs_2': 20, 'lr_1': 0.00011440652293717112, 'lr_2': 2.6885431803887616e-05, 'batch_size': 8, 'regularization': 'l2', 'reg_alpha_1': 3.595664962278216e-05}. Best is trial 4 with value: 0.2935738766159764.
Statistics value = 29.0 p-value = 0.07421875
1/1 [==============================] - ETA: 0s1/1 [==============================] - 0s 428ms/step
1/1 [==============================] - ETA: 0s1/1 [==============================] - 0s 413ms/step
1/1 [==============================] - ETA: 0s1/1 [==============================] - 0s 453ms/step
1/1 [==============================] - ETA: 0s1/1 [==============================] - 0s 394ms/step
1/1 [==============================] - ETA: 0s1/1 [==============================] - 0s 52ms/step
1/1 [==============================] - ETA: 0s1/1 [==============================] - 0s 42ms/step
