[I 2024-12-23 18:13:15,291] Trial 0 finished with value: 1.0150131668973232 and parameters: {'n_units_0': 24, 'dropout_1': 0.3, 'run': 3, 'epochs_1': 70, 'epochs_2': 30, 'lr_1': 0.00020511104188433984, 'lr_2': 1.3066739238053272e-05, 'batch_size': 16, 'regularization': 'None'}. Best is trial 0 with value: 1.0150131668973232.
[I 2024-12-23 18:13:15,355] Trial 0 finished with value: 0.5638824182364041 and parameters: {'n_units_0': 24, 'dropout_1': 0.3, 'run': 3, 'epochs_1': 70, 'epochs_2': 30, 'lr_1': 0.00020511104188433984, 'lr_2': 1.3066739238053272e-05, 'batch_size': 16, 'regularization': 'None'}. Best is trial 0 with value: 0.5638824182364041.
[I 2024-12-23 18:13:15,414] Trial 0 finished with value: 0.3068292266319744 and parameters: {'n_units_0': 24, 'dropout_1': 0.3, 'run': 3, 'epochs_1': 70, 'epochs_2': 30, 'lr_1': 0.00020511104188433984, 'lr_2': 1.3066739238053272e-05, 'batch_size': 16, 'regularization': 'None'}. Best is trial 0 with value: 0.3068292266319744.
[I 2024-12-23 18:13:15,603] Trial 0 finished with value: 0.2355905822231061 and parameters: {'n_units_0': 24, 'dropout_1': 0.3, 'run': 3, 'epochs_1': 70, 'epochs_2': 30, 'lr_1': 0.00020511104188433984, 'lr_2': 1.3066739238053272e-05, 'batch_size': 16, 'regularization': 'None'}. Best is trial 0 with value: 0.2355905822231061.
Statistics value = 21.0 p-value = 0.37109375
1/1 [==============================] - ETA: 0s1/1 [==============================] - 0s 397ms/step
Statistics value = 14.0 p-value = 0.7265625
1/1 [==============================] - ETA: 0s1/1 [==============================] - 0s 434ms/step
Statistics value = 26.0 p-value = 0.15625
1/1 [==============================] - ETA: 0s1/1 [==============================] - 0s 381ms/step
Statistics value = 17.0 p-value = 0.578125
1/1 [==============================] - ETA: 0s1/1 [==============================] - 0s 353ms/step
1/1 [==============================] - ETA: 0s1/1 [==============================] - 0s 415ms/step
1/1 [==============================] - ETA: 0s1/1 [==============================] - 0s 395ms/step
1/1 [==============================] - ETA: 0s1/1 [==============================] - 0s 362ms/step
1/1 [==============================] - ETA: 0s1/1 [==============================] - 0s 43ms/step
1/1 [==============================] - ETA: 0s1/1 [==============================] - 0s 40ms/step
1/1 [==============================] - ETA: 0s1/1 [==============================] - 0s 50ms/step
1/1 [==============================] - ETA: 0s1/1 [==============================] - 0s 58ms/step
1/1 [==============================] - ETA: 0s1/1 [==============================] - 1s 583ms/step
1/1 [==============================] - ETA: 0s1/1 [==============================] - 0s 86ms/step
1/1 [==============================] - ETA: 0s1/1 [==============================] - 0s 57ms/step
1/1 [==============================] - ETA: 0s1/1 [==============================] - 0s 63ms/step
1/1 [==============================] - ETA: 0s1/1 [==============================] - 0s 39ms/step
Statistics value = 12.0 p-value = 0.947265625
1/1 [==============================] - ETA: 0s1/1 [==============================] - 0s 379ms/step
Statistics value = 31.0 p-value = 0.384765625
1/1 [==============================] - ETA: 0s1/1 [==============================] - 0s 390ms/step
Statistics value = 34.0 p-value = 0.2783203125
1/1 [==============================] - ETA: 0s1/1 [==============================] - 0s 385ms/step
Statistics value = 26.0 p-value = 0.5771484375
1/1 [==============================] - ETA: 0s1/1 [==============================] - 0s 388ms/step
1/1 [==============================] - ETA: 0s1/1 [==============================] - 0s 446ms/step
1/1 [==============================] - ETA: 0s1/1 [==============================] - 0s 43ms/step
1/1 [==============================] - ETA: 0s1/1 [==============================] - 0s 367ms/step
1/1 [==============================] - ETA: 0s1/1 [==============================] - 0s 53ms/step
1/1 [==============================] - ETA: 0s1/1 [==============================] - 0s 384ms/step
1/1 [==============================] - ETA: 0s1/1 [==============================] - 0s 417ms/step
1/1 [==============================] - ETA: 0s1/1 [==============================] - 0s 75ms/step
1/1 [==============================] - ETA: 0s1/1 [==============================] - 0s 73ms/step
1/1 [==============================] - ETA: 0s1/1 [==============================] - 0s 98ms/step
1/1 [==============================] - ETA: 0s1/1 [==============================] - 0s 82ms/step
1/1 [==============================] - ETA: 0s1/1 [==============================] - 0s 78ms/step
1/1 [==============================] - ETA: 0s1/1 [==============================] - 0s 87ms/step
[I 2024-12-23 18:13:46,267] Trial 1 finished with value: 0.2683273477698131 and parameters: {'n_units_0': 56, 'dropout_1': 0.15000000000000002, 'run': 1, 'epochs_1': 40, 'epochs_2': 40, 'lr_1': 0.0011207606211860567, 'lr_2': 7.309539835912905e-05, 'batch_size': 8, 'regularization': 'l1_l2', 'reg_alpha_1': 0.00023345864076016249, 'reg_alpha_2': 0.0022673986523780395}. Best is trial 0 with value: 0.2355905822231061.
[I 2024-12-23 18:13:46,575] Trial 1 finished with value: 1.663244206014689 and parameters: {'n_units_0': 56, 'dropout_1': 0.15000000000000002, 'run': 1, 'epochs_1': 40, 'epochs_2': 40, 'lr_1': 0.0011207606211860567, 'lr_2': 7.309539835912905e-05, 'batch_size': 8, 'regularization': 'l1_l2', 'reg_alpha_1': 0.00023345864076016249, 'reg_alpha_2': 0.0022673986523780395}. Best is trial 0 with value: 1.0150131668973232.
[I 2024-12-23 18:13:46,580] Trial 1 finished with value: 0.6849868038129716 and parameters: {'n_units_0': 56, 'dropout_1': 0.15000000000000002, 'run': 1, 'epochs_1': 40, 'epochs_2': 40, 'lr_1': 0.0011207606211860567, 'lr_2': 7.309539835912905e-05, 'batch_size': 8, 'regularization': 'l1_l2', 'reg_alpha_1': 0.00023345864076016249, 'reg_alpha_2': 0.0022673986523780395}. Best is trial 0 with value: 0.5638824182364041.
[I 2024-12-23 18:13:46,671] Trial 1 finished with value: 0.4278187913699727 and parameters: {'n_units_0': 56, 'dropout_1': 0.15000000000000002, 'run': 1, 'epochs_1': 40, 'epochs_2': 40, 'lr_1': 0.0011207606211860567, 'lr_2': 7.309539835912905e-05, 'batch_size': 8, 'regularization': 'l1_l2', 'reg_alpha_1': 0.00023345864076016249, 'reg_alpha_2': 0.0022673986523780395}. Best is trial 0 with value: 0.3068292266319744.
Statistics value = 7.0 p-value = 0.9453125
1/1 [==============================] - ETA: 0s1/1 [==============================] - 0s 436ms/step
Statistics value = 20.0 p-value = 0.421875
1/1 [==============================] - ETA: 0s1/1 [==============================] - 0s 370ms/step
Statistics value = 17.0 p-value = 0.578125
1/1 [==============================] - ETA: 0s1/1 [==============================] - 0s 368ms/step
Statistics value = 35.0 p-value = 0.0078125
1/1 [==============================] - ETA: 0s1/1 [==============================] - 0s 484ms/step
1/1 [==============================] - ETA: 0s1/1 [==============================] - 0s 405ms/step
1/1 [==============================] - ETA: 0s1/1 [==============================] - 0s 390ms/step
1/1 [==============================] - ETA: 0s1/1 [==============================] - 0s 399ms/step
1/1 [==============================] - ETA: 0s1/1 [==============================] - 0s 368ms/step
1/1 [==============================] - ETA: 0s1/1 [==============================] - 0s 323ms/step
1/1 [==============================] - ETA: 0s1/1 [==============================] - 0s 321ms/step
1/1 [==============================] - ETA: 0s1/1 [==============================] - 0s 302ms/step
1/1 [==============================] - ETA: 0s1/1 [==============================] - 0s 295ms/step
1/1 [==============================] - ETA: 0s1/1 [==============================] - 0s 33ms/step
1/1 [==============================] - ETA: 0s1/1 [==============================] - 0s 304ms/step
1/1 [==============================] - ETA: 0s1/1 [==============================] - 0s 34ms/step
1/1 [==============================] - ETA: 0s1/1 [==============================] - 0s 341ms/step
1/1 [==============================] - ETA: 0s1/1 [==============================] - 0s 327ms/step
1/1 [==============================] - ETA: 0s1/1 [==============================] - 0s 360ms/step
1/1 [==============================] - ETA: 0s1/1 [==============================] - 0s 35ms/step
1/1 [==============================] - ETA: 0s1/1 [==============================] - 0s 35ms/step
1/1 [==============================] - ETA: 0s1/1 [==============================] - 0s 28ms/step
1/1 [==============================] - ETA: 0s1/1 [==============================] - 0s 41ms/step
1/1 [==============================] - ETA: 0s1/1 [==============================] - 0s 49ms/step
1/1 [==============================] - ETA: 0s1/1 [==============================] - 0s 28ms/step
Statistics value = 38.0 p-value = 0.1611328125
1/1 [==============================] - ETA: 0s1/1 [==============================] - 0s 306ms/step
1/1 [==============================] - ETA: 0s1/1 [==============================] - 0s 323ms/step
Statistics value = 24.0 p-value = 0.65234375
1/1 [==============================] - ETA: 0s1/1 [==============================] - 0s 304ms/step
Statistics value = 41.0 p-value = 0.0966796875
1/1 [==============================] - ETA: 0s1/1 [==============================] - 0s 324ms/step
Statistics value = 25.0 p-value = 0.615234375
1/1 [==============================] - ETA: 0s1/1 [==============================] - 0s 306ms/step
1/1 [==============================] - ETA: 0s1/1 [==============================] - 0s 325ms/step
1/1 [==============================] - ETA: 0s1/1 [==============================] - 0s 320ms/step
1/1 [==============================] - ETA: 0s1/1 [==============================] - 0s 324ms/step
1/1 [==============================] - ETA: 0s1/1 [==============================] - 0s 341ms/step
1/1 [==============================] - ETA: 0s1/1 [==============================] - 0s 308ms/step
1/1 [==============================] - ETA: 0s1/1 [==============================] - 0s 28ms/step
1/1 [==============================] - ETA: 0s1/1 [==============================] - 0s 28ms/step
1/1 [==============================] - ETA: 0s1/1 [==============================] - 0s 340ms/step
1/1 [==============================] - ETA: 0s1/1 [==============================] - 0s 329ms/step
1/1 [==============================] - ETA: 0s1/1 [==============================] - 0s 347ms/step
1/1 [==============================] - ETA: 0s1/1 [==============================] - 0s 240ms/step
1/1 [==============================] - ETA: 0s1/1 [==============================] - 0s 316ms/step
[I 2024-12-23 18:14:31,772] Trial 2 finished with value: 0.23770512587235165 and parameters: {'n_units_0': 16, 'dropout_1': 0.2, 'run': 2, 'epochs_1': 30, 'epochs_2': 70, 'lr_1': 0.00021930485556643703, 'lr_2': 1.3492834268013232e-05, 'batch_size': 16, 'regularization': 'l1_l2', 'reg_alpha_1': 0.0011290133559092666, 'reg_alpha_2': 0.00020914981329035596}. Best is trial 0 with value: 0.2355905822231061.
1/1 [==============================] - ETA: 0s1/1 [==============================] - 0s 27ms/step
1/1 [==============================] - ETA: 0s1/1 [==============================] - 0s 39ms/step
1/1 [==============================] - ETA: 0s1/1 [==============================] - 0s 320ms/step
1/1 [==============================] - ETA: 0s1/1 [==============================] - 0s 22ms/step
1/1 [==============================] - ETA: 0s1/1 [==============================] - 0s 31ms/step
1/1 [==============================] - ETA: 0s1/1 [==============================] - 0s 40ms/step
1/1 [==============================] - ETA: 0s1/1 [==============================] - 0s 30ms/step
[I 2024-12-23 18:14:32,514] Trial 2 finished with value: 0.2897168795505005 and parameters: {'n_units_0': 16, 'dropout_1': 0.2, 'run': 2, 'epochs_1': 30, 'epochs_2': 70, 'lr_1': 0.00021930485556643703, 'lr_2': 1.3492834268013232e-05, 'batch_size': 16, 'regularization': 'l1_l2', 'reg_alpha_1': 0.0011290133559092666, 'reg_alpha_2': 0.00020914981329035596}. Best is trial 2 with value: 0.2897168795505005.
[I 2024-12-23 18:14:32,553] Trial 2 finished with value: 1.1651650079485538 and parameters: {'n_units_0': 16, 'dropout_1': 0.2, 'run': 2, 'epochs_1': 30, 'epochs_2': 70, 'lr_1': 0.00021930485556643703, 'lr_2': 1.3492834268013232e-05, 'batch_size': 16, 'regularization': 'l1_l2', 'reg_alpha_1': 0.0011290133559092666, 'reg_alpha_2': 0.00020914981329035596}. Best is trial 0 with value: 1.0150131668973232.
[I 2024-12-23 18:14:32,677] Trial 2 finished with value: 0.6880878668227692 and parameters: {'n_units_0': 16, 'dropout_1': 0.2, 'run': 2, 'epochs_1': 30, 'epochs_2': 70, 'lr_1': 0.00021930485556643703, 'lr_2': 1.3492834268013232e-05, 'batch_size': 16, 'regularization': 'l1_l2', 'reg_alpha_1': 0.0011290133559092666, 'reg_alpha_2': 0.00020914981329035596}. Best is trial 0 with value: 0.5638824182364041.
Statistics value = 19.0 p-value = 0.47265625
1/1 [==============================] - ETA: 0s1/1 [==============================] - 0s 295ms/step
1/1 [==============================] - ETA: 0s1/1 [==============================] - 0s 322ms/step
1/1 [==============================] - ETA: 0s1/1 [==============================] - 0s 28ms/step
1/1 [==============================] - ETA: 0s1/1 [==============================] - 0s 27ms/step
Statistics value = 19.0 p-value = 0.47265625
1/1 [==============================] - ETA: 0s1/1 [==============================] - 0s 342ms/step
Statistics value = 34.0 p-value = 0.01171875
1/1 [==============================] - ETA: 0s1/1 [==============================] - 0s 349ms/step
Statistics value = 23.0 p-value = 0.2734375
1/1 [==============================] - ETA: 0s1/1 [==============================] - 0s 319ms/step
1/1 [==============================] - ETA: 0s1/1 [==============================] - 0s 376ms/step
1/1 [==============================] - ETA: 0s1/1 [==============================] - 0s 336ms/step
1/1 [==============================] - ETA: 0s1/1 [==============================] - 0s 334ms/step
1/1 [==============================] - ETA: 0s1/1 [==============================] - 0s 33ms/step
1/1 [==============================] - ETA: 0s1/1 [==============================] - 0s 40ms/step
1/1 [==============================] - ETA: 0s1/1 [==============================] - 0s 49ms/step
1/1 [==============================] - ETA: 0s1/1 [==============================] - 0s 29ms/step
1/1 [==============================] - ETA: 0s1/1 [==============================] - 0s 37ms/step
1/1 [==============================] - ETA: 0s1/1 [==============================] - 0s 32ms/step
Statistics value = 7.0 p-value = 0.986328125
1/1 [==============================] - ETA: 0s1/1 [==============================] - 0s 356ms/step
1/1 [==============================] - ETA: 0s1/1 [==============================] - 0s 295ms/step
1/1 [==============================] - ETA: 0s1/1 [==============================] - 0s 27ms/step
1/1 [==============================] - ETA: 0s1/1 [==============================] - 0s 31ms/step
