[I 2024-12-23 21:37:01,625] Trial 13 finished with value: 0.26006452213042 and parameters: {'n_units_0': 64, 'dropout_1': 0.25, 'run': 1, 'epochs_1': 60, 'epochs_2': 80, 'lr_1': 0.0004211820672276473, 'lr_2': 0.0001103278686573759, 'batch_size': 8, 'regularization': 'l2', 'reg_alpha_1': 1.503134287034407e-05}. Best is trial 4 with value: 0.23204332328658517.
Statistics value = 17.0 p-value = 0.578125
1/1 [==============================] - ETA: 0s1/1 [==============================] - 0s 421ms/step
1/1 [==============================] - ETA: 0s1/1 [==============================] - 0s 407ms/step
1/1 [==============================] - ETA: 0s1/1 [==============================] - 0s 423ms/step
1/1 [==============================] - ETA: 0s1/1 [==============================] - 0s 393ms/step
1/1 [==============================] - ETA: 0s1/1 [==============================] - 0s 55ms/step
1/1 [==============================] - ETA: 0s1/1 [==============================] - 0s 43ms/step
Statistics value = 6.0 p-value = 0.9609375
1/1 [==============================] - ETA: 0s1/1 [==============================] - 0s 385ms/step
1/1 [==============================] - ETA: 0s1/1 [==============================] - 0s 400ms/step
1/1 [==============================] - ETA: 0s1/1 [==============================] - 0s 426ms/step
1/1 [==============================] - ETA: 0s1/1 [==============================] - 0s 403ms/step
1/1 [==============================] - ETA: 0s1/1 [==============================] - 0s 47ms/step
1/1 [==============================] - ETA: 0s1/1 [==============================] - 0s 47ms/step
1/1 [==============================] - ETA: 0s1/1 [==============================] - 0s 414ms/step
1/1 [==============================] - ETA: 0s1/1 [==============================] - 0s 414ms/step
1/1 [==============================] - ETA: 0s1/1 [==============================] - 0s 53ms/step
1/1 [==============================] - ETA: 0s1/1 [==============================] - 0s 54ms/step
1/1 [==============================] - ETA: 0s1/1 [==============================] - 0s 418ms/step
1/1 [==============================] - ETA: 0s1/1 [==============================] - 0s 426ms/step
1/1 [==============================] - ETA: 0s1/1 [==============================] - 0s 57ms/step
1/1 [==============================] - ETA: 0s1/1 [==============================] - 0s 39ms/step
Statistics value = 30.0 p-value = 0.4228515625
1/1 [==============================] - ETA: 0s1/1 [==============================] - 0s 433ms/step
1/1 [==============================] - ETA: 0s1/1 [==============================] - 0s 411ms/step
Statistics value = 34.0 p-value = 0.2783203125
1/1 [==============================] - ETA: 0s1/1 [==============================] - 0s 405ms/step
1/1 [==============================] - ETA: 0s1/1 [==============================] - 0s 383ms/step
Statistics value = 13.0 p-value = 0.9345703125
1/1 [==============================] - ETA: 0s1/1 [==============================] - 0s 409ms/step
Statistics value = 2.0 p-value = 0.998046875
1/1 [==============================] - ETA: 0s1/1 [==============================] - 0s 394ms/step
1/1 [==============================] - ETA: 0s1/1 [==============================] - 0s 408ms/step
1/1 [==============================] - ETA: 0s1/1 [==============================] - 0s 419ms/step
1/1 [==============================] - ETA: 0s1/1 [==============================] - 1s 561ms/step
1/1 [==============================] - ETA: 0s1/1 [==============================] - 0s 421ms/step
1/1 [==============================] - ETA: 0s1/1 [==============================] - 0s 51ms/step
1/1 [==============================] - ETA: 0s1/1 [==============================] - 0s 50ms/step
1/1 [==============================] - ETA: 0s1/1 [==============================] - 0s 452ms/step
1/1 [==============================] - ETA: 0s1/1 [==============================] - 0s 400ms/step
1/1 [==============================] - ETA: 0s1/1 [==============================] - 0s 50ms/step
1/1 [==============================] - ETA: 0s1/1 [==============================] - 0s 48ms/step
[I 2024-12-23 21:37:51,314] Trial 13 finished with value: 0.692042885475417 and parameters: {'n_units_0': 40, 'dropout_1': 0.25, 'run': 2, 'epochs_1': 50, 'epochs_2': 100, 'lr_1': 0.00010623818229569275, 'lr_2': 0.0008524636948952184, 'batch_size': 16, 'regularization': 'l1_l2', 'reg_alpha_1': 0.00120026983261724, 'reg_alpha_2': 0.0008988429017913118}. Best is trial 6 with value: 0.5389333941129716.
[I 2024-12-23 21:37:52,145] Trial 13 finished with value: 0.41262075157165845 and parameters: {'n_units_0': 44, 'dropout_1': 0.25, 'run': 2, 'epochs_1': 50, 'epochs_2': 90, 'lr_1': 0.0004948068192559079, 'lr_2': 0.00011550287009382684, 'batch_size': 8, 'regularization': 'l1', 'reg_alpha_1': 0.0009715366035201349}. Best is trial 2 with value: 0.28885393619906585.
1/1 [==============================] - ETA: 0s1/1 [==============================] - 0s 411ms/step
1/1 [==============================] - ETA: 0s1/1 [==============================] - 0s 363ms/step
1/1 [==============================] - ETA: 0s1/1 [==============================] - 0s 55ms/step
1/1 [==============================] - ETA: 0s1/1 [==============================] - 0s 43ms/step
[I 2024-12-23 21:37:59,442] Trial 14 finished with value: 0.27556065582295286 and parameters: {'n_units_0': 44, 'dropout_1': 0.15000000000000002, 'run': 2, 'epochs_1': 30, 'epochs_2': 60, 'lr_1': 0.002569532796402447, 'lr_2': 0.0003366563730093227, 'batch_size': 16, 'regularization': 'l1', 'reg_alpha_1': 0.0007816581332871905}. Best is trial 4 with value: 0.23204332328658517.
1/1 [==============================] - ETA: 0s1/1 [==============================] - 0s 415ms/step
1/1 [==============================] - ETA: 0s1/1 [==============================] - 0s 376ms/step
1/1 [==============================] - ETA: 0s1/1 [==============================] - 0s 47ms/step
1/1 [==============================] - ETA: 0s1/1 [==============================] - 0s 48ms/step
[I 2024-12-23 21:38:01,350] Trial 13 finished with value: 2.272006795169802 and parameters: {'n_units_0': 44, 'dropout_1': 0.25, 'run': 2, 'epochs_1': 60, 'epochs_2': 100, 'lr_1': 0.0006621940629534764, 'lr_2': 0.0009169288511092416, 'batch_size': 16, 'regularization': 'None'}. Best is trial 0 with value: 1.0441492888163748.
Statistics value = 24.0 p-value = 0.23046875
1/1 [==============================] - ETA: 0s1/1 [==============================] - 0s 418ms/step
1/1 [==============================] - ETA: 0s1/1 [==============================] - 0s 357ms/step
Statistics value = 21.0 p-value = 0.37109375
1/1 [==============================] - ETA: 0s1/1 [==============================] - 0s 396ms/step
1/1 [==============================] - ETA: 0s1/1 [==============================] - 0s 400ms/step
Statistics value = 3.0 p-value = 0.98828125
1/1 [==============================] - ETA: 0s1/1 [==============================] - 0s 418ms/step
1/1 [==============================] - ETA: 0s1/1 [==============================] - 0s 393ms/step
Statistics value = 34.0 p-value = 0.01171875
1/1 [==============================] - ETA: 0s1/1 [==============================] - 0s 419ms/step
1/1 [==============================] - ETA: 0s1/1 [==============================] - 0s 406ms/step
1/1 [==============================] - ETA: 0s1/1 [==============================] - 0s 413ms/step
1/1 [==============================] - ETA: 0s1/1 [==============================] - 0s 400ms/step
1/1 [==============================] - ETA: 0s1/1 [==============================] - 0s 391ms/step
1/1 [==============================] - ETA: 0s1/1 [==============================] - 0s 391ms/step
1/1 [==============================] - ETA: 0s1/1 [==============================] - 0s 61ms/step
1/1 [==============================] - ETA: 0s1/1 [==============================] - 0s 41ms/step
1/1 [==============================] - ETA: 0s1/1 [==============================] - 0s 401ms/step
1/1 [==============================] - ETA: 0s1/1 [==============================] - 0s 382ms/step
1/1 [==============================] - ETA: 0s1/1 [==============================] - 0s 57ms/step
1/1 [==============================] - ETA: 0s1/1 [==============================] - 0s 45ms/step
1/1 [==============================] - ETA: 0s1/1 [==============================] - 0s 405ms/step
1/1 [==============================] - ETA: 0s1/1 [==============================] - 0s 389ms/step
1/1 [==============================] - ETA: 0s1/1 [==============================] - 0s 410ms/step
1/1 [==============================] - ETA: 0s1/1 [==============================] - 0s 378ms/step
Statistics value = 34.0 p-value = 0.2783203125
1/1 [==============================] - ETA: 0s1/1 [==============================] - 0s 405ms/step
1/1 [==============================] - ETA: 0s1/1 [==============================] - 0s 413ms/step
Statistics value = 28.0 p-value = 0.5
1/1 [==============================] - ETA: 0s1/1 [==============================] - 0s 400ms/step
1/1 [==============================] - ETA: 0s1/1 [==============================] - 0s 395ms/step
1/1 [==============================] - ETA: 0s1/1 [==============================] - 0s 408ms/step
1/1 [==============================] - ETA: 0s1/1 [==============================] - 0s 406ms/step
1/1 [==============================] - ETA: 0s1/1 [==============================] - 0s 52ms/step
1/1 [==============================] - ETA: 0s1/1 [==============================] - 0s 44ms/step
1/1 [==============================] - ETA: 0s1/1 [==============================] - 0s 421ms/step
1/1 [==============================] - ETA: 0s1/1 [==============================] - 0s 386ms/step
1/1 [==============================] - ETA: 0s1/1 [==============================] - 0s 45ms/step
1/1 [==============================] - ETA: 0s1/1 [==============================] - 0s 41ms/step
1/1 [==============================] - ETA: 0s1/1 [==============================] - 0s 388ms/step
1/1 [==============================] - ETA: 0s1/1 [==============================] - 0s 404ms/step
1/1 [==============================] - ETA: 0s1/1 [==============================] - 0s 50ms/step
1/1 [==============================] - ETA: 0s1/1 [==============================] - 0s 47ms/step
[I 2024-12-23 21:38:51,138] Trial 14 finished with value: 0.6492484441501436 and parameters: {'n_units_0': 20, 'dropout_1': 0.15000000000000002, 'run': 2, 'epochs_1': 80, 'epochs_2': 70, 'lr_1': 0.00034072877669816926, 'lr_2': 2.1549354394506772e-05, 'batch_size': 16, 'regularization': 'l1', 'reg_alpha_1': 0.0006744117088447108}. Best is trial 6 with value: 0.5389333941129716.
1/1 [==============================] - ETA: 0s1/1 [==============================] - 0s 393ms/step
1/1 [==============================] - ETA: 0s1/1 [==============================] - 0s 372ms/step
Statistics value = 39.0 p-value = 0.1376953125
1/1 [==============================] - ETA: 0s1/1 [==============================] - 0s 394ms/step
Statistics value = 24.0 p-value = 0.65234375
1/1 [==============================] - ETA: 0s1/1 [==============================] - 0s 423ms/step
1/1 [==============================] - ETA: 0s1/1 [==============================] - 0s 383ms/step
1/1 [==============================] - ETA: 0s1/1 [==============================] - 0s 400ms/step
1/1 [==============================] - ETA: 0s1/1 [==============================] - 0s 427ms/step
1/1 [==============================] - ETA: 0s1/1 [==============================] - 0s 410ms/step
Statistics value = 18.0 p-value = 0.52734375
1/1 [==============================] - ETA: 0s1/1 [==============================] - 0s 392ms/step
1/1 [==============================] - ETA: 0s1/1 [==============================] - 0s 45ms/step
1/1 [==============================] - ETA: 0s1/1 [==============================] - 0s 48ms/step
1/1 [==============================] - ETA: 0s1/1 [==============================] - 0s 404ms/step
[I 2024-12-23 21:39:05,642] Trial 14 finished with value: 0.4173911653960215 and parameters: {'n_units_0': 64, 'dropout_1': 0.15000000000000002, 'run': 3, 'epochs_1': 30, 'epochs_2': 50, 'lr_1': 0.0015107653087335614, 'lr_2': 2.2254614713958383e-05, 'batch_size': 16, 'regularization': 'l1_l2', 'reg_alpha_1': 0.000583488841966373, 'reg_alpha_2': 0.0009784074393024533}. Best is trial 2 with value: 0.28885393619906585.
1/1 [==============================] - ETA: 0s1/1 [==============================] - 0s 457ms/step
1/1 [==============================] - ETA: 0s1/1 [==============================] - 0s 387ms/step
1/1 [==============================] - ETA: 0s1/1 [==============================] - 0s 391ms/step
1/1 [==============================] - ETA: 0s1/1 [==============================] - 0s 396ms/step
1/1 [==============================] - ETA: 0s1/1 [==============================] - 0s 374ms/step
1/1 [==============================] - ETA: 0s1/1 [==============================] - 0s 365ms/step
1/1 [==============================] - ETA: 0s1/1 [==============================] - 0s 47ms/step
1/1 [==============================] - ETA: 0s1/1 [==============================] - 0s 48ms/step
1/1 [==============================] - ETA: 0s1/1 [==============================] - 0s 379ms/step
Statistics value = 25.0 p-value = 0.19140625
1/1 [==============================] - ETA: 0s1/1 [==============================] - 0s 396ms/step
1/1 [==============================] - ETA: 0s1/1 [==============================] - 0s 382ms/step
1/1 [==============================] - ETA: 0s1/1 [==============================] - 0s 378ms/step
1/1 [==============================] - ETA: 0s1/1 [==============================] - 0s 46ms/step
1/1 [==============================] - ETA: 0s1/1 [==============================] - 0s 54ms/step
[I 2024-12-23 21:39:22,950] Trial 15 finished with value: 0.23623326724286176 and parameters: {'n_units_0': 36, 'dropout_1': 0.15000000000000002, 'run': 3, 'epochs_1': 70, 'epochs_2': 50, 'lr_1': 0.00028156397952127326, 'lr_2': 6.823849970527322e-05, 'batch_size': 12, 'regularization': 'l2', 'reg_alpha_1': 0.00048701077622320996}. Best is trial 4 with value: 0.23204332328658517.
1/1 [==============================] - ETA: 0s1/1 [==============================] - 0s 383ms/step
1/1 [==============================] - ETA: 0s1/1 [==============================] - 0s 402ms/step
1/1 [==============================] - ETA: 0s1/1 [==============================] - 0s 44ms/step
1/1 [==============================] - ETA: 0s1/1 [==============================] - 0s 41ms/step
