[I 2024-12-23 16:34:03,837] Trial 15 finished with value: 1.3147445563643174 and parameters: {'n_units_0': 4, 'dropout_1': 0.1, 'run': 2, 'epochs_1': 30, 'epochs_2': 70, 'lr_1': 0.0001012145355811484, 'lr_2': 9.552335254144706e-05, 'batch_size': 12, 'regularization': 'l1_l2', 'reg_alpha_1': 0.0013230718692473172, 'reg_alpha_2': 0.0009990953045534545}. Best is trial 2 with value: 1.0043789986087965.
1/1 [==============================] - ETA: 0s1/1 [==============================] - 0s 360ms/step
1/1 [==============================] - ETA: 0s1/1 [==============================] - 0s 348ms/step
1/1 [==============================] - ETA: 0s1/1 [==============================] - 0s 55ms/step
1/1 [==============================] - ETA: 0s1/1 [==============================] - 0s 42ms/step
Statistics value = 48.0 p-value = 0.0185546875
1/1 [==============================] - ETA: 0s1/1 [==============================] - 0s 353ms/step
1/1 [==============================] - ETA: 0s1/1 [==============================] - 0s 387ms/step
Statistics value = 23.0 p-value = 0.2734375
1/1 [==============================] - ETA: 0s1/1 [==============================] - 0s 469ms/step
1/1 [==============================] - ETA: 0s1/1 [==============================] - 1s 524ms/step
Statistics value = 2.0 p-value = 0.998046875
1/1 [==============================] - ETA: 0s1/1 [==============================] - 0s 427ms/step
1/1 [==============================] - ETA: 0s1/1 [==============================] - 0s 402ms/step
Statistics value = 18.0 p-value = 0.52734375
1/1 [==============================] - ETA: 0s1/1 [==============================] - 0s 421ms/step
1/1 [==============================] - ETA: 0s1/1 [==============================] - 0s 450ms/step
1/1 [==============================] - ETA: 0s1/1 [==============================] - 0s 426ms/step
1/1 [==============================] - ETA: 0s1/1 [==============================] - 0s 445ms/step
1/1 [==============================] - ETA: 0s1/1 [==============================] - 0s 427ms/step
1/1 [==============================] - ETA: 0s1/1 [==============================] - 0s 42ms/step
1/1 [==============================] - ETA: 0s1/1 [==============================] - 0s 48ms/step
1/1 [==============================] - ETA: 0s1/1 [==============================] - 0s 451ms/step
1/1 [==============================] - ETA: 0s1/1 [==============================] - 0s 42ms/step
1/1 [==============================] - ETA: 0s1/1 [==============================] - 0s 42ms/step
[I 2024-12-23 16:34:33,937] Trial 16 finished with value: 0.23243562533344933 and parameters: {'n_units_0': 4, 'dropout_1': 0.25, 'run': 2, 'epochs_1': 60, 'epochs_2': 80, 'lr_1': 0.0008370878680916443, 'lr_2': 8.121442290811373e-05, 'batch_size': 16, 'regularization': 'None'}. Best is trial 13 with value: 0.23178411957054648.
1/1 [==============================] - ETA: 0s1/1 [==============================] - 0s 410ms/step
1/1 [==============================] - ETA: 0s1/1 [==============================] - 0s 391ms/step
1/1 [==============================] - ETA: 0s1/1 [==============================] - 0s 492ms/step
1/1 [==============================] - ETA: 0s1/1 [==============================] - 0s 422ms/step
Statistics value = 14.0 p-value = 0.919921875
1/1 [==============================] - ETA: 0s1/1 [==============================] - 0s 406ms/step
1/1 [==============================] - ETA: 0s1/1 [==============================] - 0s 414ms/step
Statistics value = 27.0 p-value = 0.125
1/1 [==============================] - ETA: 0s1/1 [==============================] - 0s 390ms/step
1/1 [==============================] - ETA: 0s1/1 [==============================] - 0s 413ms/step
1/1 [==============================] - ETA: 0s1/1 [==============================] - 0s 385ms/step
1/1 [==============================] - ETA: 0s1/1 [==============================] - 0s 388ms/step
1/1 [==============================] - ETA: 0s1/1 [==============================] - 0s 43ms/step
1/1 [==============================] - ETA: 0s1/1 [==============================] - 0s 42ms/step
1/1 [==============================] - ETA: 0s1/1 [==============================] - 0s 412ms/step
1/1 [==============================] - ETA: 0s1/1 [==============================] - 0s 400ms/step
1/1 [==============================] - ETA: 0s1/1 [==============================] - 0s 56ms/step
1/1 [==============================] - ETA: 0s1/1 [==============================] - 0s 47ms/step
[I 2024-12-23 16:34:57,797] Trial 16 finished with value: 0.5713003359391187 and parameters: {'n_units_0': 24, 'dropout_1': 0.1, 'run': 3, 'epochs_1': 40, 'epochs_2': 100, 'lr_1': 0.00010139588954351961, 'lr_2': 9.614047329008705e-05, 'batch_size': 12, 'regularization': 'l2', 'reg_alpha_1': 1.1591303829210734e-05}. Best is trial 8 with value: 0.5624808276421804.
1/1 [==============================] - ETA: 0s1/1 [==============================] - 0s 420ms/step
1/1 [==============================] - ETA: 0s1/1 [==============================] - 0s 386ms/step
1/1 [==============================] - ETA: 0s1/1 [==============================] - 0s 48ms/step
1/1 [==============================] - ETA: 0s1/1 [==============================] - 0s 50ms/step
[I 2024-12-23 16:35:03,173] Trial 16 finished with value: 2.6765481578364274 and parameters: {'n_units_0': 28, 'dropout_1': 0.15000000000000002, 'run': 2, 'epochs_1': 80, 'epochs_2': 60, 'lr_1': 0.003308684637425101, 'lr_2': 0.00018306292451801082, 'batch_size': 16, 'regularization': 'l1_l2', 'reg_alpha_1': 0.0012540541198692435, 'reg_alpha_2': 0.0002879242897444343}. Best is trial 2 with value: 1.0043789986087965.
Statistics value = 31.0 p-value = 0.384765625
1/1 [==============================] - ETA: 0s1/1 [==============================] - 0s 421ms/step
1/1 [==============================] - ETA: 0s1/1 [==============================] - 0s 425ms/step
1/1 [==============================] - ETA: 0s1/1 [==============================] - 0s 413ms/step
1/1 [==============================] - ETA: 0s1/1 [==============================] - 0s 405ms/step
1/1 [==============================] - ETA: 0s1/1 [==============================] - 0s 47ms/step
Statistics value = 17.0 p-value = 0.578125
1/1 [==============================] - ETA: 0s1/1 [==============================] - 0s 435ms/step
1/1 [==============================] - ETA: 0s1/1 [==============================] - 0s 46ms/step
1/1 [==============================] - ETA: 0s1/1 [==============================] - 0s 416ms/step
Statistics value = 34.0 p-value = 0.01171875
1/1 [==============================] - ETA: 0s1/1 [==============================] - 0s 360ms/step
1/1 [==============================] - ETA: 0s1/1 [==============================] - 0s 340ms/step
1/1 [==============================] - ETA: 0s1/1 [==============================] - 0s 343ms/step
1/1 [==============================] - ETA: 0s1/1 [==============================] - 0s 303ms/step
Statistics value = 8.0 p-value = 0.9814453125
1/1 [==============================] - ETA: 0s1/1 [==============================] - 0s 342ms/step
1/1 [==============================] - ETA: 0s1/1 [==============================] - 0s 321ms/step
1/1 [==============================] - ETA: 0s1/1 [==============================] - 0s 339ms/step
1/1 [==============================] - ETA: 0s1/1 [==============================] - 0s 349ms/step
1/1 [==============================] - ETA: 0s1/1 [==============================] - 0s 439ms/step
1/1 [==============================] - ETA: 0s1/1 [==============================] - 0s 431ms/step
1/1 [==============================] - ETA: 0s1/1 [==============================] - 0s 415ms/step
1/1 [==============================] - ETA: 0s1/1 [==============================] - 0s 395ms/step
1/1 [==============================] - ETA: 0s1/1 [==============================] - 0s 46ms/step
1/1 [==============================] - ETA: 0s1/1 [==============================] - 0s 46ms/step
[I 2024-12-23 16:35:34,707] Trial 16 finished with value: 0.34472191810689373 and parameters: {'n_units_0': 48, 'dropout_1': 0.1, 'run': 3, 'epochs_1': 80, 'epochs_2': 80, 'lr_1': 0.00020302372911966822, 'lr_2': 4.518363588745506e-05, 'batch_size': 16, 'regularization': 'l1_l2', 'reg_alpha_1': 0.0004571007083170026, 'reg_alpha_2': 0.009464154147879048}. Best is trial 2 with value: 0.28592394505080987.
1/1 [==============================] - ETA: 0s1/1 [==============================] - 0s 369ms/step
1/1 [==============================] - ETA: 0s1/1 [==============================] - 0s 408ms/step
1/1 [==============================] - ETA: 0s1/1 [==============================] - 0s 50ms/step
1/1 [==============================] - ETA: 0s1/1 [==============================] - 0s 39ms/step
1/1 [==============================] - ETA: 0s1/1 [==============================] - 0s 457ms/step
1/1 [==============================] - ETA: 0s1/1 [==============================] - 0s 403ms/step
[I 2024-12-23 16:35:36,707] Trial 17 finished with value: 0.270927585996409 and parameters: {'n_units_0': 24, 'dropout_1': 0.25, 'run': 2, 'epochs_1': 90, 'epochs_2': 80, 'lr_1': 0.0007266076838237294, 'lr_2': 0.00048281447087035825, 'batch_size': 12, 'regularization': 'None'}. Best is trial 13 with value: 0.23178411957054648.
1/1 [==============================] - ETA: 0s1/1 [==============================] - 0s 54ms/step
1/1 [==============================] - ETA: 0s1/1 [==============================] - 0s 56ms/step
1/1 [==============================] - ETA: 0s1/1 [==============================] - 0s 422ms/step
1/1 [==============================] - ETA: 0s1/1 [==============================] - 0s 400ms/step
1/1 [==============================] - ETA: 0s1/1 [==============================] - 0s 51ms/step
1/1 [==============================] - ETA: 0s1/1 [==============================] - 0s 49ms/step
Statistics value = 22.0 p-value = 0.3203125
1/1 [==============================] - ETA: 0s1/1 [==============================] - 0s 385ms/step
1/1 [==============================] - ETA: 0s1/1 [==============================] - 0s 411ms/step
1/1 [==============================] - ETA: 0s1/1 [==============================] - 0s 52ms/step
1/1 [==============================] - ETA: 0s1/1 [==============================] - 0s 47ms/step
Statistics value = 31.0 p-value = 0.384765625
1/1 [==============================] - ETA: 0s1/1 [==============================] - 0s 391ms/step
1/1 [==============================] - ETA: 0s1/1 [==============================] - 0s 432ms/step
Statistics value = 4.0 p-value = 0.98046875
1/1 [==============================] - ETA: 0s1/1 [==============================] - 0s 413ms/step
1/1 [==============================] - ETA: 0s1/1 [==============================] - 0s 397ms/step
1/1 [==============================] - ETA: 0s1/1 [==============================] - 0s 39ms/step
1/1 [==============================] - ETA: 0s1/1 [==============================] - 0s 41ms/step
Statistics value = 21.0 p-value = 0.75390625
1/1 [==============================] - ETA: 0s1/1 [==============================] - 0s 408ms/step
1/1 [==============================] - ETA: 0s1/1 [==============================] - 0s 404ms/step
1/1 [==============================] - ETA: 0s1/1 [==============================] - 0s 435ms/step
Statistics value = 27.0 p-value = 0.5390625
1/1 [==============================] - ETA: 0s1/1 [==============================] - 0s 412ms/step
1/1 [==============================] - ETA: 0s1/1 [==============================] - 0s 413ms/step
1/1 [==============================] - ETA: 0s1/1 [==============================] - 0s 364ms/step
1/1 [==============================] - ETA: 0s1/1 [==============================] - 0s 48ms/step
1/1 [==============================] - ETA: 0s1/1 [==============================] - 0s 55ms/step
[I 2024-12-23 16:36:06,708] Trial 17 finished with value: 0.30494679040127215 and parameters: {'n_units_0': 32, 'dropout_1': 0.15000000000000002, 'run': 1, 'epochs_1': 50, 'epochs_2': 60, 'lr_1': 0.00010182712311136019, 'lr_2': 1.9356450104946525e-05, 'batch_size': 8, 'regularization': 'None'}. Best is trial 2 with value: 0.28592394505080987.
Statistics value = 17.0 p-value = 0.8623046875
1/1 [==============================] - ETA: 0s1/1 [==============================] - 0s 398ms/step
1/1 [==============================] - ETA: 0s1/1 [==============================] - 0s 391ms/step
1/1 [==============================] - ETA: 0s1/1 [==============================] - 0s 49ms/step
1/1 [==============================] - ETA: 0s1/1 [==============================] - 0s 45ms/step
[I 2024-12-23 16:36:11,061] Trial 18 finished with value: 0.24774856694997438 and parameters: {'n_units_0': 4, 'dropout_1': 0.25, 'run': 1, 'epochs_1': 60, 'epochs_2': 80, 'lr_1': 0.004459277004980994, 'lr_2': 0.0001359712691321492, 'batch_size': 8, 'regularization': 'None'}. Best is trial 13 with value: 0.23178411957054648.
1/1 [==============================] - ETA: 0s1/1 [==============================] - 0s 421ms/step
1/1 [==============================] - ETA: 0s1/1 [==============================] - 0s 390ms/step
1/1 [==============================] - ETA: 0s1/1 [==============================] - 0s 425ms/step
1/1 [==============================] - ETA: 0s1/1 [==============================] - 0s 404ms/step
1/1 [==============================] - ETA: 0s1/1 [==============================] - 0s 56ms/step
1/1 [==============================] - ETA: 0s1/1 [==============================] - 0s 41ms/step
[I 2024-12-23 16:36:20,654] Trial 17 finished with value: 0.6482459827689212 and parameters: {'n_units_0': 44, 'dropout_1': 0.15000000000000002, 'run': 3, 'epochs_1': 40, 'epochs_2': 50, 'lr_1': 0.001032065580149812, 'lr_2': 2.226861811802432e-05, 'batch_size': 8, 'regularization': 'l2', 'reg_alpha_1': 2.1816878663947824e-05}. Best is trial 8 with value: 0.5624808276421804.
Statistics value = 18.0 p-value = 0.52734375
1/1 [==============================] - ETA: 0s1/1 [==============================] - 0s 415ms/step
1/1 [==============================] - ETA: 0s1/1 [==============================] - 0s 417ms/step
1/1 [==============================] - ETA: 0s1/1 [==============================] - 0s 394ms/step
1/1 [==============================] - ETA: 0s1/1 [==============================] - 0s 408ms/step
1/1 [==============================] - ETA: 0s1/1 [==============================] - 0s 42ms/step
1/1 [==============================] - ETA: 0s1/1 [==============================] - 0s 41ms/step
Statistics value = 6.0 p-value = 0.9609375
1/1 [==============================] - ETA: 0s1/1 [==============================] - 0s 405ms/step
