[I 2024-12-23 20:53:57,833] Trial 17 finished with value: 0.48021979906513057 and parameters: {'n_units_0': 24, 'dropout_1': 0.15000000000000002, 'run': 1, 'epochs_1': 70, 'epochs_2': 60, 'lr_1': 0.004340239310740141, 'lr_2': 9.240538757372141e-05, 'batch_size': 12, 'regularization': 'None'}. Best is trial 2 with value: 0.2846803112753509.
Statistics value = 22.0 p-value = 0.3203125
1/1 [==============================] - ETA: 0s1/1 [==============================] - 0s 320ms/step
1/1 [==============================] - ETA: 0s1/1 [==============================] - 0s 317ms/step
1/1 [==============================] - ETA: 0s1/1 [==============================] - 0s 36ms/step
1/1 [==============================] - ETA: 0s1/1 [==============================] - 0s 34ms/step
Statistics value = 21.0 p-value = 0.37109375
1/1 [==============================] - ETA: 0s1/1 [==============================] - 0s 328ms/step
1/1 [==============================] - ETA: 0s1/1 [==============================] - 0s 327ms/step
Statistics value = 10.0 p-value = 0.875
1/1 [==============================] - ETA: 0s1/1 [==============================] - 0s 368ms/step
1/1 [==============================] - ETA: 0s1/1 [==============================] - 0s 311ms/step
1/1 [==============================] - ETA: 0s1/1 [==============================] - 0s 44ms/step
1/1 [==============================] - ETA: 0s1/1 [==============================] - 0s 36ms/step
Statistics value = 7.0 p-value = 0.986328125
1/1 [==============================] - ETA: 0s1/1 [==============================] - 0s 387ms/step
1/1 [==============================] - ETA: 0s1/1 [==============================] - 0s 441ms/step
1/1 [==============================] - ETA: 0s1/1 [==============================] - 0s 29ms/step
1/1 [==============================] - ETA: 0s1/1 [==============================] - 0s 28ms/step
[I 2024-12-23 20:54:13,647] Trial 17 finished with value: 3.4478336788512585 and parameters: {'n_units_0': 44, 'dropout_1': 0.25, 'run': 1, 'epochs_1': 60, 'epochs_2': 30, 'lr_1': 0.008520499116629804, 'lr_2': 0.00016592327744822277, 'batch_size': 12, 'regularization': 'l1_l2', 'reg_alpha_1': 4.6050399542456446e-05, 'reg_alpha_2': 1.0843603593919683e-05}. Best is trial 8 with value: 1.0469849464594678.
1/1 [==============================] - ETA: 0s1/1 [==============================] - 0s 327ms/step
1/1 [==============================] - ETA: 0s1/1 [==============================] - 0s 316ms/step
1/1 [==============================] - ETA: 0s1/1 [==============================] - 0s 28ms/step
1/1 [==============================] - ETA: 0s1/1 [==============================] - 0s 28ms/step
Statistics value = 31.0 p-value = 0.384765625
1/1 [==============================] - ETA: 0s1/1 [==============================] - 0s 367ms/step
1/1 [==============================] - ETA: 0s1/1 [==============================] - 0s 332ms/step
1/1 [==============================] - ETA: 0s1/1 [==============================] - 0s 38ms/step
1/1 [==============================] - ETA: 0s1/1 [==============================] - 0s 27ms/step
[I 2024-12-23 20:54:21,743] Trial 18 finished with value: 0.33819434465996384 and parameters: {'n_units_0': 28, 'dropout_1': 0.15000000000000002, 'run': 1, 'epochs_1': 60, 'epochs_2': 80, 'lr_1': 0.0002324217176807864, 'lr_2': 3.326986549113283e-05, 'batch_size': 8, 'regularization': 'l1', 'reg_alpha_1': 0.004245484787084074}. Best is trial 2 with value: 0.2846803112753509.
Statistics value = 28.0 p-value = 0.09765625
1/1 [==============================] - ETA: 0s1/1 [==============================] - 0s 345ms/step
1/1 [==============================] - ETA: 0s1/1 [==============================] - 0s 343ms/step
Statistics value = 30.0 p-value = 0.4228515625
1/1 [==============================] - ETA: 0s1/1 [==============================] - 0s 358ms/step
1/1 [==============================] - ETA: 0s1/1 [==============================] - 0s 337ms/step
Statistics value = 20.0 p-value = 0.421875
1/1 [==============================] - ETA: 0s1/1 [==============================] - 0s 375ms/step
1/1 [==============================] - ETA: 0s1/1 [==============================] - 0s 359ms/step
1/1 [==============================] - ETA: 0s1/1 [==============================] - 0s 339ms/step
1/1 [==============================] - ETA: 0s1/1 [==============================] - 0s 325ms/step
1/1 [==============================] - ETA: 0s1/1 [==============================] - 0s 43ms/step
1/1 [==============================] - ETA: 0s1/1 [==============================] - 0s 31ms/step
1/1 [==============================] - ETA: 0s1/1 [==============================] - 0s 380ms/step
1/1 [==============================] - ETA: 0s1/1 [==============================] - 0s 380ms/step
1/1 [==============================] - ETA: 0s1/1 [==============================] - 0s 38ms/step
1/1 [==============================] - ETA: 0s1/1 [==============================] - 0s 61ms/step
[I 2024-12-23 20:54:39,198] Trial 16 finished with value: 0.6293454889537173 and parameters: {'n_units_0': 48, 'dropout_1': 0.25, 'run': 2, 'epochs_1': 70, 'epochs_2': 50, 'lr_1': 0.0038297801329237216, 'lr_2': 0.0007822712043986086, 'batch_size': 16, 'regularization': 'l2', 'reg_alpha_1': 3.928789105566633e-05}. Best is trial 8 with value: 0.5444094279064726.
1/1 [==============================] - ETA: 0s1/1 [==============================] - 0s 408ms/step
1/1 [==============================] - ETA: 0s1/1 [==============================] - 0s 378ms/step
1/1 [==============================] - ETA: 0s1/1 [==============================] - 0s 51ms/step
1/1 [==============================] - ETA: 0s1/1 [==============================] - 0s 48ms/step
Statistics value = 8.0 p-value = 0.9814453125
1/1 [==============================] - ETA: 0s1/1 [==============================] - 0s 385ms/step
1/1 [==============================] - ETA: 0s1/1 [==============================] - 0s 401ms/step
Statistics value = 10.0 p-value = 0.875
1/1 [==============================] - ETA: 0s1/1 [==============================] - 0s 415ms/step
1/1 [==============================] - ETA: 0s1/1 [==============================] - 0s 439ms/step
Statistics value = 28.0 p-value = 0.5
1/1 [==============================] - ETA: 0s1/1 [==============================] - 0s 414ms/step
1/1 [==============================] - ETA: 0s1/1 [==============================] - 0s 411ms/step
1/1 [==============================] - ETA: 0s1/1 [==============================] - 0s 398ms/step
1/1 [==============================] - ETA: 0s1/1 [==============================] - 0s 399ms/step
1/1 [==============================] - ETA: 0s1/1 [==============================] - 0s 57ms/step
1/1 [==============================] - ETA: 0s1/1 [==============================] - 0s 60ms/step
1/1 [==============================] - ETA: 0s1/1 [==============================] - 0s 398ms/step
[I 2024-12-23 20:55:09,287] Trial 18 finished with value: 2.575964182390414 and parameters: {'n_units_0': 28, 'dropout_1': 0.1, 'run': 2, 'epochs_1': 80, 'epochs_2': 50, 'lr_1': 0.003994466661346413, 'lr_2': 4.739344400999496e-05, 'batch_size': 8, 'regularization': 'l1', 'reg_alpha_1': 0.0005903639128219392}. Best is trial 8 with value: 1.0469849464594678.
1/1 [==============================] - ETA: 0s1/1 [==============================] - 0s 361ms/step
1/1 [==============================] - ETA: 0s1/1 [==============================] - 0s 431ms/step
1/1 [==============================] - ETA: 0s1/1 [==============================] - 0s 398ms/step
1/1 [==============================] - ETA: 0s1/1 [==============================] - 0s 47ms/step
1/1 [==============================] - ETA: 0s1/1 [==============================] - 0s 39ms/step
[I 2024-12-23 20:55:19,088] Trial 19 finished with value: 0.3119359508805771 and parameters: {'n_units_0': 16, 'dropout_1': 0.1, 'run': 2, 'epochs_1': 80, 'epochs_2': 90, 'lr_1': 0.00018166111383761298, 'lr_2': 1.602381687332457e-05, 'batch_size': 16, 'regularization': 'l1_l2', 'reg_alpha_1': 0.0005259456914306042, 'reg_alpha_2': 0.00019067594876368463}. Best is trial 2 with value: 0.2846803112753509.
Statistics value = 35.0 p-value = 0.0078125
1/1 [==============================] - ETA: 0s1/1 [==============================] - 0s 414ms/step
1/1 [==============================] - ETA: 0s1/1 [==============================] - 0s 411ms/step
1/1 [==============================] - ETA: 0s1/1 [==============================] - 0s 405ms/step
1/1 [==============================] - ETA: 0s1/1 [==============================] - 0s 389ms/step
1/1 [==============================] - ETA: 0s1/1 [==============================] - 0s 46ms/step
1/1 [==============================] - ETA: 0s1/1 [==============================] - 0s 38ms/step
Statistics value = 29.0 p-value = 0.4609375
1/1 [==============================] - ETA: 0s1/1 [==============================] - 0s 431ms/step
1/1 [==============================] - ETA: 0s1/1 [==============================] - 0s 396ms/step
1/1 [==============================] - ETA: 0s1/1 [==============================] - 0s 455ms/step
1/1 [==============================] - ETA: 0s1/1 [==============================] - 0s 411ms/step
1/1 [==============================] - ETA: 0s1/1 [==============================] - 0s 51ms/step
1/1 [==============================] - ETA: 0s1/1 [==============================] - 0s 43ms/step
Statistics value = 50.0 p-value = 0.009765625
1/1 [==============================] - ETA: 0s1/1 [==============================] - 0s 417ms/step
1/1 [==============================] - ETA: 0s1/1 [==============================] - 0s 411ms/step
1/1 [==============================] - ETA: 0s1/1 [==============================] - 0s 412ms/step
1/1 [==============================] - ETA: 0s1/1 [==============================] - 0s 401ms/step
1/1 [==============================] - ETA: 0s1/1 [==============================] - 0s 394ms/step
1/1 [==============================] - ETA: 0s1/1 [==============================] - 0s 388ms/step
1/1 [==============================] - ETA: 0s1/1 [==============================] - 0s 51ms/step
1/1 [==============================] - ETA: 0s1/1 [==============================] - 0s 44ms/step
[I 2024-12-23 20:56:04,512] Trial 19 finished with value: 1.1969653182406281 and parameters: {'n_units_0': 16, 'dropout_1': 0.15000000000000002, 'run': 2, 'epochs_1': 30, 'epochs_2': 20, 'lr_1': 0.0001071623979726951, 'lr_2': 1.7971048980822346e-05, 'batch_size': 16, 'regularization': 'l2', 'reg_alpha_1': 0.003445951792561841}. Best is trial 8 with value: 1.0469849464594678.
1/1 [==============================] - ETA: 0s1/1 [==============================] - 0s 431ms/step
1/1 [==============================] - ETA: 0s1/1 [==============================] - 0s 404ms/step
1/1 [==============================] - ETA: 0s1/1 [==============================] - 0s 45ms/step
1/1 [==============================] - ETA: 0s1/1 [==============================] - 0s 42ms/step
[I 2024-12-23 20:56:11,357] Trial 17 finished with value: 0.6472645992656576 and parameters: {'n_units_0': 32, 'dropout_1': 0.1, 'run': 3, 'epochs_1': 90, 'epochs_2': 20, 'lr_1': 0.0005675340745421171, 'lr_2': 0.00032030233222131893, 'batch_size': 8, 'regularization': 'l2', 'reg_alpha_1': 2.213858792036171e-05}. Best is trial 8 with value: 0.5444094279064726.
Statistics value = 18.0 p-value = 0.52734375
1/1 [==============================] - ETA: 0s1/1 [==============================] - 0s 407ms/step
1/1 [==============================] - ETA: 0s1/1 [==============================] - 0s 398ms/step
1/1 [==============================] - ETA: 0s1/1 [==============================] - 0s 45ms/step
1/1 [==============================] - ETA: 0s1/1 [==============================] - 0s 48ms/step
Statistics value = 34.0 p-value = 0.2783203125
1/1 [==============================] - ETA: 0s1/1 [==============================] - 0s 426ms/step
1/1 [==============================] - ETA: 0s1/1 [==============================] - 0s 387ms/step
1/1 [==============================] - ETA: 0s1/1 [==============================] - 0s 55ms/step
1/1 [==============================] - ETA: 0s1/1 [==============================] - 0s 49ms/step
[I 2024-12-23 20:56:40,277] Trial 18 finished with value: 0.6599214547459632 and parameters: {'n_units_0': 44, 'dropout_1': 0.25, 'run': 1, 'epochs_1': 40, 'epochs_2': 70, 'lr_1': 0.0022501939407350425, 'lr_2': 2.2321056191513992e-05, 'batch_size': 12, 'regularization': 'l1_l2', 'reg_alpha_1': 7.87627003880781e-05, 'reg_alpha_2': 1.3491843278385426e-05}. Best is trial 8 with value: 0.5444094279064726.
Statistics value = 22.0 p-value = 0.3203125
1/1 [==============================] - ETA: 0s1/1 [==============================] - 0s 430ms/step
1/1 [==============================] - ETA: 0s1/1 [==============================] - 0s 417ms/step
1/1 [==============================] - ETA: 0s1/1 [==============================] - 0s 459ms/step
1/1 [==============================] - ETA: 0s1/1 [==============================] - 0s 400ms/step
1/1 [==============================] - ETA: 0s1/1 [==============================] - 0s 54ms/step
1/1 [==============================] - ETA: 0s1/1 [==============================] - 0s 42ms/step
Statistics value = 21.0 p-value = 0.75390625
1/1 [==============================] - ETA: 0s1/1 [==============================] - 0s 400ms/step
1/1 [==============================] - ETA: 0s1/1 [==============================] - 0s 421ms/step
1/1 [==============================] - ETA: 0s1/1 [==============================] - 0s 419ms/step
1/1 [==============================] - ETA: 0s1/1 [==============================] - 0s 403ms/step
1/1 [==============================] - ETA: 0s1/1 [==============================] - 0s 45ms/step
1/1 [==============================] - ETA: 0s1/1 [==============================] - 0s 47ms/step
[I 2024-12-23 20:57:48,684] Trial 19 finished with value: 0.6582882816103646 and parameters: {'n_units_0': 20, 'dropout_1': 0.15000000000000002, 'run': 2, 'epochs_1': 50, 'epochs_2': 90, 'lr_1': 0.0047552585314227505, 'lr_2': 9.058312269530302e-05, 'batch_size': 12, 'regularization': 'None'}. Best is trial 8 with value: 0.5444094279064726.
Statistics value = 25.0 p-value = 0.19140625
Statistics value = 8.0 p-value = 0.92578125
Statistics value = 22.0 p-value = 0.3203125
Statistics value = 16.0 p-value = 0.62890625

EVER Study Best parameters:
{'n_units_0': 12, 'dropout_1': 0.3, 'run': 1, 'epochs_1': 100, 'epochs_2': 80, 'lr_1': 0.00024970737145052745, 'lr_2': 1.0257563974185649e-05, 'batch_size': 16, 'regularization': 'l2', 'reg_alpha_1': 0.0001189589673755355}
Best value (Average MSE): 0.2324022591686981

EV Study Best parameters:
{'n_units_0': 16, 'dropout_1': 0.2, 'run': 3, 'epochs_1': 40, 'epochs_2': 20, 'lr_1': 0.0003797544798678418, 'lr_2': 2.101079931010355e-05, 'batch_size': 16, 'regularization': 'l2', 'reg_alpha_1': 3.6283583803549155e-05}
Best value (Average MSE): 1.0469849464594678

PHEV Study Best parameters:
{'n_units_0': 16, 'dropout_1': 0.2, 'run': 3, 'epochs_1': 40, 'epochs_2': 20, 'lr_1': 0.0003797544798678418, 'lr_2': 2.101079931010355e-05, 'batch_size': 16, 'regularization': 'l2', 'reg_alpha_1': 3.6283583803549155e-05}
Best value (Average MSE): 0.5444094279064726

FUEL Study Best parameters:
{'n_units_0': 16, 'dropout_1': 0.2, 'run': 2, 'epochs_1': 30, 'epochs_2': 70, 'lr_1': 0.00021930485556643703, 'lr_2': 1.3492834268013232e-05, 'batch_size': 16, 'regularization': 'l1_l2', 'reg_alpha_1': 0.0011290133559092666, 'reg_alpha_2': 0.00020914981329035596}
Best value (Average MSE): 0.2846803112753509
