[I 2024-12-23 19:07:32,764] Trial 11 finished with value: 0.3126900613465463 and parameters: {'n_units_0': 36, 'dropout_1': 0.25, 'run': 2, 'epochs_1': 50, 'epochs_2': 20, 'lr_1': 0.00012427889293047006, 'lr_2': 0.00017340750366137944, 'batch_size': 12, 'regularization': 'l1', 'reg_alpha_1': 0.0010614983432824354}. Best is trial 4 with value: 0.28953663209472913.
Statistics value = 47.0 p-value = 0.0244140625
1/1 [==============================] - ETA: 0s1/1 [==============================] - 0s 310ms/step
Statistics value = 33.0 p-value = 0.3125
1/1 [==============================] - ETA: 0s1/1 [==============================] - 0s 350ms/step
1/1 [==============================] - ETA: 0s1/1 [==============================] - 0s 336ms/step
1/1 [==============================] - ETA: 0s1/1 [==============================] - 0s 313ms/step
Statistics value = 28.0 p-value = 0.09765625
1/1 [==============================] - ETA: 0s1/1 [==============================] - 0s 335ms/step
1/1 [==============================] - ETA: 0s1/1 [==============================] - 0s 346ms/step
Statistics value = 20.0 p-value = 0.421875
1/1 [==============================] - ETA: 0s1/1 [==============================] - 0s 330ms/step
1/1 [==============================] - ETA: 0s1/1 [==============================] - 0s 320ms/step
1/1 [==============================] - ETA: 0s1/1 [==============================] - 0s 362ms/step
1/1 [==============================] - ETA: 0s1/1 [==============================] - 0s 347ms/step
1/1 [==============================] - ETA: 0s1/1 [==============================] - 0s 344ms/step
1/1 [==============================] - ETA: 0s1/1 [==============================] - 0s 340ms/step
1/1 [==============================] - ETA: 0s1/1 [==============================] - 0s 340ms/step
1/1 [==============================] - ETA: 0s1/1 [==============================] - 0s 334ms/step
1/1 [==============================] - ETA: 0s1/1 [==============================] - 0s 36ms/step
1/1 [==============================] - ETA: 0s1/1 [==============================] - 0s 28ms/step
1/1 [==============================] - ETA: 0s1/1 [==============================] - 0s 345ms/step
1/1 [==============================] - ETA: 0s1/1 [==============================] - 0s 344ms/step
1/1 [==============================] - ETA: 0s1/1 [==============================] - 0s 36ms/step
1/1 [==============================] - ETA: 0s1/1 [==============================] - 0s 28ms/step
1/1 [==============================] - ETA: 0s1/1 [==============================] - 0s 308ms/step
1/1 [==============================] - ETA: 0s1/1 [==============================] - 0s 277ms/step
1/1 [==============================] - ETA: 0s1/1 [==============================] - 0s 336ms/step
1/1 [==============================] - ETA: 0s1/1 [==============================] - 0s 289ms/step
1/1 [==============================] - ETA: 0s1/1 [==============================] - 0s 36ms/step
1/1 [==============================] - ETA: 0s1/1 [==============================] - 0s 32ms/step
1/1 [==============================] - ETA: 0s1/1 [==============================] - 0s 38ms/step
1/1 [==============================] - ETA: 0s1/1 [==============================] - 0s 27ms/step
[I 2024-12-23 19:07:55,067] Trial 11 finished with value: 0.23570338152713777 and parameters: {'n_units_0': 28, 'dropout_1': 0.25, 'run': 3, 'epochs_1': 70, 'epochs_2': 50, 'lr_1': 0.0001090249182652839, 'lr_2': 0.0001965638261089347, 'batch_size': 12, 'regularization': 'None'}. Best is trial 4 with value: 0.2332224010264714.
[I 2024-12-23 19:07:55,155] Trial 11 finished with value: 0.6425030565625656 and parameters: {'n_units_0': 36, 'dropout_1': 0.25, 'run': 3, 'epochs_1': 70, 'epochs_2': 50, 'lr_1': 0.0001090249182652839, 'lr_2': 0.0001965638261089347, 'batch_size': 12, 'regularization': 'None'}. Best is trial 0 with value: 0.5600802703795851.
Statistics value = 21.0 p-value = 0.75390625
1/1 [==============================] - ETA: 0s1/1 [==============================] - 0s 346ms/step
1/1 [==============================] - ETA: 0s1/1 [==============================] - 0s 319ms/step
Statistics value = 29.0 p-value = 0.4609375
1/1 [==============================] - ETA: 0s1/1 [==============================] - 0s 341ms/step
1/1 [==============================] - ETA: 0s1/1 [==============================] - 0s 330ms/step
Statistics value = 14.0 p-value = 0.7265625
1/1 [==============================] - ETA: 0s1/1 [==============================] - 0s 333ms/step
Statistics value = 23.0 p-value = 0.2734375
1/1 [==============================] - ETA: 0s1/1 [==============================] - 0s 353ms/step
1/1 [==============================] - ETA: 0s1/1 [==============================] - 0s 325ms/step
1/1 [==============================] - ETA: 0s1/1 [==============================] - 0s 329ms/step
1/1 [==============================] - ETA: 0s1/1 [==============================] - 0s 335ms/step
1/1 [==============================] - ETA: 0s1/1 [==============================] - 0s 303ms/step
1/1 [==============================] - ETA: 0s1/1 [==============================] - 0s 31ms/step
1/1 [==============================] - ETA: 0s1/1 [==============================] - 0s 30ms/step
[I 2024-12-23 19:08:07,583] Trial 12 finished with value: 1.3292083923365887 and parameters: {'n_units_0': 28, 'dropout_1': 0.25, 'run': 2, 'epochs_1': 30, 'epochs_2': 50, 'lr_1': 0.0004957547237088648, 'lr_2': 0.0008538648795388481, 'batch_size': 12, 'regularization': 'l1', 'reg_alpha_1': 0.00089752676716181}. Best is trial 6 with value: 1.0738389804040076.
1/1 [==============================] - ETA: 0s1/1 [==============================] - 0s 344ms/step
1/1 [==============================] - ETA: 0s1/1 [==============================] - 0s 316ms/step
1/1 [==============================] - ETA: 0s1/1 [==============================] - 0s 31ms/step
1/1 [==============================] - ETA: 0s1/1 [==============================] - 0s 27ms/step
[I 2024-12-23 19:08:09,773] Trial 12 finished with value: 0.3940093064327834 and parameters: {'n_units_0': 28, 'dropout_1': 0.25, 'run': 2, 'epochs_1': 30, 'epochs_2': 50, 'lr_1': 0.0004957547237088648, 'lr_2': 0.0008538648795388481, 'batch_size': 12, 'regularization': 'l1', 'reg_alpha_1': 0.00089752676716181}. Best is trial 4 with value: 0.28953663209472913.
1/1 [==============================] - ETA: 0s1/1 [==============================] - 0s 324ms/step
1/1 [==============================] - ETA: 0s1/1 [==============================] - 0s 343ms/step
1/1 [==============================] - ETA: 0s1/1 [==============================] - 0s 339ms/step
1/1 [==============================] - ETA: 0s1/1 [==============================] - 0s 322ms/step
Statistics value = 30.0 p-value = 0.0546875
1/1 [==============================] - ETA: 0s1/1 [==============================] - 0s 359ms/step
1/1 [==============================] - ETA: 0s1/1 [==============================] - 0s 342ms/step
Statistics value = 24.0 p-value = 0.23046875
1/1 [==============================] - ETA: 0s1/1 [==============================] - 0s 393ms/step
1/1 [==============================] - ETA: 0s1/1 [==============================] - 0s 353ms/step
1/1 [==============================] - ETA: 0s1/1 [==============================] - 0s 458ms/step
1/1 [==============================] - ETA: 0s1/1 [==============================] - 0s 318ms/step
1/1 [==============================] - ETA: 0s1/1 [==============================] - 0s 27ms/step
1/1 [==============================] - ETA: 0s1/1 [==============================] - 0s 28ms/step
1/1 [==============================] - ETA: 0s1/1 [==============================] - 0s 335ms/step
1/1 [==============================] - ETA: 0s1/1 [==============================] - 0s 348ms/step
1/1 [==============================] - ETA: 0s1/1 [==============================] - 0s 317ms/step
1/1 [==============================] - ETA: 0s1/1 [==============================] - 0s 38ms/step
1/1 [==============================] - ETA: 0s1/1 [==============================] - 0s 33ms/step
1/1 [==============================] - ETA: 0s1/1 [==============================] - 0s 319ms/step
1/1 [==============================] - ETA: 0s1/1 [==============================] - 0s 29ms/step
1/1 [==============================] - ETA: 0s1/1 [==============================] - 0s 29ms/step
1/1 [==============================] - ETA: 0s1/1 [==============================] - 0s 339ms/step
1/1 [==============================] - ETA: 0s1/1 [==============================] - 0s 362ms/step
1/1 [==============================] - ETA: 0s1/1 [==============================] - 0s 35ms/step
1/1 [==============================] - ETA: 0s1/1 [==============================] - 0s 34ms/step
Statistics value = 42.0 p-value = 0.080078125
1/1 [==============================] - ETA: 0s1/1 [==============================] - 0s 334ms/step
1/1 [==============================] - ETA: 0s1/1 [==============================] - 0s 343ms/step
Statistics value = 28.0 p-value = 0.5
1/1 [==============================] - ETA: 0s1/1 [==============================] - 0s 383ms/step
1/1 [==============================] - ETA: 0s1/1 [==============================] - 0s 374ms/step
Statistics value = 28.0 p-value = 0.5
1/1 [==============================] - ETA: 0s1/1 [==============================] - 0s 437ms/step
1/1 [==============================] - ETA: 0s1/1 [==============================] - 0s 416ms/step
1/1 [==============================] - ETA: 0s1/1 [==============================] - 0s 375ms/step
1/1 [==============================] - ETA: 0s1/1 [==============================] - 0s 401ms/step
1/1 [==============================] - ETA: 0s1/1 [==============================] - 0s 412ms/step
1/1 [==============================] - ETA: 0s1/1 [==============================] - 0s 404ms/step
Statistics value = 29.0 p-value = 0.4609375
1/1 [==============================] - ETA: 0s1/1 [==============================] - 0s 443ms/step
1/1 [==============================] - ETA: 0s1/1 [==============================] - 0s 394ms/step
1/1 [==============================] - ETA: 0s1/1 [==============================] - 0s 385ms/step
1/1 [==============================] - ETA: 0s1/1 [==============================] - 0s 379ms/step
1/1 [==============================] - ETA: 0s1/1 [==============================] - 0s 59ms/step
1/1 [==============================] - ETA: 0s1/1 [==============================] - 0s 42ms/step
[I 2024-12-23 19:08:57,321] Trial 13 finished with value: 1.2496675550557168 and parameters: {'n_units_0': 64, 'dropout_1': 0.25, 'run': 2, 'epochs_1': 50, 'epochs_2': 20, 'lr_1': 0.00011523690027939872, 'lr_2': 7.062547819974309e-05, 'batch_size': 8, 'regularization': 'l1', 'reg_alpha_1': 0.002067601458516047}. Best is trial 6 with value: 1.0738389804040076.
1/1 [==============================] - ETA: 0s1/1 [==============================] - 0s 406ms/step
1/1 [==============================] - ETA: 0s1/1 [==============================] - 0s 415ms/step
1/1 [==============================] - ETA: 0s1/1 [==============================] - 0s 369ms/step
1/1 [==============================] - ETA: 0s1/1 [==============================] - 0s 42ms/step
1/1 [==============================] - ETA: 0s1/1 [==============================] - 0s 47ms/step
1/1 [==============================] - ETA: 0s1/1 [==============================] - 0s 376ms/step
1/1 [==============================] - ETA: 0s1/1 [==============================] - 0s 64ms/step
1/1 [==============================] - ETA: 0s1/1 [==============================] - 0s 42ms/step
[I 2024-12-23 19:09:03,077] Trial 12 finished with value: 0.23628689965595073 and parameters: {'n_units_0': 32, 'dropout_1': 0.25, 'run': 3, 'epochs_1': 80, 'epochs_2': 20, 'lr_1': 0.000124303097384124, 'lr_2': 0.00011781522065752308, 'batch_size': 12, 'regularization': 'None'}. Best is trial 4 with value: 0.2332224010264714.
[I 2024-12-23 19:09:03,332] Trial 13 finished with value: 0.31538964466153485 and parameters: {'n_units_0': 64, 'dropout_1': 0.25, 'run': 2, 'epochs_1': 50, 'epochs_2': 20, 'lr_1': 0.00011523690027939872, 'lr_2': 7.062547819974309e-05, 'batch_size': 8, 'regularization': 'l1', 'reg_alpha_1': 0.002067601458516047}. Best is trial 4 with value: 0.28953663209472913.
1/1 [==============================] - ETA: 0s1/1 [==============================] - 0s 419ms/step
1/1 [==============================] - ETA: 0s1/1 [==============================] - 0s 411ms/step
1/1 [==============================] - ETA: 0s1/1 [==============================] - 0s 51ms/step
1/1 [==============================] - ETA: 0s1/1 [==============================] - 0s 52ms/step
