[I 2024-12-23 17:37:30,650] Trial 10 finished with value: 0.6052968809987997 and parameters: {'n_units_0': 32, 'dropout_1': 0.1, 'run': 2, 'epochs_1': 80, 'epochs_2': 90, 'lr_1': 0.006536264082965737, 'lr_2': 0.0002888908524619867, 'batch_size': 12, 'regularization': 'None'}. Best is trial 0 with value: 0.4917174351813718.
Statistics value = 32.0 p-value = 0.02734375
1/1 [==============================] - ETA: 0s1/1 [==============================] - 0s 384ms/step
Statistics value = 7.0 p-value = 0.9453125
1/1 [==============================] - ETA: 0s1/1 [==============================] - 0s 353ms/step
1/1 [==============================] - ETA: 0s1/1 [==============================] - 0s 369ms/step
1/1 [==============================] - ETA: 0s1/1 [==============================] - 0s 369ms/step
Statistics value = 18.0 p-value = 0.52734375
1/1 [==============================] - ETA: 0s1/1 [==============================] - 0s 394ms/step
Statistics value = 3.0 p-value = 0.98828125
1/1 [==============================] - ETA: 0s1/1 [==============================] - 0s 393ms/step
1/1 [==============================] - ETA: 0s1/1 [==============================] - 0s 373ms/step
1/1 [==============================] - ETA: 0s1/1 [==============================] - 0s 413ms/step
1/1 [==============================] - ETA: 0s1/1 [==============================] - 0s 407ms/step
1/1 [==============================] - ETA: 0s1/1 [==============================] - 0s 384ms/step
1/1 [==============================] - ETA: 0s1/1 [==============================] - 0s 46ms/step
1/1 [==============================] - ETA: 0s1/1 [==============================] - 0s 44ms/step
1/1 [==============================] - ETA: 0s1/1 [==============================] - 0s 394ms/step
1/1 [==============================] - ETA: 0s1/1 [==============================] - 0s 403ms/step
1/1 [==============================] - ETA: 0s1/1 [==============================] - 0s 50ms/step
1/1 [==============================] - ETA: 0s1/1 [==============================] - 0s 45ms/step
1/1 [==============================] - ETA: 0s1/1 [==============================] - 0s 400ms/step
1/1 [==============================] - ETA: 0s1/1 [==============================] - 0s 389ms/step
1/1 [==============================] - ETA: 0s1/1 [==============================] - 0s 52ms/step
1/1 [==============================] - ETA: 0s1/1 [==============================] - 0s 41ms/step
1/1 [==============================] - ETA: 0s1/1 [==============================] - 0s 446ms/step
1/1 [==============================] - ETA: 0s1/1 [==============================] - 0s 381ms/step
Statistics value = 10.0 p-value = 0.9677734375
1/1 [==============================] - ETA: 0s1/1 [==============================] - 0s 302ms/step
Statistics value = 28.0 p-value = 0.5
1/1 [==============================] - ETA: 0s1/1 [==============================] - 0s 355ms/step
1/1 [==============================] - ETA: 0s1/1 [==============================] - 0s 295ms/step
1/1 [==============================] - ETA: 0s1/1 [==============================] - 0s 349ms/step
Statistics value = 34.0 p-value = 0.2783203125
1/1 [==============================] - ETA: 0s1/1 [==============================] - 0s 337ms/step
1/1 [==============================] - ETA: 0s1/1 [==============================] - 0s 323ms/step
1/1 [==============================] - ETA: 0s1/1 [==============================] - 0s 338ms/step
1/1 [==============================] - ETA: 0s1/1 [==============================] - 0s 343ms/step
1/1 [==============================] - ETA: 0s1/1 [==============================] - 0s 30ms/step
1/1 [==============================] - ETA: 0s1/1 [==============================] - 0s 29ms/step
1/1 [==============================] - ETA: 0s1/1 [==============================] - 0s 345ms/step
1/1 [==============================] - ETA: 0s1/1 [==============================] - 0s 317ms/step
1/1 [==============================] - ETA: 0s1/1 [==============================] - 0s 28ms/step
1/1 [==============================] - ETA: 0s1/1 [==============================] - 0s 27ms/step
1/1 [==============================] - ETA: 0s1/1 [==============================] - 0s 330ms/step
[I 2024-12-23 17:38:27,063] Trial 11 finished with value: 0.33196594458735107 and parameters: {'n_units_0': 36, 'dropout_1': 0.25, 'run': 2, 'epochs_1': 30, 'epochs_2': 70, 'lr_1': 0.0001090249182652839, 'lr_2': 0.00018929638659073147, 'batch_size': 12, 'regularization': 'l1_l2', 'reg_alpha_1': 0.0012533290118628825, 'reg_alpha_2': 2.7056636258998517e-05}. Best is trial 4 with value: 0.2906675775177939.
1/1 [==============================] - ETA: 0s1/1 [==============================] - 0s 325ms/step
1/1 [==============================] - ETA: 0s1/1 [==============================] - 0s 29ms/step
1/1 [==============================] - ETA: 0s1/1 [==============================] - 0s 27ms/step
[I 2024-12-23 17:38:28,062] Trial 11 finished with value: 1.2281382336164521 and parameters: {'n_units_0': 4, 'dropout_1': 0.25, 'run': 2, 'epochs_1': 50, 'epochs_2': 70, 'lr_1': 0.0004842080300729574, 'lr_2': 0.0001890393117750688, 'batch_size': 16, 'regularization': 'l1_l2', 'reg_alpha_1': 0.0012533290118628825, 'reg_alpha_2': 2.7056636258998517e-05}. Best is trial 6 with value: 1.0206205845816532.
1/1 [==============================] - ETA: 0s1/1 [==============================] - 0s 338ms/step
1/1 [==============================] - ETA: 0s1/1 [==============================] - 0s 325ms/step
1/1 [==============================] - ETA: 0s1/1 [==============================] - 0s 41ms/step
1/1 [==============================] - ETA: 0s1/1 [==============================] - 0s 39ms/step
Statistics value = 52.0 p-value = 0.0048828125
1/1 [==============================] - ETA: 0s1/1 [==============================] - 0s 328ms/step
1/1 [==============================] - ETA: 0s1/1 [==============================] - 0s 304ms/step
[I 2024-12-23 17:38:29,854] Trial 11 finished with value: 0.6551869860593635 and parameters: {'n_units_0': 28, 'dropout_1': 0.25, 'run': 2, 'epochs_1': 70, 'epochs_2': 70, 'lr_1': 0.00011643043743323932, 'lr_2': 0.00021689446559895785, 'batch_size': 16, 'regularization': 'l1_l2', 'reg_alpha_1': 1.2188958012648946e-05, 'reg_alpha_2': 2.7056636258998517e-05}. Best is trial 0 with value: 0.4917174351813718.
Statistics value = 8.0 p-value = 0.92578125
1/1 [==============================] - ETA: 0s1/1 [==============================] - 0s 334ms/step
Statistics value = 19.0 p-value = 0.47265625
1/1 [==============================] - ETA: 0s1/1 [==============================] - 0s 346ms/step
1/1 [==============================] - ETA: 0s1/1 [==============================] - 0s 354ms/step
1/1 [==============================] - ETA: 0s1/1 [==============================] - 0s 346ms/step
1/1 [==============================] - ETA: 0s1/1 [==============================] - 0s 333ms/step
1/1 [==============================] - ETA: 0s1/1 [==============================] - 0s 328ms/step
Statistics value = 17.0 p-value = 0.578125
1/1 [==============================] - ETA: 0s1/1 [==============================] - 0s 339ms/step
1/1 [==============================] - ETA: 0s1/1 [==============================] - 0s 349ms/step
1/1 [==============================] - ETA: 0s1/1 [==============================] - 0s 332ms/step
1/1 [==============================] - ETA: 0s1/1 [==============================] - 0s 334ms/step
1/1 [==============================] - ETA: 0s1/1 [==============================] - 0s 33ms/step
1/1 [==============================] - ETA: 0s1/1 [==============================] - 0s 27ms/step
1/1 [==============================] - ETA: 0s1/1 [==============================] - 0s 332ms/step
1/1 [==============================] - ETA: 0s1/1 [==============================] - 0s 328ms/step
1/1 [==============================] - ETA: 0s1/1 [==============================] - 0s 29ms/step
[I 2024-12-23 17:38:47,234] Trial 11 finished with value: 0.23918504969914264 and parameters: {'n_units_0': 36, 'dropout_1': 0.25, 'run': 3, 'epochs_1': 70, 'epochs_2': 50, 'lr_1': 0.0001090249182652839, 'lr_2': 0.0001965638261089347, 'batch_size': 12, 'regularization': 'None'}. Best is trial 0 with value: 0.23409761630714898.
1/1 [==============================] - ETA: 0s1/1 [==============================] - 0s 28ms/step
1/1 [==============================] - ETA: 0s1/1 [==============================] - 0s 377ms/step
1/1 [==============================] - ETA: 0s1/1 [==============================] - 0s 333ms/step
1/1 [==============================] - ETA: 0s1/1 [==============================] - 0s 29ms/step
1/1 [==============================] - ETA: 0s1/1 [==============================] - 0s 30ms/step
1/1 [==============================] - ETA: 0s1/1 [==============================] - 0s 343ms/step
1/1 [==============================] - ETA: 0s1/1 [==============================] - 0s 326ms/step
1/1 [==============================] - ETA: 0s1/1 [==============================] - 0s 31ms/step
1/1 [==============================] - ETA: 0s1/1 [==============================] - 0s 36ms/step
Statistics value = 32.0 p-value = 0.34765625
1/1 [==============================] - ETA: 0s1/1 [==============================] - 0s 327ms/step
1/1 [==============================] - ETA: 0s1/1 [==============================] - 0s 344ms/step
Statistics value = 26.0 p-value = 0.5771484375
1/1 [==============================] - ETA: 0s1/1 [==============================] - 0s 322ms/step
1/1 [==============================] - ETA: 0s1/1 [==============================] - 0s 329ms/step
Statistics value = 19.0 p-value = 0.47265625
1/1 [==============================] - ETA: 0s1/1 [==============================] - 0s 341ms/step
1/1 [==============================] - ETA: 0s1/1 [==============================] - 0s 307ms/step
Statistics value = 34.0 p-value = 0.2783203125
1/1 [==============================] - ETA: 0s1/1 [==============================] - 0s 339ms/step
1/1 [==============================] - ETA: 0s1/1 [==============================] - 0s 310ms/step
1/1 [==============================] - ETA: 0s1/1 [==============================] - 0s 350ms/step
1/1 [==============================] - ETA: 0s1/1 [==============================] - 0s 283ms/step
1/1 [==============================] - ETA: 0s1/1 [==============================] - 0s 27ms/step
1/1 [==============================] - ETA: 0s1/1 [==============================] - 0s 28ms/step
[I 2024-12-23 17:39:05,222] Trial 12 finished with value: 0.29681542327703275 and parameters: {'n_units_0': 28, 'dropout_1': 0.15000000000000002, 'run': 2, 'epochs_1': 30, 'epochs_2': 60, 'lr_1': 0.00011672711987380462, 'lr_2': 0.00010814406628766146, 'batch_size': 12, 'regularization': 'l1_l2', 'reg_alpha_1': 0.0009606543991623592, 'reg_alpha_2': 0.00015064127440612878}. Best is trial 4 with value: 0.2906675775177939.
1/1 [==============================] - ETA: 0s1/1 [==============================] - 0s 329ms/step
1/1 [==============================] - ETA: 0s1/1 [==============================] - 0s 336ms/step
1/1 [==============================] - ETA: 0s1/1 [==============================] - 0s 33ms/step
1/1 [==============================] - ETA: 0s1/1 [==============================] - 0s 34ms/step
[I 2024-12-23 17:39:06,882] Trial 12 finished with value: 1.3983453087232498 and parameters: {'n_units_0': 28, 'dropout_1': 0.25, 'run': 2, 'epochs_1': 30, 'epochs_2': 60, 'lr_1': 0.0010730472988585093, 'lr_2': 0.00010814406628766146, 'batch_size': 16, 'regularization': 'l1_l2', 'reg_alpha_1': 0.001787099867859511, 'reg_alpha_2': 0.00015064127440612878}. Best is trial 6 with value: 1.0206205845816532.
1/1 [==============================] - ETA: 0s1/1 [==============================] - 0s 331ms/step
1/1 [==============================] - ETA: 0s1/1 [==============================] - 0s 367ms/step
1/1 [==============================] - ETA: 0s1/1 [==============================] - 0s 343ms/step
1/1 [==============================] - ETA: 0s1/1 [==============================] - 0s 339ms/step
1/1 [==============================] - ETA: 0s1/1 [==============================] - 0s 37ms/step
1/1 [==============================] - ETA: 0s1/1 [==============================] - 0s 28ms/step
