[I 2024-12-23 21:02:17,882] Trial 2 finished with value: 0.2884382235608452 and parameters: {'n_units_0': 16, 'dropout_1': 0.2, 'run': 2, 'epochs_1': 30, 'epochs_2': 70, 'lr_1': 0.00021930485556643703, 'lr_2': 1.3492834268013232e-05, 'batch_size': 16, 'regularization': 'l1_l2', 'reg_alpha_1': 0.0011290133559092666, 'reg_alpha_2': 0.00020914981329035596}. Best is trial 2 with value: 0.2884382235608452.
Statistics value = 33.0 p-value = 0.01953125
1/1 [==============================] - ETA: 0s1/1 [==============================] - 1s 534ms/step
Statistics value = 16.0 p-value = 0.62890625
1/1 [==============================] - ETA: 0s1/1 [==============================] - 0s 485ms/step
Statistics value = 15.0 p-value = 0.6796875
1/1 [==============================] - ETA: 0s1/1 [==============================] - 0s 433ms/step
Statistics value = 14.0 p-value = 0.7265625
1/1 [==============================] - ETA: 0s1/1 [==============================] - 0s 421ms/step
1/1 [==============================] - ETA: 0s1/1 [==============================] - 0s 488ms/step
1/1 [==============================] - ETA: 0s1/1 [==============================] - 0s 445ms/step
1/1 [==============================] - ETA: 0s1/1 [==============================] - 0s 486ms/step
1/1 [==============================] - ETA: 0s1/1 [==============================] - 0s 489ms/step
1/1 [==============================] - ETA: 0s1/1 [==============================] - 0s 103ms/step
1/1 [==============================] - ETA: 0s1/1 [==============================] - 0s 54ms/step
1/1 [==============================] - ETA: 0s1/1 [==============================] - 0s 97ms/step
1/1 [==============================] - ETA: 0s1/1 [==============================] - 0s 96ms/step
1/1 [==============================] - ETA: 0s1/1 [==============================] - 0s 117ms/step
1/1 [==============================] - ETA: 0s1/1 [==============================] - 0s 111ms/step
1/1 [==============================] - ETA: 0s1/1 [==============================] - 0s 94ms/step
1/1 [==============================] - ETA: 0s1/1 [==============================] - 0s 89ms/step
Statistics value = 17.0 p-value = 0.8623046875
1/1 [==============================] - ETA: 0s1/1 [==============================] - 0s 481ms/step
Statistics value = 30.0 p-value = 0.4228515625
1/1 [==============================] - ETA: 0s1/1 [==============================] - 0s 429ms/step
Statistics value = 30.0 p-value = 0.4228515625
1/1 [==============================] - ETA: 0s1/1 [==============================] - 0s 431ms/step
Statistics value = 32.0 p-value = 0.34765625
1/1 [==============================] - ETA: 0s1/1 [==============================] - 0s 448ms/step
1/1 [==============================] - ETA: 0s1/1 [==============================] - 0s 463ms/step
1/1 [==============================] - ETA: 0s1/1 [==============================] - 0s 485ms/step
1/1 [==============================] - ETA: 0s1/1 [==============================] - 0s 437ms/step
1/1 [==============================] - ETA: 0s1/1 [==============================] - 0s 460ms/step
1/1 [==============================] - ETA: 0s1/1 [==============================] - 0s 108ms/step
1/1 [==============================] - ETA: 0s1/1 [==============================] - 0s 92ms/step
1/1 [==============================] - ETA: 0s1/1 [==============================] - 0s 96ms/step
1/1 [==============================] - ETA: 0s1/1 [==============================] - 0s 89ms/step
1/1 [==============================] - ETA: 0s1/1 [==============================] - 0s 97ms/step
1/1 [==============================] - ETA: 0s1/1 [==============================] - 0s 108ms/step
1/1 [==============================] - ETA: 0s1/1 [==============================] - 0s 109ms/step
1/1 [==============================] - ETA: 0s1/1 [==============================] - 0s 115ms/step
[I 2024-12-23 21:02:55,678] Trial 3 finished with value: 0.27058665602405707 and parameters: {'n_units_0': 8, 'dropout_1': 0.2, 'run': 1, 'epochs_1': 100, 'epochs_2': 40, 'lr_1': 0.0021137059440645744, 'lr_2': 4.201672054372529e-05, 'batch_size': 12, 'regularization': 'l2', 'reg_alpha_1': 0.006584106160121612}. Best is trial 2 with value: 0.23391714665713081.
[I 2024-12-23 21:02:55,715] Trial 3 finished with value: 1.7975096148828507 and parameters: {'n_units_0': 8, 'dropout_1': 0.2, 'run': 1, 'epochs_1': 100, 'epochs_2': 40, 'lr_1': 0.0021137059440645744, 'lr_2': 4.201672054372529e-05, 'batch_size': 12, 'regularization': 'l2', 'reg_alpha_1': 0.006584106160121612}. Best is trial 2 with value: 1.0593185521458317.
[I 2024-12-23 21:02:55,748] Trial 3 finished with value: 0.43673954455359676 and parameters: {'n_units_0': 8, 'dropout_1': 0.2, 'run': 1, 'epochs_1': 100, 'epochs_2': 40, 'lr_1': 0.0021137059440645744, 'lr_2': 4.201672054372529e-05, 'batch_size': 12, 'regularization': 'l2', 'reg_alpha_1': 0.006584106160121612}. Best is trial 2 with value: 0.2884382235608452.
[I 2024-12-23 21:02:55,753] Trial 3 finished with value: 0.6506522525001852 and parameters: {'n_units_0': 8, 'dropout_1': 0.2, 'run': 1, 'epochs_1': 100, 'epochs_2': 40, 'lr_1': 0.0021137059440645744, 'lr_2': 4.201672054372529e-05, 'batch_size': 12, 'regularization': 'l2', 'reg_alpha_1': 0.006584106160121612}. Best is trial 2 with value: 0.5777166485766146.
Statistics value = 20.0 p-value = 0.421875
1/1 [==============================] - ETA: 0s1/1 [==============================] - 0s 437ms/step
Statistics value = 34.0 p-value = 0.01171875
1/1 [==============================] - ETA: 0s1/1 [==============================] - 0s 413ms/step
Statistics value = 5.0 p-value = 0.97265625
1/1 [==============================] - ETA: 0s1/1 [==============================] - 0s 475ms/step
Statistics value = 20.0 p-value = 0.421875
1/1 [==============================] - ETA: 0s1/1 [==============================] - 0s 451ms/step
1/1 [==============================] - ETA: 0s1/1 [==============================] - 0s 425ms/step
1/1 [==============================] - ETA: 0s1/1 [==============================] - 0s 423ms/step
1/1 [==============================] - ETA: 0s1/1 [==============================] - 0s 406ms/step
1/1 [==============================] - ETA: 0s1/1 [==============================] - 0s 444ms/step
1/1 [==============================] - ETA: 0s1/1 [==============================] - 0s 419ms/step
1/1 [==============================] - ETA: 0s1/1 [==============================] - 0s 437ms/step
1/1 [==============================] - ETA: 0s1/1 [==============================] - 0s 467ms/step
1/1 [==============================] - ETA: 0s1/1 [==============================] - 0s 449ms/step
1/1 [==============================] - ETA: 0s1/1 [==============================] - 0s 423ms/step
1/1 [==============================] - ETA: 0s1/1 [==============================] - 0s 420ms/step
1/1 [==============================] - ETA: 0s1/1 [==============================] - 0s 428ms/step
1/1 [==============================] - ETA: 0s1/1 [==============================] - 0s 500ms/step
1/1 [==============================] - ETA: 0s1/1 [==============================] - 0s 432ms/step
1/1 [==============================] - ETA: 0s1/1 [==============================] - 0s 445ms/step
1/1 [==============================] - ETA: 0s1/1 [==============================] - 0s 438ms/step
1/1 [==============================] - ETA: 0s1/1 [==============================] - 0s 461ms/step
1/1 [==============================] - ETA: 0s1/1 [==============================] - 0s 471ms/step
1/1 [==============================] - ETA: 0s1/1 [==============================] - 0s 425ms/step
1/1 [==============================] - ETA: 0s1/1 [==============================] - 0s 437ms/step
1/1 [==============================] - ETA: 0s1/1 [==============================] - 1s 604ms/step
1/1 [==============================] - ETA: 0s1/1 [==============================] - 0s 88ms/step
1/1 [==============================] - ETA: 0s1/1 [==============================] - 0s 92ms/step
1/1 [==============================] - ETA: 0s1/1 [==============================] - 0s 90ms/step
1/1 [==============================] - ETA: 0s1/1 [==============================] - 0s 112ms/step
1/1 [==============================] - ETA: 0s1/1 [==============================] - 0s 80ms/step
1/1 [==============================] - ETA: 0s1/1 [==============================] - 0s 85ms/step
1/1 [==============================] - ETA: 0s1/1 [==============================] - 0s 84ms/step
1/1 [==============================] - ETA: 0s1/1 [==============================] - 0s 52ms/step
Statistics value = 27.0 p-value = 0.5390625
1/1 [==============================] - ETA: 0s1/1 [==============================] - 0s 448ms/step
Statistics value = 29.0 p-value = 0.4609375
1/1 [==============================] - ETA: 0s1/1 [==============================] - 0s 485ms/step
Statistics value = 48.0 p-value = 0.0185546875
1/1 [==============================] - ETA: 0s1/1 [==============================] - 0s 476ms/step
Statistics value = 46.0 p-value = 0.0322265625
1/1 [==============================] - ETA: 0s1/1 [==============================] - 1s 527ms/step
1/1 [==============================] - ETA: 0s1/1 [==============================] - 0s 475ms/step
1/1 [==============================] - ETA: 0s1/1 [==============================] - 0s 415ms/step
1/1 [==============================] - ETA: 0s1/1 [==============================] - 0s 404ms/step
1/1 [==============================] - ETA: 0s1/1 [==============================] - 0s 447ms/step
1/1 [==============================] - ETA: 0s1/1 [==============================] - 0s 406ms/step
1/1 [==============================] - ETA: 0s1/1 [==============================] - 0s 411ms/step
1/1 [==============================] - ETA: 0s1/1 [==============================] - 0s 396ms/step
1/1 [==============================] - ETA: 0s1/1 [==============================] - 0s 446ms/step
1/1 [==============================] - ETA: 0s1/1 [==============================] - 0s 444ms/step
1/1 [==============================] - ETA: 0s1/1 [==============================] - 0s 381ms/step
1/1 [==============================] - ETA: 0s1/1 [==============================] - 0s 395ms/step
1/1 [==============================] - ETA: 0s1/1 [==============================] - 0s 418ms/step
1/1 [==============================] - ETA: 0s1/1 [==============================] - 1s 510ms/step
1/1 [==============================] - ETA: 0s1/1 [==============================] - 1s 576ms/step
1/1 [==============================] - ETA: 0s1/1 [==============================] - 1s 593ms/step
1/1 [==============================] - ETA: 0s1/1 [==============================] - 1s 780ms/step
1/1 [==============================] - ETA: 0s1/1 [==============================] - 1s 571ms/step
1/1 [==============================] - ETA: 0s1/1 [==============================] - 1s 520ms/step
1/1 [==============================] - ETA: 0s1/1 [==============================] - 1s 522ms/step
1/1 [==============================] - ETA: 0s1/1 [==============================] - 1s 540ms/step
1/1 [==============================] - ETA: 0s1/1 [==============================] - 0s 81ms/step
1/1 [==============================] - ETA: 0s1/1 [==============================] - 0s 47ms/step
1/1 [==============================] - ETA: 0s1/1 [==============================] - 0s 95ms/step
1/1 [==============================] - ETA: 0s1/1 [==============================] - 0s 109ms/step
1/1 [==============================] - ETA: 0s1/1 [==============================] - 0s 83ms/step
1/1 [==============================] - ETA: 0s1/1 [==============================] - 0s 85ms/step
1/1 [==============================] - ETA: 0s1/1 [==============================] - 0s 91ms/step
1/1 [==============================] - ETA: 0s1/1 [==============================] - 0s 48ms/step
[I 2024-12-23 21:04:14,956] Trial 4 finished with value: 0.29916263372215035 and parameters: {'n_units_0': 60, 'dropout_1': 0.2, 'run': 3, 'epochs_1': 30, 'epochs_2': 30, 'lr_1': 0.00012315571723666037, 'lr_2': 4.473636174621264e-05, 'batch_size': 12, 'regularization': 'l1', 'reg_alpha_1': 0.00042470585622618684}. Best is trial 2 with value: 0.2884382235608452.
[I 2024-12-23 21:04:14,959] Trial 4 finished with value: 1.1702576470347592 and parameters: {'n_units_0': 60, 'dropout_1': 0.2, 'run': 3, 'epochs_1': 30, 'epochs_2': 30, 'lr_1': 0.00012315571723666037, 'lr_2': 4.473636174621264e-05, 'batch_size': 12, 'regularization': 'l1', 'reg_alpha_1': 0.00042470585622618684}. Best is trial 2 with value: 1.0593185521458317.
[I 2024-12-23 21:04:14,976] Trial 4 finished with value: 0.5592867591529402 and parameters: {'n_units_0': 60, 'dropout_1': 0.2, 'run': 3, 'epochs_1': 30, 'epochs_2': 30, 'lr_1': 0.00012315571723666037, 'lr_2': 4.473636174621264e-05, 'batch_size': 12, 'regularization': 'l1', 'reg_alpha_1': 0.00042470585622618684}. Best is trial 4 with value: 0.5592867591529402.
