[I 2024-12-23 16:22:59,555] Trial 5 finished with value: 1.7210320324722825 and parameters: {'n_units_0': 12, 'dropout_1': 0.3, 'run': 1, 'epochs_1': 100, 'epochs_2': 80, 'lr_1': 0.00024970737145052745, 'lr_2': 1.0257563974185649e-05, 'batch_size': 16, 'regularization': 'l2', 'reg_alpha_1': 0.0001189589673755355}. Best is trial 2 with value: 1.0043789986087965.
Statistics value = 5.0 p-value = 0.97265625
1/1 [==============================] - ETA: 0s1/1 [==============================] - 0s 408ms/step
Statistics value = 17.0 p-value = 0.578125
1/1 [==============================] - ETA: 0s1/1 [==============================] - 0s 371ms/step
1/1 [==============================] - ETA: 0s1/1 [==============================] - 0s 403ms/step
1/1 [==============================] - ETA: 0s1/1 [==============================] - 0s 398ms/step
Statistics value = 31.0 p-value = 0.0390625
1/1 [==============================] - ETA: 0s1/1 [==============================] - 0s 464ms/step
Statistics value = 9.0 p-value = 0.90234375
1/1 [==============================] - ETA: 0s1/1 [==============================] - 0s 394ms/step
1/1 [==============================] - ETA: 0s1/1 [==============================] - 0s 387ms/step
1/1 [==============================] - ETA: 0s1/1 [==============================] - 0s 380ms/step
1/1 [==============================] - ETA: 0s1/1 [==============================] - 0s 441ms/step
1/1 [==============================] - ETA: 0s1/1 [==============================] - 0s 390ms/step
1/1 [==============================] - ETA: 0s1/1 [==============================] - 0s 389ms/step
1/1 [==============================] - ETA: 0s1/1 [==============================] - 0s 388ms/step
1/1 [==============================] - ETA: 0s1/1 [==============================] - 0s 52ms/step
1/1 [==============================] - ETA: 0s1/1 [==============================] - 0s 50ms/step
1/1 [==============================] - ETA: 0s1/1 [==============================] - 0s 42ms/step
1/1 [==============================] - ETA: 0s1/1 [==============================] - 0s 47ms/step
1/1 [==============================] - ETA: 0s1/1 [==============================] - 0s 414ms/step
1/1 [==============================] - ETA: 0s1/1 [==============================] - 0s 396ms/step
1/1 [==============================] - ETA: 0s1/1 [==============================] - 0s 392ms/step
1/1 [==============================] - ETA: 0s1/1 [==============================] - 0s 389ms/step
1/1 [==============================] - ETA: 0s1/1 [==============================] - 0s 49ms/step
1/1 [==============================] - ETA: 0s1/1 [==============================] - 0s 46ms/step
1/1 [==============================] - ETA: 0s1/1 [==============================] - 0s 63ms/step
1/1 [==============================] - ETA: 0s1/1 [==============================] - 0s 44ms/step
Statistics value = 54.0 p-value = 0.001953125
1/1 [==============================] - ETA: 0s1/1 [==============================] - 0s 421ms/step
Statistics value = 20.0 p-value = 0.7841796875
1/1 [==============================] - ETA: 0s1/1 [==============================] - 0s 399ms/step
1/1 [==============================] - ETA: 0s1/1 [==============================] - 0s 386ms/step
1/1 [==============================] - ETA: 0s1/1 [==============================] - 0s 380ms/step
Statistics value = 42.0 p-value = 0.080078125
1/1 [==============================] - ETA: 0s1/1 [==============================] - 0s 456ms/step
Statistics value = 29.0 p-value = 0.4609375
1/1 [==============================] - ETA: 0s1/1 [==============================] - 0s 420ms/step
1/1 [==============================] - ETA: 0s1/1 [==============================] - 0s 406ms/step
1/1 [==============================] - ETA: 0s1/1 [==============================] - 0s 406ms/step
1/1 [==============================] - ETA: 0s1/1 [==============================] - 0s 411ms/step
1/1 [==============================] - ETA: 0s1/1 [==============================] - 0s 396ms/step
1/1 [==============================] - ETA: 0s1/1 [==============================] - 0s 437ms/step
1/1 [==============================] - ETA: 0s1/1 [==============================] - 0s 401ms/step
1/1 [==============================] - ETA: 0s1/1 [==============================] - 0s 51ms/step
1/1 [==============================] - ETA: 0s1/1 [==============================] - 0s 44ms/step
1/1 [==============================] - ETA: 0s1/1 [==============================] - 0s 42ms/step
1/1 [==============================] - ETA: 0s1/1 [==============================] - 0s 66ms/step
[I 2024-12-23 16:23:43,644] Trial 6 finished with value: 0.3054438074163562 and parameters: {'n_units_0': 8, 'dropout_1': 0.3, 'run': 2, 'epochs_1': 50, 'epochs_2': 20, 'lr_1': 0.0004187594718900631, 'lr_2': 4.4706085467784903e-05, 'batch_size': 16, 'regularization': 'l1', 'reg_alpha_1': 0.0013795402040204172}. Best is trial 2 with value: 0.28592394505080987.
[I 2024-12-23 16:23:43,720] Trial 6 finished with value: 0.23307710566177214 and parameters: {'n_units_0': 8, 'dropout_1': 0.3, 'run': 2, 'epochs_1': 50, 'epochs_2': 20, 'lr_1': 0.0004187594718900631, 'lr_2': 4.4706085467784903e-05, 'batch_size': 16, 'regularization': 'l1', 'reg_alpha_1': 0.0013795402040204172}. Best is trial 6 with value: 0.23307710566177214.
1/1 [==============================] - ETA: 0s1/1 [==============================] - 0s 387ms/step
1/1 [==============================] - ETA: 0s1/1 [==============================] - 0s 403ms/step
1/1 [==============================] - ETA: 0s1/1 [==============================] - 0s 392ms/step
1/1 [==============================] - ETA: 0s1/1 [==============================] - 0s 422ms/step
1/1 [==============================] - ETA: 0s1/1 [==============================] - 0s 56ms/step
1/1 [==============================] - ETA: 0s1/1 [==============================] - 0s 53ms/step
1/1 [==============================] - ETA: 0s1/1 [==============================] - 0s 53ms/step
1/1 [==============================] - ETA: 0s1/1 [==============================] - 0s 45ms/step
[I 2024-12-23 16:23:48,269] Trial 6 finished with value: 1.092041327813814 and parameters: {'n_units_0': 8, 'dropout_1': 0.3, 'run': 2, 'epochs_1': 50, 'epochs_2': 20, 'lr_1': 0.0004187594718900631, 'lr_2': 4.4706085467784903e-05, 'batch_size': 16, 'regularization': 'l1', 'reg_alpha_1': 0.0013795402040204172}. Best is trial 2 with value: 1.0043789986087965.
[I 2024-12-23 16:23:48,284] Trial 6 finished with value: 0.675157823297365 and parameters: {'n_units_0': 8, 'dropout_1': 0.3, 'run': 2, 'epochs_1': 50, 'epochs_2': 20, 'lr_1': 0.0004187594718900631, 'lr_2': 4.4706085467784903e-05, 'batch_size': 16, 'regularization': 'l1', 'reg_alpha_1': 0.0013795402040204172}. Best is trial 5 with value: 0.5704337764397787.
Statistics value = 12.0 p-value = 0.80859375
1/1 [==============================] - ETA: 0s1/1 [==============================] - 0s 390ms/step
1/1 [==============================] - ETA: 0s1/1 [==============================] - 0s 401ms/step
Statistics value = 15.0 p-value = 0.6796875
1/1 [==============================] - ETA: 0s1/1 [==============================] - 0s 388ms/step
1/1 [==============================] - ETA: 0s1/1 [==============================] - 0s 427ms/step
Statistics value = 34.0 p-value = 0.01171875
1/1 [==============================] - ETA: 0s1/1 [==============================] - 0s 397ms/step
Statistics value = 20.0 p-value = 0.421875
1/1 [==============================] - ETA: 0s1/1 [==============================] - 0s 395ms/step
1/1 [==============================] - ETA: 0s1/1 [==============================] - 0s 424ms/step
1/1 [==============================] - ETA: 0s1/1 [==============================] - 0s 409ms/step
1/1 [==============================] - ETA: 0s1/1 [==============================] - 0s 401ms/step
1/1 [==============================] - ETA: 0s1/1 [==============================] - 0s 385ms/step
1/1 [==============================] - ETA: 0s1/1 [==============================] - 0s 484ms/step
1/1 [==============================] - ETA: 0s1/1 [==============================] - 0s 414ms/step
1/1 [==============================] - ETA: 0s1/1 [==============================] - 0s 390ms/step
1/1 [==============================] - ETA: 0s1/1 [==============================] - 0s 392ms/step
1/1 [==============================] - ETA: 0s1/1 [==============================] - 0s 448ms/step
1/1 [==============================] - ETA: 0s1/1 [==============================] - 0s 420ms/step
1/1 [==============================] - ETA: 0s1/1 [==============================] - 0s 407ms/step
1/1 [==============================] - ETA: 0s1/1 [==============================] - 0s 423ms/step
1/1 [==============================] - ETA: 0s1/1 [==============================] - 0s 405ms/step
1/1 [==============================] - ETA: 0s1/1 [==============================] - 0s 63ms/step
1/1 [==============================] - ETA: 0s1/1 [==============================] - 0s 47ms/step
1/1 [==============================] - ETA: 0s1/1 [==============================] - 0s 433ms/step
1/1 [==============================] - ETA: 0s1/1 [==============================] - 0s 50ms/step
1/1 [==============================] - ETA: 0s1/1 [==============================] - 0s 52ms/step
1/1 [==============================] - ETA: 0s1/1 [==============================] - 0s 387ms/step
1/1 [==============================] - ETA: 0s1/1 [==============================] - 1s 547ms/step
1/1 [==============================] - ETA: 0s1/1 [==============================] - 0s 388ms/step
1/1 [==============================] - ETA: 0s1/1 [==============================] - 0s 55ms/step
1/1 [==============================] - ETA: 0s1/1 [==============================] - 0s 402ms/step
1/1 [==============================] - ETA: 0s1/1 [==============================] - 0s 47ms/step
1/1 [==============================] - ETA: 0s1/1 [==============================] - 0s 41ms/step
1/1 [==============================] - ETA: 0s1/1 [==============================] - 0s 64ms/step
Statistics value = 16.0 p-value = 0.8837890625
1/1 [==============================] - ETA: 0s1/1 [==============================] - 0s 398ms/step
Statistics value = 27.0 p-value = 0.5390625
1/1 [==============================] - ETA: 0s1/1 [==============================] - 0s 368ms/step
1/1 [==============================] - ETA: 0s1/1 [==============================] - 0s 375ms/step
1/1 [==============================] - ETA: 0s1/1 [==============================] - 0s 384ms/step
Statistics value = 33.0 p-value = 0.3125
1/1 [==============================] - ETA: 0s1/1 [==============================] - 0s 395ms/step
Statistics value = 34.0 p-value = 0.2783203125
1/1 [==============================] - ETA: 0s1/1 [==============================] - 0s 397ms/step
1/1 [==============================] - ETA: 0s1/1 [==============================] - 0s 382ms/step
1/1 [==============================] - ETA: 0s1/1 [==============================] - 0s 351ms/step
1/1 [==============================] - ETA: 0s1/1 [==============================] - 0s 411ms/step
1/1 [==============================] - ETA: 0s1/1 [==============================] - 0s 386ms/step
1/1 [==============================] - ETA: 0s1/1 [==============================] - 0s 386ms/step
1/1 [==============================] - ETA: 0s1/1 [==============================] - 0s 363ms/step
1/1 [==============================] - ETA: 0s1/1 [==============================] - 0s 426ms/step
1/1 [==============================] - ETA: 0s1/1 [==============================] - 1s 529ms/step
1/1 [==============================] - ETA: 0s1/1 [==============================] - 0s 407ms/step
1/1 [==============================] - ETA: 0s1/1 [==============================] - 0s 393ms/step
1/1 [==============================] - ETA: 0s1/1 [==============================] - 0s 405ms/step
1/1 [==============================] - ETA: 0s1/1 [==============================] - 0s 392ms/step
1/1 [==============================] - ETA: 0s1/1 [==============================] - 0s 455ms/step
1/1 [==============================] - ETA: 0s1/1 [==============================] - 0s 376ms/step
1/1 [==============================] - ETA: 0s1/1 [==============================] - 0s 47ms/step
1/1 [==============================] - ETA: 0s1/1 [==============================] - 0s 49ms/step
1/1 [==============================] - ETA: 0s1/1 [==============================] - 0s 39ms/step
1/1 [==============================] - ETA: 0s1/1 [==============================] - 0s 47ms/step
[I 2024-12-23 16:25:27,739] Trial 7 finished with value: 0.26440500135022904 and parameters: {'n_units_0': 52, 'dropout_1': 0.2, 'run': 3, 'epochs_1': 60, 'epochs_2': 60, 'lr_1': 0.0007162786999897341, 'lr_2': 1.1241862095793047e-05, 'batch_size': 8, 'regularization': 'l1', 'reg_alpha_1': 0.005280796376895365}. Best is trial 6 with value: 0.23307710566177214.
[I 2024-12-23 16:25:28,004] Trial 7 finished with value: 0.4017427328201752 and parameters: {'n_units_0': 52, 'dropout_1': 0.2, 'run': 3, 'epochs_1': 60, 'epochs_2': 60, 'lr_1': 0.0007162786999897341, 'lr_2': 1.1241862095793047e-05, 'batch_size': 8, 'regularization': 'l1', 'reg_alpha_1': 0.005280796376895365}. Best is trial 2 with value: 0.28592394505080987.
1/1 [==============================] - ETA: 0s1/1 [==============================] - 0s 410ms/step
1/1 [==============================] - ETA: 0s1/1 [==============================] - 0s 393ms/step
1/1 [==============================] - ETA: 0s1/1 [==============================] - 0s 397ms/step
1/1 [==============================] - ETA: 0s1/1 [==============================] - 0s 388ms/step
1/1 [==============================] - ETA: 0s1/1 [==============================] - 0s 43ms/step
1/1 [==============================] - ETA: 0s1/1 [==============================] - 0s 47ms/step
1/1 [==============================] - ETA: 0s1/1 [==============================] - 0s 41ms/step
1/1 [==============================] - ETA: 0s1/1 [==============================] - 0s 44ms/step
[I 2024-12-23 16:25:31,280] Trial 7 finished with value: 1.5326517767362415 and parameters: {'n_units_0': 52, 'dropout_1': 0.2, 'run': 3, 'epochs_1': 60, 'epochs_2': 60, 'lr_1': 0.0007162786999897341, 'lr_2': 1.1241862095793047e-05, 'batch_size': 8, 'regularization': 'l1', 'reg_alpha_1': 0.005280796376895365}. Best is trial 2 with value: 1.0043789986087965.
