[I 2024-12-22 15:37:03,556] Trial 0 finished with value: 0.31414679480818664 and parameters: {'n_units_0': 24, 'dropout_1': 0.3, 'run': 3, 'epochs_1': 70, 'epochs_2': 30, 'lr_1': 0.00020511104188433984, 'lr_2': 1.3066739238053272e-05, 'batch_size': 16, 'regularization': 'None'}. Best is trial 0 with value: 0.31414679480818664.
1/1 [==============================] - ETA: 0s1/1 [==============================] - 0s 391ms/step
1/1 [==============================] - ETA: 0s1/1 [==============================] - 0s 408ms/step
1/1 [==============================] - ETA: 0s1/1 [==============================] - 0s 41ms/step
1/1 [==============================] - ETA: 0s1/1 [==============================] - 0s 28ms/step
1/1 [==============================] - ETA: 0s1/1 [==============================] - 0s 32ms/step
1/1 [==============================] - ETA: 0s1/1 [==============================] - 0s 33ms/step
1/1 [==============================] - ETA: 0s1/1 [==============================] - 0s 27ms/step
1/1 [==============================] - ETA: 0s1/1 [==============================] - 0s 27ms/step
[I 2024-12-22 15:37:04,307] Trial 0 finished with value: 0.23621892557210417 and parameters: {'n_units_0': 24, 'dropout_1': 0.3, 'run': 3, 'epochs_1': 70, 'epochs_2': 30, 'lr_1': 0.00020511104188433984, 'lr_2': 1.3066739238053272e-05, 'batch_size': 16, 'regularization': 'None'}. Best is trial 0 with value: 0.23621892557210417.
[I 2024-12-22 15:37:04,399] Trial 0 finished with value: 0.5081879107317093 and parameters: {'n_units_0': 24, 'dropout_1': 0.3, 'run': 3, 'epochs_1': 70, 'epochs_2': 30, 'lr_1': 0.00020511104188433984, 'lr_2': 1.3066739238053272e-05, 'batch_size': 16, 'regularization': 'None'}. Best is trial 0 with value: 0.5081879107317093.
[I 2024-12-22 15:37:04,413] Trial 0 finished with value: 1.1198576827825049 and parameters: {'n_units_0': 24, 'dropout_1': 0.3, 'run': 3, 'epochs_1': 70, 'epochs_2': 30, 'lr_1': 0.00020511104188433984, 'lr_2': 1.3066739238053272e-05, 'batch_size': 16, 'regularization': 'None'}. Best is trial 0 with value: 1.1198576827825049.
Statistics value = 16.0 p-value = 0.62890625
1/1 [==============================] - ETA: 0s1/1 [==============================] - 0s 338ms/step
1/1 [==============================] - ETA: 0s1/1 [==============================] - 0s 335ms/step
1/1 [==============================] - ETA: 0s1/1 [==============================] - 0s 35ms/step
1/1 [==============================] - ETA: 0s1/1 [==============================] - 0s 30ms/step
Statistics value = 11.0 p-value = 0.84375
1/1 [==============================] - ETA: 0s1/1 [==============================] - 0s 333ms/step
Statistics value = 13.0 p-value = 0.76953125
1/1 [==============================] - ETA: 0s1/1 [==============================] - 0s 295ms/step
Statistics value = 14.0 p-value = 0.7265625
1/1 [==============================] - ETA: 0s1/1 [==============================] - 0s 306ms/step
1/1 [==============================] - ETA: 0s1/1 [==============================] - 0s 311ms/step
1/1 [==============================] - ETA: 0s1/1 [==============================] - 0s 311ms/step
1/1 [==============================] - ETA: 0s1/1 [==============================] - 0s 302ms/step
1/1 [==============================] - ETA: 0s1/1 [==============================] - 0s 31ms/step
1/1 [==============================] - ETA: 0s1/1 [==============================] - 0s 26ms/step
1/1 [==============================] - ETA: 0s1/1 [==============================] - 0s 27ms/step
1/1 [==============================] - ETA: 0s1/1 [==============================] - 0s 28ms/step
1/1 [==============================] - ETA: 0s1/1 [==============================] - 0s 28ms/step
1/1 [==============================] - ETA: 0s1/1 [==============================] - 0s 28ms/step
Statistics value = 24.0 p-value = 0.65234375
1/1 [==============================] - ETA: 0s1/1 [==============================] - 0s 319ms/step
1/1 [==============================] - ETA: 0s1/1 [==============================] - 0s 326ms/step
1/1 [==============================] - ETA: 0s1/1 [==============================] - 0s 42ms/step
1/1 [==============================] - ETA: 0s1/1 [==============================] - 0s 34ms/step
Statistics value = 24.0 p-value = 0.65234375
1/1 [==============================] - ETA: 0s1/1 [==============================] - 0s 319ms/step
Statistics value = 12.0 p-value = 0.947265625
1/1 [==============================] - ETA: 0s1/1 [==============================] - 0s 345ms/step
Statistics value = 31.0 p-value = 0.384765625
1/1 [==============================] - ETA: 0s1/1 [==============================] - 0s 322ms/step
1/1 [==============================] - ETA: 0s1/1 [==============================] - 0s 336ms/step
[I 2024-12-22 15:37:25,465] Trial 1 finished with value: 0.4139514807897976 and parameters: {'n_units_0': 56, 'dropout_1': 0.15000000000000002, 'run': 1, 'epochs_1': 40, 'epochs_2': 40, 'lr_1': 0.0011207606211860567, 'lr_2': 7.309539835912905e-05, 'batch_size': 8, 'regularization': 'l1_l2', 'reg_alpha_1': 0.00023345864076016249, 'reg_alpha_2': 0.0022673986523780395}. Best is trial 0 with value: 0.31414679480818664.
1/1 [==============================] - ETA: 0s1/1 [==============================] - 0s 327ms/step
1/1 [==============================] - ETA: 0s1/1 [==============================] - 0s 306ms/step
1/1 [==============================] - ETA: 0s1/1 [==============================] - 0s 34ms/step
1/1 [==============================] - ETA: 0s1/1 [==============================] - 0s 29ms/step
1/1 [==============================] - ETA: 0s1/1 [==============================] - 0s 28ms/step
1/1 [==============================] - ETA: 0s1/1 [==============================] - 0s 33ms/step
1/1 [==============================] - ETA: 0s1/1 [==============================] - 0s 26ms/step
1/1 [==============================] - ETA: 0s1/1 [==============================] - 0s 28ms/step
[I 2024-12-22 15:37:26,118] Trial 1 finished with value: 1.7553233638448975 and parameters: {'n_units_0': 56, 'dropout_1': 0.15000000000000002, 'run': 1, 'epochs_1': 40, 'epochs_2': 40, 'lr_1': 0.0011207606211860567, 'lr_2': 7.309539835912905e-05, 'batch_size': 8, 'regularization': 'l1_l2', 'reg_alpha_1': 0.00023345864076016249, 'reg_alpha_2': 0.0022673986523780395}. Best is trial 0 with value: 1.1198576827825049.
[I 2024-12-22 15:37:26,144] Trial 1 finished with value: 0.6631225838793211 and parameters: {'n_units_0': 56, 'dropout_1': 0.15000000000000002, 'run': 1, 'epochs_1': 40, 'epochs_2': 40, 'lr_1': 0.0011207606211860567, 'lr_2': 7.309539835912905e-05, 'batch_size': 8, 'regularization': 'l1_l2', 'reg_alpha_1': 0.00023345864076016249, 'reg_alpha_2': 0.0022673986523780395}. Best is trial 0 with value: 0.5081879107317093.
[I 2024-12-22 15:37:26,166] Trial 1 finished with value: 0.2643712621241725 and parameters: {'n_units_0': 56, 'dropout_1': 0.15000000000000002, 'run': 1, 'epochs_1': 40, 'epochs_2': 40, 'lr_1': 0.0011207606211860567, 'lr_2': 7.309539835912905e-05, 'batch_size': 8, 'regularization': 'l1_l2', 'reg_alpha_1': 0.00023345864076016249, 'reg_alpha_2': 0.0022673986523780395}. Best is trial 0 with value: 0.23621892557210417.
Statistics value = 18.0 p-value = 0.52734375
1/1 [==============================] - ETA: 0s1/1 [==============================] - 0s 356ms/step
1/1 [==============================] - ETA: 0s1/1 [==============================] - 0s 298ms/step
Statistics value = 35.0 p-value = 0.0078125
1/1 [==============================] - ETA: 0s1/1 [==============================] - 0s 335ms/step
Statistics value = 21.0 p-value = 0.37109375
1/1 [==============================] - ETA: 0s1/1 [==============================] - 0s 322ms/step
Statistics value = 3.0 p-value = 0.98828125
1/1 [==============================] - ETA: 0s1/1 [==============================] - 0s 325ms/step
1/1 [==============================] - ETA: 0s1/1 [==============================] - 0s 322ms/step
1/1 [==============================] - ETA: 0s1/1 [==============================] - 0s 332ms/step
1/1 [==============================] - ETA: 0s1/1 [==============================] - 0s 302ms/step
1/1 [==============================] - ETA: 0s1/1 [==============================] - 0s 331ms/step
1/1 [==============================] - ETA: 0s1/1 [==============================] - 0s 330ms/step
1/1 [==============================] - ETA: 0s1/1 [==============================] - 0s 336ms/step
1/1 [==============================] - ETA: 0s1/1 [==============================] - 0s 320ms/step
1/1 [==============================] - ETA: 0s1/1 [==============================] - 0s 321ms/step
1/1 [==============================] - ETA: 0s1/1 [==============================] - 0s 28ms/step
1/1 [==============================] - ETA: 0s1/1 [==============================] - 0s 26ms/step
1/1 [==============================] - ETA: 0s1/1 [==============================] - 0s 325ms/step
1/1 [==============================] - ETA: 0s1/1 [==============================] - 0s 330ms/step
1/1 [==============================] - ETA: 0s1/1 [==============================] - 0s 331ms/step
1/1 [==============================] - ETA: 0s1/1 [==============================] - 0s 36ms/step
1/1 [==============================] - ETA: 0s1/1 [==============================] - 0s 27ms/step
1/1 [==============================] - ETA: 0s1/1 [==============================] - 0s 29ms/step
1/1 [==============================] - ETA: 0s1/1 [==============================] - 0s 33ms/step
1/1 [==============================] - ETA: 0s1/1 [==============================] - 0s 27ms/step
1/1 [==============================] - ETA: 0s1/1 [==============================] - 0s 28ms/step
Statistics value = 29.0 p-value = 0.4609375
1/1 [==============================] - ETA: 0s1/1 [==============================] - 0s 343ms/step
Statistics value = 24.0 p-value = 0.65234375
1/1 [==============================] - ETA: 0s1/1 [==============================] - 0s 316ms/step
Statistics value = 30.0 p-value = 0.4228515625
1/1 [==============================] - ETA: 0s1/1 [==============================] - 0s 326ms/step
Statistics value = 49.0 p-value = 0.013671875
1/1 [==============================] - ETA: 0s1/1 [==============================] - 0s 328ms/step
1/1 [==============================] - ETA: 0s1/1 [==============================] - 0s 327ms/step
1/1 [==============================] - ETA: 0s1/1 [==============================] - 0s 307ms/step
1/1 [==============================] - ETA: 0s1/1 [==============================] - 0s 329ms/step
1/1 [==============================] - ETA: 0s1/1 [==============================] - 0s 319ms/step
1/1 [==============================] - ETA: 0s1/1 [==============================] - 0s 346ms/step
1/1 [==============================] - ETA: 0s1/1 [==============================] - 0s 348ms/step
1/1 [==============================] - ETA: 0s1/1 [==============================] - 0s 307ms/step
1/1 [==============================] - ETA: 0s1/1 [==============================] - 0s 318ms/step
1/1 [==============================] - ETA: 0s1/1 [==============================] - 0s 320ms/step
1/1 [==============================] - ETA: 0s1/1 [==============================] - 0s 301ms/step
1/1 [==============================] - ETA: 0s1/1 [==============================] - 0s 36ms/step
1/1 [==============================] - ETA: 0s1/1 [==============================] - 0s 310ms/step
1/1 [==============================] - ETA: 0s1/1 [==============================] - 0s 295ms/step
1/1 [==============================] - ETA: 0s1/1 [==============================] - 0s 34ms/step
1/1 [==============================] - ETA: 0s1/1 [==============================] - 0s 27ms/step
1/1 [==============================] - ETA: 0s1/1 [==============================] - 0s 31ms/step
1/1 [==============================] - ETA: 0s1/1 [==============================] - 0s 32ms/step
1/1 [==============================] - ETA: 0s1/1 [==============================] - 0s 27ms/step
1/1 [==============================] - ETA: 0s1/1 [==============================] - 0s 30ms/step
1/1 [==============================] - ETA: 0s1/1 [==============================] - 0s 28ms/step
[I 2024-12-22 15:38:06,764] Trial 2 finished with value: 0.28349299987855825 and parameters: {'n_units_0': 16, 'dropout_1': 0.2, 'run': 2, 'epochs_1': 30, 'epochs_2': 70, 'lr_1': 0.00021930485556643703, 'lr_2': 1.3492834268013232e-05, 'batch_size': 16, 'regularization': 'l1_l2', 'reg_alpha_1': 0.0011290133559092666, 'reg_alpha_2': 0.00020914981329035596}. Best is trial 2 with value: 0.28349299987855825.
[I 2024-12-22 15:38:06,810] Trial 2 finished with value: 0.23717201882972658 and parameters: {'n_units_0': 16, 'dropout_1': 0.2, 'run': 2, 'epochs_1': 30, 'epochs_2': 70, 'lr_1': 0.00021930485556643703, 'lr_2': 1.3492834268013232e-05, 'batch_size': 16, 'regularization': 'l1_l2', 'reg_alpha_1': 0.0011290133559092666, 'reg_alpha_2': 0.00020914981329035596}. Best is trial 0 with value: 0.23621892557210417.
[I 2024-12-22 15:38:06,839] Trial 2 finished with value: 1.0811798111018074 and parameters: {'n_units_0': 16, 'dropout_1': 0.2, 'run': 2, 'epochs_1': 30, 'epochs_2': 70, 'lr_1': 0.00021930485556643703, 'lr_2': 1.3492834268013232e-05, 'batch_size': 16, 'regularization': 'l1_l2', 'reg_alpha_1': 0.0011290133559092666, 'reg_alpha_2': 0.00020914981329035596}. Best is trial 2 with value: 1.0811798111018074.
[I 2024-12-22 15:38:06,862] Trial 2 finished with value: 0.6298844017021898 and parameters: {'n_units_0': 16, 'dropout_1': 0.2, 'run': 2, 'epochs_1': 30, 'epochs_2': 70, 'lr_1': 0.00021930485556643703, 'lr_2': 1.3492834268013232e-05, 'batch_size': 16, 'regularization': 'l1_l2', 'reg_alpha_1': 0.0011290133559092666, 'reg_alpha_2': 0.00020914981329035596}. Best is trial 0 with value: 0.5081879107317093.
Statistics value = 22.0 p-value = 0.3203125
1/1 [==============================] - ETA: 0s1/1 [==============================] - 0s 336ms/step
1/1 [==============================] - ETA: 0s1/1 [==============================] - 0s 336ms/step
1/1 [==============================] - ETA: 0s1/1 [==============================] - 0s 36ms/step
1/1 [==============================] - ETA: 0s1/1 [==============================] - 0s 32ms/step
Statistics value = 20.0 p-value = 0.421875
1/1 [==============================] - ETA: 0s1/1 [==============================] - 0s 336ms/step
Statistics value = 33.0 p-value = 0.01953125
1/1 [==============================] - ETA: 0s1/1 [==============================] - 0s 338ms/step
Statistics value = 14.0 p-value = 0.7265625
1/1 [==============================] - ETA: 0s1/1 [==============================] - 0s 338ms/step
1/1 [==============================] - ETA: 0s1/1 [==============================] - 0s 299ms/step
1/1 [==============================] - ETA: 0s1/1 [==============================] - 0s 37ms/step
1/1 [==============================] - ETA: 0s1/1 [==============================] - 0s 27ms/step
1/1 [==============================] - ETA: 0s1/1 [==============================] - 0s 322ms/step
1/1 [==============================] - ETA: 0s1/1 [==============================] - 0s 319ms/step
1/1 [==============================] - ETA: 0s1/1 [==============================] - 0s 28ms/step
1/1 [==============================] - ETA: 0s1/1 [==============================] - 0s 27ms/step
1/1 [==============================] - ETA: 0s1/1 [==============================] - 0s 28ms/step
1/1 [==============================] - ETA: 0s1/1 [==============================] - 0s 29ms/step
Statistics value = 28.0 p-value = 0.5
1/1 [==============================] - ETA: 0s1/1 [==============================] - 0s 330ms/step
1/1 [==============================] - ETA: 0s1/1 [==============================] - 0s 327ms/step
1/1 [==============================] - ETA: 0s1/1 [==============================] - 0s 34ms/step
1/1 [==============================] - ETA: 0s1/1 [==============================] - 0s 33ms/step
