[I 2024-12-23 21:41:20,717] Trial 15 finished with value: 0.2507313024666513 and parameters: {'n_units_0': 24, 'dropout_1': 0.15000000000000002, 'run': 2, 'epochs_1': 30, 'epochs_2': 100, 'lr_1': 0.0002776117464781474, 'lr_2': 9.263265558124973e-05, 'batch_size': 12, 'regularization': 'l1', 'reg_alpha_1': 0.0008673767576116599}. Best is trial 0 with value: 0.23218461230249676.
Statistics value = 30.0 p-value = 0.4228515625
1/1 [==============================] - ETA: 0s1/1 [==============================] - 0s 397ms/step
1/1 [==============================] - ETA: 0s1/1 [==============================] - 0s 396ms/step
1/1 [==============================] - ETA: 0s1/1 [==============================] - 0s 453ms/step
1/1 [==============================] - ETA: 0s1/1 [==============================] - 0s 406ms/step
1/1 [==============================] - ETA: 0s1/1 [==============================] - 0s 49ms/step
1/1 [==============================] - ETA: 0s1/1 [==============================] - 0s 50ms/step
Statistics value = 14.0 p-value = 0.919921875
1/1 [==============================] - ETA: 0s1/1 [==============================] - 0s 405ms/step
Statistics value = 6.0 p-value = 0.9609375
1/1 [==============================] - ETA: 0s1/1 [==============================] - 0s 385ms/step
1/1 [==============================] - ETA: 0s1/1 [==============================] - 0s 389ms/step
1/1 [==============================] - ETA: 0s1/1 [==============================] - 0s 400ms/step
1/1 [==============================] - ETA: 0s1/1 [==============================] - 0s 412ms/step
1/1 [==============================] - ETA: 0s1/1 [==============================] - 0s 402ms/step
1/1 [==============================] - ETA: 0s1/1 [==============================] - 0s 408ms/step
1/1 [==============================] - ETA: 0s1/1 [==============================] - 0s 407ms/step
1/1 [==============================] - ETA: 0s1/1 [==============================] - 0s 382ms/step
1/1 [==============================] - ETA: 0s1/1 [==============================] - 0s 378ms/step
1/1 [==============================] - ETA: 0s1/1 [==============================] - 0s 43ms/step
1/1 [==============================] - ETA: 0s1/1 [==============================] - 0s 49ms/step
Statistics value = 30.0 p-value = 0.4228515625
1/1 [==============================] - ETA: 0s1/1 [==============================] - 0s 399ms/step
[I 2024-12-23 21:41:48,482] Trial 16 finished with value: 2.029795141086078 and parameters: {'n_units_0': 36, 'dropout_1': 0.15000000000000002, 'run': 2, 'epochs_1': 50, 'epochs_2': 100, 'lr_1': 0.0028439994205734453, 'lr_2': 8.334140274883222e-05, 'batch_size': 16, 'regularization': 'None'}. Best is trial 0 with value: 1.0165803997742875.
1/1 [==============================] - ETA: 0s1/1 [==============================] - 0s 425ms/step
1/1 [==============================] - ETA: 0s1/1 [==============================] - 0s 428ms/step
1/1 [==============================] - ETA: 0s1/1 [==============================] - 0s 395ms/step
1/1 [==============================] - ETA: 0s1/1 [==============================] - 0s 57ms/step
1/1 [==============================] - ETA: 0s1/1 [==============================] - 0s 58ms/step
[I 2024-12-23 21:41:55,043] Trial 16 finished with value: 0.36516758209546296 and parameters: {'n_units_0': 48, 'dropout_1': 0.1, 'run': 3, 'epochs_1': 80, 'epochs_2': 80, 'lr_1': 0.00020302372911966822, 'lr_2': 4.518363588745506e-05, 'batch_size': 16, 'regularization': 'l1_l2', 'reg_alpha_1': 0.0004571007083170026, 'reg_alpha_2': 0.009464154147879048}. Best is trial 2 with value: 0.2840492158412148.
1/1 [==============================] - ETA: 0s1/1 [==============================] - 0s 409ms/step
1/1 [==============================] - ETA: 0s1/1 [==============================] - 0s 360ms/step
1/1 [==============================] - ETA: 0s1/1 [==============================] - 0s 56ms/step
1/1 [==============================] - ETA: 0s1/1 [==============================] - 0s 42ms/step
1/1 [==============================] - ETA: 0s1/1 [==============================] - 0s 383ms/step
1/1 [==============================] - ETA: 0s1/1 [==============================] - 0s 394ms/step
1/1 [==============================] - ETA: 0s1/1 [==============================] - 0s 42ms/step
1/1 [==============================] - ETA: 0s1/1 [==============================] - 0s 46ms/step
[I 2024-12-23 21:42:03,033] Trial 16 finished with value: 0.5906634661483333 and parameters: {'n_units_0': 44, 'dropout_1': 0.15000000000000002, 'run': 2, 'epochs_1': 70, 'epochs_2': 90, 'lr_1': 0.008738350484393647, 'lr_2': 0.000996765358982435, 'batch_size': 12, 'regularization': 'l1_l2', 'reg_alpha_1': 1.1994576630838033e-05, 'reg_alpha_2': 0.00013520349315366534}. Best is trial 13 with value: 0.5472108920612986.
Statistics value = 33.0 p-value = 0.01953125
1/1 [==============================] - ETA: 0s1/1 [==============================] - 0s 437ms/step
1/1 [==============================] - ETA: 0s1/1 [==============================] - 1s 541ms/step
Statistics value = 21.0 p-value = 0.37109375
1/1 [==============================] - ETA: 0s1/1 [==============================] - 0s 404ms/step
1/1 [==============================] - ETA: 0s1/1 [==============================] - 0s 407ms/step
1/1 [==============================] - ETA: 0s1/1 [==============================] - 0s 45ms/step
1/1 [==============================] - ETA: 0s1/1 [==============================] - 0s 40ms/step
Statistics value = 5.0 p-value = 0.9931640625
1/1 [==============================] - ETA: 0s1/1 [==============================] - 0s 414ms/step
1/1 [==============================] - ETA: 0s1/1 [==============================] - 0s 409ms/step
Statistics value = 6.0 p-value = 0.9609375
1/1 [==============================] - ETA: 0s1/1 [==============================] - 0s 420ms/step
1/1 [==============================] - ETA: 0s1/1 [==============================] - 0s 389ms/step
1/1 [==============================] - ETA: 0s1/1 [==============================] - 0s 56ms/step
1/1 [==============================] - ETA: 0s1/1 [==============================] - 0s 43ms/step
1/1 [==============================] - ETA: 0s1/1 [==============================] - 0s 492ms/step
1/1 [==============================] - ETA: 0s1/1 [==============================] - 0s 393ms/step
1/1 [==============================] - ETA: 0s1/1 [==============================] - 0s 53ms/step
1/1 [==============================] - ETA: 0s1/1 [==============================] - 0s 40ms/step
1/1 [==============================] - ETA: 0s1/1 [==============================] - 0s 400ms/step
1/1 [==============================] - ETA: 0s1/1 [==============================] - 0s 420ms/step
Statistics value = 27.0 p-value = 0.5390625
1/1 [==============================] - ETA: 0s1/1 [==============================] - 0s 444ms/step
1/1 [==============================] - ETA: 0s1/1 [==============================] - 0s 406ms/step
1/1 [==============================] - ETA: 0s1/1 [==============================] - 0s 43ms/step
1/1 [==============================] - ETA: 0s1/1 [==============================] - 0s 39ms/step
[I 2024-12-23 21:42:26,646] Trial 17 finished with value: 0.31073028206316566 and parameters: {'n_units_0': 32, 'dropout_1': 0.15000000000000002, 'run': 1, 'epochs_1': 50, 'epochs_2': 60, 'lr_1': 0.00010182712311136019, 'lr_2': 1.9356450104946525e-05, 'batch_size': 8, 'regularization': 'None'}. Best is trial 2 with value: 0.2840492158412148.
Statistics value = 30.0 p-value = 0.4228515625
1/1 [==============================] - ETA: 0s1/1 [==============================] - 0s 414ms/step
1/1 [==============================] - ETA: 0s1/1 [==============================] - 0s 418ms/step
Statistics value = 31.0 p-value = 0.384765625
1/1 [==============================] - ETA: 0s1/1 [==============================] - 0s 429ms/step
1/1 [==============================] - ETA: 0s1/1 [==============================] - 0s 398ms/step
1/1 [==============================] - ETA: 0s1/1 [==============================] - 0s 386ms/step
1/1 [==============================] - ETA: 0s1/1 [==============================] - 0s 50ms/step
1/1 [==============================] - ETA: 0s1/1 [==============================] - 0s 50ms/step
1/1 [==============================] - ETA: 0s1/1 [==============================] - 0s 416ms/step
1/1 [==============================] - ETA: 0s1/1 [==============================] - 0s 60ms/step
1/1 [==============================] - ETA: 0s1/1 [==============================] - 0s 43ms/step
[I 2024-12-23 21:42:36,885] Trial 17 finished with value: 0.6859317016730393 and parameters: {'n_units_0': 28, 'dropout_1': 0.1, 'run': 1, 'epochs_1': 60, 'epochs_2': 60, 'lr_1': 0.004716599213759996, 'lr_2': 0.00015815122865214286, 'batch_size': 8, 'regularization': 'l1_l2', 'reg_alpha_1': 4.5164594450094275e-05, 'reg_alpha_2': 5.728444385844096e-05}. Best is trial 13 with value: 0.5472108920612986.
[I 2024-12-23 21:42:37,477] Trial 16 finished with value: 0.2628279268619005 and parameters: {'n_units_0': 40, 'dropout_1': 0.3, 'run': 3, 'epochs_1': 70, 'epochs_2': 30, 'lr_1': 0.0028439994205734453, 'lr_2': 4.787031778640873e-05, 'batch_size': 16, 'regularization': 'None'}. Best is trial 0 with value: 0.23218461230249676.
Statistics value = 20.0 p-value = 0.421875
1/1 [==============================] - ETA: 0s1/1 [==============================] - 0s 395ms/step
1/1 [==============================] - ETA: 0s1/1 [==============================] - 0s 443ms/step
1/1 [==============================] - ETA: 0s1/1 [==============================] - 0s 391ms/step
1/1 [==============================] - ETA: 0s1/1 [==============================] - 0s 493ms/step
1/1 [==============================] - ETA: 0s1/1 [==============================] - 0s 49ms/step
1/1 [==============================] - ETA: 0s1/1 [==============================] - 0s 41ms/step
[I 2024-12-23 21:42:47,981] Trial 17 finished with value: 1.1607346397652427 and parameters: {'n_units_0': 40, 'dropout_1': 0.15000000000000002, 'run': 2, 'epochs_1': 70, 'epochs_2': 70, 'lr_1': 0.00013925567079247348, 'lr_2': 2.7610359282076483e-05, 'batch_size': 12, 'regularization': 'l2', 'reg_alpha_1': 1.678309831865769e-05}. Best is trial 0 with value: 1.0165803997742875.
Statistics value = 5.0 p-value = 0.97265625
1/1 [==============================] - ETA: 0s1/1 [==============================] - 0s 401ms/step
1/1 [==============================] - ETA: 0s1/1 [==============================] - 0s 403ms/step
1/1 [==============================] - ETA: 0s1/1 [==============================] - 0s 384ms/step
Statistics value = 12.0 p-value = 0.80859375
1/1 [==============================] - ETA: 0s1/1 [==============================] - 0s 414ms/step
1/1 [==============================] - ETA: 0s1/1 [==============================] - 0s 392ms/step
1/1 [==============================] - ETA: 0s1/1 [==============================] - 0s 398ms/step
1/1 [==============================] - ETA: 0s1/1 [==============================] - 0s 54ms/step
1/1 [==============================] - ETA: 0s1/1 [==============================] - 0s 41ms/step
1/1 [==============================] - ETA: 0s1/1 [==============================] - 0s 42ms/step
1/1 [==============================] - ETA: 0s1/1 [==============================] - 0s 61ms/step
Statistics value = 23.0 p-value = 0.2734375
1/1 [==============================] - ETA: 0s1/1 [==============================] - 0s 412ms/step
1/1 [==============================] - ETA: 0s1/1 [==============================] - 0s 432ms/step
1/1 [==============================] - ETA: 0s1/1 [==============================] - 0s 46ms/step
1/1 [==============================] - ETA: 0s1/1 [==============================] - 0s 41ms/step
1/1 [==============================] - ETA: 0s1/1 [==============================] - 0s 381ms/step
1/1 [==============================] - ETA: 0s1/1 [==============================] - 0s 407ms/step
Statistics value = 34.0 p-value = 0.2783203125
1/1 [==============================] - ETA: 0s1/1 [==============================] - 0s 409ms/step
1/1 [==============================] - ETA: 0s1/1 [==============================] - 0s 384ms/step
Statistics value = 25.0 p-value = 0.615234375
1/1 [==============================] - ETA: 0s1/1 [==============================] - 0s 425ms/step
1/1 [==============================] - ETA: 0s1/1 [==============================] - 0s 409ms/step
1/1 [==============================] - ETA: 0s1/1 [==============================] - 0s 42ms/step
1/1 [==============================] - ETA: 0s1/1 [==============================] - 0s 47ms/step
Statistics value = 9.0 p-value = 0.9755859375
1/1 [==============================] - ETA: 0s1/1 [==============================] - 0s 409ms/step
1/1 [==============================] - ETA: 0s1/1 [==============================] - 0s 385ms/step
1/1 [==============================] - ETA: 0s1/1 [==============================] - 0s 41ms/step
[I 2024-12-23 21:43:18,870] Trial 18 finished with value: 0.6749523502200148 and parameters: {'n_units_0': 36, 'dropout_1': 0.25, 'run': 1, 'epochs_1': 90, 'epochs_2': 100, 'lr_1': 0.002224965095978354, 'lr_2': 0.000523104919247132, 'batch_size': 8, 'regularization': 'l1_l2', 'reg_alpha_1': 8.589425401696316e-05, 'reg_alpha_2': 0.0012424814685740775}. Best is trial 13 with value: 0.5472108920612986.
1/1 [==============================] - ETA: 0s1/1 [==============================] - 0s 44ms/step
[I 2024-12-23 21:43:19,637] Trial 18 finished with value: 1.1750824753734248 and parameters: {'n_units_0': 4, 'dropout_1': 0.3, 'run': 1, 'epochs_1': 50, 'epochs_2': 60, 'lr_1': 0.0006430625574162195, 'lr_2': 0.0004899110090905861, 'batch_size': 8, 'regularization': 'l1_l2', 'reg_alpha_1': 4.5164594450094275e-05, 'reg_alpha_2': 1.4533550875819813e-05}. Best is trial 0 with value: 1.0165803997742875.
1/1 [==============================] - ETA: 0s1/1 [==============================] - 0s 415ms/step
1/1 [==============================] - ETA: 0s1/1 [==============================] - 0s 431ms/step
1/1 [==============================] - ETA: 0s1/1 [==============================] - 0s 52ms/step
1/1 [==============================] - ETA: 0s1/1 [==============================] - 0s 50ms/step
