[I 2024-12-23 18:54:05,199] Trial 18 finished with value: 0.26666341130832183 and parameters: {'n_units_0': 40, 'dropout_1': 0.3, 'run': 1, 'epochs_1': 90, 'epochs_2': 80, 'lr_1': 0.0027667815433627535, 'lr_2': 0.00011355037717221845, 'batch_size': 12, 'regularization': 'None'}. Best is trial 0 with value: 0.23202120953609393.
Statistics value = 7.0 p-value = 0.9453125
1/1 [==============================] - ETA: 0s1/1 [==============================] - 0s 391ms/step
1/1 [==============================] - ETA: 0s1/1 [==============================] - 0s 395ms/step
1/1 [==============================] - ETA: 0s1/1 [==============================] - 0s 365ms/step
1/1 [==============================] - ETA: 0s1/1 [==============================] - 0s 339ms/step
1/1 [==============================] - ETA: 0s1/1 [==============================] - 0s 40ms/step
1/1 [==============================] - ETA: 0s1/1 [==============================] - 0s 35ms/step
Statistics value = 43.0 p-value = 0.0654296875
1/1 [==============================] - ETA: 0s1/1 [==============================] - 0s 450ms/step
1/1 [==============================] - ETA: 0s1/1 [==============================] - 0s 384ms/step
1/1 [==============================] - ETA: 0s1/1 [==============================] - 0s 347ms/step
1/1 [==============================] - ETA: 0s1/1 [==============================] - 0s 356ms/step
1/1 [==============================] - ETA: 0s1/1 [==============================] - 0s 43ms/step
1/1 [==============================] - ETA: 0s1/1 [==============================] - 0s 32ms/step
[I 2024-12-23 18:55:03,359] Trial 19 finished with value: 0.2489632814362108 and parameters: {'n_units_0': 24, 'dropout_1': 0.15000000000000002, 'run': 2, 'epochs_1': 50, 'epochs_2': 70, 'lr_1': 0.0007731789801741327, 'lr_2': 7.610448036166555e-05, 'batch_size': 12, 'regularization': 'l1', 'reg_alpha_1': 4.483733072628455e-05}. Best is trial 0 with value: 0.23202120953609393.
Statistics value = 7.0 p-value = 0.9453125
Statistics value = 12.0 p-value = 0.80859375
Statistics value = 14.0 p-value = 0.7265625
Statistics value = 34.0 p-value = 0.01171875

EVER Study Best parameters:
{'n_units_0': 24, 'dropout_1': 0.3, 'run': 3, 'epochs_1': 70, 'epochs_2': 30, 'lr_1': 0.00020511104188433984, 'lr_2': 1.3066739238053272e-05, 'batch_size': 16, 'regularization': 'None'}
Best value (Average MSE): 0.23202120953609393

EV Study Best parameters:
{'n_units_0': 8, 'dropout_1': 0.3, 'run': 2, 'epochs_1': 50, 'epochs_2': 20, 'lr_1': 0.0004187594718900631, 'lr_2': 4.4706085467784903e-05, 'batch_size': 16, 'regularization': 'l1', 'reg_alpha_1': 0.0013795402040204172}
Best value (Average MSE): 1.049489099625191

PHEV Study Best parameters:
{'n_units_0': 8, 'dropout_1': 0.3, 'run': 2, 'epochs_1': 50, 'epochs_2': 20, 'lr_1': 0.0004187594718900631, 'lr_2': 4.4706085467784903e-05, 'batch_size': 16, 'regularization': 'l1', 'reg_alpha_1': 0.0013795402040204172}
Best value (Average MSE): 0.48928629561029846

FUEL Study Best parameters:
{'n_units_0': 20, 'dropout_1': 0.25, 'run': 2, 'epochs_1': 40, 'epochs_2': 70, 'lr_1': 0.00010132245891005802, 'lr_2': 9.029245888295042e-05, 'batch_size': 12, 'regularization': 'l1_l2', 'reg_alpha_1': 1.2068605164306045e-05, 'reg_alpha_2': 0.00010362161015212055}
Best value (Average MSE): 0.2915010271980293
