[I 2024-12-23 17:00:53,453] Trial 19 finished with value: 1.2147430076215957 and parameters: {'n_units_0': 44, 'dropout_1': 0.15000000000000002, 'run': 2, 'epochs_1': 50, 'epochs_2': 30, 'lr_1': 0.00016221710112314004, 'lr_2': 1.2530940853009607e-05, 'batch_size': 16, 'regularization': 'None'}. Best is trial 2 with value: 0.976896850367106.
1/1 [==============================] - ETA: 0s1/1 [==============================] - 0s 390ms/step
1/1 [==============================] - ETA: 0s1/1 [==============================] - 0s 389ms/step
1/1 [==============================] - ETA: 0s1/1 [==============================] - 0s 411ms/step
1/1 [==============================] - ETA: 0s1/1 [==============================] - 0s 391ms/step
1/1 [==============================] - ETA: 0s1/1 [==============================] - 0s 40ms/step
1/1 [==============================] - ETA: 0s1/1 [==============================] - 0s 39ms/step
Statistics value = 9.0 p-value = 0.9755859375
1/1 [==============================] - ETA: 0s1/1 [==============================] - 0s 378ms/step
1/1 [==============================] - ETA: 0s1/1 [==============================] - 0s 400ms/step
1/1 [==============================] - ETA: 0s1/1 [==============================] - 0s 397ms/step
1/1 [==============================] - ETA: 0s1/1 [==============================] - 0s 383ms/step
1/1 [==============================] - ETA: 0s1/1 [==============================] - 0s 430ms/step
1/1 [==============================] - ETA: 0s1/1 [==============================] - 0s 415ms/step
1/1 [==============================] - ETA: 0s1/1 [==============================] - 0s 59ms/step
1/1 [==============================] - ETA: 0s1/1 [==============================] - 0s 38ms/step
[I 2024-12-23 17:01:56,590] Trial 18 finished with value: 0.2837986966409115 and parameters: {'n_units_0': 48, 'dropout_1': 0.1, 'run': 3, 'epochs_1': 90, 'epochs_2': 30, 'lr_1': 0.008436425496343047, 'lr_2': 0.00046195662593098133, 'batch_size': 12, 'regularization': 'None'}. Best is trial 0 with value: 0.23247497150471458.
Statistics value = 5.0 p-value = 0.97265625
1/1 [==============================] - ETA: 0s1/1 [==============================] - 0s 484ms/step
1/1 [==============================] - ETA: 0s1/1 [==============================] - 0s 439ms/step
1/1 [==============================] - ETA: 0s1/1 [==============================] - 1s 620ms/step
1/1 [==============================] - ETA: 0s1/1 [==============================] - 0s 422ms/step
1/1 [==============================] - ETA: 0s1/1 [==============================] - 0s 56ms/step
1/1 [==============================] - ETA: 0s1/1 [==============================] - 0s 45ms/step
Statistics value = 29.0 p-value = 0.4609375
1/1 [==============================] - ETA: 0s1/1 [==============================] - 0s 416ms/step
1/1 [==============================] - ETA: 0s1/1 [==============================] - 0s 413ms/step
1/1 [==============================] - ETA: 0s1/1 [==============================] - 0s 438ms/step
1/1 [==============================] - ETA: 0s1/1 [==============================] - 0s 410ms/step
1/1 [==============================] - ETA: 0s1/1 [==============================] - 0s 54ms/step
1/1 [==============================] - ETA: 0s1/1 [==============================] - 0s 44ms/step
[I 2024-12-23 17:02:51,595] Trial 19 finished with value: 0.24204015721550443 and parameters: {'n_units_0': 28, 'dropout_1': 0.15000000000000002, 'run': 2, 'epochs_1': 50, 'epochs_2': 50, 'lr_1': 0.0007731789801741327, 'lr_2': 3.52467936491714e-05, 'batch_size': 12, 'regularization': 'l1', 'reg_alpha_1': 0.0005324470038913565}. Best is trial 0 with value: 0.23247497150471458.
Statistics value = 13.0 p-value = 0.76953125
Statistics value = 32.0 p-value = 0.02734375
Statistics value = 16.0 p-value = 0.62890625
Statistics value = 21.0 p-value = 0.37109375

EVER Study Best parameters:
{'n_units_0': 24, 'dropout_1': 0.3, 'run': 3, 'epochs_1': 70, 'epochs_2': 30, 'lr_1': 0.00020511104188433984, 'lr_2': 1.3066739238053272e-05, 'batch_size': 16, 'regularization': 'None'}
Best value (Average MSE): 0.23247497150471458

EV Study Best parameters:
{'n_units_0': 16, 'dropout_1': 0.2, 'run': 2, 'epochs_1': 30, 'epochs_2': 70, 'lr_1': 0.00021930485556643703, 'lr_2': 1.3492834268013232e-05, 'batch_size': 16, 'regularization': 'l1_l2', 'reg_alpha_1': 0.0011290133559092666, 'reg_alpha_2': 0.00020914981329035596}
Best value (Average MSE): 0.976896850367106

PHEV Study Best parameters:
{'n_units_0': 8, 'dropout_1': 0.3, 'run': 2, 'epochs_1': 50, 'epochs_2': 20, 'lr_1': 0.0004187594718900631, 'lr_2': 4.4706085467784903e-05, 'batch_size': 16, 'regularization': 'l1', 'reg_alpha_1': 0.0013795402040204172}
Best value (Average MSE): 0.4954431705195493

FUEL Study Best parameters:
{'n_units_0': 4, 'dropout_1': 0.25, 'run': 2, 'epochs_1': 50, 'epochs_2': 20, 'lr_1': 0.0005848316202689828, 'lr_2': 0.0001723817972360149, 'batch_size': 16, 'regularization': 'None'}
Best value (Average MSE): 0.2957578316957797
