[I 2024-12-23 19:05:30,883] Trial 9 finished with value: 0.6652232006385443 and parameters: {'n_units_0': 60, 'dropout_1': 0.2, 'run': 3, 'epochs_1': 100, 'epochs_2': 40, 'lr_1': 0.00016599837974449222, 'lr_2': 2.8567374298471872e-05, 'batch_size': 12, 'regularization': 'l1', 'reg_alpha_1': 0.000178744632562384}. Best is trial 0 with value: 0.5600802703795851.
1/1 [==============================] - ETA: 0s1/1 [==============================] - 0s 428ms/step
1/1 [==============================] - ETA: 0s1/1 [==============================] - 0s 385ms/step
1/1 [==============================] - ETA: 0s1/1 [==============================] - 0s 432ms/step
1/1 [==============================] - ETA: 0s1/1 [==============================] - 0s 427ms/step
1/1 [==============================] - ETA: 0s1/1 [==============================] - 0s 413ms/step
1/1 [==============================] - ETA: 0s1/1 [==============================] - 0s 55ms/step
1/1 [==============================] - ETA: 0s1/1 [==============================] - 0s 53ms/step
1/1 [==============================] - ETA: 0s1/1 [==============================] - 0s 474ms/step
1/1 [==============================] - ETA: 0s1/1 [==============================] - 0s 42ms/step
1/1 [==============================] - ETA: 0s1/1 [==============================] - 0s 44ms/step
1/1 [==============================] - ETA: 0s1/1 [==============================] - 0s 76ms/step
1/1 [==============================] - ETA: 0s1/1 [==============================] - 0s 41ms/step
[I 2024-12-23 19:05:34,273] Trial 9 finished with value: 1.4050168490429704 and parameters: {'n_units_0': 60, 'dropout_1': 0.2, 'run': 3, 'epochs_1': 100, 'epochs_2': 40, 'lr_1': 0.00016599837974449222, 'lr_2': 2.8567374298471872e-05, 'batch_size': 12, 'regularization': 'l1', 'reg_alpha_1': 0.000178744632562384}. Best is trial 6 with value: 1.0738389804040076.
[I 2024-12-23 19:05:34,288] Trial 9 finished with value: 0.24158478884653362 and parameters: {'n_units_0': 60, 'dropout_1': 0.2, 'run': 3, 'epochs_1': 100, 'epochs_2': 40, 'lr_1': 0.00016599837974449222, 'lr_2': 2.8567374298471872e-05, 'batch_size': 12, 'regularization': 'l1', 'reg_alpha_1': 0.000178744632562384}. Best is trial 4 with value: 0.2332224010264714.
[I 2024-12-23 19:05:34,495] Trial 9 finished with value: 0.3352737716035955 and parameters: {'n_units_0': 60, 'dropout_1': 0.2, 'run': 3, 'epochs_1': 100, 'epochs_2': 40, 'lr_1': 0.00016599837974449222, 'lr_2': 2.8567374298471872e-05, 'batch_size': 12, 'regularization': 'l1', 'reg_alpha_1': 0.000178744632562384}. Best is trial 4 with value: 0.28953663209472913.
Statistics value = 22.0 p-value = 0.3203125
1/1 [==============================] - ETA: 0s1/1 [==============================] - 1s 503ms/step
1/1 [==============================] - ETA: 0s1/1 [==============================] - 0s 400ms/step
Statistics value = 22.0 p-value = 0.3203125
1/1 [==============================] - ETA: 0s1/1 [==============================] - 0s 421ms/step
Statistics value = 33.0 p-value = 0.01953125
1/1 [==============================] - ETA: 0s1/1 [==============================] - 0s 440ms/step
Statistics value = 14.0 p-value = 0.7265625
1/1 [==============================] - ETA: 0s1/1 [==============================] - 0s 447ms/step
1/1 [==============================] - ETA: 0s1/1 [==============================] - 0s 420ms/step
1/1 [==============================] - ETA: 0s1/1 [==============================] - 0s 408ms/step
1/1 [==============================] - ETA: 0s1/1 [==============================] - 0s 412ms/step
1/1 [==============================] - ETA: 0s1/1 [==============================] - 0s 362ms/step
1/1 [==============================] - ETA: 0s1/1 [==============================] - 0s 472ms/step
1/1 [==============================] - ETA: 0s1/1 [==============================] - 0s 51ms/step
1/1 [==============================] - ETA: 0s1/1 [==============================] - 0s 46ms/step
1/1 [==============================] - ETA: 0s1/1 [==============================] - 0s 410ms/step
1/1 [==============================] - ETA: 0s1/1 [==============================] - 0s 407ms/step
1/1 [==============================] - ETA: 0s1/1 [==============================] - 0s 376ms/step
1/1 [==============================] - ETA: 0s1/1 [==============================] - 0s 43ms/step
1/1 [==============================] - ETA: 0s1/1 [==============================] - 0s 42ms/step
1/1 [==============================] - ETA: 0s1/1 [==============================] - 0s 491ms/step
1/1 [==============================] - ETA: 0s1/1 [==============================] - 0s 401ms/step
1/1 [==============================] - ETA: 0s1/1 [==============================] - 0s 46ms/step
1/1 [==============================] - ETA: 0s1/1 [==============================] - 0s 43ms/step
1/1 [==============================] - ETA: 0s1/1 [==============================] - 0s 380ms/step
1/1 [==============================] - ETA: 0s1/1 [==============================] - 0s 53ms/step
1/1 [==============================] - ETA: 0s1/1 [==============================] - 0s 41ms/step
Statistics value = 26.0 p-value = 0.5771484375
1/1 [==============================] - ETA: 0s1/1 [==============================] - 0s 436ms/step
1/1 [==============================] - ETA: 0s1/1 [==============================] - 0s 398ms/step
Statistics value = 7.0 p-value = 0.986328125
1/1 [==============================] - ETA: 0s1/1 [==============================] - 0s 418ms/step
1/1 [==============================] - ETA: 0s1/1 [==============================] - 0s 376ms/step
Statistics value = 7.0 p-value = 0.986328125
1/1 [==============================] - ETA: 0s1/1 [==============================] - 0s 415ms/step
Statistics value = 20.0 p-value = 0.7841796875
1/1 [==============================] - ETA: 0s1/1 [==============================] - 0s 429ms/step
1/1 [==============================] - ETA: 0s1/1 [==============================] - 0s 378ms/step
1/1 [==============================] - ETA: 0s1/1 [==============================] - 0s 380ms/step
1/1 [==============================] - ETA: 0s1/1 [==============================] - 0s 404ms/step
1/1 [==============================] - ETA: 0s1/1 [==============================] - 0s 384ms/step
1/1 [==============================] - ETA: 0s1/1 [==============================] - 0s 54ms/step
1/1 [==============================] - ETA: 0s1/1 [==============================] - 0s 40ms/step
[I 2024-12-23 19:06:37,605] Trial 10 finished with value: 0.5828497251469918 and parameters: {'n_units_0': 32, 'dropout_1': 0.1, 'run': 2, 'epochs_1': 80, 'epochs_2': 90, 'lr_1': 0.006536264082965737, 'lr_2': 0.0002888908524619867, 'batch_size': 12, 'regularization': 'None'}. Best is trial 0 with value: 0.5600802703795851.
1/1 [==============================] - ETA: 0s1/1 [==============================] - 0s 362ms/step
1/1 [==============================] - ETA: 0s1/1 [==============================] - 0s 358ms/step
1/1 [==============================] - ETA: 0s1/1 [==============================] - 0s 41ms/step
1/1 [==============================] - ETA: 0s1/1 [==============================] - 0s 39ms/step
1/1 [==============================] - ETA: 0s1/1 [==============================] - 0s 397ms/step
1/1 [==============================] - ETA: 0s1/1 [==============================] - 0s 417ms/step
1/1 [==============================] - ETA: 0s1/1 [==============================] - 0s 376ms/step
1/1 [==============================] - ETA: 0s1/1 [==============================] - 0s 51ms/step
[I 2024-12-23 19:06:40,090] Trial 10 finished with value: 2.963194375058433 and parameters: {'n_units_0': 36, 'dropout_1': 0.1, 'run': 2, 'epochs_1': 70, 'epochs_2': 90, 'lr_1': 0.006536264082965737, 'lr_2': 0.0002888908524619867, 'batch_size': 12, 'regularization': 'None'}. Best is trial 6 with value: 1.0738389804040076.
1/1 [==============================] - ETA: 0s1/1 [==============================] - 0s 48ms/step
1/1 [==============================] - ETA: 0s1/1 [==============================] - 0s 394ms/step
1/1 [==============================] - ETA: 0s1/1 [==============================] - 0s 46ms/step
1/1 [==============================] - ETA: 0s1/1 [==============================] - 0s 48ms/step
[I 2024-12-23 19:06:40,955] Trial 10 finished with value: 0.26990397012960043 and parameters: {'n_units_0': 44, 'dropout_1': 0.1, 'run': 2, 'epochs_1': 80, 'epochs_2': 90, 'lr_1': 0.006536264082965737, 'lr_2': 0.0002888908524619867, 'batch_size': 12, 'regularization': 'None'}. Best is trial 4 with value: 0.2332224010264714.
[I 2024-12-23 19:06:41,353] Trial 10 finished with value: 0.6816508026370729 and parameters: {'n_units_0': 44, 'dropout_1': 0.1, 'run': 2, 'epochs_1': 80, 'epochs_2': 90, 'lr_1': 0.006536264082965737, 'lr_2': 0.0002888908524619867, 'batch_size': 12, 'regularization': 'None'}. Best is trial 4 with value: 0.28953663209472913.
Statistics value = 6.0 p-value = 0.9609375
1/1 [==============================] - ETA: 0s1/1 [==============================] - 0s 407ms/step
Statistics value = 28.0 p-value = 0.09765625
1/1 [==============================] - ETA: 0s1/1 [==============================] - 0s 413ms/step
1/1 [==============================] - ETA: 0s1/1 [==============================] - 0s 425ms/step
1/1 [==============================] - ETA: 0s1/1 [==============================] - 0s 412ms/step
Statistics value = 19.0 p-value = 0.47265625
1/1 [==============================] - ETA: 0s1/1 [==============================] - 0s 406ms/step
1/1 [==============================] - ETA: 0s1/1 [==============================] - 0s 404ms/step
Statistics value = 6.0 p-value = 0.9609375
1/1 [==============================] - ETA: 0s1/1 [==============================] - 0s 419ms/step
1/1 [==============================] - ETA: 0s1/1 [==============================] - 0s 425ms/step
1/1 [==============================] - ETA: 0s1/1 [==============================] - 0s 415ms/step
1/1 [==============================] - ETA: 0s1/1 [==============================] - 0s 415ms/step
1/1 [==============================] - ETA: 0s1/1 [==============================] - 0s 53ms/step
1/1 [==============================] - ETA: 0s1/1 [==============================] - 0s 44ms/step
1/1 [==============================] - ETA: 0s1/1 [==============================] - 0s 402ms/step
1/1 [==============================] - ETA: 0s1/1 [==============================] - 0s 393ms/step
1/1 [==============================] - ETA: 0s1/1 [==============================] - 0s 38ms/step
1/1 [==============================] - ETA: 0s1/1 [==============================] - 0s 47ms/step
1/1 [==============================] - ETA: 0s1/1 [==============================] - 0s 434ms/step
1/1 [==============================] - ETA: 0s1/1 [==============================] - 0s 397ms/step
1/1 [==============================] - ETA: 0s1/1 [==============================] - 0s 469ms/step
1/1 [==============================] - ETA: 0s1/1 [==============================] - 0s 395ms/step
Statistics value = 24.0 p-value = 0.65234375
1/1 [==============================] - ETA: 0s1/1 [==============================] - 0s 346ms/step
1/1 [==============================] - ETA: 0s1/1 [==============================] - 0s 345ms/step
Statistics value = 35.0 p-value = 0.24609375
1/1 [==============================] - ETA: 0s1/1 [==============================] - 0s 349ms/step
1/1 [==============================] - ETA: 0s1/1 [==============================] - 0s 348ms/step
1/1 [==============================] - ETA: 0s1/1 [==============================] - 0s 432ms/step
1/1 [==============================] - ETA: 0s1/1 [==============================] - 0s 318ms/step
1/1 [==============================] - ETA: 0s1/1 [==============================] - 0s 330ms/step
1/1 [==============================] - ETA: 0s1/1 [==============================] - 0s 31ms/step
1/1 [==============================] - ETA: 0s1/1 [==============================] - 0s 302ms/step
1/1 [==============================] - ETA: 0s1/1 [==============================] - 0s 32ms/step
1/1 [==============================] - ETA: 0s1/1 [==============================] - 0s 33ms/step
1/1 [==============================] - ETA: 0s1/1 [==============================] - 0s 36ms/step
1/1 [==============================] - ETA: 0s1/1 [==============================] - 0s 391ms/step
1/1 [==============================] - ETA: 0s1/1 [==============================] - 0s 315ms/step
1/1 [==============================] - ETA: 0s1/1 [==============================] - 0s 30ms/step
1/1 [==============================] - ETA: 0s1/1 [==============================] - 0s 26ms/step
[I 2024-12-23 19:07:30,791] Trial 11 finished with value: 1.2862016073064289 and parameters: {'n_units_0': 44, 'dropout_1': 0.25, 'run': 2, 'epochs_1': 50, 'epochs_2': 20, 'lr_1': 0.00012427889293047006, 'lr_2': 0.00017340750366137944, 'batch_size': 12, 'regularization': 'l1', 'reg_alpha_1': 0.0010614983432824354}. Best is trial 6 with value: 1.0738389804040076.
1/1 [==============================] - ETA: 0s1/1 [==============================] - 0s 298ms/step
1/1 [==============================] - ETA: 0s1/1 [==============================] - 0s 339ms/step
1/1 [==============================] - ETA: 0s1/1 [==============================] - 0s 30ms/step
1/1 [==============================] - ETA: 0s1/1 [==============================] - 0s 27ms/step
