[I 2024-12-23 16:29:52,194] Trial 11 finished with value: 0.3313393253411926 and parameters: {'n_units_0': 40, 'dropout_1': 0.25, 'run': 2, 'epochs_1': 30, 'epochs_2': 70, 'lr_1': 0.0001055467102927026, 'lr_2': 0.000214529409721754, 'batch_size': 12, 'regularization': 'l1_l2', 'reg_alpha_1': 0.001068853786687612, 'reg_alpha_2': 0.00011712111399381304}. Best is trial 2 with value: 0.28592394505080987.
1/1 [==============================] - ETA: 0s1/1 [==============================] - 0s 345ms/step
1/1 [==============================] - ETA: 0s1/1 [==============================] - 0s 331ms/step
1/1 [==============================] - ETA: 0s1/1 [==============================] - 0s 34ms/step
1/1 [==============================] - ETA: 0s1/1 [==============================] - 0s 33ms/step
Statistics value = 32.0 p-value = 0.02734375
1/1 [==============================] - ETA: 0s1/1 [==============================] - 0s 327ms/step
1/1 [==============================] - ETA: 0s1/1 [==============================] - 0s 338ms/step
Statistics value = 20.0 p-value = 0.421875
1/1 [==============================] - ETA: 0s1/1 [==============================] - 0s 324ms/step
Statistics value = 4.0 p-value = 0.9951171875
1/1 [==============================] - ETA: 0s1/1 [==============================] - 0s 344ms/step
1/1 [==============================] - ETA: 0s1/1 [==============================] - 0s 347ms/step
1/1 [==============================] - ETA: 0s1/1 [==============================] - 0s 457ms/step
Statistics value = 35.0 p-value = 0.24609375
1/1 [==============================] - ETA: 0s1/1 [==============================] - 0s 340ms/step
1/1 [==============================] - ETA: 0s1/1 [==============================] - 0s 308ms/step
1/1 [==============================] - ETA: 0s1/1 [==============================] - 0s 362ms/step
1/1 [==============================] - ETA: 0s1/1 [==============================] - 0s 320ms/step
1/1 [==============================] - ETA: 0s1/1 [==============================] - 0s 30ms/step
1/1 [==============================] - ETA: 0s1/1 [==============================] - 0s 27ms/step
1/1 [==============================] - ETA: 0s1/1 [==============================] - 0s 340ms/step
1/1 [==============================] - ETA: 0s1/1 [==============================] - 0s 321ms/step
1/1 [==============================] - ETA: 0s1/1 [==============================] - 0s 34ms/step
1/1 [==============================] - ETA: 0s1/1 [==============================] - 0s 42ms/step
1/1 [==============================] - ETA: 0s1/1 [==============================] - 0s 341ms/step
1/1 [==============================] - ETA: 0s1/1 [==============================] - 0s 320ms/step
1/1 [==============================] - ETA: 0s1/1 [==============================] - 0s 366ms/step
1/1 [==============================] - ETA: 0s1/1 [==============================] - 0s 37ms/step
1/1 [==============================] - ETA: 0s1/1 [==============================] - 0s 41ms/step
1/1 [==============================] - ETA: 0s1/1 [==============================] - 0s 331ms/step
1/1 [==============================] - ETA: 0s1/1 [==============================] - 0s 36ms/step
1/1 [==============================] - ETA: 0s1/1 [==============================] - 0s 33ms/step
[I 2024-12-23 16:30:14,861] Trial 12 finished with value: 0.2704519422555117 and parameters: {'n_units_0': 32, 'dropout_1': 0.3, 'run': 2, 'epochs_1': 50, 'epochs_2': 70, 'lr_1': 0.0015870924019190965, 'lr_2': 0.0008538648795388481, 'batch_size': 16, 'regularization': 'l1', 'reg_alpha_1': 0.00089752676716181}. Best is trial 6 with value: 0.23307710566177214.
[I 2024-12-23 16:30:15,162] Trial 12 finished with value: 0.6830174874110494 and parameters: {'n_units_0': 40, 'dropout_1': 0.25, 'run': 2, 'epochs_1': 50, 'epochs_2': 70, 'lr_1': 0.000465195546891647, 'lr_2': 0.00017552298921736604, 'batch_size': 16, 'regularization': 'l2', 'reg_alpha_1': 5.746584635692312e-05}. Best is trial 8 with value: 0.5624808276421804.
Statistics value = 28.0 p-value = 0.5
1/1 [==============================] - ETA: 0s1/1 [==============================] - 0s 429ms/step
Statistics value = 16.0 p-value = 0.8837890625
1/1 [==============================] - ETA: 0s1/1 [==============================] - 0s 398ms/step
1/1 [==============================] - ETA: 0s1/1 [==============================] - 0s 419ms/step
1/1 [==============================] - ETA: 0s1/1 [==============================] - 0s 387ms/step
Statistics value = 4.0 p-value = 0.98046875
1/1 [==============================] - ETA: 0s1/1 [==============================] - 0s 388ms/step
Statistics value = 19.0 p-value = 0.47265625
1/1 [==============================] - ETA: 0s1/1 [==============================] - 0s 407ms/step
1/1 [==============================] - ETA: 0s1/1 [==============================] - 0s 386ms/step
1/1 [==============================] - ETA: 0s1/1 [==============================] - 0s 396ms/step
1/1 [==============================] - ETA: 0s1/1 [==============================] - 0s 44ms/step
1/1 [==============================] - ETA: 0s1/1 [==============================] - 0s 48ms/step
1/1 [==============================] - ETA: 0s1/1 [==============================] - 0s 414ms/step
1/1 [==============================] - ETA: 0s1/1 [==============================] - 0s 419ms/step
1/1 [==============================] - ETA: 0s1/1 [==============================] - 0s 54ms/step
1/1 [==============================] - ETA: 0s1/1 [==============================] - 0s 48ms/step
[I 2024-12-23 16:30:34,141] Trial 12 finished with value: 0.4136056894822634 and parameters: {'n_units_0': 28, 'dropout_1': 0.15000000000000002, 'run': 2, 'epochs_1': 30, 'epochs_2': 60, 'lr_1': 0.00010525521998095273, 'lr_2': 0.0008607419445086135, 'batch_size': 12, 'regularization': 'None'}. Best is trial 2 with value: 0.28592394505080987.
1/1 [==============================] - ETA: 0s1/1 [==============================] - 0s 472ms/step
1/1 [==============================] - ETA: 0s1/1 [==============================] - 0s 381ms/step
1/1 [==============================] - ETA: 0s1/1 [==============================] - 0s 50ms/step
1/1 [==============================] - ETA: 0s1/1 [==============================] - 0s 40ms/step
[I 2024-12-23 16:30:36,831] Trial 12 finished with value: 1.6749740608919568 and parameters: {'n_units_0': 20, 'dropout_1': 0.15000000000000002, 'run': 2, 'epochs_1': 40, 'epochs_2': 60, 'lr_1': 0.001518064075631007, 'lr_2': 0.0008607419445086135, 'batch_size': 16, 'regularization': 'l2', 'reg_alpha_1': 4.242944391550308e-05}. Best is trial 2 with value: 1.0043789986087965.
Statistics value = 19.0 p-value = 0.8125
1/1 [==============================] - ETA: 0s1/1 [==============================] - 0s 393ms/step
1/1 [==============================] - ETA: 0s1/1 [==============================] - 0s 397ms/step
1/1 [==============================] - ETA: 0s1/1 [==============================] - 0s 415ms/step
1/1 [==============================] - ETA: 0s1/1 [==============================] - 0s 385ms/step
1/1 [==============================] - ETA: 0s1/1 [==============================] - 0s 46ms/step
1/1 [==============================] - ETA: 0s1/1 [==============================] - 0s 55ms/step
1/1 [==============================] - ETA: 0s1/1 [==============================] - 0s 54ms/step
1/1 [==============================] - ETA: 0s1/1 [==============================] - 0s 42ms/step
[I 2024-12-23 16:30:46,464] Trial 13 finished with value: 0.6781853067274973 and parameters: {'n_units_0': 16, 'dropout_1': 0.25, 'run': 1, 'epochs_1': 90, 'epochs_2': 80, 'lr_1': 0.0019469167007567757, 'lr_2': 2.101702987688372e-05, 'batch_size': 16, 'regularization': 'l2', 'reg_alpha_1': 6.307693840084273e-05}. Best is trial 8 with value: 0.5624808276421804.
Statistics value = 33.0 p-value = 0.01953125
1/1 [==============================] - ETA: 0s1/1 [==============================] - 0s 405ms/step
1/1 [==============================] - ETA: 0s1/1 [==============================] - 0s 397ms/step
Statistics value = 27.0 p-value = 0.125
1/1 [==============================] - ETA: 0s1/1 [==============================] - 0s 411ms/step
1/1 [==============================] - ETA: 0s1/1 [==============================] - 0s 406ms/step
Statistics value = 24.0 p-value = 0.23046875
1/1 [==============================] - ETA: 0s1/1 [==============================] - 0s 401ms/step
1/1 [==============================] - ETA: 0s1/1 [==============================] - 0s 405ms/step
Statistics value = 45.0 p-value = 0.0419921875
1/1 [==============================] - ETA: 0s1/1 [==============================] - 0s 417ms/step
1/1 [==============================] - ETA: 0s1/1 [==============================] - 0s 387ms/step
1/1 [==============================] - ETA: 0s1/1 [==============================] - 0s 419ms/step
1/1 [==============================] - ETA: 0s1/1 [==============================] - 0s 384ms/step
1/1 [==============================] - ETA: 0s1/1 [==============================] - 0s 57ms/step
1/1 [==============================] - ETA: 0s1/1 [==============================] - 0s 60ms/step
1/1 [==============================] - ETA: 0s1/1 [==============================] - 0s 400ms/step
1/1 [==============================] - ETA: 0s1/1 [==============================] - 0s 404ms/step
1/1 [==============================] - ETA: 0s1/1 [==============================] - 0s 46ms/step
1/1 [==============================] - ETA: 0s1/1 [==============================] - 0s 49ms/step
1/1 [==============================] - ETA: 0s1/1 [==============================] - 0s 416ms/step
1/1 [==============================] - ETA: 0s1/1 [==============================] - 0s 406ms/step
1/1 [==============================] - ETA: 0s1/1 [==============================] - 0s 52ms/step
1/1 [==============================] - ETA: 0s1/1 [==============================] - 0s 43ms/step
1/1 [==============================] - ETA: 0s1/1 [==============================] - 0s 446ms/step
1/1 [==============================] - ETA: 0s1/1 [==============================] - 0s 391ms/step
1/1 [==============================] - ETA: 0s1/1 [==============================] - 0s 51ms/step
1/1 [==============================] - ETA: 0s1/1 [==============================] - 0s 46ms/step
[I 2024-12-23 16:31:17,351] Trial 13 finished with value: 0.23178411957054648 and parameters: {'n_units_0': 12, 'dropout_1': 0.25, 'run': 2, 'epochs_1': 90, 'epochs_2': 80, 'lr_1': 0.0003535187306430949, 'lr_2': 9.09229311905955e-05, 'batch_size': 16, 'regularization': 'l2', 'reg_alpha_1': 6.685680105396621e-05}. Best is trial 13 with value: 0.23178411957054648.
Statistics value = 30.0 p-value = 0.4228515625
1/1 [==============================] - ETA: 0s1/1 [==============================] - 0s 443ms/step
1/1 [==============================] - ETA: 0s1/1 [==============================] - 0s 391ms/step
Statistics value = 27.0 p-value = 0.5390625
1/1 [==============================] - ETA: 0s1/1 [==============================] - 0s 447ms/step
Statistics value = 9.0 p-value = 0.9755859375
1/1 [==============================] - ETA: 0s1/1 [==============================] - 0s 381ms/step
1/1 [==============================] - ETA: 0s1/1 [==============================] - 0s 428ms/step
1/1 [==============================] - ETA: 0s1/1 [==============================] - 0s 388ms/step
1/1 [==============================] - ETA: 0s1/1 [==============================] - 0s 402ms/step
1/1 [==============================] - ETA: 0s1/1 [==============================] - 0s 388ms/step
1/1 [==============================] - ETA: 0s1/1 [==============================] - 0s 47ms/step
1/1 [==============================] - ETA: 0s1/1 [==============================] - 0s 47ms/step
Statistics value = 14.0 p-value = 0.7265625
1/1 [==============================] - ETA: 0s1/1 [==============================] - 0s 437ms/step
[I 2024-12-23 16:31:41,572] Trial 13 finished with value: 1.2411159840695203 and parameters: {'n_units_0': 40, 'dropout_1': 0.25, 'run': 2, 'epochs_1': 50, 'epochs_2': 90, 'lr_1': 0.0004044758550598607, 'lr_2': 2.0020914470861683e-05, 'batch_size': 16, 'regularization': 'None'}. Best is trial 2 with value: 1.0043789986087965.
1/1 [==============================] - ETA: 0s1/1 [==============================] - 0s 362ms/step
1/1 [==============================] - ETA: 0s1/1 [==============================] - 0s 393ms/step
1/1 [==============================] - ETA: 0s1/1 [==============================] - 0s 403ms/step
1/1 [==============================] - ETA: 0s1/1 [==============================] - 0s 41ms/step
1/1 [==============================] - ETA: 0s1/1 [==============================] - 0s 44ms/step
[I 2024-12-23 16:31:47,574] Trial 14 finished with value: 0.7195954057542175 and parameters: {'n_units_0': 4, 'dropout_1': 0.15000000000000002, 'run': 2, 'epochs_1': 60, 'epochs_2': 60, 'lr_1': 0.00030123701273964245, 'lr_2': 0.0005550848532063985, 'batch_size': 16, 'regularization': 'None'}. Best is trial 8 with value: 0.5624808276421804.
1/1 [==============================] - ETA: 0s1/1 [==============================] - 0s 396ms/step
1/1 [==============================] - ETA: 0s1/1 [==============================] - 0s 392ms/step
1/1 [==============================] - ETA: 0s1/1 [==============================] - 0s 52ms/step
1/1 [==============================] - ETA: 0s1/1 [==============================] - 0s 52ms/step
