[I 2024-12-23 19:17:45,636] Trial 19 finished with value: 0.26108240175568187 and parameters: {'n_units_0': 48, 'dropout_1': 0.15000000000000002, 'run': 2, 'epochs_1': 50, 'epochs_2': 50, 'lr_1': 0.0007731789801741327, 'lr_2': 3.52467936491714e-05, 'batch_size': 12, 'regularization': 'l1', 'reg_alpha_1': 0.0005324470038913565}. Best is trial 4 with value: 0.2332224010264714.
1/1 [==============================] - ETA: 0s1/1 [==============================] - 0s 401ms/step
1/1 [==============================] - ETA: 0s1/1 [==============================] - 0s 391ms/step
1/1 [==============================] - ETA: 0s1/1 [==============================] - 0s 48ms/step
1/1 [==============================] - ETA: 0s1/1 [==============================] - 0s 42ms/step
[I 2024-12-23 19:17:50,350] Trial 19 finished with value: 0.6605343781827131 and parameters: {'n_units_0': 28, 'dropout_1': 0.15000000000000002, 'run': 2, 'epochs_1': 50, 'epochs_2': 50, 'lr_1': 0.0007731789801741327, 'lr_2': 3.52467936491714e-05, 'batch_size': 12, 'regularization': 'l1', 'reg_alpha_1': 0.0005324470038913565}. Best is trial 0 with value: 0.5600802703795851.
Statistics value = 29.0 p-value = 0.07421875
Statistics value = 25.0 p-value = 0.19140625
Statistics value = 6.0 p-value = 0.9609375
Statistics value = 19.0 p-value = 0.47265625

EVER Study Best parameters:
{'n_units_0': 60, 'dropout_1': 0.2, 'run': 3, 'epochs_1': 30, 'epochs_2': 30, 'lr_1': 0.00012315571723666037, 'lr_2': 4.473636174621264e-05, 'batch_size': 12, 'regularization': 'l1', 'reg_alpha_1': 0.00042470585622618684}
Best value (Average MSE): 0.2332224010264714

EV Study Best parameters:
{'n_units_0': 8, 'dropout_1': 0.3, 'run': 2, 'epochs_1': 50, 'epochs_2': 20, 'lr_1': 0.0004187594718900631, 'lr_2': 4.4706085467784903e-05, 'batch_size': 16, 'regularization': 'l1', 'reg_alpha_1': 0.0013795402040204172}
Best value (Average MSE): 1.0738389804040076

PHEV Study Best parameters:
{'n_units_0': 24, 'dropout_1': 0.3, 'run': 3, 'epochs_1': 70, 'epochs_2': 30, 'lr_1': 0.00020511104188433984, 'lr_2': 1.3066739238053272e-05, 'batch_size': 16, 'regularization': 'None'}
Best value (Average MSE): 0.5600802703795851

FUEL Study Best parameters:
{'n_units_0': 60, 'dropout_1': 0.2, 'run': 3, 'epochs_1': 30, 'epochs_2': 30, 'lr_1': 0.00012315571723666037, 'lr_2': 4.473636174621264e-05, 'batch_size': 12, 'regularization': 'l1', 'reg_alpha_1': 0.00042470585622618684}
Best value (Average MSE): 0.28953663209472913
