[I 2024-12-23 18:11:43,276] Trial 19 finished with value: 0.648479305399626 and parameters: {'n_units_0': 48, 'dropout_1': 0.1, 'run': 2, 'epochs_1': 50, 'epochs_2': 60, 'lr_1': 0.009827674611457334, 'lr_2': 0.00016284308471291718, 'batch_size': 8, 'regularization': 'l1_l2', 'reg_alpha_1': 6.024523329711246e-05, 'reg_alpha_2': 1.08358475147221e-05}. Best is trial 17 with value: 0.5175037256459785.
Statistics value = 33.0 p-value = 0.01953125
Statistics value = 12.0 p-value = 0.80859375
Statistics value = 7.0 p-value = 0.9453125
Statistics value = 19.0 p-value = 0.47265625

EVER Study Best parameters:
{'n_units_0': 12, 'dropout_1': 0.3, 'run': 1, 'epochs_1': 100, 'epochs_2': 80, 'lr_1': 0.00024970737145052745, 'lr_2': 1.0257563974185649e-05, 'batch_size': 16, 'regularization': 'l2', 'reg_alpha_1': 0.0001189589673755355}
Best value (Average MSE): 0.23368017846616423

EV Study Best parameters:
{'n_units_0': 32, 'dropout_1': 0.15000000000000002, 'run': 3, 'epochs_1': 50, 'epochs_2': 80, 'lr_1': 0.00021599482199839118, 'lr_2': 2.1021968149855235e-05, 'batch_size': 12, 'regularization': 'l1_l2', 'reg_alpha_1': 0.0006109041447705925, 'reg_alpha_2': 0.009415244195298792}
Best value (Average MSE): 1.0583501763682008

PHEV Study Best parameters:
{'n_units_0': 24, 'dropout_1': 0.25, 'run': 3, 'epochs_1': 50, 'epochs_2': 50, 'lr_1': 0.00011819786349763367, 'lr_2': 1.8681529427709917e-05, 'batch_size': 8, 'regularization': 'l1_l2', 'reg_alpha_1': 5.165245440136452e-05, 'reg_alpha_2': 1.0049202757123853e-05}
Best value (Average MSE): 0.5175037256459785

FUEL Study Best parameters:
{'n_units_0': 16, 'dropout_1': 0.2, 'run': 2, 'epochs_1': 30, 'epochs_2': 70, 'lr_1': 0.00021930485556643703, 'lr_2': 1.3492834268013232e-05, 'batch_size': 16, 'regularization': 'l1_l2', 'reg_alpha_1': 0.0011290133559092666, 'reg_alpha_2': 0.00020914981329035596}
Best value (Average MSE): 0.28203118759691337
