[I 2024-12-23 20:51:43,877] Trial 17 finished with value: 0.24826196569184977 and parameters: {'n_units_0': 12, 'dropout_1': 0.25, 'run': 1, 'epochs_1': 70, 'epochs_2': 70, 'lr_1': 0.0003179137026688628, 'lr_2': 7.859914655394861e-05, 'batch_size': 12, 'regularization': 'l2', 'reg_alpha_1': 5.165245440136452e-05}. Best is trial 5 with value: 0.2324022591686981.
Statistics value = 20.0 p-value = 0.421875
1/1 [==============================] - ETA: 0s1/1 [==============================] - 1s 532ms/step
Statistics value = 7.0 p-value = 0.9453125
1/1 [==============================] - ETA: 0s1/1 [==============================] - 0s 459ms/step
1/1 [==============================] - ETA: 0s1/1 [==============================] - 0s 416ms/step
1/1 [==============================] - ETA: 0s1/1 [==============================] - 0s 416ms/step
Statistics value = 24.0 p-value = 0.23046875
1/1 [==============================] - ETA: 0s1/1 [==============================] - 0s 493ms/step
1/1 [==============================] - ETA: 0s1/1 [==============================] - 1s 582ms/step
1/1 [==============================] - ETA: 0s1/1 [==============================] - 0s 434ms/step
1/1 [==============================] - ETA: 0s1/1 [==============================] - 0s 409ms/step
Statistics value = 23.0 p-value = 0.2734375
1/1 [==============================] - ETA: 0s1/1 [==============================] - 0s 434ms/step
1/1 [==============================] - ETA: 0s1/1 [==============================] - 0s 446ms/step
1/1 [==============================] - ETA: 0s1/1 [==============================] - 0s 475ms/step
1/1 [==============================] - ETA: 0s1/1 [==============================] - 0s 430ms/step
1/1 [==============================] - ETA: 0s1/1 [==============================] - 0s 46ms/step
1/1 [==============================] - ETA: 0s1/1 [==============================] - 0s 72ms/step
1/1 [==============================] - ETA: 0s1/1 [==============================] - 0s 405ms/step
1/1 [==============================] - ETA: 0s1/1 [==============================] - 0s 424ms/step
1/1 [==============================] - ETA: 0s1/1 [==============================] - 0s 67ms/step
1/1 [==============================] - ETA: 0s1/1 [==============================] - 0s 42ms/step
1/1 [==============================] - ETA: 0s1/1 [==============================] - 0s 468ms/step
Statistics value = 22.0 p-value = 0.7216796875
1/1 [==============================] - ETA: 0s1/1 [==============================] - 0s 425ms/step
1/1 [==============================] - ETA: 0s1/1 [==============================] - 0s 416ms/step
1/1 [==============================] - ETA: 0s1/1 [==============================] - 0s 73ms/step
1/1 [==============================] - ETA: 0s1/1 [==============================] - 0s 40ms/step
1/1 [==============================] - ETA: 0s1/1 [==============================] - 0s 444ms/step
1/1 [==============================] - ETA: 0s1/1 [==============================] - 0s 478ms/step
1/1 [==============================] - ETA: 0s1/1 [==============================] - 0s 439ms/step
1/1 [==============================] - ETA: 0s1/1 [==============================] - 0s 65ms/step
1/1 [==============================] - ETA: 0s1/1 [==============================] - 0s 61ms/step
Statistics value = 20.0 p-value = 0.7841796875
1/1 [==============================] - ETA: 0s1/1 [==============================] - 0s 426ms/step
1/1 [==============================] - ETA: 0s1/1 [==============================] - 0s 457ms/step
1/1 [==============================] - ETA: 0s1/1 [==============================] - 0s 432ms/step
1/1 [==============================] - ETA: 0s1/1 [==============================] - 0s 408ms/step
1/1 [==============================] - ETA: 0s1/1 [==============================] - 0s 50ms/step
1/1 [==============================] - ETA: 0s1/1 [==============================] - 0s 69ms/step
[I 2024-12-23 20:52:33,363] Trial 15 finished with value: 0.2894252810816801 and parameters: {'n_units_0': 20, 'dropout_1': 0.1, 'run': 2, 'epochs_1': 30, 'epochs_2': 100, 'lr_1': 0.0001011497839903103, 'lr_2': 2.1914805291808674e-05, 'batch_size': 12, 'regularization': 'l1', 'reg_alpha_1': 0.0006929288475554173}. Best is trial 2 with value: 0.2846803112753509.
Statistics value = 27.0 p-value = 0.5390625
1/1 [==============================] - ETA: 0s1/1 [==============================] - 0s 433ms/step
1/1 [==============================] - ETA: 0s1/1 [==============================] - 0s 453ms/step
Statistics value = 14.0 p-value = 0.7265625
1/1 [==============================] - ETA: 0s1/1 [==============================] - 1s 630ms/step
1/1 [==============================] - ETA: 0s1/1 [==============================] - 0s 487ms/step
Statistics value = 7.0 p-value = 0.986328125
1/1 [==============================] - ETA: 0s1/1 [==============================] - 0s 448ms/step
1/1 [==============================] - ETA: 0s1/1 [==============================] - 0s 448ms/step
1/1 [==============================] - ETA: 0s1/1 [==============================] - 0s 407ms/step
1/1 [==============================] - ETA: 0s1/1 [==============================] - 0s 407ms/step
1/1 [==============================] - ETA: 0s1/1 [==============================] - 9s 9s/step
1/1 [==============================] - ETA: 0s1/1 [==============================] - 1s 518ms/step
1/1 [==============================] - ETA: 0s1/1 [==============================] - 0s 60ms/step
1/1 [==============================] - ETA: 0s1/1 [==============================] - 0s 47ms/step
[I 2024-12-23 20:52:52,788] Trial 15 finished with value: 1.5189879949383074 and parameters: {'n_units_0': 4, 'dropout_1': 0.15000000000000002, 'run': 2, 'epochs_1': 70, 'epochs_2': 50, 'lr_1': 0.0014306087388007698, 'lr_2': 2.359101874975911e-05, 'batch_size': 12, 'regularization': 'l2', 'reg_alpha_1': 0.0014601920314970508}. Best is trial 8 with value: 1.0469849464594678.
Statistics value = 34.0 p-value = 0.01171875
1/1 [==============================] - ETA: 0s1/1 [==============================] - 0s 465ms/step
1/1 [==============================] - ETA: 0s1/1 [==============================] - 0s 466ms/step
1/1 [==============================] - ETA: 0s1/1 [==============================] - 0s 433ms/step
1/1 [==============================] - ETA: 0s1/1 [==============================] - 0s 401ms/step
1/1 [==============================] - ETA: 0s1/1 [==============================] - 0s 96ms/step
1/1 [==============================] - ETA: 0s1/1 [==============================] - 0s 50ms/step
[I 2024-12-23 20:53:07,485] Trial 14 finished with value: 0.6740191955165264 and parameters: {'n_units_0': 24, 'dropout_1': 0.25, 'run': 3, 'epochs_1': 60, 'epochs_2': 90, 'lr_1': 0.001418848214704326, 'lr_2': 0.0001891650611416324, 'batch_size': 16, 'regularization': 'None'}. Best is trial 8 with value: 0.5444094279064726.
1/1 [==============================] - ETA: 0s1/1 [==============================] - 0s 440ms/step
1/1 [==============================] - ETA: 0s1/1 [==============================] - 0s 429ms/step
1/1 [==============================] - ETA: 0s1/1 [==============================] - 0s 49ms/step
1/1 [==============================] - ETA: 0s1/1 [==============================] - 0s 53ms/step
[I 2024-12-23 20:53:10,968] Trial 18 finished with value: 0.28048091292927135 and parameters: {'n_units_0': 24, 'dropout_1': 0.25, 'run': 2, 'epochs_1': 90, 'epochs_2': 100, 'lr_1': 0.005743795281920744, 'lr_2': 0.0006460396893600766, 'batch_size': 8, 'regularization': 'l1_l2', 'reg_alpha_1': 1.3477289228691214e-05, 'reg_alpha_2': 1.4533550875819813e-05}. Best is trial 5 with value: 0.2324022591686981.
1/1 [==============================] - ETA: 0s1/1 [==============================] - 0s 454ms/step
1/1 [==============================] - ETA: 0s1/1 [==============================] - 0s 492ms/step
1/1 [==============================] - ETA: 0s1/1 [==============================] - 0s 66ms/step
1/1 [==============================] - ETA: 0s1/1 [==============================] - 0s 42ms/step
1/1 [==============================] - ETA: 0s1/1 [==============================] - 0s 424ms/step
1/1 [==============================] - ETA: 0s1/1 [==============================] - 0s 416ms/step
Statistics value = 22.0 p-value = 0.3203125
1/1 [==============================] - ETA: 0s1/1 [==============================] - 0s 351ms/step
1/1 [==============================] - ETA: 0s1/1 [==============================] - 0s 376ms/step
Statistics value = 7.0 p-value = 0.9453125
1/1 [==============================] - ETA: 0s1/1 [==============================] - 0s 353ms/step
1/1 [==============================] - ETA: 0s1/1 [==============================] - 0s 352ms/step
1/1 [==============================] - ETA: 0s1/1 [==============================] - 0s 37ms/step
1/1 [==============================] - ETA: 0s1/1 [==============================] - 0s 38ms/step
Statistics value = 36.0 p-value = 0.2158203125
1/1 [==============================] - ETA: 0s1/1 [==============================] - 0s 346ms/step
1/1 [==============================] - ETA: 0s1/1 [==============================] - 0s 330ms/step
1/1 [==============================] - ETA: 0s1/1 [==============================] - 0s 388ms/step
1/1 [==============================] - ETA: 0s1/1 [==============================] - 0s 396ms/step
1/1 [==============================] - ETA: 0s1/1 [==============================] - 0s 31ms/step
1/1 [==============================] - ETA: 0s1/1 [==============================] - 0s 30ms/step
1/1 [==============================] - ETA: 0s1/1 [==============================] - 0s 350ms/step
1/1 [==============================] - ETA: 0s1/1 [==============================] - 0s 344ms/step
1/1 [==============================] - ETA: 0s1/1 [==============================] - 0s 34ms/step
Statistics value = 33.0 p-value = 0.3125
1/1 [==============================] - ETA: 0s1/1 [==============================] - 0s 332ms/step
1/1 [==============================] - ETA: 0s1/1 [==============================] - 0s 29ms/step
1/1 [==============================] - ETA: 0s1/1 [==============================] - 0s 372ms/step
1/1 [==============================] - ETA: 0s1/1 [==============================] - 0s 358ms/step
1/1 [==============================] - ETA: 0s1/1 [==============================] - 0s 380ms/step
1/1 [==============================] - ETA: 0s1/1 [==============================] - 0s 30ms/step
1/1 [==============================] - ETA: 0s1/1 [==============================] - 0s 28ms/step
[I 2024-12-23 20:53:37,399] Trial 16 finished with value: 0.2882838099922446 and parameters: {'n_units_0': 44, 'dropout_1': 0.15000000000000002, 'run': 2, 'epochs_1': 40, 'epochs_2': 90, 'lr_1': 0.00010267748249206944, 'lr_2': 1.853052192364326e-05, 'batch_size': 16, 'regularization': 'l1_l2', 'reg_alpha_1': 0.0025238502193384122, 'reg_alpha_2': 0.009464154147879048}. Best is trial 2 with value: 0.2846803112753509.
Statistics value = 45.0 p-value = 0.0419921875
1/1 [==============================] - ETA: 0s1/1 [==============================] - 0s 343ms/step
1/1 [==============================] - ETA: 0s1/1 [==============================] - 0s 343ms/step
1/1 [==============================] - ETA: 0s1/1 [==============================] - 0s 28ms/step
1/1 [==============================] - ETA: 0s1/1 [==============================] - 0s 27ms/step
[I 2024-12-23 20:53:39,815] Trial 19 finished with value: 0.23407709159803153 and parameters: {'n_units_0': 36, 'dropout_1': 0.15000000000000002, 'run': 1, 'epochs_1': 50, 'epochs_2': 50, 'lr_1': 0.0002727360066541973, 'lr_2': 1.970256274929135e-05, 'batch_size': 16, 'regularization': 'None'}. Best is trial 5 with value: 0.2324022591686981.
Statistics value = 39.0 p-value = 0.1376953125
1/1 [==============================] - ETA: 0s1/1 [==============================] - 0s 300ms/step
1/1 [==============================] - ETA: 0s1/1 [==============================] - 0s 337ms/step
1/1 [==============================] - ETA: 0s1/1 [==============================] - 0s 320ms/step
1/1 [==============================] - ETA: 0s1/1 [==============================] - 0s 326ms/step
Statistics value = 19.0 p-value = 0.47265625
1/1 [==============================] - ETA: 0s1/1 [==============================] - 0s 348ms/step
1/1 [==============================] - ETA: 0s1/1 [==============================] - 0s 329ms/step
1/1 [==============================] - ETA: 0s1/1 [==============================] - 0s 29ms/step
1/1 [==============================] - ETA: 0s1/1 [==============================] - 0s 29ms/step
1/1 [==============================] - ETA: 0s1/1 [==============================] - 0s 317ms/step
1/1 [==============================] - ETA: 0s1/1 [==============================] - 0s 333ms/step
1/1 [==============================] - ETA: 0s1/1 [==============================] - 0s 337ms/step
1/1 [==============================] - ETA: 0s1/1 [==============================] - 0s 28ms/step
1/1 [==============================] - ETA: 0s1/1 [==============================] - 0s 38ms/step
1/1 [==============================] - ETA: 0s1/1 [==============================] - 0s 342ms/step
1/1 [==============================] - ETA: 0s1/1 [==============================] - 0s 28ms/step
1/1 [==============================] - ETA: 0s1/1 [==============================] - 0s 28ms/step
[I 2024-12-23 20:53:53,339] Trial 15 finished with value: 0.6470764770913966 and parameters: {'n_units_0': 24, 'dropout_1': 0.15000000000000002, 'run': 2, 'epochs_1': 50, 'epochs_2': 60, 'lr_1': 0.00044540534165451946, 'lr_2': 0.00014015515556056352, 'batch_size': 12, 'regularization': 'l2', 'reg_alpha_1': 3.307424654077889e-05}. Best is trial 8 with value: 0.5444094279064726.
[I 2024-12-23 20:53:53,869] Trial 16 finished with value: 1.0660464558804799 and parameters: {'n_units_0': 16, 'dropout_1': 0.3, 'run': 3, 'epochs_1': 40, 'epochs_2': 20, 'lr_1': 0.00034086154072914573, 'lr_2': 7.803511669278675e-05, 'batch_size': 16, 'regularization': 'None'}. Best is trial 8 with value: 1.0469849464594678.
Statistics value = 20.0 p-value = 0.7841796875
1/1 [==============================] - ETA: 0s1/1 [==============================] - 0s 346ms/step
1/1 [==============================] - ETA: 0s1/1 [==============================] - 0s 419ms/step
1/1 [==============================] - ETA: 0s1/1 [==============================] - 0s 30ms/step
1/1 [==============================] - ETA: 0s1/1 [==============================] - 0s 46ms/step
