[I 2024-12-23 18:56:34,071] Trial 0 finished with value: 0.23352708123960866 and parameters: {'n_units_0': 24, 'dropout_1': 0.3, 'run': 3, 'epochs_1': 70, 'epochs_2': 30, 'lr_1': 0.00020511104188433984, 'lr_2': 1.3066739238053272e-05, 'batch_size': 16, 'regularization': 'None'}. Best is trial 0 with value: 0.23352708123960866.
[I 2024-12-23 18:56:34,071] Trial 0 finished with value: 1.1392108612541028 and parameters: {'n_units_0': 24, 'dropout_1': 0.3, 'run': 3, 'epochs_1': 70, 'epochs_2': 30, 'lr_1': 0.00020511104188433984, 'lr_2': 1.3066739238053272e-05, 'batch_size': 16, 'regularization': 'None'}. Best is trial 0 with value: 1.1392108612541028.
1/1 [==============================] - ETA: 0s1/1 [==============================] - 0s 408ms/step
1/1 [==============================] - ETA: 0s1/1 [==============================] - 0s 394ms/step
1/1 [==============================] - ETA: 0s1/1 [==============================] - 0s 383ms/step
1/1 [==============================] - ETA: 0s1/1 [==============================] - 0s 374ms/step
1/1 [==============================] - ETA: 0s1/1 [==============================] - 0s 61ms/step
1/1 [==============================] - ETA: 0s1/1 [==============================] - 0s 45ms/step
1/1 [==============================] - ETA: 0s1/1 [==============================] - 0s 45ms/step
1/1 [==============================] - ETA: 0s1/1 [==============================] - 0s 46ms/step
[I 2024-12-23 18:56:38,058] Trial 0 finished with value: 0.31832105317346554 and parameters: {'n_units_0': 24, 'dropout_1': 0.3, 'run': 3, 'epochs_1': 70, 'epochs_2': 30, 'lr_1': 0.00020511104188433984, 'lr_2': 1.3066739238053272e-05, 'batch_size': 16, 'regularization': 'None'}. Best is trial 0 with value: 0.31832105317346554.
[I 2024-12-23 18:56:38,157] Trial 0 finished with value: 0.5600802703795851 and parameters: {'n_units_0': 24, 'dropout_1': 0.3, 'run': 3, 'epochs_1': 70, 'epochs_2': 30, 'lr_1': 0.00020511104188433984, 'lr_2': 1.3066739238053272e-05, 'batch_size': 16, 'regularization': 'None'}. Best is trial 0 with value: 0.5600802703795851.
Statistics value = 9.0 p-value = 0.90234375
1/1 [==============================] - ETA: 0s1/1 [==============================] - 0s 353ms/step
Statistics value = 12.0 p-value = 0.80859375
1/1 [==============================] - ETA: 0s1/1 [==============================] - 0s 367ms/step
1/1 [==============================] - ETA: 0s1/1 [==============================] - 0s 401ms/step
1/1 [==============================] - ETA: 0s1/1 [==============================] - 0s 464ms/step
1/1 [==============================] - ETA: 0s1/1 [==============================] - 0s 65ms/step
1/1 [==============================] - ETA: 0s1/1 [==============================] - 0s 40ms/step
1/1 [==============================] - ETA: 0s1/1 [==============================] - 0s 52ms/step
1/1 [==============================] - ETA: 0s1/1 [==============================] - 0s 54ms/step
Statistics value = 15.0 p-value = 0.6796875
1/1 [==============================] - ETA: 0s1/1 [==============================] - 0s 380ms/step
Statistics value = 19.0 p-value = 0.47265625
1/1 [==============================] - ETA: 0s1/1 [==============================] - 0s 429ms/step
1/1 [==============================] - ETA: 0s1/1 [==============================] - 0s 402ms/step
1/1 [==============================] - ETA: 0s1/1 [==============================] - 0s 46ms/step
1/1 [==============================] - ETA: 0s1/1 [==============================] - 0s 404ms/step
1/1 [==============================] - ETA: 0s1/1 [==============================] - 0s 45ms/step
1/1 [==============================] - ETA: 0s1/1 [==============================] - 0s 46ms/step
1/1 [==============================] - ETA: 0s1/1 [==============================] - 0s 45ms/step
Statistics value = 7.0 p-value = 0.986328125
1/1 [==============================] - ETA: 0s1/1 [==============================] - 0s 417ms/step
Statistics value = 25.0 p-value = 0.615234375
1/1 [==============================] - ETA: 0s1/1 [==============================] - 0s 381ms/step
1/1 [==============================] - ETA: 0s1/1 [==============================] - 0s 358ms/step
1/1 [==============================] - ETA: 0s1/1 [==============================] - 0s 405ms/step
1/1 [==============================] - ETA: 0s1/1 [==============================] - 0s 49ms/step
1/1 [==============================] - ETA: 0s1/1 [==============================] - 0s 46ms/step
1/1 [==============================] - ETA: 0s1/1 [==============================] - 0s 42ms/step
1/1 [==============================] - ETA: 0s1/1 [==============================] - 0s 39ms/step
[I 2024-12-23 18:57:04,473] Trial 1 finished with value: 1.779736347699766 and parameters: {'n_units_0': 56, 'dropout_1': 0.15000000000000002, 'run': 1, 'epochs_1': 40, 'epochs_2': 40, 'lr_1': 0.0011207606211860567, 'lr_2': 7.309539835912905e-05, 'batch_size': 8, 'regularization': 'l1_l2', 'reg_alpha_1': 0.00023345864076016249, 'reg_alpha_2': 0.0022673986523780395}. Best is trial 0 with value: 1.1392108612541028.
[I 2024-12-23 18:57:04,501] Trial 1 finished with value: 0.2749914922732627 and parameters: {'n_units_0': 56, 'dropout_1': 0.15000000000000002, 'run': 1, 'epochs_1': 40, 'epochs_2': 40, 'lr_1': 0.0011207606211860567, 'lr_2': 7.309539835912905e-05, 'batch_size': 8, 'regularization': 'l1_l2', 'reg_alpha_1': 0.00023345864076016249, 'reg_alpha_2': 0.0022673986523780395}. Best is trial 0 with value: 0.23352708123960866.
Statistics value = 31.0 p-value = 0.384765625
1/1 [==============================] - ETA: 0s1/1 [==============================] - 0s 413ms/step
1/1 [==============================] - ETA: 0s1/1 [==============================] - 0s 387ms/step
1/1 [==============================] - ETA: 0s1/1 [==============================] - 0s 40ms/step
1/1 [==============================] - ETA: 0s1/1 [==============================] - 0s 41ms/step
Statistics value = 26.0 p-value = 0.5771484375
1/1 [==============================] - ETA: 0s1/1 [==============================] - 0s 431ms/step
1/1 [==============================] - ETA: 0s1/1 [==============================] - 0s 373ms/step
[I 2024-12-23 18:57:08,064] Trial 1 finished with value: 0.6766576459252565 and parameters: {'n_units_0': 56, 'dropout_1': 0.15000000000000002, 'run': 1, 'epochs_1': 40, 'epochs_2': 40, 'lr_1': 0.0011207606211860567, 'lr_2': 7.309539835912905e-05, 'batch_size': 8, 'regularization': 'l1_l2', 'reg_alpha_1': 0.00023345864076016249, 'reg_alpha_2': 0.0022673986523780395}. Best is trial 0 with value: 0.5600802703795851.
1/1 [==============================] - ETA: 0s1/1 [==============================] - 0s 43ms/step
1/1 [==============================] - ETA: 0s1/1 [==============================] - 0s 51ms/step
[I 2024-12-23 18:57:09,101] Trial 1 finished with value: 0.42684408275177177 and parameters: {'n_units_0': 56, 'dropout_1': 0.15000000000000002, 'run': 1, 'epochs_1': 40, 'epochs_2': 40, 'lr_1': 0.0011207606211860567, 'lr_2': 7.309539835912905e-05, 'batch_size': 8, 'regularization': 'l1_l2', 'reg_alpha_1': 0.00023345864076016249, 'reg_alpha_2': 0.0022673986523780395}. Best is trial 0 with value: 0.31832105317346554.
Statistics value = 35.0 p-value = 0.0078125
1/1 [==============================] - ETA: 0s1/1 [==============================] - 0s 388ms/step
Statistics value = 3.0 p-value = 0.98828125
1/1 [==============================] - ETA: 0s1/1 [==============================] - 1s 533ms/step
1/1 [==============================] - ETA: 0s1/1 [==============================] - 0s 379ms/step
1/1 [==============================] - ETA: 0s1/1 [==============================] - 0s 368ms/step
Statistics value = 20.0 p-value = 0.421875
1/1 [==============================] - ETA: 0s1/1 [==============================] - 0s 406ms/step
1/1 [==============================] - ETA: 0s1/1 [==============================] - 0s 447ms/step
Statistics value = 17.0 p-value = 0.578125
1/1 [==============================] - ETA: 0s1/1 [==============================] - 0s 439ms/step
1/1 [==============================] - ETA: 0s1/1 [==============================] - 0s 413ms/step
1/1 [==============================] - ETA: 0s1/1 [==============================] - 0s 392ms/step
1/1 [==============================] - ETA: 0s1/1 [==============================] - 0s 385ms/step
1/1 [==============================] - ETA: 0s1/1 [==============================] - 0s 377ms/step
1/1 [==============================] - ETA: 0s1/1 [==============================] - 0s 388ms/step
1/1 [==============================] - ETA: 0s1/1 [==============================] - 0s 53ms/step
1/1 [==============================] - ETA: 0s1/1 [==============================] - 0s 57ms/step
1/1 [==============================] - ETA: 0s1/1 [==============================] - 0s 50ms/step
1/1 [==============================] - ETA: 0s1/1 [==============================] - 0s 48ms/step
1/1 [==============================] - ETA: 0s1/1 [==============================] - 0s 394ms/step
1/1 [==============================] - ETA: 0s1/1 [==============================] - 0s 400ms/step
1/1 [==============================] - ETA: 0s1/1 [==============================] - 0s 63ms/step
1/1 [==============================] - ETA: 0s1/1 [==============================] - 0s 48ms/step
1/1 [==============================] - ETA: 0s1/1 [==============================] - 0s 386ms/step
1/1 [==============================] - ETA: 0s1/1 [==============================] - 0s 407ms/step
1/1 [==============================] - ETA: 0s1/1 [==============================] - 0s 52ms/step
1/1 [==============================] - ETA: 0s1/1 [==============================] - 0s 57ms/step
Statistics value = 48.0 p-value = 0.0185546875
1/1 [==============================] - ETA: 0s1/1 [==============================] - 0s 400ms/step
Statistics value = 8.0 p-value = 0.9814453125
1/1 [==============================] - ETA: 0s1/1 [==============================] - 0s 382ms/step
1/1 [==============================] - ETA: 0s1/1 [==============================] - 0s 435ms/step
1/1 [==============================] - ETA: 0s1/1 [==============================] - 0s 385ms/step
Statistics value = 45.0 p-value = 0.0419921875
1/1 [==============================] - ETA: 0s1/1 [==============================] - 0s 320ms/step
1/1 [==============================] - ETA: 0s1/1 [==============================] - 0s 315ms/step
Statistics value = 19.0 p-value = 0.8125
1/1 [==============================] - ETA: 0s1/1 [==============================] - 0s 337ms/step
1/1 [==============================] - ETA: 0s1/1 [==============================] - 0s 314ms/step
1/1 [==============================] - ETA: 0s1/1 [==============================] - 0s 347ms/step
1/1 [==============================] - ETA: 0s1/1 [==============================] - 0s 335ms/step
1/1 [==============================] - ETA: 0s1/1 [==============================] - 0s 309ms/step
1/1 [==============================] - ETA: 0s1/1 [==============================] - 0s 32ms/step
1/1 [==============================] - ETA: 0s1/1 [==============================] - 0s 315ms/step
1/1 [==============================] - ETA: 0s1/1 [==============================] - 0s 43ms/step
1/1 [==============================] - ETA: 0s1/1 [==============================] - 0s 29ms/step
1/1 [==============================] - ETA: 0s1/1 [==============================] - 0s 29ms/step
[I 2024-12-23 18:57:57,466] Trial 2 finished with value: 0.23898456967187626 and parameters: {'n_units_0': 16, 'dropout_1': 0.2, 'run': 2, 'epochs_1': 30, 'epochs_2': 70, 'lr_1': 0.00021930485556643703, 'lr_2': 1.3492834268013232e-05, 'batch_size': 16, 'regularization': 'l1_l2', 'reg_alpha_1': 0.0011290133559092666, 'reg_alpha_2': 0.00020914981329035596}. Best is trial 0 with value: 0.23352708123960866.
[I 2024-12-23 18:57:57,677] Trial 2 finished with value: 1.2084388032421793 and parameters: {'n_units_0': 16, 'dropout_1': 0.2, 'run': 2, 'epochs_1': 30, 'epochs_2': 70, 'lr_1': 0.00021930485556643703, 'lr_2': 1.3492834268013232e-05, 'batch_size': 16, 'regularization': 'l1_l2', 'reg_alpha_1': 0.0011290133559092666, 'reg_alpha_2': 0.00020914981329035596}. Best is trial 0 with value: 1.1392108612541028.
1/1 [==============================] - ETA: 0s1/1 [==============================] - 0s 347ms/step
1/1 [==============================] - ETA: 0s1/1 [==============================] - 0s 331ms/step
1/1 [==============================] - ETA: 0s1/1 [==============================] - 0s 35ms/step
1/1 [==============================] - ETA: 0s1/1 [==============================] - 0s 34ms/step
[I 2024-12-23 18:58:01,365] Trial 2 finished with value: 0.7253315513572531 and parameters: {'n_units_0': 16, 'dropout_1': 0.2, 'run': 2, 'epochs_1': 30, 'epochs_2': 70, 'lr_1': 0.00021930485556643703, 'lr_2': 1.3492834268013232e-05, 'batch_size': 16, 'regularization': 'l1_l2', 'reg_alpha_1': 0.0011290133559092666, 'reg_alpha_2': 0.00020914981329035596}. Best is trial 0 with value: 0.5600802703795851.
1/1 [==============================] - ETA: 0s1/1 [==============================] - 0s 377ms/step
1/1 [==============================] - ETA: 0s1/1 [==============================] - 0s 307ms/step
1/1 [==============================] - ETA: 0s1/1 [==============================] - 0s 33ms/step
1/1 [==============================] - ETA: 0s1/1 [==============================] - 0s 32ms/step
