[I 2024-12-23 19:43:34,272] Trial 3 finished with value: 0.41156261295377417 and parameters: {'n_units_0': 8, 'dropout_1': 0.2, 'run': 1, 'epochs_1': 100, 'epochs_2': 40, 'lr_1': 0.0021137059440645744, 'lr_2': 4.201672054372529e-05, 'batch_size': 12, 'regularization': 'l2', 'reg_alpha_1': 0.006584106160121612}. Best is trial 0 with value: 0.29953667830368996.
[I 2024-12-23 19:43:34,284] Trial 3 finished with value: 1.7425939293240016 and parameters: {'n_units_0': 8, 'dropout_1': 0.2, 'run': 1, 'epochs_1': 100, 'epochs_2': 40, 'lr_1': 0.0021137059440645744, 'lr_2': 4.201672054372529e-05, 'batch_size': 12, 'regularization': 'l2', 'reg_alpha_1': 0.006584106160121612}. Best is trial 0 with value: 1.0647727512473726.
[I 2024-12-23 19:43:34,300] Trial 3 finished with value: 0.7330771201700683 and parameters: {'n_units_0': 8, 'dropout_1': 0.2, 'run': 1, 'epochs_1': 100, 'epochs_2': 40, 'lr_1': 0.0021137059440645744, 'lr_2': 4.201672054372529e-05, 'batch_size': 12, 'regularization': 'l2', 'reg_alpha_1': 0.006584106160121612}. Best is trial 2 with value: 0.6298573907333288.
1/1 [==============================] - ETA: 0s1/1 [==============================] - 0s 39ms/step
[I 2024-12-23 19:43:34,836] Trial 3 finished with value: 0.2681381584100948 and parameters: {'n_units_0': 8, 'dropout_1': 0.2, 'run': 1, 'epochs_1': 100, 'epochs_2': 40, 'lr_1': 0.0021137059440645744, 'lr_2': 4.201672054372529e-05, 'batch_size': 12, 'regularization': 'l2', 'reg_alpha_1': 0.006584106160121612}. Best is trial 0 with value: 0.2335885552687536.
Statistics value = 33.0 p-value = 0.01953125
1/1 [==============================] - ETA: 0s1/1 [==============================] - 0s 354ms/step
Statistics value = 17.0 p-value = 0.578125
1/1 [==============================] - ETA: 0s1/1 [==============================] - 0s 337ms/step
Statistics value = 21.0 p-value = 0.37109375
1/1 [==============================] - ETA: 0s1/1 [==============================] - 0s 358ms/step
1/1 [==============================] - ETA: 0s1/1 [==============================] - 0s 346ms/step
1/1 [==============================] - ETA: 0s1/1 [==============================] - 0s 312ms/step
1/1 [==============================] - ETA: 0s1/1 [==============================] - 0s 342ms/step
Statistics value = 11.0 p-value = 0.84375
1/1 [==============================] - ETA: 0s1/1 [==============================] - 0s 351ms/step
1/1 [==============================] - ETA: 0s1/1 [==============================] - 0s 333ms/step
1/1 [==============================] - ETA: 0s1/1 [==============================] - 0s 355ms/step
1/1 [==============================] - ETA: 0s1/1 [==============================] - 0s 350ms/step
1/1 [==============================] - ETA: 0s1/1 [==============================] - 0s 358ms/step
1/1 [==============================] - ETA: 0s1/1 [==============================] - 0s 365ms/step
1/1 [==============================] - ETA: 0s1/1 [==============================] - 0s 372ms/step
1/1 [==============================] - ETA: 0s1/1 [==============================] - 0s 366ms/step
1/1 [==============================] - ETA: 0s1/1 [==============================] - 0s 372ms/step
1/1 [==============================] - ETA: 0s1/1 [==============================] - 0s 361ms/step
1/1 [==============================] - ETA: 0s1/1 [==============================] - 0s 388ms/step
1/1 [==============================] - ETA: 0s1/1 [==============================] - 0s 366ms/step
1/1 [==============================] - ETA: 0s1/1 [==============================] - 0s 382ms/step
1/1 [==============================] - ETA: 0s1/1 [==============================] - 0s 395ms/step
1/1 [==============================] - ETA: 0s1/1 [==============================] - 1s 530ms/step
1/1 [==============================] - ETA: 0s1/1 [==============================] - 0s 48ms/step
1/1 [==============================] - ETA: 0s1/1 [==============================] - 0s 360ms/step
1/1 [==============================] - ETA: 0s1/1 [==============================] - 1s 516ms/step
1/1 [==============================] - ETA: 0s1/1 [==============================] - 0s 49ms/step
1/1 [==============================] - ETA: 0s1/1 [==============================] - 0s 60ms/step
1/1 [==============================] - ETA: 0s1/1 [==============================] - 0s 57ms/step
1/1 [==============================] - ETA: 0s1/1 [==============================] - 0s 62ms/step
1/1 [==============================] - ETA: 0s1/1 [==============================] - 0s 54ms/step
1/1 [==============================] - ETA: 0s1/1 [==============================] - 0s 381ms/step
1/1 [==============================] - ETA: 0s1/1 [==============================] - 0s 52ms/step
1/1 [==============================] - ETA: 0s1/1 [==============================] - 0s 45ms/step
Statistics value = 1.0 p-value = 0.9990234375
1/1 [==============================] - ETA: 0s1/1 [==============================] - 0s 385ms/step
Statistics value = 24.0 p-value = 0.65234375
1/1 [==============================] - ETA: 0s1/1 [==============================] - 0s 376ms/step
Statistics value = 20.0 p-value = 0.7841796875
1/1 [==============================] - ETA: 0s1/1 [==============================] - 0s 391ms/step
1/1 [==============================] - ETA: 0s1/1 [==============================] - 0s 393ms/step
1/1 [==============================] - ETA: 0s1/1 [==============================] - 0s 380ms/step
1/1 [==============================] - ETA: 0s1/1 [==============================] - 0s 383ms/step
Statistics value = 47.0 p-value = 0.0244140625
1/1 [==============================] - ETA: 0s1/1 [==============================] - 0s 393ms/step
1/1 [==============================] - ETA: 0s1/1 [==============================] - 0s 369ms/step
1/1 [==============================] - ETA: 0s1/1 [==============================] - 0s 397ms/step
1/1 [==============================] - ETA: 0s1/1 [==============================] - 0s 397ms/step
1/1 [==============================] - ETA: 0s1/1 [==============================] - 0s 395ms/step
1/1 [==============================] - ETA: 0s1/1 [==============================] - 0s 350ms/step
1/1 [==============================] - ETA: 0s1/1 [==============================] - 0s 352ms/step
1/1 [==============================] - ETA: 0s1/1 [==============================] - 0s 365ms/step
1/1 [==============================] - ETA: 0s1/1 [==============================] - 0s 371ms/step
1/1 [==============================] - ETA: 0s1/1 [==============================] - 0s 367ms/step
1/1 [==============================] - ETA: 0s1/1 [==============================] - 0s 396ms/step
1/1 [==============================] - ETA: 0s1/1 [==============================] - 0s 376ms/step
1/1 [==============================] - ETA: 0s1/1 [==============================] - 0s 377ms/step
1/1 [==============================] - ETA: 0s1/1 [==============================] - 0s 407ms/step
1/1 [==============================] - ETA: 0s1/1 [==============================] - 0s 379ms/step
1/1 [==============================] - ETA: 0s1/1 [==============================] - 0s 370ms/step
1/1 [==============================] - ETA: 0s1/1 [==============================] - 0s 389ms/step
1/1 [==============================] - ETA: 0s1/1 [==============================] - 0s 76ms/step
1/1 [==============================] - ETA: 0s1/1 [==============================] - 0s 48ms/step
1/1 [==============================] - ETA: 0s1/1 [==============================] - 0s 41ms/step
1/1 [==============================] - ETA: 0s1/1 [==============================] - 0s 47ms/step
1/1 [==============================] - ETA: 0s1/1 [==============================] - 0s 43ms/step
1/1 [==============================] - ETA: 0s1/1 [==============================] - 0s 38ms/step
1/1 [==============================] - ETA: 0s1/1 [==============================] - 0s 421ms/step
1/1 [==============================] - ETA: 0s1/1 [==============================] - 0s 71ms/step
1/1 [==============================] - ETA: 0s1/1 [==============================] - 0s 106ms/step
[I 2024-12-23 19:44:43,195] Trial 4 finished with value: 0.29836268250711184 and parameters: {'n_units_0': 60, 'dropout_1': 0.2, 'run': 3, 'epochs_1': 30, 'epochs_2': 30, 'lr_1': 0.00012315571723666037, 'lr_2': 4.473636174621264e-05, 'batch_size': 12, 'regularization': 'l1', 'reg_alpha_1': 0.00042470585622618684}. Best is trial 4 with value: 0.29836268250711184.
[I 2024-12-23 19:44:43,242] Trial 4 finished with value: 1.1465866654134143 and parameters: {'n_units_0': 60, 'dropout_1': 0.2, 'run': 3, 'epochs_1': 30, 'epochs_2': 30, 'lr_1': 0.00012315571723666037, 'lr_2': 4.473636174621264e-05, 'batch_size': 12, 'regularization': 'l1', 'reg_alpha_1': 0.00042470585622618684}. Best is trial 0 with value: 1.0647727512473726.
[I 2024-12-23 19:44:43,294] Trial 4 finished with value: 0.6043509879484533 and parameters: {'n_units_0': 60, 'dropout_1': 0.2, 'run': 3, 'epochs_1': 30, 'epochs_2': 30, 'lr_1': 0.00012315571723666037, 'lr_2': 4.473636174621264e-05, 'batch_size': 12, 'regularization': 'l1', 'reg_alpha_1': 0.00042470585622618684}. Best is trial 4 with value: 0.6043509879484533.
[I 2024-12-23 19:44:43,798] Trial 4 finished with value: 0.23463168804024498 and parameters: {'n_units_0': 60, 'dropout_1': 0.2, 'run': 3, 'epochs_1': 30, 'epochs_2': 30, 'lr_1': 0.00012315571723666037, 'lr_2': 4.473636174621264e-05, 'batch_size': 12, 'regularization': 'l1', 'reg_alpha_1': 0.00042470585622618684}. Best is trial 0 with value: 0.2335885552687536.
Statistics value = 27.0 p-value = 0.125
1/1 [==============================] - ETA: 0s1/1 [==============================] - 0s 399ms/step
Statistics value = 30.0 p-value = 0.0546875
1/1 [==============================] - ETA: 0s1/1 [==============================] - 0s 428ms/step
Statistics value = 19.0 p-value = 0.47265625
1/1 [==============================] - ETA: 0s1/1 [==============================] - 0s 416ms/step
Statistics value = 27.0 p-value = 0.125
1/1 [==============================] - ETA: 0s1/1 [==============================] - 0s 405ms/step
1/1 [==============================] - ETA: 0s1/1 [==============================] - 0s 372ms/step
1/1 [==============================] - ETA: 0s1/1 [==============================] - 0s 369ms/step
1/1 [==============================] - ETA: 0s1/1 [==============================] - 0s 357ms/step
1/1 [==============================] - ETA: 0s1/1 [==============================] - 0s 382ms/step
1/1 [==============================] - ETA: 0s1/1 [==============================] - 0s 64ms/step
1/1 [==============================] - ETA: 0s1/1 [==============================] - 0s 52ms/step
1/1 [==============================] - ETA: 0s1/1 [==============================] - 0s 48ms/step
1/1 [==============================] - ETA: 0s1/1 [==============================] - 0s 57ms/step
1/1 [==============================] - ETA: 0s1/1 [==============================] - 0s 77ms/step
1/1 [==============================] - ETA: 0s1/1 [==============================] - 0s 44ms/step
1/1 [==============================] - ETA: 0s1/1 [==============================] - 0s 49ms/step
1/1 [==============================] - ETA: 0s1/1 [==============================] - 0s 81ms/step
Statistics value = 28.0 p-value = 0.5
1/1 [==============================] - ETA: 0s1/1 [==============================] - 0s 409ms/step
Statistics value = 26.0 p-value = 0.5771484375
1/1 [==============================] - ETA: 0s1/1 [==============================] - 0s 403ms/step
Statistics value = 34.0 p-value = 0.2783203125
1/1 [==============================] - ETA: 0s1/1 [==============================] - 0s 372ms/step
Statistics value = 47.0 p-value = 0.0244140625
1/1 [==============================] - ETA: 0s1/1 [==============================] - 0s 385ms/step
1/1 [==============================] - ETA: 0s1/1 [==============================] - 0s 390ms/step
1/1 [==============================] - ETA: 0s1/1 [==============================] - 0s 373ms/step
1/1 [==============================] - ETA: 0s1/1 [==============================] - 0s 361ms/step
1/1 [==============================] - ETA: 0s1/1 [==============================] - 0s 396ms/step
1/1 [==============================] - ETA: 0s1/1 [==============================] - 0s 71ms/step
1/1 [==============================] - ETA: 0s1/1 [==============================] - 0s 77ms/step
1/1 [==============================] - ETA: 0s1/1 [==============================] - 0s 76ms/step
1/1 [==============================] - ETA: 0s1/1 [==============================] - 0s 85ms/step
1/1 [==============================] - ETA: 0s1/1 [==============================] - 0s 41ms/step
1/1 [==============================] - ETA: 0s1/1 [==============================] - 0s 50ms/step
1/1 [==============================] - ETA: 0s1/1 [==============================] - 0s 58ms/step
1/1 [==============================] - ETA: 0s1/1 [==============================] - 0s 42ms/step
[I 2024-12-23 19:45:20,072] Trial 5 finished with value: 1.1424951263040697 and parameters: {'n_units_0': 12, 'dropout_1': 0.3, 'run': 1, 'epochs_1': 100, 'epochs_2': 80, 'lr_1': 0.00024970737145052745, 'lr_2': 1.0257563974185649e-05, 'batch_size': 16, 'regularization': 'l2', 'reg_alpha_1': 0.0001189589673755355}. Best is trial 0 with value: 1.0647727512473726.
[I 2024-12-23 19:45:20,141] Trial 5 finished with value: 0.5595612150109663 and parameters: {'n_units_0': 12, 'dropout_1': 0.3, 'run': 1, 'epochs_1': 100, 'epochs_2': 80, 'lr_1': 0.00024970737145052745, 'lr_2': 1.0257563974185649e-05, 'batch_size': 16, 'regularization': 'l2', 'reg_alpha_1': 0.0001189589673755355}. Best is trial 5 with value: 0.5595612150109663.
[I 2024-12-23 19:45:20,143] Trial 5 finished with value: 0.33726339126212157 and parameters: {'n_units_0': 12, 'dropout_1': 0.3, 'run': 1, 'epochs_1': 100, 'epochs_2': 80, 'lr_1': 0.00024970737145052745, 'lr_2': 1.0257563974185649e-05, 'batch_size': 16, 'regularization': 'l2', 'reg_alpha_1': 0.0001189589673755355}. Best is trial 4 with value: 0.29836268250711184.
