[I 2024-12-23 17:07:50,378] Trial 5 finished with value: 1.214258009466481 and parameters: {'n_units_0': 12, 'dropout_1': 0.3, 'run': 1, 'epochs_1': 100, 'epochs_2': 80, 'lr_1': 0.00024970737145052745, 'lr_2': 1.0257563974185649e-05, 'batch_size': 16, 'regularization': 'l2', 'reg_alpha_1': 0.0001189589673755355}. Best is trial 4 with value: 1.1675709350378733.
Statistics value = 4.0 p-value = 0.98046875
1/1 [==============================] - ETA: 0s1/1 [==============================] - 0s 428ms/step
Statistics value = 17.0 p-value = 0.578125
1/1 [==============================] - ETA: 0s1/1 [==============================] - 0s 378ms/step
Statistics value = 23.0 p-value = 0.2734375
1/1 [==============================] - ETA: 0s1/1 [==============================] - 0s 373ms/step
1/1 [==============================] - ETA: 0s1/1 [==============================] - 0s 388ms/step
1/1 [==============================] - ETA: 0s1/1 [==============================] - 0s 377ms/step
1/1 [==============================] - ETA: 0s1/1 [==============================] - 0s 381ms/step
Statistics value = 21.0 p-value = 0.37109375
1/1 [==============================] - ETA: 0s1/1 [==============================] - 0s 376ms/step
1/1 [==============================] - ETA: 0s1/1 [==============================] - 0s 387ms/step
1/1 [==============================] - ETA: 0s1/1 [==============================] - 0s 392ms/step
1/1 [==============================] - ETA: 0s1/1 [==============================] - 0s 378ms/step
1/1 [==============================] - ETA: 0s1/1 [==============================] - 0s 462ms/step
1/1 [==============================] - ETA: 0s1/1 [==============================] - 0s 443ms/step
1/1 [==============================] - ETA: 0s1/1 [==============================] - 0s 408ms/step
1/1 [==============================] - ETA: 0s1/1 [==============================] - 0s 391ms/step
1/1 [==============================] - ETA: 0s1/1 [==============================] - 0s 46ms/step
1/1 [==============================] - ETA: 0s1/1 [==============================] - 0s 48ms/step
1/1 [==============================] - ETA: 0s1/1 [==============================] - 0s 51ms/step
1/1 [==============================] - ETA: 0s1/1 [==============================] - 0s 47ms/step
1/1 [==============================] - ETA: 0s1/1 [==============================] - 0s 43ms/step
1/1 [==============================] - ETA: 0s1/1 [==============================] - 0s 43ms/step
1/1 [==============================] - ETA: 0s1/1 [==============================] - 0s 355ms/step
1/1 [==============================] - ETA: 0s1/1 [==============================] - 0s 424ms/step
1/1 [==============================] - ETA: 0s1/1 [==============================] - 0s 48ms/step
1/1 [==============================] - ETA: 0s1/1 [==============================] - 0s 40ms/step
Statistics value = 22.0 p-value = 0.7216796875
1/1 [==============================] - ETA: 0s1/1 [==============================] - 0s 395ms/step
Statistics value = 22.0 p-value = 0.7216796875
1/1 [==============================] - ETA: 0s1/1 [==============================] - 0s 415ms/step
Statistics value = 36.0 p-value = 0.2158203125
1/1 [==============================] - ETA: 0s1/1 [==============================] - 0s 396ms/step
1/1 [==============================] - ETA: 0s1/1 [==============================] - 0s 400ms/step
1/1 [==============================] - ETA: 0s1/1 [==============================] - 0s 412ms/step
1/1 [==============================] - ETA: 0s1/1 [==============================] - 0s 391ms/step
Statistics value = 13.0 p-value = 0.9345703125
1/1 [==============================] - ETA: 0s1/1 [==============================] - 0s 455ms/step
1/1 [==============================] - ETA: 0s1/1 [==============================] - 0s 370ms/step
1/1 [==============================] - ETA: 0s1/1 [==============================] - 0s 388ms/step
1/1 [==============================] - ETA: 0s1/1 [==============================] - 0s 383ms/step
1/1 [==============================] - ETA: 0s1/1 [==============================] - 0s 424ms/step
1/1 [==============================] - ETA: 0s1/1 [==============================] - 0s 383ms/step
1/1 [==============================] - ETA: 0s1/1 [==============================] - 0s 401ms/step
1/1 [==============================] - ETA: 0s1/1 [==============================] - 0s 43ms/step
1/1 [==============================] - ETA: 0s1/1 [==============================] - 0s 379ms/step
1/1 [==============================] - ETA: 0s1/1 [==============================] - 0s 48ms/step
1/1 [==============================] - ETA: 0s1/1 [==============================] - 0s 39ms/step
1/1 [==============================] - ETA: 0s1/1 [==============================] - 0s 43ms/step
1/1 [==============================] - ETA: 0s1/1 [==============================] - 0s 41ms/step
1/1 [==============================] - ETA: 0s1/1 [==============================] - 0s 51ms/step
[I 2024-12-23 17:08:36,367] Trial 6 finished with value: 0.3123948990448731 and parameters: {'n_units_0': 8, 'dropout_1': 0.3, 'run': 2, 'epochs_1': 50, 'epochs_2': 20, 'lr_1': 0.0004187594718900631, 'lr_2': 4.4706085467784903e-05, 'batch_size': 16, 'regularization': 'l1', 'reg_alpha_1': 0.0013795402040204172}. Best is trial 2 with value: 0.2908927571689997.
[I 2024-12-23 17:08:36,388] Trial 6 finished with value: 0.4750649506232465 and parameters: {'n_units_0': 8, 'dropout_1': 0.3, 'run': 2, 'epochs_1': 50, 'epochs_2': 20, 'lr_1': 0.0004187594718900631, 'lr_2': 4.4706085467784903e-05, 'batch_size': 16, 'regularization': 'l1', 'reg_alpha_1': 0.0013795402040204172}. Best is trial 6 with value: 0.4750649506232465.
[I 2024-12-23 17:08:36,530] Trial 6 finished with value: 0.23387704684403066 and parameters: {'n_units_0': 8, 'dropout_1': 0.3, 'run': 2, 'epochs_1': 50, 'epochs_2': 20, 'lr_1': 0.0004187594718900631, 'lr_2': 4.4706085467784903e-05, 'batch_size': 16, 'regularization': 'l1', 'reg_alpha_1': 0.0013795402040204172}. Best is trial 6 with value: 0.23387704684403066.
1/1 [==============================] - ETA: 0s1/1 [==============================] - 0s 370ms/step
1/1 [==============================] - ETA: 0s1/1 [==============================] - 0s 381ms/step
1/1 [==============================] - ETA: 0s1/1 [==============================] - 0s 44ms/step
1/1 [==============================] - ETA: 0s1/1 [==============================] - 0s 43ms/step
[I 2024-12-23 17:08:39,196] Trial 6 finished with value: 1.2848798259528607 and parameters: {'n_units_0': 8, 'dropout_1': 0.3, 'run': 2, 'epochs_1': 50, 'epochs_2': 20, 'lr_1': 0.0004187594718900631, 'lr_2': 4.4706085467784903e-05, 'batch_size': 16, 'regularization': 'l1', 'reg_alpha_1': 0.0013795402040204172}. Best is trial 4 with value: 1.1675709350378733.
Statistics value = 10.0 p-value = 0.875
1/1 [==============================] - ETA: 0s1/1 [==============================] - 0s 385ms/step
Statistics value = 15.0 p-value = 0.6796875
1/1 [==============================] - ETA: 0s1/1 [==============================] - 0s 385ms/step
Statistics value = 30.0 p-value = 0.0546875
1/1 [==============================] - ETA: 0s1/1 [==============================] - 0s 362ms/step
1/1 [==============================] - ETA: 0s1/1 [==============================] - 0s 417ms/step
1/1 [==============================] - ETA: 0s1/1 [==============================] - 0s 424ms/step
1/1 [==============================] - ETA: 0s1/1 [==============================] - 0s 447ms/step
Statistics value = 33.0 p-value = 0.01953125
1/1 [==============================] - ETA: 0s1/1 [==============================] - 0s 384ms/step
1/1 [==============================] - ETA: 0s1/1 [==============================] - 0s 396ms/step
1/1 [==============================] - ETA: 0s1/1 [==============================] - 0s 374ms/step
1/1 [==============================] - ETA: 0s1/1 [==============================] - 0s 370ms/step
1/1 [==============================] - ETA: 0s1/1 [==============================] - 0s 372ms/step
1/1 [==============================] - ETA: 0s1/1 [==============================] - 0s 383ms/step
1/1 [==============================] - ETA: 0s1/1 [==============================] - 0s 385ms/step
1/1 [==============================] - ETA: 0s1/1 [==============================] - 0s 363ms/step
1/1 [==============================] - ETA: 0s1/1 [==============================] - 0s 426ms/step
1/1 [==============================] - ETA: 0s1/1 [==============================] - 0s 395ms/step
1/1 [==============================] - ETA: 0s1/1 [==============================] - 0s 397ms/step
1/1 [==============================] - ETA: 0s1/1 [==============================] - 0s 417ms/step
1/1 [==============================] - ETA: 0s1/1 [==============================] - 0s 405ms/step
1/1 [==============================] - ETA: 0s1/1 [==============================] - 0s 410ms/step
1/1 [==============================] - ETA: 0s1/1 [==============================] - 0s 369ms/step
1/1 [==============================] - ETA: 0s1/1 [==============================] - 0s 373ms/step
1/1 [==============================] - ETA: 0s1/1 [==============================] - 0s 43ms/step
1/1 [==============================] - ETA: 0s1/1 [==============================] - 0s 48ms/step
1/1 [==============================] - ETA: 0s1/1 [==============================] - 0s 46ms/step
1/1 [==============================] - ETA: 0s1/1 [==============================] - 0s 40ms/step
1/1 [==============================] - ETA: 0s1/1 [==============================] - 0s 41ms/step
1/1 [==============================] - ETA: 0s1/1 [==============================] - 0s 44ms/step
1/1 [==============================] - ETA: 0s1/1 [==============================] - 0s 405ms/step
1/1 [==============================] - ETA: 0s1/1 [==============================] - 0s 398ms/step
1/1 [==============================] - ETA: 0s1/1 [==============================] - 0s 45ms/step
1/1 [==============================] - ETA: 0s1/1 [==============================] - 0s 43ms/step
Statistics value = 35.0 p-value = 0.24609375
1/1 [==============================] - ETA: 0s1/1 [==============================] - 0s 410ms/step
Statistics value = 18.0 p-value = 0.8388671875
1/1 [==============================] - ETA: 0s1/1 [==============================] - 0s 378ms/step
Statistics value = 27.0 p-value = 0.5390625
1/1 [==============================] - ETA: 0s1/1 [==============================] - 0s 388ms/step
1/1 [==============================] - ETA: 0s1/1 [==============================] - 0s 395ms/step
1/1 [==============================] - ETA: 0s1/1 [==============================] - 0s 387ms/step
1/1 [==============================] - ETA: 0s1/1 [==============================] - 0s 385ms/step
Statistics value = 39.0 p-value = 0.1376953125
1/1 [==============================] - ETA: 0s1/1 [==============================] - 0s 389ms/step
1/1 [==============================] - ETA: 0s1/1 [==============================] - 0s 359ms/step
1/1 [==============================] - ETA: 0s1/1 [==============================] - 0s 434ms/step
1/1 [==============================] - ETA: 0s1/1 [==============================] - 0s 382ms/step
1/1 [==============================] - ETA: 0s1/1 [==============================] - 0s 379ms/step
1/1 [==============================] - ETA: 0s1/1 [==============================] - 0s 399ms/step
1/1 [==============================] - ETA: 0s1/1 [==============================] - 0s 371ms/step
1/1 [==============================] - ETA: 0s1/1 [==============================] - 0s 375ms/step
1/1 [==============================] - ETA: 0s1/1 [==============================] - 0s 399ms/step
1/1 [==============================] - ETA: 0s1/1 [==============================] - 0s 383ms/step
1/1 [==============================] - ETA: 0s1/1 [==============================] - 0s 437ms/step
1/1 [==============================] - ETA: 0s1/1 [==============================] - 0s 388ms/step
1/1 [==============================] - ETA: 0s1/1 [==============================] - 0s 393ms/step
1/1 [==============================] - ETA: 0s1/1 [==============================] - 0s 390ms/step
1/1 [==============================] - ETA: 0s1/1 [==============================] - 0s 425ms/step
1/1 [==============================] - ETA: 0s1/1 [==============================] - 0s 409ms/step
1/1 [==============================] - ETA: 0s1/1 [==============================] - 0s 41ms/step
1/1 [==============================] - ETA: 0s1/1 [==============================] - 0s 54ms/step
1/1 [==============================] - ETA: 0s1/1 [==============================] - 0s 51ms/step
1/1 [==============================] - ETA: 0s1/1 [==============================] - 0s 47ms/step
1/1 [==============================] - ETA: 0s1/1 [==============================] - 0s 50ms/step
1/1 [==============================] - ETA: 0s1/1 [==============================] - 0s 40ms/step
[I 2024-12-23 17:10:19,625] Trial 7 finished with value: 0.2542399959677588 and parameters: {'n_units_0': 52, 'dropout_1': 0.2, 'run': 3, 'epochs_1': 60, 'epochs_2': 60, 'lr_1': 0.0007162786999897341, 'lr_2': 1.1241862095793047e-05, 'batch_size': 8, 'regularization': 'l1', 'reg_alpha_1': 0.005280796376895365}. Best is trial 6 with value: 0.23387704684403066.
[I 2024-12-23 17:10:19,681] Trial 7 finished with value: 0.41176653061837537 and parameters: {'n_units_0': 52, 'dropout_1': 0.2, 'run': 3, 'epochs_1': 60, 'epochs_2': 60, 'lr_1': 0.0007162786999897341, 'lr_2': 1.1241862095793047e-05, 'batch_size': 8, 'regularization': 'l1', 'reg_alpha_1': 0.005280796376895365}. Best is trial 2 with value: 0.2908927571689997.
[I 2024-12-23 17:10:19,697] Trial 7 finished with value: 0.6831090276917589 and parameters: {'n_units_0': 52, 'dropout_1': 0.2, 'run': 3, 'epochs_1': 60, 'epochs_2': 60, 'lr_1': 0.0007162786999897341, 'lr_2': 1.1241862095793047e-05, 'batch_size': 8, 'regularization': 'l1', 'reg_alpha_1': 0.005280796376895365}. Best is trial 6 with value: 0.4750649506232465.
1/1 [==============================] - ETA: 0s1/1 [==============================] - 0s 392ms/step
1/1 [==============================] - ETA: 0s1/1 [==============================] - 0s 392ms/step
1/1 [==============================] - ETA: 0s1/1 [==============================] - 0s 54ms/step
1/1 [==============================] - ETA: 0s1/1 [==============================] - 0s 55ms/step
