[I 2024-12-23 18:27:03,208] Trial 13 finished with value: 0.23257386099382837 and parameters: {'n_units_0': 44, 'dropout_1': 0.25, 'run': 3, 'epochs_1': 50, 'epochs_2': 20, 'lr_1': 0.00011440652293717112, 'lr_2': 2.6885431803887616e-05, 'batch_size': 8, 'regularization': 'l2', 'reg_alpha_1': 3.595664962278216e-05}. Best is trial 13 with value: 0.23257386099382837.
1/1 [==============================] - ETA: 0s1/1 [==============================] - 0s 440ms/step
1/1 [==============================] - ETA: 0s1/1 [==============================] - 0s 383ms/step
1/1 [==============================] - ETA: 0s1/1 [==============================] - 0s 41ms/step
1/1 [==============================] - ETA: 0s1/1 [==============================] - 0s 42ms/step
Statistics value = 26.0 p-value = 0.5771484375
1/1 [==============================] - ETA: 0s1/1 [==============================] - 0s 428ms/step
1/1 [==============================] - ETA: 0s1/1 [==============================] - 0s 405ms/step
1/1 [==============================] - ETA: 0s1/1 [==============================] - 0s 417ms/step
1/1 [==============================] - ETA: 0s1/1 [==============================] - 0s 406ms/step
Statistics value = 27.0 p-value = 0.5390625
1/1 [==============================] - ETA: 0s1/1 [==============================] - 0s 422ms/step
1/1 [==============================] - ETA: 0s1/1 [==============================] - 0s 468ms/step
1/1 [==============================] - ETA: 0s1/1 [==============================] - 0s 426ms/step
1/1 [==============================] - ETA: 0s1/1 [==============================] - 0s 418ms/step
Statistics value = 9.0 p-value = 0.90234375
1/1 [==============================] - ETA: 0s1/1 [==============================] - 0s 465ms/step
1/1 [==============================] - ETA: 0s1/1 [==============================] - 0s 394ms/step
1/1 [==============================] - ETA: 0s1/1 [==============================] - 0s 475ms/step
1/1 [==============================] - ETA: 0s1/1 [==============================] - 0s 412ms/step
1/1 [==============================] - ETA: 0s1/1 [==============================] - 0s 46ms/step
1/1 [==============================] - ETA: 0s1/1 [==============================] - 0s 53ms/step
1/1 [==============================] - ETA: 0s1/1 [==============================] - 0s 397ms/step
[I 2024-12-23 18:27:30,341] Trial 13 finished with value: 1.568103285835657 and parameters: {'n_units_0': 44, 'dropout_1': 0.25, 'run': 3, 'epochs_1': 60, 'epochs_2': 30, 'lr_1': 0.0005429080450351473, 'lr_2': 0.0008106561872514704, 'batch_size': 8, 'regularization': 'l1', 'reg_alpha_1': 1.095017215723929e-05}. Best is trial 0 with value: 1.0128579211187816.
1/1 [==============================] - ETA: 0s1/1 [==============================] - 0s 410ms/step
1/1 [==============================] - ETA: 0s1/1 [==============================] - 0s 409ms/step
1/1 [==============================] - ETA: 0s1/1 [==============================] - 0s 373ms/step
1/1 [==============================] - ETA: 0s1/1 [==============================] - 0s 57ms/step
1/1 [==============================] - ETA: 0s1/1 [==============================] - 0s 41ms/step
[I 2024-12-23 18:27:32,347] Trial 14 finished with value: 0.4116949901790673 and parameters: {'n_units_0': 64, 'dropout_1': 0.15000000000000002, 'run': 3, 'epochs_1': 30, 'epochs_2': 50, 'lr_1': 0.0015107653087335614, 'lr_2': 2.2254614713958383e-05, 'batch_size': 16, 'regularization': 'l1_l2', 'reg_alpha_1': 0.000583488841966373, 'reg_alpha_2': 0.0009784074393024533}. Best is trial 2 with value: 0.2886060291488606.
1/1 [==============================] - ETA: 0s1/1 [==============================] - 0s 379ms/step
1/1 [==============================] - ETA: 0s1/1 [==============================] - 0s 371ms/step
1/1 [==============================] - ETA: 0s1/1 [==============================] - 0s 40ms/step
1/1 [==============================] - ETA: 0s1/1 [==============================] - 0s 41ms/step
1/1 [==============================] - ETA: 0s1/1 [==============================] - 0s 440ms/step
1/1 [==============================] - ETA: 0s1/1 [==============================] - 0s 414ms/step
1/1 [==============================] - ETA: 0s1/1 [==============================] - 0s 51ms/step
1/1 [==============================] - ETA: 0s1/1 [==============================] - 0s 51ms/step
[I 2024-12-23 18:27:43,159] Trial 15 finished with value: 0.6438968866989673 and parameters: {'n_units_0': 20, 'dropout_1': 0.15000000000000002, 'run': 3, 'epochs_1': 40, 'epochs_2': 100, 'lr_1': 0.00010220690547060614, 'lr_2': 2.1972722159805787e-05, 'batch_size': 12, 'regularization': 'l2', 'reg_alpha_1': 1.0403436020778304e-05}. Best is trial 8 with value: 0.4546888985283567.
Statistics value = 33.0 p-value = 0.01953125
1/1 [==============================] - ETA: 0s1/1 [==============================] - 0s 386ms/step
1/1 [==============================] - ETA: 0s1/1 [==============================] - 0s 408ms/step
Statistics value = 24.0 p-value = 0.23046875
1/1 [==============================] - ETA: 0s1/1 [==============================] - 0s 423ms/step
1/1 [==============================] - ETA: 0s1/1 [==============================] - 0s 385ms/step
Statistics value = 4.0 p-value = 0.9951171875
1/1 [==============================] - ETA: 0s1/1 [==============================] - 0s 417ms/step
1/1 [==============================] - ETA: 0s1/1 [==============================] - 0s 402ms/step
Statistics value = 32.0 p-value = 0.02734375
1/1 [==============================] - ETA: 0s1/1 [==============================] - 0s 407ms/step
1/1 [==============================] - ETA: 0s1/1 [==============================] - 0s 371ms/step
1/1 [==============================] - ETA: 0s1/1 [==============================] - 0s 49ms/step
1/1 [==============================] - ETA: 0s1/1 [==============================] - 0s 363ms/step
1/1 [==============================] - ETA: 0s1/1 [==============================] - 0s 40ms/step
1/1 [==============================] - ETA: 0s1/1 [==============================] - 0s 374ms/step
1/1 [==============================] - ETA: 0s1/1 [==============================] - 0s 44ms/step
1/1 [==============================] - ETA: 0s1/1 [==============================] - 0s 44ms/step
1/1 [==============================] - ETA: 0s1/1 [==============================] - 0s 395ms/step
1/1 [==============================] - ETA: 0s1/1 [==============================] - 0s 410ms/step
1/1 [==============================] - ETA: 0s1/1 [==============================] - 0s 44ms/step
1/1 [==============================] - ETA: 0s1/1 [==============================] - 0s 53ms/step
Statistics value = 37.0 p-value = 0.1875
1/1 [==============================] - ETA: 0s1/1 [==============================] - 0s 411ms/step
1/1 [==============================] - ETA: 0s1/1 [==============================] - 0s 381ms/step
1/1 [==============================] - ETA: 0s1/1 [==============================] - 0s 46ms/step
1/1 [==============================] - ETA: 0s1/1 [==============================] - 0s 54ms/step
Statistics value = 15.0 p-value = 0.9033203125
1/1 [==============================] - ETA: 0s1/1 [==============================] - 0s 387ms/step
1/1 [==============================] - ETA: 0s1/1 [==============================] - 0s 377ms/step
[I 2024-12-23 18:28:12,684] Trial 16 finished with value: 0.641239689362604 and parameters: {'n_units_0': 12, 'dropout_1': 0.3, 'run': 1, 'epochs_1': 70, 'epochs_2': 60, 'lr_1': 0.0008865560628037693, 'lr_2': 9.614047329008705e-05, 'batch_size': 16, 'regularization': 'l2', 'reg_alpha_1': 9.604433699998727e-05}. Best is trial 8 with value: 0.4546888985283567.
1/1 [==============================] - ETA: 0s1/1 [==============================] - 0s 366ms/step
1/1 [==============================] - ETA: 0s1/1 [==============================] - 0s 376ms/step
1/1 [==============================] - ETA: 0s1/1 [==============================] - 0s 42ms/step
1/1 [==============================] - ETA: 0s1/1 [==============================] - 0s 42ms/step
[I 2024-12-23 18:28:14,339] Trial 14 finished with value: 0.26961404458151744 and parameters: {'n_units_0': 44, 'dropout_1': 0.25, 'run': 2, 'epochs_1': 50, 'epochs_2': 100, 'lr_1': 0.0015035349502845765, 'lr_2': 2.1077950687316246e-05, 'batch_size': 8, 'regularization': 'l2', 'reg_alpha_1': 4.417603674318699e-05}. Best is trial 13 with value: 0.23257386099382837.
Statistics value = 31.0 p-value = 0.384765625
1/1 [==============================] - ETA: 0s1/1 [==============================] - 0s 417ms/step
1/1 [==============================] - ETA: 0s1/1 [==============================] - 0s 405ms/step
1/1 [==============================] - ETA: 0s1/1 [==============================] - 0s 454ms/step
1/1 [==============================] - ETA: 0s1/1 [==============================] - 0s 433ms/step
1/1 [==============================] - ETA: 0s1/1 [==============================] - 0s 52ms/step
1/1 [==============================] - ETA: 0s1/1 [==============================] - 0s 49ms/step
[I 2024-12-23 18:28:27,346] Trial 14 finished with value: 2.4279309648477962 and parameters: {'n_units_0': 64, 'dropout_1': 0.15000000000000002, 'run': 2, 'epochs_1': 80, 'epochs_2': 60, 'lr_1': 0.00146540232227398, 'lr_2': 2.264101174216791e-05, 'batch_size': 16, 'regularization': 'None'}. Best is trial 0 with value: 1.0128579211187816.
1/1 [==============================] - ETA: 0s1/1 [==============================] - 0s 444ms/step
1/1 [==============================] - ETA: 0s1/1 [==============================] - 0s 340ms/step
1/1 [==============================] - ETA: 0s1/1 [==============================] - 0s 41ms/step
1/1 [==============================] - ETA: 0s1/1 [==============================] - 0s 31ms/step
Statistics value = 5.0 p-value = 0.97265625
1/1 [==============================] - ETA: 0s1/1 [==============================] - 0s 334ms/step
[I 2024-12-23 18:28:28,817] Trial 15 finished with value: 0.40950227653543325 and parameters: {'n_units_0': 20, 'dropout_1': 0.25, 'run': 2, 'epochs_1': 40, 'epochs_2': 70, 'lr_1': 0.0034273608548774158, 'lr_2': 9.029245888295042e-05, 'batch_size': 12, 'regularization': 'l1', 'reg_alpha_1': 0.002279709361501178}. Best is trial 2 with value: 0.2886060291488606.
1/1 [==============================] - ETA: 0s1/1 [==============================] - 0s 329ms/step
Statistics value = 3.0 p-value = 0.98828125
1/1 [==============================] - ETA: 0s1/1 [==============================] - 0s 336ms/step
1/1 [==============================] - ETA: 0s1/1 [==============================] - 0s 351ms/step
1/1 [==============================] - ETA: 0s1/1 [==============================] - 0s 354ms/step
1/1 [==============================] - ETA: 0s1/1 [==============================] - 0s 379ms/step
1/1 [==============================] - ETA: 0s1/1 [==============================] - 0s 47ms/step
1/1 [==============================] - ETA: 0s1/1 [==============================] - 0s 40ms/step
1/1 [==============================] - ETA: 0s1/1 [==============================] - 0s 392ms/step
1/1 [==============================] - ETA: 0s1/1 [==============================] - 0s 428ms/step
1/1 [==============================] - ETA: 0s1/1 [==============================] - 0s 56ms/step
1/1 [==============================] - ETA: 0s1/1 [==============================] - 0s 41ms/step
Statistics value = 33.0 p-value = 0.01953125
1/1 [==============================] - ETA: 0s1/1 [==============================] - 0s 429ms/step
1/1 [==============================] - ETA: 0s1/1 [==============================] - 0s 431ms/step
Statistics value = 23.0 p-value = 0.2734375
1/1 [==============================] - ETA: 0s1/1 [==============================] - 0s 458ms/step
1/1 [==============================] - ETA: 0s1/1 [==============================] - 0s 444ms/step
Statistics value = 42.0 p-value = 0.080078125
1/1 [==============================] - ETA: 0s1/1 [==============================] - 0s 419ms/step
1/1 [==============================] - ETA: 0s1/1 [==============================] - 0s 387ms/step
1/1 [==============================] - ETA: 0s1/1 [==============================] - 1s 560ms/step
1/1 [==============================] - ETA: 0s1/1 [==============================] - 0s 402ms/step
1/1 [==============================] - ETA: 0s1/1 [==============================] - 0s 416ms/step
1/1 [==============================] - ETA: 0s1/1 [==============================] - 0s 60ms/step
1/1 [==============================] - ETA: 0s1/1 [==============================] - 0s 49ms/step
1/1 [==============================] - ETA: 0s1/1 [==============================] - 0s 390ms/step
Statistics value = 31.0 p-value = 0.384765625
1/1 [==============================] - ETA: 0s1/1 [==============================] - 0s 415ms/step
1/1 [==============================] - ETA: 0s1/1 [==============================] - 0s 410ms/step
1/1 [==============================] - ETA: 0s1/1 [==============================] - 0s 422ms/step
1/1 [==============================] - ETA: 0s1/1 [==============================] - 0s 415ms/step
1/1 [==============================] - ETA: 0s1/1 [==============================] - 0s 40ms/step
1/1 [==============================] - ETA: 0s1/1 [==============================] - 0s 41ms/step
[I 2024-12-23 18:29:13,253] Trial 15 finished with value: 0.25275549354265947 and parameters: {'n_units_0': 28, 'dropout_1': 0.25, 'run': 2, 'epochs_1': 60, 'epochs_2': 20, 'lr_1': 0.00038870699543928905, 'lr_2': 0.00010458650502121416, 'batch_size': 8, 'regularization': 'l2', 'reg_alpha_1': 1.040104332085961e-05}. Best is trial 13 with value: 0.23257386099382837.
Statistics value = 22.0 p-value = 0.7216796875
1/1 [==============================] - ETA: 0s1/1 [==============================] - 0s 451ms/step
1/1 [==============================] - ETA: 0s1/1 [==============================] - 0s 455ms/step
1/1 [==============================] - ETA: 0s1/1 [==============================] - 0s 384ms/step
1/1 [==============================] - ETA: 0s1/1 [==============================] - 0s 390ms/step
1/1 [==============================] - ETA: 0s1/1 [==============================] - 0s 48ms/step
1/1 [==============================] - ETA: 0s1/1 [==============================] - 0s 418ms/step
1/1 [==============================] - ETA: 0s1/1 [==============================] - 0s 41ms/step
1/1 [==============================] - ETA: 0s1/1 [==============================] - 0s 391ms/step
1/1 [==============================] - ETA: 0s1/1 [==============================] - 0s 55ms/step
1/1 [==============================] - ETA: 0s1/1 [==============================] - 0s 44ms/step
[I 2024-12-23 18:29:20,102] Trial 17 finished with value: 0.6517368404078923 and parameters: {'n_units_0': 44, 'dropout_1': 0.25, 'run': 2, 'epochs_1': 90, 'epochs_2': 80, 'lr_1': 0.0014289393356016887, 'lr_2': 1.0009600328263272e-05, 'batch_size': 12, 'regularization': 'l2', 'reg_alpha_1': 2.4961282701865207e-05}. Best is trial 8 with value: 0.4546888985283567.
Statistics value = 5.0 p-value = 0.97265625
1/1 [==============================] - ETA: 0s1/1 [==============================] - 0s 411ms/step
1/1 [==============================] - ETA: 0s1/1 [==============================] - 0s 412ms/step
1/1 [==============================] - ETA: 0s1/1 [==============================] - 0s 433ms/step
1/1 [==============================] - ETA: 0s1/1 [==============================] - 0s 422ms/step
1/1 [==============================] - ETA: 0s1/1 [==============================] - 0s 51ms/step
1/1 [==============================] - ETA: 0s1/1 [==============================] - 0s 41ms/step
