[I 2024-12-23 19:13:25,402] Trial 17 finished with value: 1.6790230236021726 and parameters: {'n_units_0': 44, 'dropout_1': 0.15000000000000002, 'run': 1, 'epochs_1': 70, 'epochs_2': 20, 'lr_1': 0.0007228270094869208, 'lr_2': 1.8938984110238145e-05, 'batch_size': 12, 'regularization': 'l2', 'reg_alpha_1': 0.002667709604992765}. Best is trial 2 with value: 1.018842370310491.
Statistics value = 21.0 p-value = 0.37109375
1/1 [==============================] - ETA: 0s1/1 [==============================] - 0s 407ms/step
1/1 [==============================] - ETA: 0s1/1 [==============================] - 0s 404ms/step
1/1 [==============================] - ETA: 0s1/1 [==============================] - 0s 52ms/step
1/1 [==============================] - ETA: 0s1/1 [==============================] - 0s 42ms/step
Statistics value = 5.0 p-value = 0.97265625
1/1 [==============================] - ETA: 0s1/1 [==============================] - 0s 384ms/step
1/1 [==============================] - ETA: 0s1/1 [==============================] - 0s 388ms/step
Statistics value = 21.0 p-value = 0.37109375
1/1 [==============================] - ETA: 0s1/1 [==============================] - 0s 408ms/step
1/1 [==============================] - ETA: 0s1/1 [==============================] - 0s 419ms/step
1/1 [==============================] - ETA: 0s1/1 [==============================] - 0s 74ms/step
1/1 [==============================] - ETA: 0s1/1 [==============================] - 0s 40ms/step
Statistics value = 34.0 p-value = 0.01171875
1/1 [==============================] - ETA: 0s1/1 [==============================] - 0s 417ms/step
1/1 [==============================] - ETA: 0s1/1 [==============================] - 0s 415ms/step
Statistics value = 47.0 p-value = 0.0244140625
1/1 [==============================] - ETA: 0s1/1 [==============================] - 0s 447ms/step
1/1 [==============================] - ETA: 0s1/1 [==============================] - 0s 409ms/step
1/1 [==============================] - ETA: 0s1/1 [==============================] - 0s 53ms/step
1/1 [==============================] - ETA: 0s1/1 [==============================] - 0s 44ms/step
[I 2024-12-23 19:13:45,125] Trial 17 finished with value: 0.7844669809286178 and parameters: {'n_units_0': 32, 'dropout_1': 0.15000000000000002, 'run': 1, 'epochs_1': 50, 'epochs_2': 60, 'lr_1': 0.00010182712311136019, 'lr_2': 1.9356450104946525e-05, 'batch_size': 8, 'regularization': 'None'}. Best is trial 2 with value: 0.485481997056363.
1/1 [==============================] - ETA: 0s1/1 [==============================] - 0s 398ms/step
1/1 [==============================] - ETA: 0s1/1 [==============================] - 0s 397ms/step
Statistics value = 25.0 p-value = 0.615234375
1/1 [==============================] - ETA: 0s1/1 [==============================] - 0s 441ms/step
1/1 [==============================] - ETA: 0s1/1 [==============================] - 0s 408ms/step
1/1 [==============================] - ETA: 0s1/1 [==============================] - 0s 51ms/step
1/1 [==============================] - ETA: 0s1/1 [==============================] - 0s 53ms/step
1/1 [==============================] - ETA: 0s1/1 [==============================] - 0s 413ms/step
1/1 [==============================] - ETA: 0s1/1 [==============================] - 0s 398ms/step
[I 2024-12-23 19:13:54,840] Trial 17 finished with value: 0.30039807345396796 and parameters: {'n_units_0': 32, 'dropout_1': 0.15000000000000002, 'run': 1, 'epochs_1': 50, 'epochs_2': 60, 'lr_1': 0.00010182712311136019, 'lr_2': 1.9356450104946525e-05, 'batch_size': 8, 'regularization': 'None'}. Best is trial 2 with value: 0.28503285058207284.
1/1 [==============================] - ETA: 0s1/1 [==============================] - 0s 42ms/step
1/1 [==============================] - ETA: 0s1/1 [==============================] - 0s 48ms/step
Statistics value = 24.0 p-value = 0.23046875
1/1 [==============================] - ETA: 0s1/1 [==============================] - 0s 411ms/step
1/1 [==============================] - ETA: 0s1/1 [==============================] - 0s 445ms/step
1/1 [==============================] - ETA: 0s1/1 [==============================] - 0s 386ms/step
1/1 [==============================] - ETA: 0s1/1 [==============================] - 0s 394ms/step
1/1 [==============================] - ETA: 0s1/1 [==============================] - 0s 52ms/step
1/1 [==============================] - ETA: 0s1/1 [==============================] - 0s 44ms/step
Statistics value = 20.0 p-value = 0.7841796875
1/1 [==============================] - ETA: 0s1/1 [==============================] - 0s 427ms/step
Statistics value = 19.0 p-value = 0.47265625
1/1 [==============================] - ETA: 0s1/1 [==============================] - 0s 404ms/step
1/1 [==============================] - ETA: 0s1/1 [==============================] - 0s 415ms/step
1/1 [==============================] - ETA: 0s1/1 [==============================] - 0s 402ms/step
Statistics value = 3.0 p-value = 0.9970703125
1/1 [==============================] - ETA: 0s1/1 [==============================] - 0s 392ms/step
1/1 [==============================] - ETA: 0s1/1 [==============================] - 0s 384ms/step
1/1 [==============================] - ETA: 0s1/1 [==============================] - 0s 437ms/step
1/1 [==============================] - ETA: 0s1/1 [==============================] - 0s 402ms/step
1/1 [==============================] - ETA: 0s1/1 [==============================] - 0s 58ms/step
1/1 [==============================] - ETA: 0s1/1 [==============================] - 0s 47ms/step
1/1 [==============================] - ETA: 0s1/1 [==============================] - 0s 423ms/step
1/1 [==============================] - ETA: 0s1/1 [==============================] - 0s 377ms/step
1/1 [==============================] - ETA: 0s1/1 [==============================] - 0s 429ms/step
1/1 [==============================] - ETA: 0s1/1 [==============================] - 0s 404ms/step
1/1 [==============================] - ETA: 0s1/1 [==============================] - 0s 378ms/step
1/1 [==============================] - ETA: 0s1/1 [==============================] - 0s 47ms/step
1/1 [==============================] - ETA: 0s1/1 [==============================] - 0s 53ms/step
1/1 [==============================] - ETA: 0s1/1 [==============================] - 0s 425ms/step
1/1 [==============================] - ETA: 0s1/1 [==============================] - 0s 44ms/step
1/1 [==============================] - ETA: 0s1/1 [==============================] - 0s 45ms/step
[I 2024-12-23 19:14:25,907] Trial 18 finished with value: 1.4514036469532918 and parameters: {'n_units_0': 32, 'dropout_1': 0.25, 'run': 2, 'epochs_1': 60, 'epochs_2': 50, 'lr_1': 0.0006859748044625673, 'lr_2': 3.011658968299996e-05, 'batch_size': 8, 'regularization': 'None'}. Best is trial 2 with value: 1.018842370310491.
Statistics value = 14.0 p-value = 0.919921875
1/1 [==============================] - ETA: 0s1/1 [==============================] - 1s 536ms/step
1/1 [==============================] - ETA: 0s1/1 [==============================] - 0s 420ms/step
1/1 [==============================] - ETA: 0s1/1 [==============================] - 0s 399ms/step
1/1 [==============================] - ETA: 0s1/1 [==============================] - 0s 368ms/step
1/1 [==============================] - ETA: 0s1/1 [==============================] - 0s 48ms/step
1/1 [==============================] - ETA: 0s1/1 [==============================] - 0s 46ms/step
[I 2024-12-23 19:14:36,547] Trial 19 finished with value: 0.273827683616223 and parameters: {'n_units_0': 52, 'dropout_1': 0.15000000000000002, 'run': 3, 'epochs_1': 50, 'epochs_2': 50, 'lr_1': 0.0010947688253480602, 'lr_2': 2.0462740185488014e-05, 'batch_size': 12, 'regularization': 'l2', 'reg_alpha_1': 0.00011565513838081995}. Best is trial 5 with value: 0.23331575033106378.
Statistics value = 43.0 p-value = 0.0654296875
1/1 [==============================] - ETA: 0s1/1 [==============================] - 0s 419ms/step
1/1 [==============================] - ETA: 0s1/1 [==============================] - 0s 382ms/step
1/1 [==============================] - ETA: 0s1/1 [==============================] - 0s 404ms/step
1/1 [==============================] - ETA: 0s1/1 [==============================] - 0s 420ms/step
1/1 [==============================] - ETA: 0s1/1 [==============================] - 0s 42ms/step
1/1 [==============================] - ETA: 0s1/1 [==============================] - 0s 45ms/step
Statistics value = 34.0 p-value = 0.01171875
1/1 [==============================] - ETA: 0s1/1 [==============================] - 0s 444ms/step
[I 2024-12-23 19:14:40,375] Trial 18 finished with value: 0.4198887834275359 and parameters: {'n_units_0': 4, 'dropout_1': 0.25, 'run': 2, 'epochs_1': 60, 'epochs_2': 50, 'lr_1': 0.0003042053533042828, 'lr_2': 0.00019298826820903913, 'batch_size': 12, 'regularization': 'l1', 'reg_alpha_1': 7.12313164346007e-05}. Best is trial 18 with value: 0.4198887834275359.
1/1 [==============================] - ETA: 0s1/1 [==============================] - 0s 452ms/step
1/1 [==============================] - ETA: 0s1/1 [==============================] - 0s 384ms/step
1/1 [==============================] - ETA: 0s1/1 [==============================] - 0s 383ms/step
1/1 [==============================] - ETA: 0s1/1 [==============================] - 0s 49ms/step
1/1 [==============================] - ETA: 0s1/1 [==============================] - 0s 40ms/step
[I 2024-12-23 19:14:49,994] Trial 18 finished with value: 0.30383386025247155 and parameters: {'n_units_0': 4, 'dropout_1': 0.25, 'run': 2, 'epochs_1': 60, 'epochs_2': 50, 'lr_1': 0.0003042053533042828, 'lr_2': 0.00019298826820903913, 'batch_size': 12, 'regularization': 'l1', 'reg_alpha_1': 7.12313164346007e-05}. Best is trial 2 with value: 0.28503285058207284.
Statistics value = 31.0 p-value = 0.0390625
1/1 [==============================] - ETA: 0s1/1 [==============================] - 1s 623ms/step
1/1 [==============================] - ETA: 0s1/1 [==============================] - 1s 586ms/step
Statistics value = 20.0 p-value = 0.421875
1/1 [==============================] - ETA: 0s1/1 [==============================] - 0s 401ms/step
1/1 [==============================] - ETA: 0s1/1 [==============================] - 0s 396ms/step
1/1 [==============================] - ETA: 0s1/1 [==============================] - 0s 450ms/step
1/1 [==============================] - ETA: 0s1/1 [==============================] - 0s 417ms/step
1/1 [==============================] - ETA: 0s1/1 [==============================] - 0s 51ms/step
1/1 [==============================] - ETA: 0s1/1 [==============================] - 0s 43ms/step
1/1 [==============================] - ETA: 0s1/1 [==============================] - 0s 396ms/step
1/1 [==============================] - ETA: 0s1/1 [==============================] - 0s 411ms/step
1/1 [==============================] - ETA: 0s1/1 [==============================] - 0s 48ms/step
1/1 [==============================] - ETA: 0s1/1 [==============================] - 0s 41ms/step
1/1 [==============================] - ETA: 0s1/1 [==============================] - 0s 440ms/step
1/1 [==============================] - ETA: 0s1/1 [==============================] - 0s 393ms/step
1/1 [==============================] - ETA: 0s1/1 [==============================] - 0s 44ms/step
1/1 [==============================] - ETA: 0s1/1 [==============================] - 0s 44ms/step
Statistics value = 35.0 p-value = 0.24609375
1/1 [==============================] - ETA: 0s1/1 [==============================] - 0s 438ms/step
1/1 [==============================] - ETA: 0s1/1 [==============================] - 0s 403ms/step
1/1 [==============================] - ETA: 0s1/1 [==============================] - 0s 402ms/step
1/1 [==============================] - ETA: 0s1/1 [==============================] - 0s 444ms/step
1/1 [==============================] - ETA: 0s1/1 [==============================] - 0s 49ms/step
1/1 [==============================] - ETA: 0s1/1 [==============================] - 0s 40ms/step
Statistics value = 24.0 p-value = 0.65234375
1/1 [==============================] - ETA: 0s1/1 [==============================] - 0s 446ms/step
1/1 [==============================] - ETA: 0s1/1 [==============================] - 0s 399ms/step
Statistics value = 11.0 p-value = 0.9580078125
1/1 [==============================] - ETA: 0s1/1 [==============================] - 0s 436ms/step
[I 2024-12-23 19:15:35,204] Trial 19 finished with value: 1.6015791026044643 and parameters: {'n_units_0': 16, 'dropout_1': 0.15000000000000002, 'run': 2, 'epochs_1': 40, 'epochs_2': 100, 'lr_1': 0.0001715383431338473, 'lr_2': 0.0009720432081137192, 'batch_size': 16, 'regularization': 'l1_l2', 'reg_alpha_1': 0.00047846605844165644, 'reg_alpha_2': 0.00017221754639746973}. Best is trial 2 with value: 1.018842370310491.
1/1 [==============================] - ETA: 0s1/1 [==============================] - 0s 429ms/step
1/1 [==============================] - ETA: 0s1/1 [==============================] - 0s 421ms/step
1/1 [==============================] - ETA: 0s1/1 [==============================] - 0s 397ms/step
1/1 [==============================] - ETA: 0s1/1 [==============================] - 0s 54ms/step
1/1 [==============================] - ETA: 0s1/1 [==============================] - 0s 44ms/step
[I 2024-12-23 19:15:46,401] Trial 19 finished with value: 0.3063192236619165 and parameters: {'n_units_0': 24, 'dropout_1': 0.15000000000000002, 'run': 2, 'epochs_1': 30, 'epochs_2': 30, 'lr_1': 0.0005308695300482681, 'lr_2': 3.312965424600571e-05, 'batch_size': 12, 'regularization': 'l1_l2', 'reg_alpha_1': 0.0023932297815924685, 'reg_alpha_2': 0.00017221754639746973}. Best is trial 2 with value: 0.28503285058207284.
1/1 [==============================] - ETA: 0s1/1 [==============================] - 0s 450ms/step
1/1 [==============================] - ETA: 0s1/1 [==============================] - 0s 418ms/step
1/1 [==============================] - ETA: 0s1/1 [==============================] - 0s 47ms/step
1/1 [==============================] - ETA: 0s1/1 [==============================] - 0s 58ms/step
[I 2024-12-23 19:15:49,743] Trial 19 finished with value: 0.49608913662092713 and parameters: {'n_units_0': 4, 'dropout_1': 0.25, 'run': 2, 'epochs_1': 80, 'epochs_2': 50, 'lr_1': 0.00030296210969498345, 'lr_2': 0.00033801672372022043, 'batch_size': 12, 'regularization': 'l1_l2', 'reg_alpha_1': 6.914463694028373e-05, 'reg_alpha_2': 0.00017221754639746973}. Best is trial 18 with value: 0.4198887834275359.
Statistics value = 32.0 p-value = 0.02734375
Statistics value = 4.0 p-value = 0.98046875
Statistics value = 18.0 p-value = 0.52734375
Statistics value = 22.0 p-value = 0.3203125

EVER Study Best parameters:
{'n_units_0': 12, 'dropout_1': 0.3, 'run': 1, 'epochs_1': 100, 'epochs_2': 80, 'lr_1': 0.00024970737145052745, 'lr_2': 1.0257563974185649e-05, 'batch_size': 16, 'regularization': 'l2', 'reg_alpha_1': 0.0001189589673755355}
Best value (Average MSE): 0.23331575033106378

EV Study Best parameters:
{'n_units_0': 16, 'dropout_1': 0.2, 'run': 2, 'epochs_1': 30, 'epochs_2': 70, 'lr_1': 0.00021930485556643703, 'lr_2': 1.3492834268013232e-05, 'batch_size': 16, 'regularization': 'l1_l2', 'reg_alpha_1': 0.0011290133559092666, 'reg_alpha_2': 0.00020914981329035596}
Best value (Average MSE): 1.018842370310491

PHEV Study Best parameters:
{'n_units_0': 4, 'dropout_1': 0.25, 'run': 2, 'epochs_1': 60, 'epochs_2': 50, 'lr_1': 0.0003042053533042828, 'lr_2': 0.00019298826820903913, 'batch_size': 12, 'regularization': 'l1', 'reg_alpha_1': 7.12313164346007e-05}
Best value (Average MSE): 0.4198887834275359

FUEL Study Best parameters:
{'n_units_0': 16, 'dropout_1': 0.2, 'run': 2, 'epochs_1': 30, 'epochs_2': 70, 'lr_1': 0.00021930485556643703, 'lr_2': 1.3492834268013232e-05, 'batch_size': 16, 'regularization': 'l1_l2', 'reg_alpha_1': 0.0011290133559092666, 'reg_alpha_2': 0.00020914981329035596}
Best value (Average MSE): 0.28503285058207284
