[I 2024-12-23 17:15:37,949] Trial 11 finished with value: 1.1175996266356112 and parameters: {'n_units_0': 40, 'dropout_1': 0.25, 'run': 3, 'epochs_1': 30, 'epochs_2': 20, 'lr_1': 0.00011660786382708495, 'lr_2': 0.0001724802944940557, 'batch_size': 12, 'regularization': 'None'}. Best is trial 11 with value: 1.1175996266356112.
Statistics value = 5.0 p-value = 0.97265625
1/1 [==============================] - ETA: 0s1/1 [==============================] - 0s 410ms/step
1/1 [==============================] - ETA: 0s1/1 [==============================] - 0s 378ms/step
1/1 [==============================] - ETA: 0s1/1 [==============================] - 0s 409ms/step
1/1 [==============================] - ETA: 0s1/1 [==============================] - 0s 393ms/step
1/1 [==============================] - ETA: 0s1/1 [==============================] - 0s 51ms/step
Statistics value = 43.0 p-value = 0.0654296875
1/1 [==============================] - ETA: 0s1/1 [==============================] - 0s 395ms/step
1/1 [==============================] - ETA: 0s1/1 [==============================] - 0s 50ms/step
1/1 [==============================] - ETA: 0s1/1 [==============================] - 0s 401ms/step
Statistics value = 12.0 p-value = 0.80859375
1/1 [==============================] - ETA: 0s1/1 [==============================] - 0s 373ms/step
1/1 [==============================] - ETA: 0s1/1 [==============================] - 0s 398ms/step
Statistics value = 26.0 p-value = 0.5771484375
1/1 [==============================] - ETA: 0s1/1 [==============================] - 0s 416ms/step
1/1 [==============================] - ETA: 0s1/1 [==============================] - 0s 402ms/step
1/1 [==============================] - ETA: 0s1/1 [==============================] - 0s 405ms/step
1/1 [==============================] - ETA: 0s1/1 [==============================] - 0s 414ms/step
1/1 [==============================] - ETA: 0s1/1 [==============================] - 0s 413ms/step
1/1 [==============================] - ETA: 0s1/1 [==============================] - 0s 39ms/step
1/1 [==============================] - ETA: 0s1/1 [==============================] - 0s 50ms/step
1/1 [==============================] - ETA: 0s1/1 [==============================] - 0s 401ms/step
1/1 [==============================] - ETA: 0s1/1 [==============================] - 0s 43ms/step
1/1 [==============================] - ETA: 0s1/1 [==============================] - 0s 42ms/step
[I 2024-12-23 17:15:57,850] Trial 12 finished with value: 0.2576940633908982 and parameters: {'n_units_0': 28, 'dropout_1': 0.25, 'run': 2, 'epochs_1': 50, 'epochs_2': 20, 'lr_1': 0.0004957547237088648, 'lr_2': 0.0008538648795388481, 'batch_size': 16, 'regularization': 'l1', 'reg_alpha_1': 2.1684987806223704e-05}. Best is trial 8 with value: 0.23297807833283832.
1/1 [==============================] - ETA: 0s1/1 [==============================] - 0s 416ms/step
1/1 [==============================] - ETA: 0s1/1 [==============================] - 0s 378ms/step
1/1 [==============================] - ETA: 0s1/1 [==============================] - 0s 396ms/step
1/1 [==============================] - ETA: 0s1/1 [==============================] - 0s 411ms/step
1/1 [==============================] - ETA: 0s1/1 [==============================] - 0s 44ms/step
1/1 [==============================] - ETA: 0s1/1 [==============================] - 0s 44ms/step
[I 2024-12-23 17:16:06,650] Trial 12 finished with value: 0.4038456874901436 and parameters: {'n_units_0': 28, 'dropout_1': 0.15000000000000002, 'run': 2, 'epochs_1': 30, 'epochs_2': 60, 'lr_1': 0.00010525521998095273, 'lr_2': 0.0008607419445086135, 'batch_size': 12, 'regularization': 'None'}. Best is trial 2 with value: 0.2908927571689997.
Statistics value = 33.0 p-value = 0.3125
1/1 [==============================] - ETA: 0s1/1 [==============================] - 0s 422ms/step
Statistics value = 3.0 p-value = 0.98828125
1/1 [==============================] - ETA: 0s1/1 [==============================] - 0s 375ms/step
1/1 [==============================] - ETA: 0s1/1 [==============================] - 0s 382ms/step
1/1 [==============================] - ETA: 0s1/1 [==============================] - 0s 392ms/step
1/1 [==============================] - ETA: 0s1/1 [==============================] - 0s 398ms/step
1/1 [==============================] - ETA: 0s1/1 [==============================] - 0s 414ms/step
1/1 [==============================] - ETA: 0s1/1 [==============================] - 0s 54ms/step
1/1 [==============================] - ETA: 0s1/1 [==============================] - 0s 42ms/step
Statistics value = 25.0 p-value = 0.19140625
1/1 [==============================] - ETA: 0s1/1 [==============================] - 0s 406ms/step
1/1 [==============================] - ETA: 0s1/1 [==============================] - 0s 382ms/step
1/1 [==============================] - ETA: 0s1/1 [==============================] - 0s 367ms/step
1/1 [==============================] - ETA: 0s1/1 [==============================] - 0s 390ms/step
1/1 [==============================] - ETA: 0s1/1 [==============================] - 0s 411ms/step
1/1 [==============================] - ETA: 0s1/1 [==============================] - 0s 407ms/step
1/1 [==============================] - ETA: 0s1/1 [==============================] - 0s 52ms/step
1/1 [==============================] - ETA: 0s1/1 [==============================] - 0s 53ms/step
Statistics value = 18.0 p-value = 0.8388671875
1/1 [==============================] - ETA: 0s1/1 [==============================] - 0s 432ms/step
1/1 [==============================] - ETA: 0s1/1 [==============================] - ETA: 0s1/1 [==============================] - 0s 58ms/step
1/1 [==============================] - 0s 58ms/step
1/1 [==============================] - ETA: 0s1/1 [==============================] - 0s 420ms/step
[I 2024-12-23 17:16:24,479] Trial 12 finished with value: 0.5751718229219822 and parameters: {'n_units_0': 40, 'dropout_1': 0.1, 'run': 2, 'epochs_1': 60, 'epochs_2': 100, 'lr_1': 0.006948293898915453, 'lr_2': 0.0009057608071654824, 'batch_size': 12, 'regularization': 'None'}. Best is trial 6 with value: 0.4750649506232465.
1/1 [==============================] - ETA: 0s1/1 [==============================] - 0s 373ms/step
1/1 [==============================] - ETA: 0s1/1 [==============================] - 0s 373ms/step
1/1 [==============================] - ETA: 0s1/1 [==============================] - 0s 388ms/step
Statistics value = 6.0 p-value = 0.9609375
1/1 [==============================] - ETA: 0s1/1 [==============================] - 0s 363ms/step
1/1 [==============================] - ETA: 0s1/1 [==============================] - 0s 358ms/step
1/1 [==============================] - ETA: 0s1/1 [==============================] - 0s 44ms/step
1/1 [==============================] - ETA: 0s1/1 [==============================] - 0s 40ms/step
1/1 [==============================] - ETA: 0s1/1 [==============================] - 0s 366ms/step
Statistics value = 0.0 p-value = 1.0
1/1 [==============================] - ETA: 0s1/1 [==============================] - 0s 412ms/step
1/1 [==============================] - ETA: 0s1/1 [==============================] - 0s 332ms/step
1/1 [==============================] - ETA: 0s1/1 [==============================] - 0s 424ms/step
1/1 [==============================] - ETA: 0s1/1 [==============================] - 0s 393ms/step
1/1 [==============================] - ETA: 0s1/1 [==============================] - 0s 49ms/step
1/1 [==============================] - ETA: 0s1/1 [==============================] - 0s 52ms/step
[I 2024-12-23 17:16:50,506] Trial 12 finished with value: 1.167634626379428 and parameters: {'n_units_0': 36, 'dropout_1': 0.25, 'run': 3, 'epochs_1': 40, 'epochs_2': 20, 'lr_1': 0.00010779497125564444, 'lr_2': 0.00023980757674358714, 'batch_size': 12, 'regularization': 'None'}. Best is trial 11 with value: 1.1175996266356112.
1/1 [==============================] - ETA: 0s1/1 [==============================] - 0s 418ms/step
1/1 [==============================] - ETA: 0s1/1 [==============================] - 0s 387ms/step
1/1 [==============================] - ETA: 0s1/1 [==============================] - 0s 400ms/step
1/1 [==============================] - ETA: 0s1/1 [==============================] - 0s 41ms/step
1/1 [==============================] - ETA: 0s1/1 [==============================] - 0s 390ms/step
1/1 [==============================] - ETA: 0s1/1 [==============================] - 0s 55ms/step
1/1 [==============================] - ETA: 0s1/1 [==============================] - 0s 51ms/step
1/1 [==============================] - ETA: 0s1/1 [==============================] - 0s 42ms/step
[I 2024-12-23 17:16:57,763] Trial 13 finished with value: 0.27663571904168033 and parameters: {'n_units_0': 40, 'dropout_1': 0.25, 'run': 2, 'epochs_1': 50, 'epochs_2': 60, 'lr_1': 0.0022118702914464255, 'lr_2': 2.6885431803887616e-05, 'batch_size': 16, 'regularization': 'l2', 'reg_alpha_1': 0.001283622594897186}. Best is trial 8 with value: 0.23297807833283832.
Statistics value = 27.0 p-value = 0.5390625
1/1 [==============================] - ETA: 0s1/1 [==============================] - 0s 444ms/step
1/1 [==============================] - ETA: 0s1/1 [==============================] - 0s 436ms/step
Statistics value = 16.0 p-value = 0.62890625
1/1 [==============================] - ETA: 0s1/1 [==============================] - 0s 426ms/step
1/1 [==============================] - ETA: 0s1/1 [==============================] - 0s 401ms/step
Statistics value = 3.0 p-value = 0.98828125
1/1 [==============================] - ETA: 0s1/1 [==============================] - 0s 414ms/step
1/1 [==============================] - ETA: 0s1/1 [==============================] - 0s 418ms/step
Statistics value = 25.0 p-value = 0.615234375
1/1 [==============================] - ETA: 0s1/1 [==============================] - 0s 436ms/step
1/1 [==============================] - ETA: 0s1/1 [==============================] - 0s 414ms/step
1/1 [==============================] - ETA: 0s1/1 [==============================] - 0s 410ms/step
1/1 [==============================] - ETA: 0s1/1 [==============================] - 0s 399ms/step
1/1 [==============================] - ETA: 0s1/1 [==============================] - 0s 376ms/step
1/1 [==============================] - ETA: 0s1/1 [==============================] - 0s 385ms/step
1/1 [==============================] - ETA: 0s1/1 [==============================] - 0s 43ms/step
1/1 [==============================] - ETA: 0s1/1 [==============================] - 0s 49ms/step
[I 2024-12-23 17:17:22,198] Trial 13 finished with value: 0.4058623665625173 and parameters: {'n_units_0': 44, 'dropout_1': 0.25, 'run': 2, 'epochs_1': 50, 'epochs_2': 90, 'lr_1': 0.0004948068192559079, 'lr_2': 0.00011550287009382684, 'batch_size': 8, 'regularization': 'l1', 'reg_alpha_1': 0.0009715366035201349}. Best is trial 2 with value: 0.2908927571689997.
1/1 [==============================] - ETA: 0s1/1 [==============================] - 0s 424ms/step
1/1 [==============================] - ETA: 0s1/1 [==============================] - 0s 423ms/step
Statistics value = 19.0 p-value = 0.47265625
1/1 [==============================] - ETA: 0s1/1 [==============================] - 0s 423ms/step
1/1 [==============================] - ETA: 0s1/1 [==============================] - 0s 374ms/step
1/1 [==============================] - ETA: 0s1/1 [==============================] - 0s 434ms/step
1/1 [==============================] - ETA: 0s1/1 [==============================] - 0s 404ms/step
1/1 [==============================] - ETA: 0s1/1 [==============================] - 0s 398ms/step
1/1 [==============================] - ETA: 0s1/1 [==============================] - 0s 359ms/step
1/1 [==============================] - ETA: 0s1/1 [==============================] - 0s 47ms/step
1/1 [==============================] - ETA: 0s1/1 [==============================] - 0s 49ms/step
1/1 [==============================] - ETA: 0s1/1 [==============================] - 0s 43ms/step
1/1 [==============================] - ETA: 0s1/1 [==============================] - 0s 42ms/step
