[I 2024-12-23 19:35:41,097] Trial 17 finished with value: 1.1159004982327656 and parameters: {'n_units_0': 4, 'dropout_1': 0.1, 'run': 1, 'epochs_1': 80, 'epochs_2': 90, 'lr_1': 0.0006289111532007969, 'lr_2': 0.00010297218090564382, 'batch_size': 12, 'regularization': 'l1_l2', 'reg_alpha_1': 4.5164594450094275e-05, 'reg_alpha_2': 0.0039032883526821834}. Best is trial 16 with value: 1.03777630348252.
Statistics value = 46.0 p-value = 0.0322265625
1/1 [==============================] - ETA: 0s1/1 [==============================] - 0s 409ms/step
Statistics value = 29.0 p-value = 0.4609375
1/1 [==============================] - ETA: 0s1/1 [==============================] - 0s 412ms/step
1/1 [==============================] - ETA: 0s1/1 [==============================] - 0s 401ms/step
1/1 [==============================] - ETA: 0s1/1 [==============================] - 0s 414ms/step
1/1 [==============================] - ETA: 0s1/1 [==============================] - 0s 430ms/step
1/1 [==============================] - ETA: 0s1/1 [==============================] - 0s 409ms/step
1/1 [==============================] - ETA: 0s1/1 [==============================] - 0s 48ms/step
1/1 [==============================] - ETA: 0s1/1 [==============================] - 0s 47ms/step
Statistics value = 12.0 p-value = 0.80859375
1/1 [==============================] - ETA: 0s1/1 [==============================] - 0s 398ms/step
1/1 [==============================] - ETA: 0s1/1 [==============================] - 0s 366ms/step
1/1 [==============================] - ETA: 0s1/1 [==============================] - 0s 45ms/step
1/1 [==============================] - ETA: 0s1/1 [==============================] - 0s 49ms/step
1/1 [==============================] - ETA: 0s1/1 [==============================] - 0s 399ms/step
1/1 [==============================] - ETA: 0s1/1 [==============================] - 0s 409ms/step
1/1 [==============================] - ETA: 0s1/1 [==============================] - 0s 425ms/step
1/1 [==============================] - ETA: 0s1/1 [==============================] - 0s 421ms/step
Statistics value = 32.0 p-value = 0.34765625
1/1 [==============================] - ETA: 0s1/1 [==============================] - 0s 337ms/step
1/1 [==============================] - ETA: 0s1/1 [==============================] - 0s 345ms/step
1/1 [==============================] - ETA: 0s1/1 [==============================] - 0s 349ms/step
1/1 [==============================] - ETA: 0s1/1 [==============================] - 0s 364ms/step
1/1 [==============================] - ETA: 0s1/1 [==============================] - 0s 311ms/step
1/1 [==============================] - ETA: 0s1/1 [==============================] - 0s 314ms/step
1/1 [==============================] - ETA: 0s1/1 [==============================] - 0s 28ms/step
1/1 [==============================] - ETA: 0s1/1 [==============================] - 0s 30ms/step
1/1 [==============================] - ETA: 0s1/1 [==============================] - 0s 29ms/step
1/1 [==============================] - ETA: 0s1/1 [==============================] - 0s 29ms/step
Statistics value = 19.0 p-value = 0.8125
1/1 [==============================] - ETA: 0s1/1 [==============================] - 0s 356ms/step
[I 2024-12-23 19:36:14,371] Trial 16 finished with value: 0.3025115094750842 and parameters: {'n_units_0': 48, 'dropout_1': 0.1, 'run': 3, 'epochs_1': 40, 'epochs_2': 50, 'lr_1': 0.00010411046619391087, 'lr_2': 7.756193022802541e-05, 'batch_size': 16, 'regularization': 'None'}. Best is trial 4 with value: 0.2935738766159764.
[I 2024-12-23 19:36:14,407] Trial 16 finished with value: 0.23668573520380784 and parameters: {'n_units_0': 48, 'dropout_1': 0.1, 'run': 3, 'epochs_1': 40, 'epochs_2': 50, 'lr_1': 0.00010411046619391087, 'lr_2': 7.756193022802541e-05, 'batch_size': 16, 'regularization': 'None'}. Best is trial 4 with value: 0.23212443231328786.
1/1 [==============================] - ETA: 0s1/1 [==============================] - 0s 325ms/step
1/1 [==============================] - ETA: 0s1/1 [==============================] - 0s 30ms/step
1/1 [==============================] - ETA: 0s1/1 [==============================] - 0s 32ms/step
[I 2024-12-23 19:36:15,327] Trial 18 finished with value: 1.6653470000168864 and parameters: {'n_units_0': 4, 'dropout_1': 0.1, 'run': 1, 'epochs_1': 80, 'epochs_2': 90, 'lr_1': 0.0019687741469377393, 'lr_2': 0.00010126398661569834, 'batch_size': 8, 'regularization': 'l1_l2', 'reg_alpha_1': 8.561519374510935e-05, 'reg_alpha_2': 0.006056119903340939}. Best is trial 16 with value: 1.03777630348252.
1/1 [==============================] - ETA: 0s1/1 [==============================] - 0s 401ms/step
Statistics value = 5.0 p-value = 0.97265625
1/1 [==============================] - ETA: 0s1/1 [==============================] - 0s 393ms/step
1/1 [==============================] - ETA: 0s1/1 [==============================] - 0s 396ms/step
Statistics value = 20.0 p-value = 0.421875
1/1 [==============================] - ETA: 0s1/1 [==============================] - 0s 406ms/step
1/1 [==============================] - ETA: 0s1/1 [==============================] - 0s 51ms/step
1/1 [==============================] - ETA: 0s1/1 [==============================] - 0s 397ms/step
1/1 [==============================] - ETA: 0s1/1 [==============================] - 0s 46ms/step
1/1 [==============================] - ETA: 0s1/1 [==============================] - 0s 388ms/step
[I 2024-12-23 19:36:28,872] Trial 17 finished with value: 0.6714233869372562 and parameters: {'n_units_0': 44, 'dropout_1': 0.15000000000000002, 'run': 2, 'epochs_1': 80, 'epochs_2': 50, 'lr_1': 0.0039060295435833967, 'lr_2': 0.00014203894171699522, 'batch_size': 8, 'regularization': 'l1_l2', 'reg_alpha_1': 0.0017314698333193992, 'reg_alpha_2': 1.0843603593919683e-05}. Best is trial 15 with value: 0.43226538043361695.
Statistics value = 33.0 p-value = 0.01953125
1/1 [==============================] - ETA: 0s1/1 [==============================] - 0s 396ms/step
1/1 [==============================] - ETA: 0s1/1 [==============================] - 0s 411ms/step
1/1 [==============================] - ETA: 0s1/1 [==============================] - 0s 45ms/step
1/1 [==============================] - ETA: 0s1/1 [==============================] - 0s 53ms/step
1/1 [==============================] - ETA: 0s1/1 [==============================] - 0s 419ms/step
1/1 [==============================] - ETA: 0s1/1 [==============================] - 0s 493ms/step
1/1 [==============================] - ETA: 0s1/1 [==============================] - 0s 393ms/step
1/1 [==============================] - ETA: 0s1/1 [==============================] - 0s 424ms/step
Statistics value = 14.0 p-value = 0.7265625
1/1 [==============================] - ETA: 0s1/1 [==============================] - 0s 432ms/step
Statistics value = 13.0 p-value = 0.9345703125
1/1 [==============================] - ETA: 0s1/1 [==============================] - 0s 435ms/step
1/1 [==============================] - ETA: 0s1/1 [==============================] - 0s 406ms/step
1/1 [==============================] - ETA: 0s1/1 [==============================] - 0s 403ms/step
1/1 [==============================] - ETA: 0s1/1 [==============================] - 0s 46ms/step
1/1 [==============================] - ETA: 0s1/1 [==============================] - 0s 53ms/step
1/1 [==============================] - ETA: 0s1/1 [==============================] - 0s 51ms/step
1/1 [==============================] - ETA: 0s1/1 [==============================] - 0s 47ms/step
[I 2024-12-23 19:36:47,654] Trial 19 finished with value: 1.236731879393149 and parameters: {'n_units_0': 4, 'dropout_1': 0.15000000000000002, 'run': 1, 'epochs_1': 80, 'epochs_2': 90, 'lr_1': 0.0007137245092957818, 'lr_2': 9.576174208661718e-05, 'batch_size': 12, 'regularization': 'None'}. Best is trial 16 with value: 1.03777630348252.
1/1 [==============================] - ETA: 0s1/1 [==============================] - 0s 419ms/step
1/1 [==============================] - ETA: 0s1/1 [==============================] - 0s 419ms/step
1/1 [==============================] - ETA: 0s1/1 [==============================] - 0s 399ms/step
1/1 [==============================] - ETA: 0s1/1 [==============================] - 0s 44ms/step
1/1 [==============================] - ETA: 0s1/1 [==============================] - 0s 402ms/step
1/1 [==============================] - ETA: 0s1/1 [==============================] - 0s 46ms/step
1/1 [==============================] - ETA: 0s1/1 [==============================] - 0s 53ms/step
1/1 [==============================] - ETA: 0s1/1 [==============================] - 0s 41ms/step
Statistics value = 21.0 p-value = 0.75390625
1/1 [==============================] - ETA: 0s1/1 [==============================] - 0s 418ms/step
1/1 [==============================] - ETA: 0s1/1 [==============================] - 0s 392ms/step
1/1 [==============================] - ETA: 0s1/1 [==============================] - 0s 51ms/step
1/1 [==============================] - ETA: 0s1/1 [==============================] - 0s 56ms/step
[I 2024-12-23 19:37:01,048] Trial 18 finished with value: 0.6664099890163728 and parameters: {'n_units_0': 32, 'dropout_1': 0.3, 'run': 1, 'epochs_1': 80, 'epochs_2': 70, 'lr_1': 0.009606261224252233, 'lr_2': 5.124101108039672e-05, 'batch_size': 12, 'regularization': 'l1', 'reg_alpha_1': 0.0005903639128219392}. Best is trial 15 with value: 0.43226538043361695.
Statistics value = 5.0 p-value = 0.9931640625
1/1 [==============================] - ETA: 0s1/1 [==============================] - 0s 432ms/step
Statistics value = 29.0 p-value = 0.4609375
1/1 [==============================] - ETA: 0s1/1 [==============================] - 0s 413ms/step
1/1 [==============================] - ETA: 0s1/1 [==============================] - 0s 357ms/step
1/1 [==============================] - ETA: 0s1/1 [==============================] - 0s 357ms/step
Statistics value = 9.0 p-value = 0.90234375
1/1 [==============================] - ETA: 0s1/1 [==============================] - 0s 402ms/step
1/1 [==============================] - ETA: 0s1/1 [==============================] - 0s 389ms/step
1/1 [==============================] - ETA: 0s1/1 [==============================] - 0s 430ms/step
1/1 [==============================] - ETA: 0s1/1 [==============================] - 0s 407ms/step
1/1 [==============================] - ETA: 0s1/1 [==============================] - 0s 46ms/step
1/1 [==============================] - ETA: 0s1/1 [==============================] - 0s 44ms/step
1/1 [==============================] - ETA: 0s1/1 [==============================] - 0s 418ms/step
1/1 [==============================] - ETA: 0s1/1 [==============================] - 0s 396ms/step
1/1 [==============================] - ETA: 0s1/1 [==============================] - 0s 406ms/step
1/1 [==============================] - ETA: 0s1/1 [==============================] - 0s 383ms/step
Statistics value = 29.0 p-value = 0.4609375
1/1 [==============================] - ETA: 0s1/1 [==============================] - 0s 427ms/step
1/1 [==============================] - ETA: 0s1/1 [==============================] - 0s 395ms/step
1/1 [==============================] - ETA: 0s1/1 [==============================] - 0s 418ms/step
1/1 [==============================] - ETA: 0s1/1 [==============================] - 0s 430ms/step
1/1 [==============================] - ETA: 0s1/1 [==============================] - 0s 56ms/step
1/1 [==============================] - ETA: 0s1/1 [==============================] - 0s 39ms/step
1/1 [==============================] - ETA: 0s1/1 [==============================] - 0s 386ms/step
1/1 [==============================] - ETA: 0s1/1 [==============================] - 0s 387ms/step
1/1 [==============================] - ETA: 0s1/1 [==============================] - 0s 50ms/step
[I 2024-12-23 19:37:54,202] Trial 17 finished with value: 0.26811586190701 and parameters: {'n_units_0': 32, 'dropout_1': 0.15000000000000002, 'run': 3, 'epochs_1': 70, 'epochs_2': 30, 'lr_1': 0.0021656331922769723, 'lr_2': 0.00016592327744822277, 'batch_size': 8, 'regularization': 'l1_l2', 'reg_alpha_1': 0.000562792792621263, 'reg_alpha_2': 1.0843603593919683e-05}. Best is trial 4 with value: 0.23212443231328786.
1/1 [==============================] - ETA: 0s1/1 [==============================] - 0s 40ms/step
1/1 [==============================] - ETA: 0s1/1 [==============================] - 0s 413ms/step
[I 2024-12-23 19:37:55,225] Trial 17 finished with value: 0.4450988607663106 and parameters: {'n_units_0': 32, 'dropout_1': 0.15000000000000002, 'run': 3, 'epochs_1': 70, 'epochs_2': 30, 'lr_1': 0.0021656331922769723, 'lr_2': 0.00016592327744822277, 'batch_size': 8, 'regularization': 'l1_l2', 'reg_alpha_1': 0.000562792792621263, 'reg_alpha_2': 1.0843603593919683e-05}. Best is trial 4 with value: 0.2935738766159764.
1/1 [==============================] - ETA: 0s1/1 [==============================] - 0s 391ms/step
1/1 [==============================] - ETA: 0s1/1 [==============================] - 0s 54ms/step
1/1 [==============================] - ETA: 0s1/1 [==============================] - 0s 48ms/step
