[I 2024-12-23 21:20:24,224] Trial 18 finished with value: 0.25064128398331426 and parameters: {'n_units_0': 4, 'dropout_1': 0.3, 'run': 1, 'epochs_1': 50, 'epochs_2': 60, 'lr_1': 0.0006430625574162195, 'lr_2': 0.0004899110090905861, 'batch_size': 8, 'regularization': 'l1_l2', 'reg_alpha_1': 4.5164594450094275e-05, 'reg_alpha_2': 1.4533550875819813e-05}. Best is trial 14 with value: 0.23324134727545204.
1/1 [==============================] - ETA: 0s1/1 [==============================] - 0s 449ms/step
1/1 [==============================] - ETA: 0s1/1 [==============================] - 0s 416ms/step
Statistics value = 33.0 p-value = 0.01953125
1/1 [==============================] - ETA: 0s1/1 [==============================] - 0s 390ms/step
1/1 [==============================] - ETA: 0s1/1 [==============================] - 0s 406ms/step
1/1 [==============================] - ETA: 0s1/1 [==============================] - 0s 45ms/step
1/1 [==============================] - ETA: 0s1/1 [==============================] - 0s 42ms/step
Statistics value = 28.0 p-value = 0.5
1/1 [==============================] - ETA: 0s1/1 [==============================] - 0s 493ms/step
1/1 [==============================] - ETA: 0s1/1 [==============================] - 0s 431ms/step
Statistics value = 32.0 p-value = 0.34765625
1/1 [==============================] - ETA: 0s1/1 [==============================] - 0s 427ms/step
1/1 [==============================] - ETA: 0s1/1 [==============================] - 0s 400ms/step
1/1 [==============================] - ETA: 0s1/1 [==============================] - 0s 53ms/step
1/1 [==============================] - ETA: 0s1/1 [==============================] - 0s 44ms/step
[I 2024-12-23 21:20:44,344] Trial 18 finished with value: 1.2563681461516947 and parameters: {'n_units_0': 20, 'dropout_1': 0.3, 'run': 1, 'epochs_1': 90, 'epochs_2': 70, 'lr_1': 0.00010910502142703562, 'lr_2': 0.00015176218012577308, 'batch_size': 12, 'regularization': 'l1_l2', 'reg_alpha_1': 0.0005581256703525637, 'reg_alpha_2': 0.009755895867243982}. Best is trial 15 with value: 1.0200960810433437.
1/1 [==============================] - ETA: 0s1/1 [==============================] - 0s 429ms/step
1/1 [==============================] - ETA: 0s1/1 [==============================] - 0s 409ms/step
1/1 [==============================] - ETA: 0s1/1 [==============================] - 0s 64ms/step
1/1 [==============================] - ETA: 0s1/1 [==============================] - 0s 50ms/step
[I 2024-12-23 21:20:46,263] Trial 19 finished with value: 0.445110999415676 and parameters: {'n_units_0': 32, 'dropout_1': 0.25, 'run': 2, 'epochs_1': 60, 'epochs_2': 30, 'lr_1': 0.004012134830494741, 'lr_2': 0.00043423797010243954, 'batch_size': 12, 'regularization': 'l1_l2', 'reg_alpha_1': 3.6646764060036446e-05, 'reg_alpha_2': 1.4399587275592257e-05}. Best is trial 4 with value: 0.287358010316754.
Statistics value = 29.0 p-value = 0.07421875
1/1 [==============================] - ETA: 0s1/1 [==============================] - 0s 354ms/step
1/1 [==============================] - ETA: 0s1/1 [==============================] - 0s 339ms/step
1/1 [==============================] - ETA: 0s1/1 [==============================] - 0s 300ms/step
1/1 [==============================] - ETA: 0s1/1 [==============================] - 0s 346ms/step
1/1 [==============================] - ETA: 0s1/1 [==============================] - 0s 33ms/step
1/1 [==============================] - ETA: 0s1/1 [==============================] - 0s 32ms/step
[I 2024-12-23 21:20:51,195] Trial 17 finished with value: 0.6702312424596396 and parameters: {'n_units_0': 44, 'dropout_1': 0.3, 'run': 3, 'epochs_1': 60, 'epochs_2': 50, 'lr_1': 0.0012027906411716696, 'lr_2': 0.0006380949865049286, 'batch_size': 8, 'regularization': 'None'}. Best is trial 12 with value: 0.49203987197531235.
Statistics value = 33.0 p-value = 0.01953125
1/1 [==============================] - ETA: 0s1/1 [==============================] - 0s 368ms/step
1/1 [==============================] - ETA: 0s1/1 [==============================] - 0s 354ms/step
1/1 [==============================] - ETA: 0s1/1 [==============================] - 0s 414ms/step
1/1 [==============================] - ETA: 0s1/1 [==============================] - 0s 378ms/step
1/1 [==============================] - ETA: 0s1/1 [==============================] - 0s 46ms/step
1/1 [==============================] - ETA: 0s1/1 [==============================] - 0s 49ms/step
Statistics value = 19.0 p-value = 0.47265625
1/1 [==============================] - ETA: 0s1/1 [==============================] - 0s 420ms/step
1/1 [==============================] - ETA: 0s1/1 [==============================] - 0s 378ms/step
1/1 [==============================] - ETA: 0s1/1 [==============================] - 0s 401ms/step
1/1 [==============================] - ETA: 0s1/1 [==============================] - 0s 392ms/step
1/1 [==============================] - ETA: 0s1/1 [==============================] - 0s 47ms/step
1/1 [==============================] - ETA: 0s1/1 [==============================] - 0s 49ms/step
Statistics value = 49.0 p-value = 0.013671875
1/1 [==============================] - ETA: 0s1/1 [==============================] - 0s 403ms/step
1/1 [==============================] - ETA: 0s1/1 [==============================] - 0s 407ms/step
1/1 [==============================] - ETA: 0s1/1 [==============================] - 0s 420ms/step
1/1 [==============================] - ETA: 0s1/1 [==============================] - 0s 389ms/step
Statistics value = 47.0 p-value = 0.0244140625
1/1 [==============================] - ETA: 0s1/1 [==============================] - 0s 439ms/step
1/1 [==============================] - ETA: 0s1/1 [==============================] - 0s 430ms/step
1/1 [==============================] - ETA: 0s1/1 [==============================] - 0s 384ms/step
1/1 [==============================] - ETA: 0s1/1 [==============================] - 0s 382ms/step
1/1 [==============================] - ETA: 0s1/1 [==============================] - 0s 371ms/step
1/1 [==============================] - ETA: 0s1/1 [==============================] - 0s 41ms/step
1/1 [==============================] - ETA: 0s1/1 [==============================] - 0s 383ms/step
1/1 [==============================] - ETA: 0s1/1 [==============================] - 0s 48ms/step
1/1 [==============================] - ETA: 0s1/1 [==============================] - 0s 41ms/step
1/1 [==============================] - ETA: 0s1/1 [==============================] - 0s 42ms/step
[I 2024-12-23 21:21:39,542] Trial 19 finished with value: 0.2490792297405625 and parameters: {'n_units_0': 20, 'dropout_1': 0.15000000000000002, 'run': 2, 'epochs_1': 90, 'epochs_2': 80, 'lr_1': 0.0002249081749921882, 'lr_2': 1.780331729716588e-05, 'batch_size': 16, 'regularization': 'None'}. Best is trial 14 with value: 0.23324134727545204.
1/1 [==============================] - ETA: 0s1/1 [==============================] - 0s 419ms/step
1/1 [==============================] - ETA: 0s1/1 [==============================] - 0s 367ms/step
1/1 [==============================] - ETA: 0s1/1 [==============================] - 0s 46ms/step
1/1 [==============================] - ETA: 0s1/1 [==============================] - 0s 45ms/step
[I 2024-12-23 21:21:43,098] Trial 19 finished with value: 1.564289385147506 and parameters: {'n_units_0': 4, 'dropout_1': 0.15000000000000002, 'run': 2, 'epochs_1': 50, 'epochs_2': 30, 'lr_1': 0.0011825763497863705, 'lr_2': 0.0004755258531422745, 'batch_size': 12, 'regularization': 'None'}. Best is trial 15 with value: 1.0200960810433437.
Statistics value = 24.0 p-value = 0.65234375
1/1 [==============================] - ETA: 0s1/1 [==============================] - 0s 424ms/step
1/1 [==============================] - ETA: 0s1/1 [==============================] - 0s 399ms/step
1/1 [==============================] - ETA: 0s1/1 [==============================] - 0s 419ms/step
1/1 [==============================] - ETA: 0s1/1 [==============================] - 0s 393ms/step
1/1 [==============================] - ETA: 0s1/1 [==============================] - 0s 403ms/step
1/1 [==============================] - ETA: 0s1/1 [==============================] - 0s 400ms/step
1/1 [==============================] - ETA: 0s1/1 [==============================] - 0s 48ms/step
1/1 [==============================] - ETA: 0s1/1 [==============================] - 0s 50ms/step
[I 2024-12-23 21:22:13,681] Trial 18 finished with value: 0.611511550658644 and parameters: {'n_units_0': 40, 'dropout_1': 0.25, 'run': 3, 'epochs_1': 90, 'epochs_2': 20, 'lr_1': 0.007277066009643046, 'lr_2': 0.00013831073412763696, 'batch_size': 12, 'regularization': 'None'}. Best is trial 12 with value: 0.49203987197531235.
Statistics value = 6.0 p-value = 0.9609375
1/1 [==============================] - ETA: 0s1/1 [==============================] - 0s 425ms/step
1/1 [==============================] - ETA: 0s1/1 [==============================] - 0s 411ms/step
1/1 [==============================] - ETA: 0s1/1 [==============================] - 0s 400ms/step
1/1 [==============================] - ETA: 0s1/1 [==============================] - 1s 1s/step
1/1 [==============================] - ETA: 0s1/1 [==============================] - 0s 54ms/step
1/1 [==============================] - ETA: 0s1/1 [==============================] - 0s 46ms/step
Statistics value = 13.0 p-value = 0.9345703125
1/1 [==============================] - ETA: 0s1/1 [==============================] - 0s 331ms/step
1/1 [==============================] - ETA: 0s1/1 [==============================] - 0s 340ms/step
1/1 [==============================] - ETA: 0s1/1 [==============================] - 0s 396ms/step
1/1 [==============================] - ETA: 0s1/1 [==============================] - 0s 387ms/step
1/1 [==============================] - ETA: 0s1/1 [==============================] - 0s 42ms/step
1/1 [==============================] - ETA: 0s1/1 [==============================] - 0s 40ms/step
[I 2024-12-23 21:23:10,055] Trial 19 finished with value: 0.5977469790116163 and parameters: {'n_units_0': 28, 'dropout_1': 0.15000000000000002, 'run': 2, 'epochs_1': 70, 'epochs_2': 50, 'lr_1': 0.00018984357712868846, 'lr_2': 6.140275844211314e-05, 'batch_size': 12, 'regularization': 'l1_l2', 'reg_alpha_1': 1.5540870379397035e-05, 'reg_alpha_2': 1.0319246113648101e-05}. Best is trial 12 with value: 0.49203987197531235.
Statistics value = 22.0 p-value = 0.3203125
Statistics value = 36.0 p-value = 0.00390625
Statistics value = 6.0 p-value = 0.9609375
Statistics value = 12.0 p-value = 0.80859375

EVER Study Best parameters:
{'n_units_0': 20, 'dropout_1': 0.15000000000000002, 'run': 2, 'epochs_1': 50, 'epochs_2': 100, 'lr_1': 0.00011664749929951677, 'lr_2': 2.143446078970349e-05, 'batch_size': 16, 'regularization': 'l2', 'reg_alpha_1': 1.7889107850235667e-05}
Best value (Average MSE): 0.23324134727545204

EV Study Best parameters:
{'n_units_0': 20, 'dropout_1': 0.15000000000000002, 'run': 2, 'epochs_1': 30, 'epochs_2': 70, 'lr_1': 0.00021065097606449626, 'lr_2': 1.939099870562242e-05, 'batch_size': 12, 'regularization': 'l1_l2', 'reg_alpha_1': 0.0007726556738189395, 'reg_alpha_2': 0.0005380808322182504}
Best value (Average MSE): 1.0200960810433437

PHEV Study Best parameters:
{'n_units_0': 32, 'dropout_1': 0.25, 'run': 3, 'epochs_1': 80, 'epochs_2': 20, 'lr_1': 0.000124303097384124, 'lr_2': 0.00011781522065752308, 'batch_size': 12, 'regularization': 'None'}
Best value (Average MSE): 0.49203987197531235

FUEL Study Best parameters:
{'n_units_0': 60, 'dropout_1': 0.2, 'run': 3, 'epochs_1': 30, 'epochs_2': 30, 'lr_1': 0.00012315571723666037, 'lr_2': 4.473636174621264e-05, 'batch_size': 12, 'regularization': 'l1', 'reg_alpha_1': 0.00042470585622618684}
Best value (Average MSE): 0.287358010316754
