[I 2024-12-23 15:57:17,718] Trial 2 finished with value: 0.28403899835733204 and parameters: {'n_units_0': 16, 'dropout_1': 0.2, 'run': 2, 'epochs_1': 30, 'epochs_2': 70, 'lr_1': 0.00021930485556643703, 'lr_2': 1.3492834268013232e-05, 'batch_size': 16, 'regularization': 'l1_l2', 'reg_alpha_1': 0.0011290133559092666, 'reg_alpha_2': 0.00020914981329035596}. Best is trial 2 with value: 0.28403899835733204.
Statistics value = 17.0 p-value = 0.578125
1/1 [==============================] - ETA: 0s1/1 [==============================] - 0s 429ms/step
Statistics value = 8.0 p-value = 0.92578125
1/1 [==============================] - ETA: 0s1/1 [==============================] - 0s 394ms/step
Statistics value = 30.0 p-value = 0.0546875
1/1 [==============================] - ETA: 0s1/1 [==============================] - 0s 426ms/step
Statistics value = 15.0 p-value = 0.6796875
1/1 [==============================] - ETA: 0s1/1 [==============================] - 0s 370ms/step
1/1 [==============================] - ETA: 0s1/1 [==============================] - 0s 402ms/step
1/1 [==============================] - ETA: 0s1/1 [==============================] - 0s 403ms/step
1/1 [==============================] - ETA: 0s1/1 [==============================] - 0s 51ms/step
1/1 [==============================] - ETA: 0s1/1 [==============================] - 0s 404ms/step
1/1 [==============================] - ETA: 0s1/1 [==============================] - 0s 45ms/step
1/1 [==============================] - ETA: 0s1/1 [==============================] - 0s 391ms/step
1/1 [==============================] - ETA: 0s1/1 [==============================] - 0s 47ms/step
1/1 [==============================] - ETA: 0s1/1 [==============================] - 0s 75ms/step
1/1 [==============================] - ETA: 0s1/1 [==============================] - 0s 78ms/step
1/1 [==============================] - ETA: 0s1/1 [==============================] - 0s 87ms/step
1/1 [==============================] - ETA: 0s1/1 [==============================] - 0s 78ms/step
1/1 [==============================] - ETA: 0s1/1 [==============================] - 0s 49ms/step
Statistics value = 33.0 p-value = 0.3125
1/1 [==============================] - ETA: 0s1/1 [==============================] - 0s 392ms/step
Statistics value = 22.0 p-value = 0.7216796875
1/1 [==============================] - ETA: 0s1/1 [==============================] - 0s 398ms/step
Statistics value = 28.0 p-value = 0.5
1/1 [==============================] - ETA: 0sStatistics value = 15.0 p-value = 0.9033203125
1/1 [==============================] - ETA: 0s1/1 [==============================] - 0s 372ms/step
1/1 [==============================] - 0s 373ms/step
1/1 [==============================] - ETA: 0s1/1 [==============================] - 0s 376ms/step
1/1 [==============================] - ETA: 0s1/1 [==============================] - 0s 43ms/step
1/1 [==============================] - ETA: 0s1/1 [==============================] - 0s 44ms/step
1/1 [==============================] - ETA: 0s1/1 [==============================] - 0s 365ms/step
1/1 [==============================] - ETA: 0s1/1 [==============================] - 0s 377ms/step
1/1 [==============================] - ETA: 0s1/1 [==============================] - 0s 381ms/step
1/1 [==============================] - ETA: 0s1/1 [==============================] - 0s 59ms/step
1/1 [==============================] - ETA: 0s1/1 [==============================] - 0s 59ms/step
1/1 [==============================] - ETA: 0s1/1 [==============================] - 0s 52ms/step
1/1 [==============================] - ETA: 0s1/1 [==============================] - 0s 69ms/step
1/1 [==============================] - ETA: 0s1/1 [==============================] - 0s 72ms/step
1/1 [==============================] - ETA: 0s1/1 [==============================] - 0s 81ms/step
[I 2024-12-23 15:57:51,634] Trial 3 finished with value: 0.4000718213643056 and parameters: {'n_units_0': 8, 'dropout_1': 0.2, 'run': 1, 'epochs_1': 100, 'epochs_2': 40, 'lr_1': 0.0021137059440645744, 'lr_2': 4.201672054372529e-05, 'batch_size': 12, 'regularization': 'l2', 'reg_alpha_1': 0.006584106160121612}. Best is trial 2 with value: 0.28403899835733204.
[I 2024-12-23 15:57:52,032] Trial 3 finished with value: 1.9123978277896663 and parameters: {'n_units_0': 8, 'dropout_1': 0.2, 'run': 1, 'epochs_1': 100, 'epochs_2': 40, 'lr_1': 0.0021137059440645744, 'lr_2': 4.201672054372529e-05, 'batch_size': 12, 'regularization': 'l2', 'reg_alpha_1': 0.006584106160121612}. Best is trial 0 with value: 1.139131622236553.
[I 2024-12-23 15:57:52,096] Trial 3 finished with value: 0.7144407405678982 and parameters: {'n_units_0': 8, 'dropout_1': 0.2, 'run': 1, 'epochs_1': 100, 'epochs_2': 40, 'lr_1': 0.0021137059440645744, 'lr_2': 4.201672054372529e-05, 'batch_size': 12, 'regularization': 'l2', 'reg_alpha_1': 0.006584106160121612}. Best is trial 0 with value: 0.5606847346796215.
[I 2024-12-23 15:57:52,106] Trial 3 finished with value: 0.2817554256344429 and parameters: {'n_units_0': 8, 'dropout_1': 0.2, 'run': 1, 'epochs_1': 100, 'epochs_2': 40, 'lr_1': 0.0021137059440645744, 'lr_2': 4.201672054372529e-05, 'batch_size': 12, 'regularization': 'l2', 'reg_alpha_1': 0.006584106160121612}. Best is trial 0 with value: 0.23758915172932213.
Statistics value = 27.0 p-value = 0.125
1/1 [==============================] - ETA: 0s1/1 [==============================] - 0s 478ms/step
Statistics value = 21.0 p-value = 0.37109375
1/1 [==============================] - ETA: 0s1/1 [==============================] - 0s 406ms/step
Statistics value = 36.0 p-value = 0.00390625
1/1 [==============================] - ETA: 0s1/1 [==============================] - 0s 382ms/step
Statistics value = 5.0 p-value = 0.97265625
1/1 [==============================] - ETA: 0s1/1 [==============================] - 0s 449ms/step
1/1 [==============================] - ETA: 0s1/1 [==============================] - 0s 430ms/step
1/1 [==============================] - ETA: 0s1/1 [==============================] - 0s 359ms/step
1/1 [==============================] - ETA: 0s1/1 [==============================] - 0s 389ms/step
1/1 [==============================] - ETA: 0s1/1 [==============================] - 0s 385ms/step
1/1 [==============================] - ETA: 0s1/1 [==============================] - 0s 426ms/step
1/1 [==============================] - ETA: 0s1/1 [==============================] - 0s 384ms/step
1/1 [==============================] - ETA: 0s1/1 [==============================] - 0s 402ms/step
1/1 [==============================] - ETA: 0s1/1 [==============================] - 0s 379ms/step
1/1 [==============================] - ETA: 0s1/1 [==============================] - 0s 418ms/step
1/1 [==============================] - ETA: 0s1/1 [==============================] - 0s 401ms/step
1/1 [==============================] - ETA: 0s1/1 [==============================] - 0s 405ms/step
1/1 [==============================] - ETA: 0s1/1 [==============================] - 0s 392ms/step
1/1 [==============================] - ETA: 0s1/1 [==============================] - 0s 385ms/step
1/1 [==============================] - ETA: 0s1/1 [==============================] - 0s 378ms/step
1/1 [==============================] - ETA: 0s1/1 [==============================] - 0s 415ms/step
1/1 [==============================] - ETA: 0s1/1 [==============================] - 0s 391ms/step
1/1 [==============================] - ETA: 0s1/1 [==============================] - 0s 382ms/step
1/1 [==============================] - ETA: 0s1/1 [==============================] - 0s 356ms/step
1/1 [==============================] - ETA: 0s1/1 [==============================] - 0s 391ms/step
1/1 [==============================] - ETA: 0s1/1 [==============================] - 0s 41ms/step
1/1 [==============================] - ETA: 0s1/1 [==============================] - 0s 50ms/step
1/1 [==============================] - ETA: 0s1/1 [==============================] - 0s 54ms/step
1/1 [==============================] - ETA: 0s1/1 [==============================] - 0s 55ms/step
1/1 [==============================] - ETA: 0s1/1 [==============================] - 0s 420ms/step
1/1 [==============================] - ETA: 0s1/1 [==============================] - 0s 55ms/step
1/1 [==============================] - ETA: 0s1/1 [==============================] - 0s 79ms/step
1/1 [==============================] - ETA: 0s1/1 [==============================] - 0s 47ms/step
1/1 [==============================] - ETA: 0s1/1 [==============================] - 0s 40ms/step
Statistics value = 27.0 p-value = 0.5390625
1/1 [==============================] - ETA: 0s1/1 [==============================] - 0s 396ms/step
Statistics value = 46.0 p-value = 0.0322265625
1/1 [==============================] - ETA: 0s1/1 [==============================] - 0s 401ms/step
Statistics value = 46.0 p-value = 0.0322265625
1/1 [==============================] - ETA: 0s1/1 [==============================] - 0s 380ms/step
Statistics value = 30.0 p-value = 0.4228515625
1/1 [==============================] - ETA: 0s1/1 [==============================] - 0s 399ms/step
1/1 [==============================] - ETA: 0s1/1 [==============================] - 0s 408ms/step
1/1 [==============================] - ETA: 0s1/1 [==============================] - 0s 416ms/step
1/1 [==============================] - ETA: 0s1/1 [==============================] - 0s 419ms/step
1/1 [==============================] - ETA: 0s1/1 [==============================] - 0s 397ms/step
1/1 [==============================] - ETA: 0s1/1 [==============================] - 0s 375ms/step
1/1 [==============================] - ETA: 0s1/1 [==============================] - 0s 394ms/step
1/1 [==============================] - ETA: 0s1/1 [==============================] - 0s 423ms/step
1/1 [==============================] - ETA: 0s1/1 [==============================] - 0s 348ms/step
1/1 [==============================] - ETA: 0s1/1 [==============================] - 0s 378ms/step
1/1 [==============================] - ETA: 0s1/1 [==============================] - 0s 375ms/step
1/1 [==============================] - ETA: 0s1/1 [==============================] - 1s 563ms/step
1/1 [==============================] - ETA: 0s1/1 [==============================] - 0s 349ms/step
1/1 [==============================] - ETA: 0s1/1 [==============================] - 0s 448ms/step
1/1 [==============================] - ETA: 0s1/1 [==============================] - 0s 398ms/step
1/1 [==============================] - ETA: 0s1/1 [==============================] - 0s 405ms/step
1/1 [==============================] - ETA: 0s1/1 [==============================] - 0s 403ms/step
1/1 [==============================] - ETA: 0s1/1 [==============================] - 0s 397ms/step
1/1 [==============================] - ETA: 0s1/1 [==============================] - 0s 391ms/step
1/1 [==============================] - ETA: 0s1/1 [==============================] - 0s 386ms/step
1/1 [==============================] - ETA: 0s1/1 [==============================] - 0s 42ms/step
1/1 [==============================] - ETA: 0s1/1 [==============================] - 0s 70ms/step
1/1 [==============================] - ETA: 0s1/1 [==============================] - 0s 43ms/step
1/1 [==============================] - ETA: 0s1/1 [==============================] - 0s 42ms/step
1/1 [==============================] - ETA: 0s1/1 [==============================] - 0s 41ms/step
1/1 [==============================] - ETA: 0s1/1 [==============================] - 0s 43ms/step
1/1 [==============================] - ETA: 0s1/1 [==============================] - 0s 392ms/step
1/1 [==============================] - ETA: 0s1/1 [==============================] - 0s 104ms/step
1/1 [==============================] - ETA: 0s1/1 [==============================] - 0s 41ms/step
[I 2024-12-23 15:59:03,375] Trial 4 finished with value: 0.6055312748470667 and parameters: {'n_units_0': 60, 'dropout_1': 0.2, 'run': 3, 'epochs_1': 30, 'epochs_2': 30, 'lr_1': 0.00012315571723666037, 'lr_2': 4.473636174621264e-05, 'batch_size': 12, 'regularization': 'l1', 'reg_alpha_1': 0.00042470585622618684}. Best is trial 0 with value: 0.5606847346796215.
[I 2024-12-23 15:59:03,468] Trial 4 finished with value: 1.1687373377051977 and parameters: {'n_units_0': 60, 'dropout_1': 0.2, 'run': 3, 'epochs_1': 30, 'epochs_2': 30, 'lr_1': 0.00012315571723666037, 'lr_2': 4.473636174621264e-05, 'batch_size': 12, 'regularization': 'l1', 'reg_alpha_1': 0.00042470585622618684}. Best is trial 0 with value: 1.139131622236553.
[I 2024-12-23 15:59:03,493] Trial 4 finished with value: 0.23968422817233992 and parameters: {'n_units_0': 60, 'dropout_1': 0.2, 'run': 3, 'epochs_1': 30, 'epochs_2': 30, 'lr_1': 0.00012315571723666037, 'lr_2': 4.473636174621264e-05, 'batch_size': 12, 'regularization': 'l1', 'reg_alpha_1': 0.00042470585622618684}. Best is trial 0 with value: 0.23758915172932213.
