[I 2024-12-23 21:02:17,987] Trial 2 finished with value: 1.1395911434025072 and parameters: {'n_units_0': 16, 'dropout_1': 0.2, 'run': 2, 'epochs_1': 30, 'epochs_2': 70, 'lr_1': 0.00021930485556643703, 'lr_2': 1.3492834268013232e-05, 'batch_size': 16, 'regularization': 'l1_l2', 'reg_alpha_1': 0.0011290133559092666, 'reg_alpha_2': 0.00020914981329035596}. Best is trial 2 with value: 1.1395911434025072.
Statistics value = 7.0 p-value = 0.9453125
1/1 [==============================] - ETA: 0s1/1 [==============================] - 1s 533ms/step
Statistics value = 16.0 p-value = 0.62890625
1/1 [==============================] - ETA: 0s1/1 [==============================] - 0s 489ms/step
Statistics value = 19.0 p-value = 0.47265625
1/1 [==============================] - ETA: 0s1/1 [==============================] - 0s 470ms/step
Statistics value = 19.0 p-value = 0.47265625
1/1 [==============================] - ETA: 0s1/1 [==============================] - 1s 554ms/step
1/1 [==============================] - ETA: 0s1/1 [==============================] - 1s 505ms/step
1/1 [==============================] - ETA: 0s1/1 [==============================] - 0s 482ms/step
1/1 [==============================] - ETA: 0s1/1 [==============================] - 0s 478ms/step
1/1 [==============================] - ETA: 0s1/1 [==============================] - 0s 159ms/step
1/1 [==============================] - ETA: 0s1/1 [==============================] - 1s 550ms/step
1/1 [==============================] - ETA: 0s1/1 [==============================] - 0s 152ms/step
1/1 [==============================] - ETA: 0s1/1 [==============================] - 0s 103ms/step
1/1 [==============================] - ETA: 0s1/1 [==============================] - 0s 155ms/step
1/1 [==============================] - ETA: 0s1/1 [==============================] - 0s 186ms/step
1/1 [==============================] - ETA: 0s1/1 [==============================] - 0s 50ms/step
1/1 [==============================] - ETA: 0s1/1 [==============================] - 0s 105ms/step
1/1 [==============================] - ETA: 0s1/1 [==============================] - 0s 88ms/step
Statistics value = 36.0 p-value = 0.2158203125
1/1 [==============================] - ETA: 0s1/1 [==============================] - 1s 502ms/step
Statistics value = 32.0 p-value = 0.34765625
1/1 [==============================] - ETA: 0s1/1 [==============================] - 0s 451ms/step
Statistics value = 14.0 p-value = 0.919921875
1/1 [==============================] - ETA: 0s1/1 [==============================] - 0s 468ms/step
Statistics value = 10.0 p-value = 0.9677734375
1/1 [==============================] - ETA: 0s1/1 [==============================] - 1s 508ms/step
1/1 [==============================] - ETA: 0s1/1 [==============================] - 0s 460ms/step
1/1 [==============================] - ETA: 0s1/1 [==============================] - 1s 500ms/step
1/1 [==============================] - ETA: 0s1/1 [==============================] - 0s 107ms/step
1/1 [==============================] - ETA: 0s1/1 [==============================] - 1s 521ms/step
1/1 [==============================] - ETA: 0s1/1 [==============================] - 0s 149ms/step
1/1 [==============================] - ETA: 0s1/1 [==============================] - 0s 117ms/step
1/1 [==============================] - ETA: 0s1/1 [==============================] - 0s 115ms/step
1/1 [==============================] - ETA: 0s1/1 [==============================] - 1s 721ms/step
1/1 [==============================] - ETA: 0s1/1 [==============================] - 0s 99ms/step
1/1 [==============================] - ETA: 0s1/1 [==============================] - 0s 158ms/step
1/1 [==============================] - ETA: 0s1/1 [==============================] - 0s 159ms/step
1/1 [==============================] - ETA: 0s1/1 [==============================] - 0s 113ms/step
[I 2024-12-23 21:02:55,676] Trial 3 finished with value: 0.6975231181864119 and parameters: {'n_units_0': 8, 'dropout_1': 0.2, 'run': 1, 'epochs_1': 100, 'epochs_2': 40, 'lr_1': 0.0021137059440645744, 'lr_2': 4.201672054372529e-05, 'batch_size': 12, 'regularization': 'l2', 'reg_alpha_1': 0.006584106160121612}. Best is trial 0 with value: 0.5454487270133243.
[I 2024-12-23 21:02:55,733] Trial 3 finished with value: 1.4971814869853195 and parameters: {'n_units_0': 8, 'dropout_1': 0.2, 'run': 1, 'epochs_1': 100, 'epochs_2': 40, 'lr_1': 0.0021137059440645744, 'lr_2': 4.201672054372529e-05, 'batch_size': 12, 'regularization': 'l2', 'reg_alpha_1': 0.006584106160121612}. Best is trial 2 with value: 1.1395911434025072.
[I 2024-12-23 21:02:55,810] Trial 3 finished with value: 0.4260347978814942 and parameters: {'n_units_0': 8, 'dropout_1': 0.2, 'run': 1, 'epochs_1': 100, 'epochs_2': 40, 'lr_1': 0.0021137059440645744, 'lr_2': 4.201672054372529e-05, 'batch_size': 12, 'regularization': 'l2', 'reg_alpha_1': 0.006584106160121612}. Best is trial 2 with value: 0.2911392921188809.
[I 2024-12-23 21:02:56,005] Trial 3 finished with value: 0.27065026077014503 and parameters: {'n_units_0': 8, 'dropout_1': 0.2, 'run': 1, 'epochs_1': 100, 'epochs_2': 40, 'lr_1': 0.0021137059440645744, 'lr_2': 4.201672054372529e-05, 'batch_size': 12, 'regularization': 'l2', 'reg_alpha_1': 0.006584106160121612}. Best is trial 0 with value: 0.23353038736144272.
Statistics value = 22.0 p-value = 0.3203125
1/1 [==============================] - ETA: 0s1/1 [==============================] - 1s 538ms/step
Statistics value = 21.0 p-value = 0.37109375
1/1 [==============================] - ETA: 0s1/1 [==============================] - 0s 435ms/step
Statistics value = 16.0 p-value = 0.62890625
1/1 [==============================] - ETA: 0s1/1 [==============================] - 0s 461ms/step
Statistics value = 5.0 p-value = 0.97265625
1/1 [==============================] - ETA: 0s1/1 [==============================] - 0s 424ms/step
1/1 [==============================] - ETA: 0s1/1 [==============================] - 0s 494ms/step
1/1 [==============================] - ETA: 0s1/1 [==============================] - 0s 479ms/step
1/1 [==============================] - ETA: 0s1/1 [==============================] - 0s 459ms/step
1/1 [==============================] - ETA: 0s1/1 [==============================] - 0s 470ms/step
1/1 [==============================] - ETA: 0s1/1 [==============================] - 1s 527ms/step
1/1 [==============================] - ETA: 0s1/1 [==============================] - 0s 454ms/step
1/1 [==============================] - ETA: 0s1/1 [==============================] - 0s 411ms/step
1/1 [==============================] - ETA: 0s1/1 [==============================] - 0s 454ms/step
1/1 [==============================] - ETA: 0s1/1 [==============================] - 1s 525ms/step
1/1 [==============================] - ETA: 0s1/1 [==============================] - 1s 514ms/step
1/1 [==============================] - ETA: 0s1/1 [==============================] - 0s 417ms/step
1/1 [==============================] - ETA: 0s1/1 [==============================] - 0s 427ms/step
1/1 [==============================] - ETA: 0s1/1 [==============================] - 1s 584ms/step
1/1 [==============================] - ETA: 0s1/1 [==============================] - 0s 432ms/step
1/1 [==============================] - ETA: 0s1/1 [==============================] - 1s 552ms/step
1/1 [==============================] - ETA: 0s1/1 [==============================] - 1s 552ms/step
1/1 [==============================] - ETA: 0s1/1 [==============================] - 1s 613ms/step
1/1 [==============================] - ETA: 0s1/1 [==============================] - 0s 457ms/step
1/1 [==============================] - ETA: 0s1/1 [==============================] - 0s 443ms/step
1/1 [==============================] - ETA: 0s1/1 [==============================] - 0s 103ms/step
1/1 [==============================] - ETA: 0s1/1 [==============================] - 1s 537ms/step
1/1 [==============================] - ETA: 0s1/1 [==============================] - 0s 88ms/step
1/1 [==============================] - ETA: 0s1/1 [==============================] - 0s 89ms/step
1/1 [==============================] - ETA: 0s1/1 [==============================] - 0s 104ms/step
1/1 [==============================] - ETA: 0s1/1 [==============================] - 0s 114ms/step
1/1 [==============================] - ETA: 0s1/1 [==============================] - 0s 88ms/step
1/1 [==============================] - ETA: 0s1/1 [==============================] - 0s 83ms/step
1/1 [==============================] - ETA: 0s1/1 [==============================] - 0s 53ms/step
Statistics value = 31.0 p-value = 0.384765625
1/1 [==============================] - ETA: 0s1/1 [==============================] - 1s 572ms/step
Statistics value = 28.0 p-value = 0.5
1/1 [==============================] - ETA: 0s1/1 [==============================] - 0s 469ms/step
Statistics value = 49.0 p-value = 0.013671875
1/1 [==============================] - ETA: 0s1/1 [==============================] - 0s 486ms/step
Statistics value = 45.0 p-value = 0.0419921875
1/1 [==============================] - ETA: 0s1/1 [==============================] - 0s 437ms/step
1/1 [==============================] - ETA: 0s1/1 [==============================] - 1s 522ms/step
1/1 [==============================] - ETA: 0s1/1 [==============================] - 0s 407ms/step
1/1 [==============================] - ETA: 0s1/1 [==============================] - 0s 395ms/step
1/1 [==============================] - ETA: 0s1/1 [==============================] - 0s 462ms/step
1/1 [==============================] - ETA: 0s1/1 [==============================] - 0s 386ms/step
1/1 [==============================] - ETA: 0s1/1 [==============================] - 1s 505ms/step
1/1 [==============================] - ETA: 0s1/1 [==============================] - 0s 431ms/step
1/1 [==============================] - ETA: 0s1/1 [==============================] - 0s 390ms/step
1/1 [==============================] - ETA: 0s1/1 [==============================] - 0s 415ms/step
1/1 [==============================] - ETA: 0s1/1 [==============================] - 0s 473ms/step
1/1 [==============================] - ETA: 0s1/1 [==============================] - 0s 478ms/step
1/1 [==============================] - ETA: 0s1/1 [==============================] - 0s 419ms/step
1/1 [==============================] - ETA: 0s1/1 [==============================] - 0s 405ms/step
1/1 [==============================] - ETA: 0s1/1 [==============================] - 0s 470ms/step
1/1 [==============================] - ETA: 0s1/1 [==============================] - 0s 70ms/step
1/1 [==============================] - ETA: 0s1/1 [==============================] - 0s 44ms/step
1/1 [==============================] - ETA: 0s1/1 [==============================] - 1s 518ms/step
1/1 [==============================] - ETA: 0s1/1 [==============================] - 1s 525ms/step
1/1 [==============================] - ETA: 0s1/1 [==============================] - 1s 770ms/step
1/1 [==============================] - ETA: 0s1/1 [==============================] - 1s 636ms/step
1/1 [==============================] - ETA: 0s1/1 [==============================] - 1s 676ms/step
1/1 [==============================] - ETA: 0s1/1 [==============================] - 1s 554ms/step
1/1 [==============================] - ETA: 0s1/1 [==============================] - 0s 77ms/step
1/1 [==============================] - ETA: 0s1/1 [==============================] - 0s 46ms/step
1/1 [==============================] - ETA: 0s1/1 [==============================] - 0s 112ms/step
[I 2024-12-23 21:04:13,361] Trial 4 finished with value: 0.6097821088815081 and parameters: {'n_units_0': 60, 'dropout_1': 0.2, 'run': 3, 'epochs_1': 30, 'epochs_2': 30, 'lr_1': 0.00012315571723666037, 'lr_2': 4.473636174621264e-05, 'batch_size': 12, 'regularization': 'l1', 'reg_alpha_1': 0.00042470585622618684}. Best is trial 0 with value: 0.5454487270133243.
1/1 [==============================] - ETA: 0s1/1 [==============================] - 0s 87ms/step
1/1 [==============================] - ETA: 0s1/1 [==============================] - 0s 89ms/step
1/1 [==============================] - ETA: 0s1/1 [==============================] - 0s 48ms/step
[I 2024-12-23 21:04:14,904] Trial 4 finished with value: 0.28852760485481344 and parameters: {'n_units_0': 60, 'dropout_1': 0.2, 'run': 3, 'epochs_1': 30, 'epochs_2': 30, 'lr_1': 0.00012315571723666037, 'lr_2': 4.473636174621264e-05, 'batch_size': 12, 'regularization': 'l1', 'reg_alpha_1': 0.00042470585622618684}. Best is trial 4 with value: 0.28852760485481344.
[I 2024-12-23 21:04:14,989] Trial 4 finished with value: 0.23810337080862648 and parameters: {'n_units_0': 60, 'dropout_1': 0.2, 'run': 3, 'epochs_1': 30, 'epochs_2': 30, 'lr_1': 0.00012315571723666037, 'lr_2': 4.473636174621264e-05, 'batch_size': 12, 'regularization': 'l1', 'reg_alpha_1': 0.00042470585622618684}. Best is trial 0 with value: 0.23353038736144272.
[I 2024-12-23 21:04:15,074] Trial 4 finished with value: 1.1902459610806506 and parameters: {'n_units_0': 60, 'dropout_1': 0.2, 'run': 3, 'epochs_1': 30, 'epochs_2': 30, 'lr_1': 0.00012315571723666037, 'lr_2': 4.473636174621264e-05, 'batch_size': 12, 'regularization': 'l1', 'reg_alpha_1': 0.00042470585622618684}. Best is trial 2 with value: 1.1395911434025072.
Statistics value = 31.0 p-value = 0.0390625
1/1 [==============================] - ETA: 0s1/1 [==============================] - 0s 458ms/step
1/1 [==============================] - ETA: 0s1/1 [==============================] - 0s 401ms/step
1/1 [==============================] - ETA: 0s1/1 [==============================] - 0s 67ms/step
1/1 [==============================] - ETA: 0s1/1 [==============================] - 0s 110ms/step
Statistics value = 27.0 p-value = 0.125
1/1 [==============================] - ETA: 0s1/1 [==============================] - 0s 483ms/step
Statistics value = 35.0 p-value = 0.0078125
1/1 [==============================] - ETA: 0s1/1 [==============================] - 0s 470ms/step
Statistics value = 20.0 p-value = 0.421875
1/1 [==============================] - ETA: 0s1/1 [==============================] - 0s 459ms/step
1/1 [==============================] - ETA: 0s1/1 [==============================] - 0s 358ms/step
1/1 [==============================] - ETA: 0s1/1 [==============================] - 0s 407ms/step
1/1 [==============================] - ETA: 0s1/1 [==============================] - 0s 442ms/step
1/1 [==============================] - ETA: 0s1/1 [==============================] - 0s 99ms/step
1/1 [==============================] - ETA: 0s1/1 [==============================] - 0s 45ms/step
1/1 [==============================] - ETA: 0s1/1 [==============================] - 0s 85ms/step
1/1 [==============================] - ETA: 0s1/1 [==============================] - 0s 84ms/step
1/1 [==============================] - ETA: 0s1/1 [==============================] - 0s 88ms/step
1/1 [==============================] - ETA: 0s1/1 [==============================] - 0s 86ms/step
Statistics value = 49.0 p-value = 0.013671875
1/1 [==============================] - ETA: 0s1/1 [==============================] - 0s 413ms/step
1/1 [==============================] - ETA: 0s1/1 [==============================] - 0s 496ms/step
1/1 [==============================] - ETA: 0s1/1 [==============================] - 0s 80ms/step
1/1 [==============================] - ETA: 0s1/1 [==============================] - 0s 49ms/step
Statistics value = 9.0 p-value = 0.9755859375
1/1 [==============================] - ETA: 0s1/1 [==============================] - 1s 569ms/step
Statistics value = 51.0 p-value = 0.0068359375
1/1 [==============================] - ETA: 0s1/1 [==============================] - 1s 508ms/step
Statistics value = 36.0 p-value = 0.2158203125
1/1 [==============================] - ETA: 0s1/1 [==============================] - 1s 514ms/step
