[I 2024-12-23 18:22:06,253] Trial 9 finished with value: 1.4022660579359627 and parameters: {'n_units_0': 60, 'dropout_1': 0.2, 'run': 3, 'epochs_1': 100, 'epochs_2': 40, 'lr_1': 0.00016599837974449222, 'lr_2': 2.8567374298471872e-05, 'batch_size': 12, 'regularization': 'l1', 'reg_alpha_1': 0.000178744632562384}. Best is trial 0 with value: 1.0150131668973232.
[I 2024-12-23 18:22:06,317] Trial 9 finished with value: 0.3526732598049461 and parameters: {'n_units_0': 60, 'dropout_1': 0.2, 'run': 3, 'epochs_1': 100, 'epochs_2': 40, 'lr_1': 0.00016599837974449222, 'lr_2': 2.8567374298471872e-05, 'batch_size': 12, 'regularization': 'l1', 'reg_alpha_1': 0.000178744632562384}. Best is trial 4 with value: 0.28874593518049796.
[I 2024-12-23 18:22:06,376] Trial 9 finished with value: 0.6762186969002257 and parameters: {'n_units_0': 60, 'dropout_1': 0.2, 'run': 3, 'epochs_1': 100, 'epochs_2': 40, 'lr_1': 0.00016599837974449222, 'lr_2': 2.8567374298471872e-05, 'batch_size': 12, 'regularization': 'l1', 'reg_alpha_1': 0.000178744632562384}. Best is trial 0 with value: 0.5638824182364041.
Statistics value = 8.0 p-value = 0.92578125
1/1 [==============================] - ETA: 0s1/1 [==============================] - 0s 438ms/step
1/1 [==============================] - ETA: 0s1/1 [==============================] - 0s 408ms/step
Statistics value = 35.0 p-value = 0.0078125
1/1 [==============================] - ETA: 0s1/1 [==============================] - 0s 430ms/step
Statistics value = 23.0 p-value = 0.2734375
1/1 [==============================] - ETA: 0s1/1 [==============================] - 0s 491ms/step
Statistics value = 23.0 p-value = 0.2734375
1/1 [==============================] - ETA: 0s1/1 [==============================] - 0s 392ms/step
1/1 [==============================] - ETA: 0s1/1 [==============================] - 0s 383ms/step
1/1 [==============================] - ETA: 0s1/1 [==============================] - 0s 387ms/step
1/1 [==============================] - ETA: 0s1/1 [==============================] - 0s 390ms/step
1/1 [==============================] - ETA: 0s1/1 [==============================] - 0s 410ms/step
1/1 [==============================] - ETA: 0s1/1 [==============================] - 0s 376ms/step
1/1 [==============================] - ETA: 0s1/1 [==============================] - 0s 46ms/step
1/1 [==============================] - ETA: 0s1/1 [==============================] - 0s 52ms/step
1/1 [==============================] - ETA: 0s1/1 [==============================] - 0s 422ms/step
1/1 [==============================] - ETA: 0s1/1 [==============================] - 0s 426ms/step
1/1 [==============================] - ETA: 0s1/1 [==============================] - 0s 399ms/step
1/1 [==============================] - ETA: 0s1/1 [==============================] - 0s 391ms/step
1/1 [==============================] - ETA: 0s1/1 [==============================] - 0s 398ms/step
1/1 [==============================] - ETA: 0s1/1 [==============================] - 0s 368ms/step
1/1 [==============================] - ETA: 0s1/1 [==============================] - 0s 62ms/step
1/1 [==============================] - ETA: 0s1/1 [==============================] - 0s 59ms/step
1/1 [==============================] - ETA: 0s1/1 [==============================] - 0s 51ms/step
1/1 [==============================] - ETA: 0s1/1 [==============================] - 0s 59ms/step
1/1 [==============================] - ETA: 0s1/1 [==============================] - 0s 65ms/step
1/1 [==============================] - ETA: 0s1/1 [==============================] - 0s 62ms/step
Statistics value = 11.0 p-value = 0.9580078125
1/1 [==============================] - ETA: 0s1/1 [==============================] - 0s 455ms/step
1/1 [==============================] - ETA: 0s1/1 [==============================] - 0s 404ms/step
Statistics value = 9.0 p-value = 0.9755859375
1/1 [==============================] - ETA: 0s1/1 [==============================] - 0s 484ms/step
Statistics value = 12.0 p-value = 0.947265625
1/1 [==============================] - ETA: 0s1/1 [==============================] - 0s 381ms/step
Statistics value = 28.0 p-value = 0.5
1/1 [==============================] - ETA: 0s1/1 [==============================] - 0s 405ms/step
1/1 [==============================] - ETA: 0s1/1 [==============================] - 0s 368ms/step
1/1 [==============================] - ETA: 0s1/1 [==============================] - 0s 383ms/step
1/1 [==============================] - ETA: 0s1/1 [==============================] - 0s 405ms/step
1/1 [==============================] - ETA: 0s1/1 [==============================] - 0s 420ms/step
1/1 [==============================] - ETA: 0s1/1 [==============================] - 0s 468ms/step
1/1 [==============================] - ETA: 0s1/1 [==============================] - 0s 49ms/step
1/1 [==============================] - ETA: 0s1/1 [==============================] - 0s 49ms/step
[I 2024-12-23 18:23:06,803] Trial 10 finished with value: 0.2635599004877305 and parameters: {'n_units_0': 36, 'dropout_1': 0.1, 'run': 2, 'epochs_1': 80, 'epochs_2': 90, 'lr_1': 0.006536264082965737, 'lr_2': 0.0003400662576138287, 'batch_size': 12, 'regularization': 'l2', 'reg_alpha_1': 1.095292710677685e-05}. Best is trial 8 with value: 0.23390783013972766.
1/1 [==============================] - ETA: 0s1/1 [==============================] - 0s 412ms/step
1/1 [==============================] - ETA: 0s1/1 [==============================] - 0s 391ms/step
1/1 [==============================] - ETA: 0s1/1 [==============================] - 0s 388ms/step
1/1 [==============================] - ETA: 0s1/1 [==============================] - 0s 403ms/step
1/1 [==============================] - ETA: 0s1/1 [==============================] - 0s 396ms/step
1/1 [==============================] - ETA: 0s1/1 [==============================] - 0s 403ms/step
1/1 [==============================] - ETA: 0s1/1 [==============================] - 0s 48ms/step
1/1 [==============================] - ETA: 0s1/1 [==============================] - 0s 43ms/step
1/1 [==============================] - ETA: 0s1/1 [==============================] - 0s 41ms/step
1/1 [==============================] - ETA: 0s1/1 [==============================] - 0s 53ms/step
1/1 [==============================] - ETA: 0s1/1 [==============================] - 0s 60ms/step
1/1 [==============================] - ETA: 0s1/1 [==============================] - 0s 61ms/step
[I 2024-12-23 18:23:15,655] Trial 10 finished with value: 0.5579973203080888 and parameters: {'n_units_0': 32, 'dropout_1': 0.1, 'run': 2, 'epochs_1': 80, 'epochs_2': 90, 'lr_1': 0.006536264082965737, 'lr_2': 0.0002888908524619867, 'batch_size': 12, 'regularization': 'None'}. Best is trial 10 with value: 0.5579973203080888.
[I 2024-12-23 18:23:15,683] Trial 10 finished with value: 2.151856093899957 and parameters: {'n_units_0': 32, 'dropout_1': 0.1, 'run': 2, 'epochs_1': 80, 'epochs_2': 90, 'lr_1': 0.006536264082965737, 'lr_2': 0.0002888908524619867, 'batch_size': 12, 'regularization': 'None'}. Best is trial 0 with value: 1.0150131668973232.
[I 2024-12-23 18:23:15,700] Trial 10 finished with value: 0.6703530124703204 and parameters: {'n_units_0': 44, 'dropout_1': 0.1, 'run': 2, 'epochs_1': 80, 'epochs_2': 90, 'lr_1': 0.006536264082965737, 'lr_2': 0.0002888908524619867, 'batch_size': 12, 'regularization': 'None'}. Best is trial 4 with value: 0.28874593518049796.
Statistics value = 4.0 p-value = 0.98046875
1/1 [==============================] - ETA: 0s1/1 [==============================] - 0s 427ms/step
1/1 [==============================] - ETA: 0s1/1 [==============================] - 0s 358ms/step
Statistics value = 30.0 p-value = 0.0546875
1/1 [==============================] - ETA: 0s1/1 [==============================] - 0s 418ms/step
1/1 [==============================] - ETA: 0s1/1 [==============================] - 0s 430ms/step
Statistics value = 21.0 p-value = 0.37109375
1/1 [==============================] - ETA: 0s1/1 [==============================] - 0s 391ms/step
1/1 [==============================] - ETA: 0s1/1 [==============================] - 0s 396ms/step
1/1 [==============================] - ETA: 0s1/1 [==============================] - 0s 425ms/step
1/1 [==============================] - ETA: 0s1/1 [==============================] - 0s 408ms/step
Statistics value = 6.0 p-value = 0.9609375
1/1 [==============================] - ETA: 0s1/1 [==============================] - 0s 441ms/step
1/1 [==============================] - ETA: 0s1/1 [==============================] - 0s 400ms/step
1/1 [==============================] - ETA: 0s1/1 [==============================] - 0s 420ms/step
1/1 [==============================] - ETA: 0s1/1 [==============================] - 0s 372ms/step
1/1 [==============================] - ETA: 0s1/1 [==============================] - 0s 456ms/step
1/1 [==============================] - ETA: 0s1/1 [==============================] - 0s 399ms/step
1/1 [==============================] - ETA: 0s1/1 [==============================] - 0s 49ms/step
1/1 [==============================] - ETA: 0s1/1 [==============================] - 0s 40ms/step
1/1 [==============================] - ETA: 0s1/1 [==============================] - 0s 388ms/step
1/1 [==============================] - ETA: 0s1/1 [==============================] - 0s 415ms/step
1/1 [==============================] - ETA: 0s1/1 [==============================] - 0s 47ms/step
1/1 [==============================] - ETA: 0s1/1 [==============================] - 0s 56ms/step
1/1 [==============================] - ETA: 0s1/1 [==============================] - 0s 366ms/step
1/1 [==============================] - ETA: 0s1/1 [==============================] - 0s 355ms/step
1/1 [==============================] - ETA: 0s1/1 [==============================] - 0s 360ms/step
1/1 [==============================] - ETA: 0s1/1 [==============================] - 0s 363ms/step
1/1 [==============================] - ETA: 0s1/1 [==============================] - 0s 61ms/step
1/1 [==============================] - ETA: 0s1/1 [==============================] - 0s 44ms/step
Statistics value = 44.0 p-value = 0.052734375
1/1 [==============================] - ETA: 0s1/1 [==============================] - 0s 363ms/step
1/1 [==============================] - ETA: 0s1/1 [==============================] - 0s 40ms/step
1/1 [==============================] - ETA: 0s1/1 [==============================] - 0s 46ms/step
1/1 [==============================] - ETA: 0s1/1 [==============================] - 0s 385ms/step
Statistics value = 28.0 p-value = 0.5
1/1 [==============================] - ETA: 0s1/1 [==============================] - 0s 393ms/step
1/1 [==============================] - ETA: 0s1/1 [==============================] - 0s 420ms/step
1/1 [==============================] - ETA: 0s1/1 [==============================] - 0s 394ms/step
1/1 [==============================] - ETA: 0s1/1 [==============================] - 0s 403ms/step
Statistics value = 28.0 p-value = 0.5
1/1 [==============================] - ETA: 0s1/1 [==============================] - 0s 412ms/step
1/1 [==============================] - ETA: 0s1/1 [==============================] - 0s 418ms/step
Statistics value = 31.0 p-value = 0.384765625
1/1 [==============================] - ETA: 0s1/1 [==============================] - 0s 430ms/step
1/1 [==============================] - ETA: 0s1/1 [==============================] - 0s 406ms/step
1/1 [==============================] - ETA: 0s1/1 [==============================] - 0s 398ms/step
1/1 [==============================] - ETA: 0s1/1 [==============================] - 0s 374ms/step
1/1 [==============================] - ETA: 0s1/1 [==============================] - 0s 47ms/step
1/1 [==============================] - ETA: 0s1/1 [==============================] - 0s 44ms/step
[I 2024-12-23 18:24:12,963] Trial 11 finished with value: 0.32811532687613154 and parameters: {'n_units_0': 36, 'dropout_1': 0.25, 'run': 2, 'epochs_1': 30, 'epochs_2': 70, 'lr_1': 0.0001090249182652839, 'lr_2': 0.00018929638659073147, 'batch_size': 12, 'regularization': 'l1_l2', 'reg_alpha_1': 0.0012533290118628825, 'reg_alpha_2': 2.7056636258998517e-05}. Best is trial 4 with value: 0.28874593518049796.
1/1 [==============================] - ETA: 0s1/1 [==============================] - 0s 411ms/step
1/1 [==============================] - ETA: 0s1/1 [==============================] - 0s 398ms/step
1/1 [==============================] - ETA: 0s1/1 [==============================] - 0s 49ms/step
1/1 [==============================] - ETA: 0s1/1 [==============================] - 0s 39ms/step
[I 2024-12-23 18:24:18,099] Trial 11 finished with value: 0.23475801365283305 and parameters: {'n_units_0': 40, 'dropout_1': 0.25, 'run': 3, 'epochs_1': 30, 'epochs_2': 20, 'lr_1': 0.00011660786382708495, 'lr_2': 0.0001724802944940557, 'batch_size': 12, 'regularization': 'None'}. Best is trial 8 with value: 0.23390783013972766.
1/1 [==============================] - ETA: 0s1/1 [==============================] - 0s 389ms/step
1/1 [==============================] - ETA: 0s1/1 [==============================] - 0s 388ms/step
1/1 [==============================] - ETA: 0s1/1 [==============================] - 0s 409ms/step
1/1 [==============================] - ETA: 0s1/1 [==============================] - 0s 375ms/step
1/1 [==============================] - ETA: 0s1/1 [==============================] - 0s 41ms/step
1/1 [==============================] - ETA: 0s1/1 [==============================] - 0s 41ms/step
[I 2024-12-23 18:24:25,865] Trial 11 finished with value: 0.5344313182365734 and parameters: {'n_units_0': 32, 'dropout_1': 0.1, 'run': 2, 'epochs_1': 80, 'epochs_2': 100, 'lr_1': 0.008234579469570416, 'lr_2': 0.0003641686745841244, 'batch_size': 12, 'regularization': 'None'}. Best is trial 11 with value: 0.5344313182365734.
Statistics value = 18.0 p-value = 0.52734375
1/1 [==============================] - ETA: 0s1/1 [==============================] - 0s 385ms/step
1/1 [==============================] - ETA: 0s1/1 [==============================] - 0s 386ms/step
Statistics value = 20.0 p-value = 0.421875
1/1 [==============================] - ETA: 0s1/1 [==============================] - 0s 420ms/step
1/1 [==============================] - ETA: 0s1/1 [==============================] - 0s 412ms/step
1/1 [==============================] - ETA: 0s1/1 [==============================] - 0s 363ms/step
1/1 [==============================] - ETA: 0s1/1 [==============================] - 0s 393ms/step
1/1 [==============================] - ETA: 0s1/1 [==============================] - 0s 42ms/step
1/1 [==============================] - ETA: 0s1/1 [==============================] - 0s 39ms/step
