[I 2024-12-23 21:17:46,574] Trial 16 finished with value: 0.4667533479292352 and parameters: {'n_units_0': 48, 'dropout_1': 0.25, 'run': 2, 'epochs_1': 50, 'epochs_2': 80, 'lr_1': 0.006186821524659153, 'lr_2': 0.00010856876584501786, 'batch_size': 12, 'regularization': 'l1', 'reg_alpha_1': 1.1317579493600189e-05}. Best is trial 4 with value: 0.287358010316754.
Statistics value = 25.0 p-value = 0.19140625
1/1 [==============================] - ETA: 0s1/1 [==============================] - 0s 474ms/step
1/1 [==============================] - ETA: 0s1/1 [==============================] - 0s 452ms/step
Statistics value = 22.0 p-value = 0.3203125
1/1 [==============================] - ETA: 0s1/1 [==============================] - 0s 467ms/step
1/1 [==============================] - ETA: 0s1/1 [==============================] - 0s 470ms/step
Statistics value = 14.0 p-value = 0.7265625
1/1 [==============================] - ETA: 0s1/1 [==============================] - 0s 476ms/step
1/1 [==============================] - ETA: 0s1/1 [==============================] - 0s 424ms/step
Statistics value = 12.0 p-value = 0.80859375
1/1 [==============================] - ETA: 0s1/1 [==============================] - 0s 433ms/step
1/1 [==============================] - ETA: 0s1/1 [==============================] - 0s 435ms/step
1/1 [==============================] - ETA: 0s1/1 [==============================] - 1s 511ms/step
1/1 [==============================] - ETA: 0s1/1 [==============================] - 1s 504ms/step
1/1 [==============================] - ETA: 0s1/1 [==============================] - 1s 507ms/step
1/1 [==============================] - ETA: 0s1/1 [==============================] - 0s 64ms/step
1/1 [==============================] - ETA: 0s1/1 [==============================] - 0s 56ms/step
1/1 [==============================] - ETA: 0s1/1 [==============================] - 0s 499ms/step
1/1 [==============================] - ETA: 0s1/1 [==============================] - 0s 425ms/step
1/1 [==============================] - ETA: 0s1/1 [==============================] - 0s 421ms/step
1/1 [==============================] - ETA: 0s1/1 [==============================] - 0s 64ms/step
1/1 [==============================] - ETA: 0s1/1 [==============================] - 0s 40ms/step
1/1 [==============================] - ETA: 0s1/1 [==============================] - 0s 389ms/step
1/1 [==============================] - ETA: 0s1/1 [==============================] - 0s 421ms/step
Statistics value = 8.0 p-value = 0.9814453125
1/1 [==============================] - ETA: 0s1/1 [==============================] - 0s 414ms/step
1/1 [==============================] - ETA: 0s1/1 [==============================] - 0s 404ms/step
1/1 [==============================] - ETA: 0s1/1 [==============================] - 0s 402ms/step
1/1 [==============================] - ETA: 0s1/1 [==============================] - 0s 417ms/step
1/1 [==============================] - ETA: 0s1/1 [==============================] - 0s 50ms/step
1/1 [==============================] - ETA: 0s1/1 [==============================] - 0s 79ms/step
Statistics value = 3.0 p-value = 0.9970703125
1/1 [==============================] - ETA: 0s1/1 [==============================] - 0s 441ms/step
1/1 [==============================] - ETA: 0s1/1 [==============================] - 0s 417ms/step
1/1 [==============================] - ETA: 0s1/1 [==============================] - 0s 430ms/step
1/1 [==============================] - ETA: 0s1/1 [==============================] - 0s 419ms/step
1/1 [==============================] - ETA: 0s1/1 [==============================] - 0s 66ms/step
1/1 [==============================] - ETA: 0s1/1 [==============================] - 0s 41ms/step
1/1 [==============================] - ETA: 0s1/1 [==============================] - 0s 414ms/step
1/1 [==============================] - ETA: 0s1/1 [==============================] - 0s 421ms/step
1/1 [==============================] - ETA: 0s1/1 [==============================] - 0s 53ms/step
1/1 [==============================] - ETA: 0s1/1 [==============================] - 0s 42ms/step
Statistics value = 36.0 p-value = 0.2158203125
1/1 [==============================] - ETA: 0s1/1 [==============================] - 1s 513ms/step
[I 2024-12-23 21:18:37,831] Trial 16 finished with value: 2.5127932919168585 and parameters: {'n_units_0': 24, 'dropout_1': 0.1, 'run': 2, 'epochs_1': 70, 'epochs_2': 80, 'lr_1': 0.007305225733440754, 'lr_2': 2.532711568283824e-05, 'batch_size': 12, 'regularization': 'None'}. Best is trial 15 with value: 1.0200960810433437.
1/1 [==============================] - ETA: 0s1/1 [==============================] - 0s 484ms/step
Statistics value = 30.0 p-value = 0.4228515625
1/1 [==============================] - ETA: 0s1/1 [==============================] - 0s 454ms/step
1/1 [==============================] - ETA: 0s1/1 [==============================] - 0s 463ms/step
1/1 [==============================] - ETA: 0s1/1 [==============================] - 0s 425ms/step
1/1 [==============================] - ETA: 0s1/1 [==============================] - 0s 401ms/step
1/1 [==============================] - ETA: 0s1/1 [==============================] - 0s 54ms/step
1/1 [==============================] - ETA: 0s1/1 [==============================] - 0s 50ms/step
[I 2024-12-23 21:18:47,739] Trial 16 finished with value: 0.2724484259232666 and parameters: {'n_units_0': 36, 'dropout_1': 0.15000000000000002, 'run': 2, 'epochs_1': 50, 'epochs_2': 100, 'lr_1': 0.0028439994205734453, 'lr_2': 8.334140274883222e-05, 'batch_size': 16, 'regularization': 'None'}. Best is trial 14 with value: 0.23324134727545204.
1/1 [==============================] - ETA: 0s1/1 [==============================] - 0s 413ms/step
1/1 [==============================] - ETA: 0s1/1 [==============================] - 0s 439ms/step
Statistics value = 35.0 p-value = 0.0078125
1/1 [==============================] - ETA: 0s1/1 [==============================] - 0s 475ms/step
1/1 [==============================] - ETA: 0s1/1 [==============================] - 0s 450ms/step
1/1 [==============================] - ETA: 0s1/1 [==============================] - 0s 473ms/step
1/1 [==============================] - ETA: 0s1/1 [==============================] - 0s 368ms/step
Statistics value = 4.0 p-value = 0.98046875
1/1 [==============================] - ETA: 0s1/1 [==============================] - 0s 420ms/step
1/1 [==============================] - ETA: 0s1/1 [==============================] - 0s 375ms/step
1/1 [==============================] - ETA: 0s1/1 [==============================] - 0s 443ms/step
1/1 [==============================] - ETA: 0s1/1 [==============================] - 0s 392ms/step
1/1 [==============================] - ETA: 0s1/1 [==============================] - 0s 407ms/step
1/1 [==============================] - ETA: 0s1/1 [==============================] - 0s 66ms/step
1/1 [==============================] - ETA: 0s1/1 [==============================] - 0s 42ms/step
1/1 [==============================] - ETA: 0s1/1 [==============================] - 0s 442ms/step
1/1 [==============================] - ETA: 0s1/1 [==============================] - 0s 84ms/step
1/1 [==============================] - ETA: 0s1/1 [==============================] - 0s 63ms/step
[I 2024-12-23 21:19:07,468] Trial 16 finished with value: 0.6077686235798347 and parameters: {'n_units_0': 24, 'dropout_1': 0.25, 'run': 3, 'epochs_1': 90, 'epochs_2': 30, 'lr_1': 0.00010624288855632119, 'lr_2': 9.073455332083604e-05, 'batch_size': 16, 'regularization': 'None'}. Best is trial 12 with value: 0.49203987197531235.
[I 2024-12-23 21:19:07,873] Trial 17 finished with value: 0.320367983080438 and parameters: {'n_units_0': 28, 'dropout_1': 0.25, 'run': 3, 'epochs_1': 40, 'epochs_2': 60, 'lr_1': 0.00010158654736503013, 'lr_2': 0.00023688308966088526, 'batch_size': 12, 'regularization': 'None'}. Best is trial 4 with value: 0.287358010316754.
1/1 [==============================] - ETA: 0s1/1 [==============================] - 0s 425ms/step
1/1 [==============================] - ETA: 0s1/1 [==============================] - 0s 415ms/step
1/1 [==============================] - ETA: 0s1/1 [==============================] - 0s 433ms/step
Statistics value = 29.0 p-value = 0.07421875
1/1 [==============================] - ETA: 0s1/1 [==============================] - 0s 464ms/step
1/1 [==============================] - ETA: 0s1/1 [==============================] - 0s 452ms/step
1/1 [==============================] - ETA: 0s1/1 [==============================] - 0s 446ms/step
1/1 [==============================] - ETA: 0s1/1 [==============================] - 0s 415ms/step
1/1 [==============================] - ETA: 0s1/1 [==============================] - 0s 393ms/step
1/1 [==============================] - ETA: 0s1/1 [==============================] - 0s 51ms/step
1/1 [==============================] - ETA: 0s1/1 [==============================] - 0s 53ms/step
1/1 [==============================] - ETA: 0s1/1 [==============================] - 0s 63ms/step
1/1 [==============================] - ETA: 0s1/1 [==============================] - 0s 44ms/step
Statistics value = 23.0 p-value = 0.2734375
1/1 [==============================] - ETA: 0s1/1 [==============================] - 0s 455ms/step
1/1 [==============================] - ETA: 0s1/1 [==============================] - 0s 395ms/step
1/1 [==============================] - ETA: 0s1/1 [==============================] - 0s 53ms/step
1/1 [==============================] - ETA: 0s1/1 [==============================] - 0s 39ms/step
Statistics value = 48.0 p-value = 0.0185546875
1/1 [==============================] - ETA: 0s1/1 [==============================] - 0s 411ms/step
1/1 [==============================] - ETA: 0s1/1 [==============================] - 0s 404ms/step
Statistics value = 21.0 p-value = 0.75390625
1/1 [==============================] - ETA: 0s1/1 [==============================] - 0s 413ms/step
1/1 [==============================] - ETA: 0s1/1 [==============================] - 0s 436ms/step
1/1 [==============================] - ETA: 0s1/1 [==============================] - 0s 429ms/step
1/1 [==============================] - ETA: 0s1/1 [==============================] - 0s 461ms/step
Statistics value = 28.0 p-value = 0.5
1/1 [==============================] - ETA: 0s1/1 [==============================] - 0s 406ms/step
1/1 [==============================] - ETA: 0s1/1 [==============================] - 0s 402ms/step
1/1 [==============================] - ETA: 0s1/1 [==============================] - 0s 56ms/step
1/1 [==============================] - ETA: 0s1/1 [==============================] - 0s 46ms/step
[I 2024-12-23 21:19:42,466] Trial 18 finished with value: 0.4301525286550776 and parameters: {'n_units_0': 24, 'dropout_1': 0.1, 'run': 1, 'epochs_1': 70, 'epochs_2': 50, 'lr_1': 0.0009092982489921664, 'lr_2': 6.513089215355305e-05, 'batch_size': 8, 'regularization': 'l1', 'reg_alpha_1': 1.1783052491651685e-05}. Best is trial 4 with value: 0.287358010316754.
1/1 [==============================] - ETA: 0s1/1 [==============================] - 0s 406ms/step
1/1 [==============================] - ETA: 0s1/1 [==============================] - 0s 433ms/step
1/1 [==============================] - ETA: 0s1/1 [==============================] - 0s 48ms/step
1/1 [==============================] - ETA: 0s1/1 [==============================] - 0s 46ms/step
[I 2024-12-23 21:19:50,835] Trial 17 finished with value: 0.23677741122398893 and parameters: {'n_units_0': 40, 'dropout_1': 0.15000000000000002, 'run': 2, 'epochs_1': 70, 'epochs_2': 70, 'lr_1': 0.00013925567079247348, 'lr_2': 2.7610359282076483e-05, 'batch_size': 12, 'regularization': 'l2', 'reg_alpha_1': 1.678309831865769e-05}. Best is trial 14 with value: 0.23324134727545204.
1/1 [==============================] - ETA: 0s1/1 [==============================] - 0s 414ms/step
1/1 [==============================] - ETA: 0s1/1 [==============================] - 0s 451ms/step
1/1 [==============================] - ETA: 0s1/1 [==============================] - 0s 417ms/step
1/1 [==============================] - ETA: 0s1/1 [==============================] - 0s 424ms/step
1/1 [==============================] - ETA: 0s1/1 [==============================] - 0s 56ms/step
1/1 [==============================] - ETA: 0s1/1 [==============================] - 0s 41ms/step
Statistics value = 20.0 p-value = 0.421875
1/1 [==============================] - ETA: 0s1/1 [==============================] - 0s 417ms/step
1/1 [==============================] - ETA: 0s1/1 [==============================] - 0s 426ms/step
Statistics value = 14.0 p-value = 0.7265625
1/1 [==============================] - ETA: 0s1/1 [==============================] - 0s 402ms/step
1/1 [==============================] - ETA: 0s1/1 [==============================] - 0s 407ms/step
1/1 [==============================] - ETA: 0s1/1 [==============================] - 0s 56ms/step
1/1 [==============================] - ETA: 0s1/1 [==============================] - 0s 43ms/step
1/1 [==============================] - ETA: 0s1/1 [==============================] - 0s 430ms/step
1/1 [==============================] - ETA: 0s1/1 [==============================] - 0s 411ms/step
1/1 [==============================] - ETA: 0s1/1 [==============================] - 0s 42ms/step
1/1 [==============================] - ETA: 0s1/1 [==============================] - 0s 45ms/step
Statistics value = 31.0 p-value = 0.384765625
1/1 [==============================] - ETA: 0s1/1 [==============================] - 0s 416ms/step
1/1 [==============================] - ETA: 0s1/1 [==============================] - 0s 428ms/step
[I 2024-12-23 21:20:10,681] Trial 17 finished with value: 1.4184927359768826 and parameters: {'n_units_0': 40, 'dropout_1': 0.15000000000000002, 'run': 3, 'epochs_1': 50, 'epochs_2': 50, 'lr_1': 0.0004663915875553893, 'lr_2': 8.683454550720445e-05, 'batch_size': 8, 'regularization': 'None'}. Best is trial 15 with value: 1.0200960810433437.
1/1 [==============================] - ETA: 0s1/1 [==============================] - 0s 396ms/step
1/1 [==============================] - ETA: 0s1/1 [==============================] - 0s 422ms/step
1/1 [==============================] - ETA: 0s1/1 [==============================] - 0s 52ms/step
1/1 [==============================] - ETA: 0s1/1 [==============================] - 0s 52ms/step
Statistics value = 39.0 p-value = 0.1376953125
1/1 [==============================] - ETA: 0s1/1 [==============================] - 0s 424ms/step
1/1 [==============================] - ETA: 0s1/1 [==============================] - 0s 400ms/step
1/1 [==============================] - ETA: 0s1/1 [==============================] - 0s 49ms/step
1/1 [==============================] - ETA: 0s1/1 [==============================] - 0s 40ms/step
