[I 2024-12-23 19:36:12,252] Trial 16 finished with value: 1.120424395741062 and parameters: {'n_units_0': 48, 'dropout_1': 0.1, 'run': 3, 'epochs_1': 80, 'epochs_2': 80, 'lr_1': 0.00020302372911966822, 'lr_2': 4.518363588745506e-05, 'batch_size': 16, 'regularization': 'l1_l2', 'reg_alpha_1': 0.0004571007083170026, 'reg_alpha_2': 0.009464154147879048}. Best is trial 2 with value: 1.0765693127262415.
1/1 [==============================] - ETA: 0s1/1 [==============================] - 0s 378ms/step
1/1 [==============================] - ETA: 0s1/1 [==============================] - 0s 337ms/step
Statistics value = 19.0 p-value = 0.47265625
1/1 [==============================] - ETA: 0s1/1 [==============================] - 0s 382ms/step
1/1 [==============================] - ETA: 0s1/1 [==============================] - 0s 371ms/step
1/1 [==============================] - ETA: 0s1/1 [==============================] - 0s 420ms/step
1/1 [==============================] - ETA: 0s1/1 [==============================] - 0s 407ms/step
Statistics value = 18.0 p-value = 0.52734375
1/1 [==============================] - ETA: 0s1/1 [==============================] - 0s 385ms/step
1/1 [==============================] - ETA: 0s1/1 [==============================] - 0s 413ms/step
1/1 [==============================] - ETA: 0s1/1 [==============================] - 0s 53ms/step
1/1 [==============================] - ETA: 0s1/1 [==============================] - 0s 48ms/step
1/1 [==============================] - ETA: 0s1/1 [==============================] - 0s 422ms/step
1/1 [==============================] - ETA: 0s1/1 [==============================] - 0s 430ms/step
1/1 [==============================] - ETA: 0s1/1 [==============================] - 0s 48ms/step
1/1 [==============================] - ETA: 0s1/1 [==============================] - 0s 49ms/step
1/1 [==============================] - ETA: 0s1/1 [==============================] - 0s 427ms/step
1/1 [==============================] - ETA: 0s1/1 [==============================] - 0s 428ms/step
1/1 [==============================] - ETA: 0s1/1 [==============================] - 0s 404ms/step
1/1 [==============================] - ETA: 0s1/1 [==============================] - 0s 406ms/step
1/1 [==============================] - ETA: 0s1/1 [==============================] - 0s 47ms/step
1/1 [==============================] - ETA: 0s1/1 [==============================] - 0s 49ms/step
1/1 [==============================] - ETA: 0s1/1 [==============================] - 0s 52ms/step
1/1 [==============================] - ETA: 0s1/1 [==============================] - 0s 44ms/step
[I 2024-12-23 19:36:38,052] Trial 16 finished with value: 0.2684008734510547 and parameters: {'n_units_0': 36, 'dropout_1': 0.3, 'run': 3, 'epochs_1': 70, 'epochs_2': 60, 'lr_1': 0.0007047302709354253, 'lr_2': 8.389752925309778e-05, 'batch_size': 16, 'regularization': 'None'}. Best is trial 0 with value: 0.23177230325555293.
Statistics value = 40.0 p-value = 0.1162109375
1/1 [==============================] - ETA: 0s1/1 [==============================] - 0s 414ms/step
1/1 [==============================] - ETA: 0s1/1 [==============================] - 0s 439ms/step
1/1 [==============================] - ETA: 0s1/1 [==============================] - 0s 44ms/step
1/1 [==============================] - ETA: 0s1/1 [==============================] - 0s 58ms/step
[I 2024-12-23 19:36:42,031] Trial 17 finished with value: 1.2188063747787363 and parameters: {'n_units_0': 32, 'dropout_1': 0.15000000000000002, 'run': 1, 'epochs_1': 50, 'epochs_2': 60, 'lr_1': 0.00010182712311136019, 'lr_2': 1.9356450104946525e-05, 'batch_size': 8, 'regularization': 'None'}. Best is trial 2 with value: 1.0765693127262415.
Statistics value = 29.0 p-value = 0.4609375
1/1 [==============================] - ETA: 0s1/1 [==============================] - 0s 480ms/step
1/1 [==============================] - ETA: 0s1/1 [==============================] - 0s 432ms/step
Statistics value = 7.0 p-value = 0.9453125
1/1 [==============================] - ETA: 0s1/1 [==============================] - 0s 453ms/step
1/1 [==============================] - ETA: 0s1/1 [==============================] - 0s 405ms/step
Statistics value = 27.0 p-value = 0.5390625
1/1 [==============================] - ETA: 0s1/1 [==============================] - 0s 432ms/step
1/1 [==============================] - ETA: 0s1/1 [==============================] - 0s 393ms/step
Statistics value = 18.0 p-value = 0.52734375
1/1 [==============================] - ETA: 0s1/1 [==============================] - 0s 379ms/step
1/1 [==============================] - ETA: 0s1/1 [==============================] - 0s 402ms/step
1/1 [==============================] - ETA: 0s1/1 [==============================] - 0s 397ms/step
1/1 [==============================] - ETA: 0s1/1 [==============================] - 0s 421ms/step
1/1 [==============================] - ETA: 0s1/1 [==============================] - 0s 51ms/step
1/1 [==============================] - ETA: 0s1/1 [==============================] - 0s 47ms/step
[I 2024-12-23 19:36:58,937] Trial 18 finished with value: 0.34459774329244686 and parameters: {'n_units_0': 24, 'dropout_1': 0.1, 'run': 2, 'epochs_1': 60, 'epochs_2': 50, 'lr_1': 0.00033965106875519935, 'lr_2': 0.00015176218012577308, 'batch_size': 12, 'regularization': 'l1_l2', 'reg_alpha_1': 6.498592381382591e-05, 'reg_alpha_2': 1.575290788794899e-05}. Best is trial 4 with value: 0.2871657447935647.
1/1 [==============================] - ETA: 0s1/1 [==============================] - 0s 424ms/step
1/1 [==============================] - ETA: 0s1/1 [==============================] - 0s 409ms/step
Statistics value = 17.0 p-value = 0.578125
1/1 [==============================] - ETA: 0s1/1 [==============================] - 0s 431ms/step
1/1 [==============================] - ETA: 0s1/1 [==============================] - 0s 416ms/step
1/1 [==============================] - ETA: 0s1/1 [==============================] - 0s 361ms/step
1/1 [==============================] - ETA: 0s1/1 [==============================] - 0s 398ms/step
1/1 [==============================] - ETA: 0s1/1 [==============================] - 0s 45ms/step
1/1 [==============================] - ETA: 0s1/1 [==============================] - 0s 44ms/step
1/1 [==============================] - ETA: 0s1/1 [==============================] - 0s 392ms/step
1/1 [==============================] - ETA: 0s1/1 [==============================] - 0s 403ms/step
1/1 [==============================] - ETA: 0s1/1 [==============================] - 0s 402ms/step
1/1 [==============================] - ETA: 0s1/1 [==============================] - 0s 405ms/step
1/1 [==============================] - ETA: 0s1/1 [==============================] - 0s 46ms/step
1/1 [==============================] - ETA: 0s1/1 [==============================] - 0s 47ms/step
1/1 [==============================] - ETA: 0s1/1 [==============================] - 0s 405ms/step
Statistics value = 29.0 p-value = 0.4609375
1/1 [==============================] - ETA: 0s1/1 [==============================] - 0s 405ms/step
1/1 [==============================] - ETA: 0s1/1 [==============================] - 0s 399ms/step
1/1 [==============================] - ETA: 0s1/1 [==============================] - 0s 50ms/step
1/1 [==============================] - ETA: 0s1/1 [==============================] - 0s 44ms/step
1/1 [==============================] - ETA: 0s1/1 [==============================] - 0s 402ms/step
Statistics value = 34.0 p-value = 0.2783203125
1/1 [==============================] - ETA: 0s1/1 [==============================] - 0s 409ms/step
1/1 [==============================] - ETA: 0s1/1 [==============================] - 0s 399ms/step
1/1 [==============================] - ETA: 0s1/1 [==============================] - 0s 467ms/step
1/1 [==============================] - ETA: 0s1/1 [==============================] - 0s 439ms/step
1/1 [==============================] - ETA: 0s1/1 [==============================] - 0s 60ms/step
1/1 [==============================] - ETA: 0s1/1 [==============================] - 0s 47ms/step
[I 2024-12-23 19:37:34,332] Trial 18 finished with value: 0.641743882174023 and parameters: {'n_units_0': 12, 'dropout_1': 0.3, 'run': 3, 'epochs_1': 90, 'epochs_2': 80, 'lr_1': 0.0020214474286321437, 'lr_2': 8.749611193558811e-05, 'batch_size': 8, 'regularization': 'l1_l2', 'reg_alpha_1': 1.3477289228691214e-05, 'reg_alpha_2': 1.4533550875819813e-05}. Best is trial 5 with value: 0.5386896307269354.
1/1 [==============================] - ETA: 0s1/1 [==============================] - 0s 395ms/step
1/1 [==============================] - ETA: 0s1/1 [==============================] - 0s 421ms/step
1/1 [==============================] - ETA: 0s1/1 [==============================] - 0s 43ms/step
1/1 [==============================] - ETA: 0s1/1 [==============================] - 0s 48ms/step
[I 2024-12-23 19:37:37,192] Trial 18 finished with value: 1.1501289700013715 and parameters: {'n_units_0': 4, 'dropout_1': 0.25, 'run': 2, 'epochs_1': 60, 'epochs_2': 50, 'lr_1': 0.0003042053533042828, 'lr_2': 0.00019298826820903913, 'batch_size': 12, 'regularization': 'l1', 'reg_alpha_1': 7.12313164346007e-05}. Best is trial 2 with value: 1.0765693127262415.
Statistics value = 30.0 p-value = 0.4228515625
1/1 [==============================] - ETA: 0s1/1 [==============================] - 0s 426ms/step
1/1 [==============================] - ETA: 0s1/1 [==============================] - 0s 428ms/step
Statistics value = 18.0 p-value = 0.52734375
1/1 [==============================] - ETA: 0s1/1 [==============================] - 0s 404ms/step
1/1 [==============================] - ETA: 0s1/1 [==============================] - 0s 391ms/step
1/1 [==============================] - ETA: 0s1/1 [==============================] - 0s 48ms/step
1/1 [==============================] - ETA: 0s1/1 [==============================] - 0s 49ms/step
Statistics value = 11.0 p-value = 0.84375
1/1 [==============================] - ETA: 0s1/1 [==============================] - 0s 403ms/step
1/1 [==============================] - ETA: 0s1/1 [==============================] - 0s 451ms/step
1/1 [==============================] - ETA: 0s1/1 [==============================] - 0s 409ms/step
1/1 [==============================] - ETA: 0s1/1 [==============================] - 0s 475ms/step
1/1 [==============================] - ETA: 0s1/1 [==============================] - 0s 410ms/step
1/1 [==============================] - ETA: 0s1/1 [==============================] - 0s 394ms/step
1/1 [==============================] - ETA: 0s1/1 [==============================] - 0s 41ms/step
1/1 [==============================] - ETA: 0s1/1 [==============================] - 0s 39ms/step
[I 2024-12-23 19:37:55,688] Trial 19 finished with value: 0.317556951964316 and parameters: {'n_units_0': 32, 'dropout_1': 0.15000000000000002, 'run': 2, 'epochs_1': 40, 'epochs_2': 20, 'lr_1': 0.0001071623979726951, 'lr_2': 0.0004755258531422745, 'batch_size': 12, 'regularization': 'l1', 'reg_alpha_1': 0.00042920596340935695}. Best is trial 4 with value: 0.2871657447935647.
Statistics value = 36.0 p-value = 0.2158203125
1/1 [==============================] - ETA: 0s1/1 [==============================] - 0s 409ms/step
1/1 [==============================] - ETA: 0s1/1 [==============================] - 0s 410ms/step
1/1 [==============================] - ETA: 0s1/1 [==============================] - 0s 58ms/step
1/1 [==============================] - ETA: 0s1/1 [==============================] - 0s 42ms/step
[I 2024-12-23 19:38:00,743] Trial 19 finished with value: 0.7139555021572355 and parameters: {'n_units_0': 24, 'dropout_1': 0.15000000000000002, 'run': 1, 'epochs_1': 50, 'epochs_2': 50, 'lr_1': 0.00010107928070607773, 'lr_2': 0.0009827674611457343, 'batch_size': 16, 'regularization': 'None'}. Best is trial 5 with value: 0.5386896307269354.
1/1 [==============================] - ETA: 0s1/1 [==============================] - 0s 420ms/step
1/1 [==============================] - ETA: 0s1/1 [==============================] - 0s 399ms/step
1/1 [==============================] - ETA: 0s1/1 [==============================] - 0s 52ms/step
1/1 [==============================] - ETA: 0s1/1 [==============================] - 0s 416ms/step
1/1 [==============================] - ETA: 0s1/1 [==============================] - 0s 46ms/step
1/1 [==============================] - ETA: 0s1/1 [==============================] - 0s 401ms/step
1/1 [==============================] - ETA: 0s1/1 [==============================] - 0s 44ms/step
1/1 [==============================] - ETA: 0s1/1 [==============================] - 0s 41ms/step
[I 2024-12-23 19:38:02,959] Trial 17 finished with value: 0.2339002534369079 and parameters: {'n_units_0': 40, 'dropout_1': 0.25, 'run': 3, 'epochs_1': 50, 'epochs_2': 30, 'lr_1': 0.0003179137026688628, 'lr_2': 2.760137217665175e-05, 'batch_size': 12, 'regularization': 'l2', 'reg_alpha_1': 4.640949328625899e-05}. Best is trial 0 with value: 0.23177230325555293.
Statistics value = 20.0 p-value = 0.421875
1/1 [==============================] - ETA: 0s1/1 [==============================] - 0s 421ms/step
1/1 [==============================] - ETA: 0s1/1 [==============================] - 0s 392ms/step
Statistics value = 20.0 p-value = 0.7841796875
1/1 [==============================] - ETA: 0s1/1 [==============================] - 0s 407ms/step
1/1 [==============================] - ETA: 0s1/1 [==============================] - 0s 393ms/step
1/1 [==============================] - ETA: 0s1/1 [==============================] - 0s 441ms/step
1/1 [==============================] - ETA: 0s1/1 [==============================] - 0s 402ms/step
1/1 [==============================] - ETA: 0s1/1 [==============================] - 0s 428ms/step
1/1 [==============================] - ETA: 0s1/1 [==============================] - 0s 407ms/step
1/1 [==============================] - ETA: 0s1/1 [==============================] - 0s 55ms/step
1/1 [==============================] - ETA: 0s1/1 [==============================] - 0s 47ms/step
[I 2024-12-23 19:38:34,167] Trial 19 finished with value: 1.174919426698978 and parameters: {'n_units_0': 24, 'dropout_1': 0.15000000000000002, 'run': 2, 'epochs_1': 30, 'epochs_2': 30, 'lr_1': 0.0005308695300482681, 'lr_2': 3.312965424600571e-05, 'batch_size': 12, 'regularization': 'l1_l2', 'reg_alpha_1': 0.0023932297815924685, 'reg_alpha_2': 0.00017221754639746973}. Best is trial 2 with value: 1.0765693127262415.
1/1 [==============================] - ETA: 0s1/1 [==============================] - 0s 431ms/step
1/1 [==============================] - ETA: 0s1/1 [==============================] - 0s 426ms/step
1/1 [==============================] - ETA: 0s1/1 [==============================] - 0s 47ms/step
1/1 [==============================] - ETA: 0s1/1 [==============================] - 0s 41ms/step
Statistics value = 23.0 p-value = 0.6875
1/1 [==============================] - ETA: 0s1/1 [==============================] - 0s 411ms/step
1/1 [==============================] - ETA: 0s1/1 [==============================] - 0s 366ms/step
1/1 [==============================] - ETA: 0s1/1 [==============================] - 0s 424ms/step
1/1 [==============================] - ETA: 0s1/1 [==============================] - 0s 407ms/step
1/1 [==============================] - ETA: 0s1/1 [==============================] - 0s 422ms/step
1/1 [==============================] - ETA: 0s1/1 [==============================] - 0s 430ms/step
1/1 [==============================] - ETA: 0s1/1 [==============================] - 0s 48ms/step
1/1 [==============================] - ETA: 0s1/1 [==============================] - 0s 44ms/step
