[I 2024-12-23 18:10:30,370] Trial 19 finished with value: 0.641676409779139 and parameters: {'n_units_0': 40, 'dropout_1': 0.15000000000000002, 'run': 3, 'epochs_1': 90, 'epochs_2': 50, 'lr_1': 0.00010123615160899567, 'lr_2': 0.0009827674611457343, 'batch_size': 8, 'regularization': 'l1_l2', 'reg_alpha_1': 1.7123455564023617e-05, 'reg_alpha_2': 1.2471762080221563e-05}. Best is trial 18 with value: 0.5083460326932671.
Statistics value = 18.0 p-value = 0.52734375
Statistics value = 18.0 p-value = 0.52734375
Statistics value = 1.0 p-value = 0.99609375
Statistics value = 20.0 p-value = 0.421875

EVER Study Best parameters:
{'n_units_0': 24, 'dropout_1': 0.3, 'run': 3, 'epochs_1': 70, 'epochs_2': 30, 'lr_1': 0.00020511104188433984, 'lr_2': 1.3066739238053272e-05, 'batch_size': 16, 'regularization': 'None'}
Best value (Average MSE): 0.2323527228116573

EV Study Best parameters:
{'n_units_0': 16, 'dropout_1': 0.2, 'run': 2, 'epochs_1': 30, 'epochs_2': 70, 'lr_1': 0.00021930485556643703, 'lr_2': 1.3492834268013232e-05, 'batch_size': 16, 'regularization': 'l1_l2', 'reg_alpha_1': 0.0011290133559092666, 'reg_alpha_2': 0.00020914981329035596}
Best value (Average MSE): 1.0905569645862152

PHEV Study Best parameters:
{'n_units_0': 12, 'dropout_1': 0.3, 'run': 3, 'epochs_1': 90, 'epochs_2': 80, 'lr_1': 0.00011392822758949237, 'lr_2': 1.009411649000841e-05, 'batch_size': 8, 'regularization': 'l1_l2', 'reg_alpha_1': 1.3477289228691214e-05, 'reg_alpha_2': 1.4533550875819813e-05}
Best value (Average MSE): 0.5083460326932671

FUEL Study Best parameters:
{'n_units_0': 8, 'dropout_1': 0.3, 'run': 2, 'epochs_1': 50, 'epochs_2': 20, 'lr_1': 0.0004187594718900631, 'lr_2': 4.4706085467784903e-05, 'batch_size': 16, 'regularization': 'l1', 'reg_alpha_1': 0.0013795402040204172}
Best value (Average MSE): 0.294111160203098
