[I 2024-12-23 21:26:17,015] Trial 2 finished with value: 0.5434584180230934 and parameters: {'n_units_0': 16, 'dropout_1': 0.2, 'run': 2, 'epochs_1': 30, 'epochs_2': 70, 'lr_1': 0.00021930485556643703, 'lr_2': 1.3492834268013232e-05, 'batch_size': 16, 'regularization': 'l1_l2', 'reg_alpha_1': 0.0011290133559092666, 'reg_alpha_2': 0.00020914981329035596}. Best is trial 2 with value: 0.5434584180230934.
Statistics value = 18.0 p-value = 0.52734375
1/1 [==============================] - ETA: 0s1/1 [==============================] - 0s 395ms/step
Statistics value = 23.0 p-value = 0.2734375
1/1 [==============================] - ETA: 0s1/1 [==============================] - 0s 363ms/step
1/1 [==============================] - ETA: 0s1/1 [==============================] - 0s 462ms/step
1/1 [==============================] - ETA: 0s1/1 [==============================] - 0s 408ms/step
Statistics value = 10.0 p-value = 0.875
1/1 [==============================] - ETA: 0s1/1 [==============================] - 0s 377ms/step
Statistics value = 6.0 p-value = 0.9609375
1/1 [==============================] - ETA: 0s1/1 [==============================] - 0s 363ms/step
1/1 [==============================] - ETA: 0s1/1 [==============================] - 0s 84ms/step
1/1 [==============================] - ETA: 0s1/1 [==============================] - 0s 62ms/step
1/1 [==============================] - ETA: 0s1/1 [==============================] - 0s 45ms/step
1/1 [==============================] - ETA: 0s1/1 [==============================] - 0s 49ms/step
1/1 [==============================] - ETA: 0s1/1 [==============================] - 0s 403ms/step
1/1 [==============================] - ETA: 0s1/1 [==============================] - 0s 419ms/step
1/1 [==============================] - ETA: 0s1/1 [==============================] - 0s 39ms/step
1/1 [==============================] - ETA: 0s1/1 [==============================] - 0s 53ms/step
1/1 [==============================] - ETA: 0s1/1 [==============================] - 0s 44ms/step
1/1 [==============================] - ETA: 0s1/1 [==============================] - 0s 43ms/step
Statistics value = 31.0 p-value = 0.384765625
1/1 [==============================] - ETA: 0s1/1 [==============================] - 0s 377ms/step
Statistics value = 13.0 p-value = 0.9345703125
1/1 [==============================] - ETA: 0s1/1 [==============================] - 0s 387ms/step
1/1 [==============================] - ETA: 0s1/1 [==============================] - 0s 398ms/step
1/1 [==============================] - ETA: 0s1/1 [==============================] - 0s 404ms/step
Statistics value = 30.0 p-value = 0.4228515625
1/1 [==============================] - ETA: 0s1/1 [==============================] - 0s 371ms/step
1/1 [==============================] - ETA: 0s1/1 [==============================] - 0s 50ms/step
1/1 [==============================] - ETA: 0s1/1 [==============================] - 0s 51ms/step
Statistics value = 24.0 p-value = 0.65234375
1/1 [==============================] - ETA: 0s1/1 [==============================] - 0s 434ms/step
1/1 [==============================] - ETA: 0s1/1 [==============================] - 0s 59ms/step
1/1 [==============================] - ETA: 0s1/1 [==============================] - 0s 67ms/step
1/1 [==============================] - ETA: 0s1/1 [==============================] - 0s 415ms/step
1/1 [==============================] - ETA: 0s1/1 [==============================] - 0s 446ms/step
1/1 [==============================] - ETA: 0s1/1 [==============================] - 0s 128ms/step
1/1 [==============================] - ETA: 0s1/1 [==============================] - 0s 40ms/step
1/1 [==============================] - ETA: 0s1/1 [==============================] - 0s 41ms/step
1/1 [==============================] - ETA: 0s1/1 [==============================] - 0s 75ms/step
[I 2024-12-23 21:26:50,770] Trial 3 finished with value: 0.2675479394281116 and parameters: {'n_units_0': 8, 'dropout_1': 0.2, 'run': 1, 'epochs_1': 100, 'epochs_2': 40, 'lr_1': 0.0021137059440645744, 'lr_2': 4.201672054372529e-05, 'batch_size': 12, 'regularization': 'l2', 'reg_alpha_1': 0.006584106160121612}. Best is trial 2 with value: 0.23331412008324187.
[I 2024-12-23 21:26:50,779] Trial 3 finished with value: 0.4204112132134107 and parameters: {'n_units_0': 8, 'dropout_1': 0.2, 'run': 1, 'epochs_1': 100, 'epochs_2': 40, 'lr_1': 0.0021137059440645744, 'lr_2': 4.201672054372529e-05, 'batch_size': 12, 'regularization': 'l2', 'reg_alpha_1': 0.006584106160121612}. Best is trial 2 with value: 0.28885393619906585.
[I 2024-12-23 21:26:51,407] Trial 3 finished with value: 0.6424918963380335 and parameters: {'n_units_0': 8, 'dropout_1': 0.2, 'run': 1, 'epochs_1': 100, 'epochs_2': 40, 'lr_1': 0.0021137059440645744, 'lr_2': 4.201672054372529e-05, 'batch_size': 12, 'regularization': 'l2', 'reg_alpha_1': 0.006584106160121612}. Best is trial 2 with value: 0.5434584180230934.
[I 2024-12-23 21:26:51,477] Trial 3 finished with value: 1.8201417136631726 and parameters: {'n_units_0': 8, 'dropout_1': 0.2, 'run': 1, 'epochs_1': 100, 'epochs_2': 40, 'lr_1': 0.0021137059440645744, 'lr_2': 4.201672054372529e-05, 'batch_size': 12, 'regularization': 'l2', 'reg_alpha_1': 0.006584106160121612}. Best is trial 0 with value: 1.0441492888163748.
Statistics value = 7.0 p-value = 0.9453125
1/1 [==============================] - ETA: 0s1/1 [==============================] - 0s 380ms/step
Statistics value = 19.0 p-value = 0.47265625
1/1 [==============================] - ETA: 0s1/1 [==============================] - 0s 462ms/step
Statistics value = 18.0 p-value = 0.52734375
1/1 [==============================] - ETA: 0s1/1 [==============================] - 0s 389ms/step
1/1 [==============================] - ETA: 0s1/1 [==============================] - 0s 400ms/step
Statistics value = 34.0 p-value = 0.01171875
1/1 [==============================] - ETA: 0s1/1 [==============================] - 0s 411ms/step
1/1 [==============================] - ETA: 0s1/1 [==============================] - 0s 393ms/step
1/1 [==============================] - ETA: 0s1/1 [==============================] - 0s 374ms/step
1/1 [==============================] - ETA: 0s1/1 [==============================] - 0s 366ms/step
1/1 [==============================] - ETA: 0s1/1 [==============================] - 0s 395ms/step
1/1 [==============================] - ETA: 0s1/1 [==============================] - 0s 379ms/step
1/1 [==============================] - ETA: 0s1/1 [==============================] - 0s 389ms/step
1/1 [==============================] - ETA: 0s1/1 [==============================] - 0s 376ms/step
1/1 [==============================] - ETA: 0s1/1 [==============================] - 0s 381ms/step
1/1 [==============================] - ETA: 0s1/1 [==============================] - 0s 421ms/step
1/1 [==============================] - ETA: 0s1/1 [==============================] - 0s 428ms/step
1/1 [==============================] - ETA: 0s1/1 [==============================] - 0s 410ms/step
1/1 [==============================] - ETA: 0s1/1 [==============================] - 0s 426ms/step
1/1 [==============================] - ETA: 0s1/1 [==============================] - 0s 423ms/step
1/1 [==============================] - ETA: 0s1/1 [==============================] - 0s 422ms/step
1/1 [==============================] - ETA: 0s1/1 [==============================] - 0s 412ms/step
1/1 [==============================] - ETA: 0s1/1 [==============================] - 0s 385ms/step
1/1 [==============================] - ETA: 0s1/1 [==============================] - 1s 502ms/step
1/1 [==============================] - ETA: 0s1/1 [==============================] - 0s 63ms/step
1/1 [==============================] - ETA: 0s1/1 [==============================] - 0s 403ms/step
1/1 [==============================] - ETA: 0s1/1 [==============================] - 0s 68ms/step
1/1 [==============================] - ETA: 0s1/1 [==============================] - 0s 404ms/step
1/1 [==============================] - ETA: 0s1/1 [==============================] - 0s 92ms/step
1/1 [==============================] - ETA: 0s1/1 [==============================] - 0s 67ms/step
1/1 [==============================] - ETA: 0s1/1 [==============================] - 0s 65ms/step
1/1 [==============================] - ETA: 0s1/1 [==============================] - 0s 67ms/step
1/1 [==============================] - ETA: 0s1/1 [==============================] - 0s 44ms/step
1/1 [==============================] - ETA: 0s1/1 [==============================] - 0s 40ms/step
Statistics value = 44.0 p-value = 0.052734375
1/1 [==============================] - ETA: 0s1/1 [==============================] - 0s 453ms/step
Statistics value = 29.0 p-value = 0.4609375
1/1 [==============================] - ETA: 0s1/1 [==============================] - 1s 545ms/step
Statistics value = 22.0 p-value = 0.7216796875
1/1 [==============================] - ETA: 0s1/1 [==============================] - 1s 537ms/step
Statistics value = 29.0 p-value = 0.4609375
1/1 [==============================] - ETA: 0s1/1 [==============================] - 0s 417ms/step
1/1 [==============================] - ETA: 0s1/1 [==============================] - 0s 379ms/step
1/1 [==============================] - ETA: 0s1/1 [==============================] - 0s 382ms/step
1/1 [==============================] - ETA: 0s1/1 [==============================] - 0s 394ms/step
1/1 [==============================] - ETA: 0s1/1 [==============================] - 0s 406ms/step
1/1 [==============================] - ETA: 0s1/1 [==============================] - 0s 380ms/step
1/1 [==============================] - ETA: 0s1/1 [==============================] - 0s 390ms/step
1/1 [==============================] - ETA: 0s1/1 [==============================] - 0s 410ms/step
1/1 [==============================] - ETA: 0s1/1 [==============================] - 0s 391ms/step
1/1 [==============================] - ETA: 0s1/1 [==============================] - 0s 389ms/step
1/1 [==============================] - ETA: 0s1/1 [==============================] - 0s 417ms/step
1/1 [==============================] - ETA: 0s1/1 [==============================] - 0s 405ms/step
1/1 [==============================] - ETA: 0s1/1 [==============================] - 0s 399ms/step
1/1 [==============================] - ETA: 0s1/1 [==============================] - 0s 399ms/step
1/1 [==============================] - ETA: 0s1/1 [==============================] - 0s 409ms/step
1/1 [==============================] - ETA: 0s1/1 [==============================] - 0s 381ms/step
1/1 [==============================] - ETA: 0s1/1 [==============================] - 0s 412ms/step
1/1 [==============================] - ETA: 0s1/1 [==============================] - 0s 366ms/step
1/1 [==============================] - ETA: 0s1/1 [==============================] - 0s 378ms/step
1/1 [==============================] - ETA: 0s1/1 [==============================] - 0s 408ms/step
1/1 [==============================] - ETA: 0s1/1 [==============================] - 0s 404ms/step
1/1 [==============================] - ETA: 0s1/1 [==============================] - 0s 80ms/step
1/1 [==============================] - ETA: 0s1/1 [==============================] - 0s 84ms/step
1/1 [==============================] - ETA: 0s1/1 [==============================] - 0s 46ms/step
1/1 [==============================] - ETA: 0s1/1 [==============================] - 0s 51ms/step
1/1 [==============================] - ETA: 0s1/1 [==============================] - 0s 73ms/step
1/1 [==============================] - ETA: 0s1/1 [==============================] - 0s 77ms/step
1/1 [==============================] - ETA: 0s1/1 [==============================] - 0s 73ms/step
1/1 [==============================] - ETA: 0s1/1 [==============================] - 0s 70ms/step
[I 2024-12-23 21:28:04,446] Trial 4 finished with value: 0.291662624006225 and parameters: {'n_units_0': 60, 'dropout_1': 0.2, 'run': 3, 'epochs_1': 30, 'epochs_2': 30, 'lr_1': 0.00012315571723666037, 'lr_2': 4.473636174621264e-05, 'batch_size': 12, 'regularization': 'l1', 'reg_alpha_1': 0.00042470585622618684}. Best is trial 2 with value: 0.28885393619906585.
[I 2024-12-23 21:28:04,460] Trial 4 finished with value: 0.23204332328658517 and parameters: {'n_units_0': 60, 'dropout_1': 0.2, 'run': 3, 'epochs_1': 30, 'epochs_2': 30, 'lr_1': 0.00012315571723666037, 'lr_2': 4.473636174621264e-05, 'batch_size': 12, 'regularization': 'l1', 'reg_alpha_1': 0.00042470585622618684}. Best is trial 4 with value: 0.23204332328658517.
[I 2024-12-23 21:28:04,476] Trial 4 finished with value: 1.114620616921762 and parameters: {'n_units_0': 60, 'dropout_1': 0.2, 'run': 3, 'epochs_1': 30, 'epochs_2': 30, 'lr_1': 0.00012315571723666037, 'lr_2': 4.473636174621264e-05, 'batch_size': 12, 'regularization': 'l1', 'reg_alpha_1': 0.00042470585622618684}. Best is trial 0 with value: 1.0441492888163748.
