[I 2024-12-23 20:48:53,287] Trial 11 finished with value: 0.23880504511683853 and parameters: {'n_units_0': 28, 'dropout_1': 0.25, 'run': 3, 'epochs_1': 70, 'epochs_2': 50, 'lr_1': 0.0001090249182652839, 'lr_2': 0.0001965638261089347, 'batch_size': 12, 'regularization': 'None'}. Best is trial 4 with value: 0.23204400055127733.
1/1 [==============================] - ETA: 0s1/1 [==============================] - 0s 472ms/step
1/1 [==============================] - ETA: 0s1/1 [==============================] - 0s 414ms/step
1/1 [==============================] - ETA: 0s1/1 [==============================] - 0s 49ms/step
1/1 [==============================] - ETA: 0s1/1 [==============================] - 0s 51ms/step
1/1 [==============================] - ETA: 0s1/1 [==============================] - 0s 425ms/step
1/1 [==============================] - ETA: 0s1/1 [==============================] - 0s 443ms/step
1/1 [==============================] - ETA: 0s1/1 [==============================] - 0s 427ms/step
1/1 [==============================] - ETA: 0s1/1 [==============================] - 0s 52ms/step
1/1 [==============================] - ETA: 0s1/1 [==============================] - 0s 62ms/step
1/1 [==============================] - ETA: 0s1/1 [==============================] - 0s 450ms/step
1/1 [==============================] - ETA: 0s1/1 [==============================] - 0s 65ms/step
1/1 [==============================] - ETA: 0s1/1 [==============================] - 0s 40ms/step
Statistics value = 13.0 p-value = 0.76953125
1/1 [==============================] - ETA: 0s1/1 [==============================] - 1s 630ms/step
1/1 [==============================] - ETA: 0s1/1 [==============================] - 1s 581ms/step
Statistics value = 27.0 p-value = 0.5390625
1/1 [==============================] - ETA: 0s1/1 [==============================] - 0s 399ms/step
1/1 [==============================] - ETA: 0s1/1 [==============================] - 0s 440ms/step
Statistics value = 30.0 p-value = 0.4228515625
1/1 [==============================] - ETA: 0s1/1 [==============================] - 0s 460ms/step
Statistics value = 27.0 p-value = 0.5390625
1/1 [==============================] - ETA: 0s1/1 [==============================] - 0s 426ms/step
1/1 [==============================] - ETA: 0s1/1 [==============================] - 0s 428ms/step
1/1 [==============================] - ETA: 0s1/1 [==============================] - 0s 411ms/step
1/1 [==============================] - ETA: 0s1/1 [==============================] - 0s 449ms/step
1/1 [==============================] - ETA: 0s1/1 [==============================] - 0s 428ms/step
1/1 [==============================] - ETA: 0s1/1 [==============================] - 0s 414ms/step
1/1 [==============================] - ETA: 0s1/1 [==============================] - 0s 448ms/step
1/1 [==============================] - ETA: 0s1/1 [==============================] - 0s 70ms/step
1/1 [==============================] - ETA: 0s1/1 [==============================] - 0s 72ms/step
[I 2024-12-23 20:49:30,885] Trial 12 finished with value: 0.40929602052736025 and parameters: {'n_units_0': 28, 'dropout_1': 0.15000000000000002, 'run': 2, 'epochs_1': 30, 'epochs_2': 60, 'lr_1': 0.00010525521998095273, 'lr_2': 0.0008607419445086135, 'batch_size': 12, 'regularization': 'None'}. Best is trial 2 with value: 0.2849574314763971.
1/1 [==============================] - ETA: 0s1/1 [==============================] - 0s 411ms/step
1/1 [==============================] - ETA: 0s1/1 [==============================] - 0s 430ms/step
1/1 [==============================] - ETA: 0s1/1 [==============================] - 0s 64ms/step
1/1 [==============================] - ETA: 0s1/1 [==============================] - 0s 41ms/step
[I 2024-12-23 20:49:35,706] Trial 12 finished with value: 1.3378632297292121 and parameters: {'n_units_0': 28, 'dropout_1': 0.25, 'run': 2, 'epochs_1': 30, 'epochs_2': 70, 'lr_1': 0.0009920562866268196, 'lr_2': 0.00020046179107204468, 'batch_size': 16, 'regularization': 'l1_l2', 'reg_alpha_1': 0.0012890382742583037, 'reg_alpha_2': 0.0001618399410450636}. Best is trial 11 with value: 1.0687378513561676.
1/1 [==============================] - ETA: 0s1/1 [==============================] - 0s 446ms/step
1/1 [==============================] - ETA: 0s1/1 [==============================] - 0s 419ms/step
1/1 [==============================] - ETA: 0s1/1 [==============================] - 0s 60ms/step
1/1 [==============================] - ETA: 0s1/1 [==============================] - 0s 43ms/step
1/1 [==============================] - ETA: 0s1/1 [==============================] - 0s 423ms/step
[I 2024-12-23 20:49:37,972] Trial 12 finished with value: 0.6103688769131403 and parameters: {'n_units_0': 32, 'dropout_1': 0.3, 'run': 2, 'epochs_1': 50, 'epochs_2': 100, 'lr_1': 0.0006694653933471386, 'lr_2': 0.00020488656999844622, 'batch_size': 16, 'regularization': 'l1_l2', 'reg_alpha_1': 0.001676057887339191, 'reg_alpha_2': 1.0441455318786882e-05}. Best is trial 6 with value: 0.4593968537115809.
1/1 [==============================] - ETA: 0s1/1 [==============================] - 0s 409ms/step
1/1 [==============================] - ETA: 0s1/1 [==============================] - 0s 53ms/step
1/1 [==============================] - ETA: 0s1/1 [==============================] - 0s 42ms/step
Statistics value = 25.0 p-value = 0.19140625
1/1 [==============================] - ETA: 0s1/1 [==============================] - 0s 443ms/step
1/1 [==============================] - ETA: 0s1/1 [==============================] - 0s 394ms/step
Statistics value = 49.0 p-value = 0.013671875
1/1 [==============================] - ETA: 0s1/1 [==============================] - 1s 524ms/step
Statistics value = 33.0 p-value = 0.01953125
1/1 [==============================] - ETA: 0s1/1 [==============================] - 0s 400ms/step
1/1 [==============================] - ETA: 0s1/1 [==============================] - 0s 428ms/step
1/1 [==============================] - ETA: 0s1/1 [==============================] - 0s 409ms/step
Statistics value = 18.0 p-value = 0.52734375
1/1 [==============================] - ETA: 0s1/1 [==============================] - 0s 412ms/step
1/1 [==============================] - ETA: 0s1/1 [==============================] - 0s 401ms/step
1/1 [==============================] - ETA: 0s1/1 [==============================] - 0s 399ms/step
1/1 [==============================] - ETA: 0s1/1 [==============================] - 0s 445ms/step
1/1 [==============================] - ETA: 0s1/1 [==============================] - 0s 407ms/step
1/1 [==============================] - ETA: 0s1/1 [==============================] - 0s 461ms/step
1/1 [==============================] - ETA: 0s1/1 [==============================] - 0s 63ms/step
1/1 [==============================] - ETA: 0s1/1 [==============================] - 0s 80ms/step
1/1 [==============================] - ETA: 0s1/1 [==============================] - 1s 530ms/step
1/1 [==============================] - ETA: 0s1/1 [==============================] - 0s 466ms/step
1/1 [==============================] - ETA: 0s1/1 [==============================] - 0s 51ms/step
1/1 [==============================] - ETA: 0s1/1 [==============================] - 0s 55ms/step
1/1 [==============================] - ETA: 0s1/1 [==============================] - 8s 8s/step
1/1 [==============================] - ETA: 0s1/1 [==============================] - 0s 466ms/step
1/1 [==============================] - ETA: 0s1/1 [==============================] - 0s 52ms/step
1/1 [==============================] - ETA: 0s1/1 [==============================] - 0s 66ms/step
1/1 [==============================] - ETA: 0s1/1 [==============================] - 0s 430ms/step
1/1 [==============================] - ETA: 0s1/1 [==============================] - 0s 462ms/step
1/1 [==============================] - ETA: 0s1/1 [==============================] - 0s 62ms/step
1/1 [==============================] - ETA: 0s1/1 [==============================] - 0s 41ms/step
[I 2024-12-23 20:50:22,263] Trial 12 finished with value: 0.23266260763164134 and parameters: {'n_units_0': 32, 'dropout_1': 0.25, 'run': 3, 'epochs_1': 80, 'epochs_2': 20, 'lr_1': 0.000124303097384124, 'lr_2': 0.00011781522065752308, 'batch_size': 12, 'regularization': 'None'}. Best is trial 4 with value: 0.23204400055127733.
Statistics value = 24.0 p-value = 0.65234375
1/1 [==============================] - ETA: 0s1/1 [==============================] - 0s 392ms/step
1/1 [==============================] - ETA: 0s1/1 [==============================] - 0s 410ms/step
Statistics value = 24.0 p-value = 0.65234375
1/1 [==============================] - ETA: 0s1/1 [==============================] - 0s 392ms/step
1/1 [==============================] - ETA: 0s1/1 [==============================] - 0s 392ms/step
Statistics value = 29.0 p-value = 0.4609375
1/1 [==============================] - ETA: 0s1/1 [==============================] - 0s 442ms/step
1/1 [==============================] - ETA: 0s1/1 [==============================] - 0s 407ms/step
Statistics value = 14.0 p-value = 0.7265625
1/1 [==============================] - ETA: 0s1/1 [==============================] - 0s 430ms/step
1/1 [==============================] - ETA: 0s1/1 [==============================] - 0s 444ms/step
1/1 [==============================] - ETA: 0s1/1 [==============================] - 1s 507ms/step
1/1 [==============================] - ETA: 0s1/1 [==============================] - 0s 414ms/step
1/1 [==============================] - ETA: 0s1/1 [==============================] - 0s 384ms/step
1/1 [==============================] - ETA: 0s1/1 [==============================] - 0s 50ms/step
1/1 [==============================] - ETA: 0s1/1 [==============================] - 0s 43ms/step
1/1 [==============================] - ETA: 0s1/1 [==============================] - 0s 402ms/step
1/1 [==============================] - ETA: 0s1/1 [==============================] - 0s 95ms/step
1/1 [==============================] - ETA: 0s1/1 [==============================] - 0s 44ms/step
[I 2024-12-23 20:50:45,702] Trial 13 finished with value: 0.5529727116510355 and parameters: {'n_units_0': 4, 'dropout_1': 0.25, 'run': 2, 'epochs_1': 60, 'epochs_2': 60, 'lr_1': 0.0014413724938250041, 'lr_2': 0.0008524636948952184, 'batch_size': 16, 'regularization': 'l1', 'reg_alpha_1': 0.0013755821407749054}. Best is trial 6 with value: 0.4593968537115809.
[I 2024-12-23 20:50:46,273] Trial 13 finished with value: 1.4309475437360946 and parameters: {'n_units_0': 4, 'dropout_1': 0.25, 'run': 2, 'epochs_1': 50, 'epochs_2': 80, 'lr_1': 0.002116256271220487, 'lr_2': 0.0009818247569037461, 'batch_size': 16, 'regularization': 'l1_l2', 'reg_alpha_1': 0.0013196936094438834, 'reg_alpha_2': 0.00024385253899402906}. Best is trial 11 with value: 1.0687378513561676.
1/1 [==============================] - ETA: 0s1/1 [==============================] - 1s 512ms/step
1/1 [==============================] - ETA: 0s1/1 [==============================] - 0s 488ms/step
1/1 [==============================] - ETA: 0s1/1 [==============================] - 0s 69ms/step
1/1 [==============================] - ETA: 0s1/1 [==============================] - 0s 43ms/step
