[I 2024-12-23 21:16:57,985] Trial 14 finished with value: 0.6741881978264277 and parameters: {'n_units_0': 32, 'dropout_1': 0.25, 'run': 3, 'epochs_1': 60, 'epochs_2': 60, 'lr_1': 0.0020959109505026595, 'lr_2': 0.00015639193301222808, 'batch_size': 8, 'regularization': 'l1', 'reg_alpha_1': 1.3665554597014836e-05}. Best is trial 4 with value: 0.5592867591529402.
Statistics value = 5.0 p-value = 0.97265625
1/1 [==============================] - ETA: 0s1/1 [==============================] - 0s 421ms/step
1/1 [==============================] - ETA: 0s1/1 [==============================] - 0s 448ms/step
Statistics value = 15.0 p-value = 0.6796875
1/1 [==============================] - ETA: 0s1/1 [==============================] - 0s 417ms/step
1/1 [==============================] - ETA: 0s1/1 [==============================] - 1s 541ms/step
1/1 [==============================] - ETA: 0s1/1 [==============================] - 0s 456ms/step
1/1 [==============================] - ETA: 0s1/1 [==============================] - 0s 456ms/step
1/1 [==============================] - ETA: 0s1/1 [==============================] - 0s 71ms/step
1/1 [==============================] - ETA: 0s1/1 [==============================] - 0s 67ms/step
[I 2024-12-23 21:17:13,210] Trial 15 finished with value: 1.4215524377687245 and parameters: {'n_units_0': 4, 'dropout_1': 0.25, 'run': 2, 'epochs_1': 50, 'epochs_2': 50, 'lr_1': 0.0039634864398424095, 'lr_2': 0.00013336003906909693, 'batch_size': 12, 'regularization': 'l2', 'reg_alpha_1': 0.0013230718692473172}. Best is trial 8 with value: 1.0352273116668622.
Statistics value = 19.0 p-value = 0.47265625
1/1 [==============================] - ETA: 0s1/1 [==============================] - 0s 456ms/step
1/1 [==============================] - ETA: 0s1/1 [==============================] - 0s 454ms/step
1/1 [==============================] - ETA: 0s1/1 [==============================] - 0s 454ms/step
1/1 [==============================] - ETA: 0s1/1 [==============================] - 0s 421ms/step
1/1 [==============================] - ETA: 0s1/1 [==============================] - 0s 50ms/step
1/1 [==============================] - ETA: 0s1/1 [==============================] - 0s 48ms/step
1/1 [==============================] - ETA: 0s1/1 [==============================] - 0s 469ms/step
Statistics value = 21.0 p-value = 0.37109375
1/1 [==============================] - ETA: 0s1/1 [==============================] - 0s 442ms/step
1/1 [==============================] - ETA: 0s1/1 [==============================] - 0s 429ms/step
1/1 [==============================] - ETA: 0s1/1 [==============================] - 0s 50ms/step
1/1 [==============================] - ETA: 0s1/1 [==============================] - 0s 481ms/step
1/1 [==============================] - ETA: 0s1/1 [==============================] - 0s 47ms/step
1/1 [==============================] - ETA: 0s1/1 [==============================] - 0s 459ms/step
1/1 [==============================] - ETA: 0s1/1 [==============================] - 0s 383ms/step
1/1 [==============================] - ETA: 0s1/1 [==============================] - 0s 42ms/step
1/1 [==============================] - ETA: 0s1/1 [==============================] - 0s 58ms/step
Statistics value = 20.0 p-value = 0.7841796875
1/1 [==============================] - ETA: 0s1/1 [==============================] - 1s 559ms/step
1/1 [==============================] - ETA: 0s1/1 [==============================] - 0s 384ms/step
1/1 [==============================] - ETA: 0s1/1 [==============================] - 0s 470ms/step
1/1 [==============================] - ETA: 0s1/1 [==============================] - 0s 467ms/step
Statistics value = 28.0 p-value = 0.5
1/1 [==============================] - ETA: 0s1/1 [==============================] - 0s 458ms/step
1/1 [==============================] - ETA: 0s1/1 [==============================] - 0s 397ms/step
Statistics value = 4.0 p-value = 0.9951171875
1/1 [==============================] - ETA: 0s1/1 [==============================] - 0s 438ms/step
1/1 [==============================] - ETA: 0s1/1 [==============================] - 0s 404ms/step
1/1 [==============================] - ETA: 0s1/1 [==============================] - 0s 462ms/step
1/1 [==============================] - ETA: 0s1/1 [==============================] - 0s 475ms/step
1/1 [==============================] - ETA: 0s1/1 [==============================] - 0s 53ms/step
1/1 [==============================] - ETA: 0s1/1 [==============================] - 0s 49ms/step
[I 2024-12-23 21:17:57,258] Trial 16 finished with value: 0.3951276439255844 and parameters: {'n_units_0': 4, 'dropout_1': 0.1, 'run': 2, 'epochs_1': 80, 'epochs_2': 60, 'lr_1': 0.0031184049060234103, 'lr_2': 0.00017538057383814667, 'batch_size': 12, 'regularization': 'l1_l2', 'reg_alpha_1': 0.0016876638198497185, 'reg_alpha_2': 0.0002879242897444343}. Best is trial 15 with value: 0.28328449592565075.
1/1 [==============================] - ETA: 0s1/1 [==============================] - 0s 407ms/step
1/1 [==============================] - ETA: 0s1/1 [==============================] - 0s 490ms/step
1/1 [==============================] - ETA: 0s1/1 [==============================] - 0s 66ms/step
1/1 [==============================] - ETA: 0s1/1 [==============================] - 0s 55ms/step
1/1 [==============================] - ETA: 0s1/1 [==============================] - 0s 421ms/step
1/1 [==============================] - ETA: 0s1/1 [==============================] - 0s 412ms/step
1/1 [==============================] - ETA: 0s1/1 [==============================] - 0s 49ms/step
1/1 [==============================] - ETA: 0s1/1 [==============================] - 0s 47ms/step
[I 2024-12-23 21:18:04,796] Trial 15 finished with value: 0.6343367930118577 and parameters: {'n_units_0': 44, 'dropout_1': 0.15000000000000002, 'run': 2, 'epochs_1': 70, 'epochs_2': 80, 'lr_1': 0.0032104240317229835, 'lr_2': 0.0008099522355017243, 'batch_size': 12, 'regularization': 'None'}. Best is trial 4 with value: 0.5592867591529402.
1/1 [==============================] - ETA: 0s1/1 [==============================] - 0s 449ms/step
1/1 [==============================] - ETA: 0s1/1 [==============================] - 0s 406ms/step
1/1 [==============================] - ETA: 0s1/1 [==============================] - 0s 61ms/step
1/1 [==============================] - ETA: 0s1/1 [==============================] - 0s 57ms/step
[I 2024-12-23 21:18:09,483] Trial 16 finished with value: 0.27186782562704004 and parameters: {'n_units_0': 44, 'dropout_1': 0.15000000000000002, 'run': 2, 'epochs_1': 80, 'epochs_2': 80, 'lr_1': 0.0007776015220273289, 'lr_2': 0.00014040382358975986, 'batch_size': 16, 'regularization': 'l1_l2', 'reg_alpha_1': 0.0006860641350514071, 'reg_alpha_2': 0.002020012485413424}. Best is trial 2 with value: 0.23391714665713081.
Statistics value = 41.0 p-value = 0.0966796875
1/1 [==============================] - ETA: 0s1/1 [==============================] - 0s 420ms/step
1/1 [==============================] - ETA: 0s1/1 [==============================] - 0s 446ms/step
Statistics value = 25.0 p-value = 0.19140625
1/1 [==============================] - ETA: 0s1/1 [==============================] - 0s 409ms/step
1/1 [==============================] - ETA: 0s1/1 [==============================] - 0s 404ms/step
Statistics value = 3.0 p-value = 0.98828125
1/1 [==============================] - ETA: 0s1/1 [==============================] - 0s 431ms/step
1/1 [==============================] - ETA: 0s1/1 [==============================] - 0s 446ms/step
1/1 [==============================] - ETA: 0s1/1 [==============================] - 0s 46ms/step
1/1 [==============================] - ETA: 0s1/1 [==============================] - 0s 53ms/step
Statistics value = 7.0 p-value = 0.9453125
1/1 [==============================] - ETA: 0s1/1 [==============================] - 9s 9s/step
1/1 [==============================] - ETA: 0s1/1 [==============================] - 1s 533ms/step
1/1 [==============================] - ETA: 0s1/1 [==============================] - 0s 451ms/step
1/1 [==============================] - ETA: 0s1/1 [==============================] - 0s 418ms/step
1/1 [==============================] - ETA: 0s1/1 [==============================] - 0s 433ms/step
1/1 [==============================] - ETA: 0s1/1 [==============================] - 0s 401ms/step
1/1 [==============================] - ETA: 0s1/1 [==============================] - 0s 50ms/step
1/1 [==============================] - ETA: 0s1/1 [==============================] - 0s 48ms/step
1/1 [==============================] - ETA: 0s1/1 [==============================] - 0s 477ms/step
Statistics value = 33.0 p-value = 0.3125
1/1 [==============================] - ETA: 0s1/1 [==============================] - 0s 470ms/step
1/1 [==============================] - ETA: 0s1/1 [==============================] - 0s 393ms/step
1/1 [==============================] - ETA: 0s1/1 [==============================] - 0s 57ms/step
1/1 [==============================] - ETA: 0s1/1 [==============================] - 0s 435ms/step
1/1 [==============================] - ETA: 0s1/1 [==============================] - 0s 80ms/step
1/1 [==============================] - ETA: 0s1/1 [==============================] - 0s 70ms/step
1/1 [==============================] - ETA: 0s1/1 [==============================] - 0s 55ms/step
1/1 [==============================] - ETA: 0s1/1 [==============================] - 0s 447ms/step
[I 2024-12-23 21:18:44,074] Trial 17 finished with value: 0.2355613916976575 and parameters: {'n_units_0': 32, 'dropout_1': 0.25, 'run': 1, 'epochs_1': 50, 'epochs_2': 60, 'lr_1': 0.0002472996232313259, 'lr_2': 7.234696033957651e-05, 'batch_size': 8, 'regularization': 'l1_l2', 'reg_alpha_1': 0.00253373934153392, 'reg_alpha_2': 0.0005143941337094293}. Best is trial 2 with value: 0.23391714665713081.
1/1 [==============================] - ETA: 0s1/1 [==============================] - 0s 467ms/step
1/1 [==============================] - ETA: 0s1/1 [==============================] - 0s 51ms/step
1/1 [==============================] - ETA: 0s1/1 [==============================] - 0s 57ms/step
[I 2024-12-23 21:18:45,670] Trial 16 finished with value: 1.3718036692383966 and parameters: {'n_units_0': 28, 'dropout_1': 0.1, 'run': 3, 'epochs_1': 40, 'epochs_2': 80, 'lr_1': 0.0002993320271323778, 'lr_2': 8.071797454596734e-05, 'batch_size': 16, 'regularization': 'l1_l2', 'reg_alpha_1': 6.386551315546487e-05, 'reg_alpha_2': 0.009464154147879048}. Best is trial 8 with value: 1.0352273116668622.
Statistics value = 30.0 p-value = 0.4228515625
1/1 [==============================] - ETA: 0s1/1 [==============================] - 0s 423ms/step
1/1 [==============================] - ETA: 0s1/1 [==============================] - 0s 446ms/step
Statistics value = 38.0 p-value = 0.1611328125
1/1 [==============================] - ETA: 0s1/1 [==============================] - 0s 447ms/step
1/1 [==============================] - ETA: 0s1/1 [==============================] - 0s 454ms/step
Statistics value = 32.0 p-value = 0.02734375
1/1 [==============================] - ETA: 0s1/1 [==============================] - 0s 453ms/step
1/1 [==============================] - ETA: 0s1/1 [==============================] - 0s 420ms/step
1/1 [==============================] - ETA: 0s1/1 [==============================] - 0s 53ms/step
1/1 [==============================] - ETA: 0s1/1 [==============================] - 0s 41ms/step
Statistics value = 16.0 p-value = 0.62890625
1/1 [==============================] - ETA: 0s1/1 [==============================] - 1s 577ms/step
1/1 [==============================] - ETA: 0s1/1 [==============================] - 0s 397ms/step
1/1 [==============================] - ETA: 0s1/1 [==============================] - 0s 56ms/step
1/1 [==============================] - ETA: 0s1/1 [==============================] - 0s 42ms/step
1/1 [==============================] - ETA: 0s1/1 [==============================] - 0s 472ms/step
1/1 [==============================] - ETA: 0s1/1 [==============================] - 0s 453ms/step
1/1 [==============================] - ETA: 0s1/1 [==============================] - 0s 74ms/step
1/1 [==============================] - ETA: 0s1/1 [==============================] - 0s 61ms/step
[I 2024-12-23 21:19:07,321] Trial 16 finished with value: 0.5868341071378751 and parameters: {'n_units_0': 52, 'dropout_1': 0.25, 'run': 2, 'epochs_1': 30, 'epochs_2': 50, 'lr_1': 0.00010474873867657249, 'lr_2': 9.818268155784353e-05, 'batch_size': 12, 'regularization': 'l1', 'reg_alpha_1': 0.00077117119838498}. Best is trial 4 with value: 0.5592867591529402.
1/1 [==============================] - ETA: 0s1/1 [==============================] - 0s 415ms/step
1/1 [==============================] - ETA: 0s1/1 [==============================] - 0s 410ms/step
1/1 [==============================] - ETA: 0s1/1 [==============================] - 0s 43ms/step
1/1 [==============================] - ETA: 0s1/1 [==============================] - 0s 45ms/step
[I 2024-12-23 21:19:09,196] Trial 17 finished with value: 0.4105386472710083 and parameters: {'n_units_0': 28, 'dropout_1': 0.1, 'run': 2, 'epochs_1': 50, 'epochs_2': 80, 'lr_1': 0.0002096513968123572, 'lr_2': 0.0005743795281920736, 'batch_size': 8, 'regularization': 'l1_l2', 'reg_alpha_1': 0.0006675583326067126, 'reg_alpha_2': 0.009415244195298792}. Best is trial 15 with value: 0.28328449592565075.
Statistics value = 26.0 p-value = 0.5771484375
1/1 [==============================] - ETA: 0s1/1 [==============================] - 0s 493ms/step
1/1 [==============================] - ETA: 0s1/1 [==============================] - 0s 400ms/step
1/1 [==============================] - ETA: 0s1/1 [==============================] - 0s 71ms/step
1/1 [==============================] - ETA: 0s1/1 [==============================] - 0s 52ms/step
[I 2024-12-23 21:19:13,614] Trial 17 finished with value: 1.6017213683763303 and parameters: {'n_units_0': 44, 'dropout_1': 0.15000000000000002, 'run': 1, 'epochs_1': 70, 'epochs_2': 20, 'lr_1': 0.0007228270094869208, 'lr_2': 1.8938984110238145e-05, 'batch_size': 12, 'regularization': 'l2', 'reg_alpha_1': 0.0005918226679703409}. Best is trial 8 with value: 1.0352273116668622.
Statistics value = 8.0 p-value = 0.9814453125
1/1 [==============================] - ETA: 0s1/1 [==============================] - 0s 428ms/step
1/1 [==============================] - ETA: 0s1/1 [==============================] - 0s 444ms/step
1/1 [==============================] - ETA: 0s1/1 [==============================] - 0s 59ms/step
1/1 [==============================] - ETA: 0s1/1 [==============================] - 0s 50ms/step
