[I 2024-12-23 21:14:18,152] Trial 13 finished with value: 0.3662476568685894 and parameters: {'n_units_0': 40, 'dropout_1': 0.25, 'run': 2, 'epochs_1': 50, 'epochs_2': 90, 'lr_1': 0.0004044758550598607, 'lr_2': 2.0020914470861683e-05, 'batch_size': 16, 'regularization': 'None'}. Best is trial 2 with value: 0.2884382235608452.
Statistics value = 28.0 p-value = 0.5
1/1 [==============================] - ETA: 0s1/1 [==============================] - 0s 452ms/step
1/1 [==============================] - ETA: 0s1/1 [==============================] - 0s 404ms/step
Statistics value = 8.0 p-value = 0.9814453125
1/1 [==============================] - ETA: 0s1/1 [==============================] - 0s 482ms/step
1/1 [==============================] - ETA: 0s1/1 [==============================] - 0s 413ms/step
Statistics value = 21.0 p-value = 0.37109375
1/1 [==============================] - ETA: 0s1/1 [==============================] - 0s 443ms/step
1/1 [==============================] - ETA: 0s1/1 [==============================] - 0s 413ms/step
1/1 [==============================] - ETA: 0s1/1 [==============================] - 0s 450ms/step
1/1 [==============================] - ETA: 0s1/1 [==============================] - 0s 435ms/step
1/1 [==============================] - ETA: 0s1/1 [==============================] - 0s 41ms/step
1/1 [==============================] - ETA: 0s1/1 [==============================] - 0s 55ms/step
1/1 [==============================] - ETA: 0s1/1 [==============================] - 0s 419ms/step
1/1 [==============================] - ETA: 0s1/1 [==============================] - 0s 407ms/step
1/1 [==============================] - ETA: 0s1/1 [==============================] - 0s 47ms/step
1/1 [==============================] - ETA: 0s1/1 [==============================] - 0s 44ms/step
[I 2024-12-23 21:14:39,644] Trial 13 finished with value: 1.4400586322609399 and parameters: {'n_units_0': 40, 'dropout_1': 0.25, 'run': 2, 'epochs_1': 50, 'epochs_2': 100, 'lr_1': 0.0004044758550598607, 'lr_2': 2.0020914470861683e-05, 'batch_size': 16, 'regularization': 'None'}. Best is trial 8 with value: 1.0352273116668622.
1/1 [==============================] - ETA: 0s1/1 [==============================] - 0s 457ms/step
1/1 [==============================] - ETA: 0s1/1 [==============================] - 0s 456ms/step
1/1 [==============================] - ETA: 0s1/1 [==============================] - 0s 421ms/step
1/1 [==============================] - ETA: 0s1/1 [==============================] - 0s 429ms/step
1/1 [==============================] - ETA: 0s1/1 [==============================] - 0s 62ms/step
1/1 [==============================] - ETA: 0s1/1 [==============================] - 0s 70ms/step
[I 2024-12-23 21:14:49,182] Trial 13 finished with value: 0.26785340289531273 and parameters: {'n_units_0': 24, 'dropout_1': 0.25, 'run': 2, 'epochs_1': 50, 'epochs_2': 80, 'lr_1': 0.00039226124666588865, 'lr_2': 0.0009818247569037461, 'batch_size': 8, 'regularization': 'l1_l2', 'reg_alpha_1': 0.0010400758145997894, 'reg_alpha_2': 0.00024385253899402906}. Best is trial 2 with value: 0.23391714665713081.
Statistics value = 29.0 p-value = 0.4609375
1/1 [==============================] - ETA: 0s1/1 [==============================] - 0s 481ms/step
Statistics value = 34.0 p-value = 0.01171875
1/1 [==============================] - ETA: 0s1/1 [==============================] - 0s 396ms/step
1/1 [==============================] - ETA: 0s1/1 [==============================] - 0s 400ms/step
1/1 [==============================] - ETA: 0s1/1 [==============================] - 9s 9s/step
1/1 [==============================] - ETA: 0s1/1 [==============================] - 0s 382ms/step
1/1 [==============================] - ETA: 0s1/1 [==============================] - 0s 406ms/step
1/1 [==============================] - ETA: 0s1/1 [==============================] - 0s 43ms/step
1/1 [==============================] - ETA: 0s1/1 [==============================] - 0s 49ms/step
Statistics value = 5.0 p-value = 0.97265625
1/1 [==============================] - ETA: 0s1/1 [==============================] - 0s 472ms/step
1/1 [==============================] - ETA: 0s1/1 [==============================] - 0s 406ms/step
1/1 [==============================] - ETA: 0s1/1 [==============================] - 0s 385ms/step
1/1 [==============================] - ETA: 0s1/1 [==============================] - 0s 398ms/step
1/1 [==============================] - ETA: 0s1/1 [==============================] - 0s 424ms/step
1/1 [==============================] - ETA: 0s1/1 [==============================] - 0s 403ms/step
1/1 [==============================] - ETA: 0s1/1 [==============================] - 0s 63ms/step
1/1 [==============================] - ETA: 0s1/1 [==============================] - 0s 42ms/step
Statistics value = 29.0 p-value = 0.4609375
1/1 [==============================] - ETA: 0s1/1 [==============================] - 0s 426ms/step
1/1 [==============================] - ETA: 0s1/1 [==============================] - 0s 489ms/step
[I 2024-12-23 21:15:13,863] Trial 13 finished with value: 0.5671622954558706 and parameters: {'n_units_0': 64, 'dropout_1': 0.15000000000000002, 'run': 2, 'epochs_1': 80, 'epochs_2': 80, 'lr_1': 0.004021019349138742, 'lr_2': 0.0008106561872514704, 'batch_size': 12, 'regularization': 'None'}. Best is trial 4 with value: 0.5592867591529402.
1/1 [==============================] - ETA: 0s1/1 [==============================] - 0s 417ms/step
1/1 [==============================] - ETA: 0s1/1 [==============================] - 0s 402ms/step
1/1 [==============================] - ETA: 0s1/1 [==============================] - 0s 44ms/step
1/1 [==============================] - ETA: 0s1/1 [==============================] - 0s 55ms/step
1/1 [==============================] - ETA: 0s1/1 [==============================] - 0s 443ms/step
1/1 [==============================] - ETA: 0s1/1 [==============================] - 0s 447ms/step
1/1 [==============================] - ETA: 0s1/1 [==============================] - 0s 43ms/step
1/1 [==============================] - ETA: 0s1/1 [==============================] - 0s 62ms/step
1/1 [==============================] - ETA: 0s1/1 [==============================] - 0s 435ms/step
1/1 [==============================] - ETA: 0s1/1 [==============================] - 0s 430ms/step
Statistics value = 49.0 p-value = 0.013671875
1/1 [==============================] - ETA: 0s1/1 [==============================] - 0s 491ms/step
1/1 [==============================] - ETA: 0s1/1 [==============================] - 0s 475ms/step
Statistics value = 7.0 p-value = 0.9453125
1/1 [==============================] - ETA: 0s1/1 [==============================] - 0s 478ms/step
1/1 [==============================] - ETA: 0s1/1 [==============================] - 1s 538ms/step
Statistics value = 38.0 p-value = 0.1611328125
1/1 [==============================] - ETA: 0s1/1 [==============================] - 1s 504ms/step
1/1 [==============================] - ETA: 0s1/1 [==============================] - 0s 473ms/step
1/1 [==============================] - ETA: 0s1/1 [==============================] - 0s 436ms/step
1/1 [==============================] - ETA: 0s1/1 [==============================] - 0s 413ms/step
1/1 [==============================] - ETA: 0s1/1 [==============================] - 0s 51ms/step
1/1 [==============================] - ETA: 0s1/1 [==============================] - 0s 46ms/step
1/1 [==============================] - ETA: 0s1/1 [==============================] - 0s 489ms/step
[I 2024-12-23 21:15:44,278] Trial 14 finished with value: 0.2940052784482713 and parameters: {'n_units_0': 16, 'dropout_1': 0.15000000000000002, 'run': 3, 'epochs_1': 30, 'epochs_2': 70, 'lr_1': 0.0001096874927666045, 'lr_2': 2.1365437643648277e-05, 'batch_size': 16, 'regularization': 'l1_l2', 'reg_alpha_1': 0.001068042735809095, 'reg_alpha_2': 0.0009784074393024533}. Best is trial 2 with value: 0.2884382235608452.
1/1 [==============================] - ETA: 0s1/1 [==============================] - 0s 411ms/step
1/1 [==============================] - ETA: 0s1/1 [==============================] - 0s 49ms/step
1/1 [==============================] - ETA: 0s1/1 [==============================] - 0s 41ms/step
[I 2024-12-23 21:15:45,642] Trial 14 finished with value: 0.2368882177859516 and parameters: {'n_units_0': 48, 'dropout_1': 0.25, 'run': 2, 'epochs_1': 30, 'epochs_2': 60, 'lr_1': 0.00010388445237401994, 'lr_2': 0.0002109246956048817, 'batch_size': 16, 'regularization': 'l1_l2', 'reg_alpha_1': 0.00310668928285557, 'reg_alpha_2': 4.813270990765419e-05}. Best is trial 2 with value: 0.23391714665713081.
1/1 [==============================] - ETA: 0s1/1 [==============================] - 0s 404ms/step
1/1 [==============================] - ETA: 0s1/1 [==============================] - 0s 446ms/step
1/1 [==============================] - ETA: 0s1/1 [==============================] - 0s 435ms/step
1/1 [==============================] - ETA: 0s1/1 [==============================] - 0s 409ms/step
Statistics value = 18.0 p-value = 0.52734375
1/1 [==============================] - ETA: 0s1/1 [==============================] - 0s 432ms/step
1/1 [==============================] - ETA: 0s1/1 [==============================] - 0s 389ms/step
Statistics value = 13.0 p-value = 0.76953125
1/1 [==============================] - ETA: 0s1/1 [==============================] - 0s 450ms/step
1/1 [==============================] - ETA: 0s1/1 [==============================] - 0s 498ms/step
1/1 [==============================] - ETA: 0s1/1 [==============================] - 0s 450ms/step
1/1 [==============================] - ETA: 0s1/1 [==============================] - 1s 562ms/step
1/1 [==============================] - ETA: 0s1/1 [==============================] - 0s 475ms/step
1/1 [==============================] - ETA: 0s1/1 [==============================] - 0s 51ms/step
1/1 [==============================] - ETA: 0s1/1 [==============================] - 0s 427ms/step
1/1 [==============================] - ETA: 0s1/1 [==============================] - 0s 61ms/step
1/1 [==============================] - ETA: 0s1/1 [==============================] - 0s 44ms/step
1/1 [==============================] - ETA: 0s1/1 [==============================] - 0s 58ms/step
[I 2024-12-23 21:16:06,204] Trial 14 finished with value: 1.2593972405673106 and parameters: {'n_units_0': 16, 'dropout_1': 0.15000000000000002, 'run': 3, 'epochs_1': 30, 'epochs_2': 70, 'lr_1': 0.0014425540650734175, 'lr_2': 2.1365437643648277e-05, 'batch_size': 16, 'regularization': 'l1_l2', 'reg_alpha_1': 0.001068042735809095, 'reg_alpha_2': 0.0007708764500743201}. Best is trial 8 with value: 1.0352273116668622.
1/1 [==============================] - ETA: 0s1/1 [==============================] - 0s 432ms/step
1/1 [==============================] - ETA: 0s1/1 [==============================] - 0s 430ms/step
1/1 [==============================] - ETA: 0s1/1 [==============================] - 0s 87ms/step
1/1 [==============================] - ETA: 0s1/1 [==============================] - 0s 45ms/step
Statistics value = 22.0 p-value = 0.3203125
1/1 [==============================] - ETA: 0s1/1 [==============================] - 0s 436ms/step
1/1 [==============================] - ETA: 0s1/1 [==============================] - 1s 509ms/step
Statistics value = 25.0 p-value = 0.615234375
1/1 [==============================] - ETA: 0s1/1 [==============================] - 0s 498ms/step
1/1 [==============================] - ETA: 0s1/1 [==============================] - 0s 444ms/step
1/1 [==============================] - ETA: 0s1/1 [==============================] - 0s 449ms/step
1/1 [==============================] - ETA: 0s1/1 [==============================] - 0s 62ms/step
1/1 [==============================] - ETA: 0s1/1 [==============================] - 0s 39ms/step
1/1 [==============================] - ETA: 0s1/1 [==============================] - 0s 449ms/step
Statistics value = 26.0 p-value = 0.5771484375
1/1 [==============================] - ETA: 0s1/1 [==============================] - 0s 449ms/step
1/1 [==============================] - ETA: 0s1/1 [==============================] - 0s 413ms/step
Statistics value = 7.0 p-value = 0.986328125
1/1 [==============================] - ETA: 0s1/1 [==============================] - 0s 489ms/step
1/1 [==============================] - ETA: 0s1/1 [==============================] - 0s 409ms/step
1/1 [==============================] - ETA: 0s1/1 [==============================] - 0s 398ms/step
1/1 [==============================] - ETA: 0s1/1 [==============================] - 0s 426ms/step
1/1 [==============================] - ETA: 0s1/1 [==============================] - 0s 72ms/step
1/1 [==============================] - ETA: 0s1/1 [==============================] - 0s 50ms/step
1/1 [==============================] - ETA: 0s1/1 [==============================] - 0s 441ms/step
1/1 [==============================] - ETA: 0s1/1 [==============================] - 0s 431ms/step
1/1 [==============================] - ETA: 0s1/1 [==============================] - 0s 420ms/step
1/1 [==============================] - ETA: 0s1/1 [==============================] - 0s 485ms/step
1/1 [==============================] - ETA: 0s1/1 [==============================] - 0s 425ms/step
Statistics value = 49.0 p-value = 0.013671875
1/1 [==============================] - ETA: 0s1/1 [==============================] - 0s 433ms/step
1/1 [==============================] - ETA: 0s1/1 [==============================] - 0s 46ms/step
1/1 [==============================] - ETA: 0s1/1 [==============================] - 0s 41ms/step
1/1 [==============================] - ETA: 0s1/1 [==============================] - 0s 468ms/step
1/1 [==============================] - ETA: 0s1/1 [==============================] - 0s 78ms/step
1/1 [==============================] - ETA: 0s1/1 [==============================] - 0s 471ms/step
1/1 [==============================] - ETA: 0s1/1 [==============================] - 0s 62ms/step
[I 2024-12-23 21:16:51,000] Trial 15 finished with value: 0.27486889449146795 and parameters: {'n_units_0': 28, 'dropout_1': 0.15000000000000002, 'run': 2, 'epochs_1': 40, 'epochs_2': 100, 'lr_1': 0.002062009247601101, 'lr_2': 0.0005304347741682052, 'batch_size': 12, 'regularization': 'None'}. Best is trial 2 with value: 0.23391714665713081.
[I 2024-12-23 21:16:51,336] Trial 15 finished with value: 0.28328449592565075 and parameters: {'n_units_0': 4, 'dropout_1': 0.1, 'run': 2, 'epochs_1': 30, 'epochs_2': 70, 'lr_1': 0.0001012145355811484, 'lr_2': 9.552335254144706e-05, 'batch_size': 12, 'regularization': 'l1_l2', 'reg_alpha_1': 0.0013230718692473172, 'reg_alpha_2': 0.0009990953045534545}. Best is trial 15 with value: 0.28328449592565075.
1/1 [==============================] - ETA: 0s1/1 [==============================] - 1s 504ms/step
1/1 [==============================] - ETA: 0s1/1 [==============================] - 0s 434ms/step
1/1 [==============================] - ETA: 0s1/1 [==============================] - 0s 42ms/step
1/1 [==============================] - ETA: 0s1/1 [==============================] - 0s 60ms/step
