[I 2024-12-23 19:02:40,872] Trial 7 finished with value: 1.5129834197402081 and parameters: {'n_units_0': 52, 'dropout_1': 0.2, 'run': 3, 'epochs_1': 60, 'epochs_2': 60, 'lr_1': 0.0007162786999897341, 'lr_2': 1.1241862095793047e-05, 'batch_size': 8, 'regularization': 'l1', 'reg_alpha_1': 0.005280796376895365}. Best is trial 6 with value: 1.0738389804040076.
1/1 [==============================] - ETA: 0s1/1 [==============================] - 0s 484ms/step
1/1 [==============================] - ETA: 0s1/1 [==============================] - 0s 411ms/step
1/1 [==============================] - ETA: 0s1/1 [==============================] - 0s 60ms/step
1/1 [==============================] - ETA: 0s1/1 [==============================] - 0s 55ms/step
[I 2024-12-23 19:02:43,951] Trial 7 finished with value: 0.40132582278493806 and parameters: {'n_units_0': 52, 'dropout_1': 0.2, 'run': 3, 'epochs_1': 60, 'epochs_2': 60, 'lr_1': 0.0007162786999897341, 'lr_2': 1.1241862095793047e-05, 'batch_size': 8, 'regularization': 'l1', 'reg_alpha_1': 0.005280796376895365}. Best is trial 4 with value: 0.28953663209472913.
Statistics value = 20.0 p-value = 0.421875
1/1 [==============================] - ETA: 0s1/1 [==============================] - 0s 409ms/step
Statistics value = 6.0 p-value = 0.9609375
1/1 [==============================] - ETA: 0s1/1 [==============================] - 0s 400ms/step
Statistics value = 34.0 p-value = 0.01171875
1/1 [==============================] - ETA: 0s1/1 [==============================] - 0s 382ms/step
1/1 [==============================] - ETA: 0s1/1 [==============================] - 0s 401ms/step
1/1 [==============================] - ETA: 0s1/1 [==============================] - 0s 394ms/step
1/1 [==============================] - ETA: 0s1/1 [==============================] - 0s 423ms/step
Statistics value = 20.0 p-value = 0.421875
1/1 [==============================] - ETA: 0s1/1 [==============================] - 0s 375ms/step
1/1 [==============================] - ETA: 0s1/1 [==============================] - 0s 425ms/step
1/1 [==============================] - ETA: 0s1/1 [==============================] - 1s 523ms/step
1/1 [==============================] - ETA: 0s1/1 [==============================] - 0s 396ms/step
1/1 [==============================] - ETA: 0s1/1 [==============================] - 0s 390ms/step
1/1 [==============================] - ETA: 0s1/1 [==============================] - 0s 390ms/step
1/1 [==============================] - ETA: 0s1/1 [==============================] - ETA: 0s1/1 [==============================] - 0s 451ms/step
1/1 [==============================] - 0s 421ms/step
1/1 [==============================] - ETA: 0s1/1 [==============================] - 0s 397ms/step
1/1 [==============================] - ETA: 0s1/1 [==============================] - 0s 439ms/step
1/1 [==============================] - ETA: 0s1/1 [==============================] - 0s 392ms/step
1/1 [==============================] - ETA: 0s1/1 [==============================] - 0s 384ms/step
1/1 [==============================] - ETA: 0s1/1 [==============================] - 0s 425ms/step
1/1 [==============================] - ETA: 0s1/1 [==============================] - 0s 387ms/step
1/1 [==============================] - ETA: 0s1/1 [==============================] - 0s 407ms/step
1/1 [==============================] - ETA: 0s1/1 [==============================] - 0s 446ms/step
1/1 [==============================] - ETA: 0s1/1 [==============================] - 0s 42ms/step
1/1 [==============================] - ETA: 0s1/1 [==============================] - 0s 68ms/step
1/1 [==============================] - ETA: 0s1/1 [==============================] - 0s 65ms/step
1/1 [==============================] - ETA: 0s1/1 [==============================] - 0s 68ms/step
1/1 [==============================] - ETA: 0s1/1 [==============================] - 0s 44ms/step
1/1 [==============================] - ETA: 0s1/1 [==============================] - 0s 39ms/step
1/1 [==============================] - ETA: 0s1/1 [==============================] - 0s 388ms/step
1/1 [==============================] - ETA: 0s1/1 [==============================] - 0s 407ms/step
1/1 [==============================] - ETA: 0s1/1 [==============================] - 0s 43ms/step
1/1 [==============================] - ETA: 0s1/1 [==============================] - 0s 43ms/step
Statistics value = 24.0 p-value = 0.65234375
1/1 [==============================] - ETA: 0s1/1 [==============================] - 0s 417ms/step
Statistics value = 44.0 p-value = 0.052734375
1/1 [==============================] - ETA: 0s1/1 [==============================] - 0s 413ms/step
1/1 [==============================] - ETA: 0s1/1 [==============================] - 0s 373ms/step
Statistics value = 40.0 p-value = 0.1162109375
1/1 [==============================] - ETA: 0s1/1 [==============================] - 0s 444ms/step
1/1 [==============================] - ETA: 0s1/1 [==============================] - 0s 416ms/step
1/1 [==============================] - ETA: 0s1/1 [==============================] - 0s 362ms/step
Statistics value = 30.0 p-value = 0.4228515625
1/1 [==============================] - ETA: 0s1/1 [==============================] - 0s 399ms/step
1/1 [==============================] - ETA: 0s1/1 [==============================] - 0s 384ms/step
1/1 [==============================] - ETA: 0s1/1 [==============================] - 0s 375ms/step
1/1 [==============================] - ETA: 0s1/1 [==============================] - 0s 408ms/step
1/1 [==============================] - ETA: 0s1/1 [==============================] - 0s 400ms/step
1/1 [==============================] - ETA: 0s1/1 [==============================] - 0s 411ms/step
1/1 [==============================] - ETA: 0s1/1 [==============================] - 0s 424ms/step
1/1 [==============================] - ETA: 0s1/1 [==============================] - 0s 386ms/step
1/1 [==============================] - ETA: 0s1/1 [==============================] - 0s 401ms/step
1/1 [==============================] - ETA: 0s1/1 [==============================] - 0s 414ms/step
1/1 [==============================] - ETA: 0s1/1 [==============================] - 0s 397ms/step
1/1 [==============================] - ETA: 0s1/1 [==============================] - 0s 420ms/step
1/1 [==============================] - ETA: 0s1/1 [==============================] - 0s 403ms/step
1/1 [==============================] - ETA: 0s1/1 [==============================] - 0s 399ms/step
1/1 [==============================] - ETA: 0s1/1 [==============================] - 0s 39ms/step
1/1 [==============================] - ETA: 0s1/1 [==============================] - 0s 43ms/step
1/1 [==============================] - ETA: 0s1/1 [==============================] - 0s 393ms/step
1/1 [==============================] - ETA: 0s1/1 [==============================] - 0s 64ms/step
1/1 [==============================] - ETA: 0s1/1 [==============================] - 0s 471ms/step
1/1 [==============================] - ETA: 0s1/1 [==============================] - 0s 66ms/step
1/1 [==============================] - ETA: 0s1/1 [==============================] - 0s 74ms/step
1/1 [==============================] - ETA: 0s1/1 [==============================] - 0s 50ms/step
[I 2024-12-23 19:03:53,675] Trial 8 finished with value: 0.5938551463150638 and parameters: {'n_units_0': 16, 'dropout_1': 0.2, 'run': 3, 'epochs_1': 40, 'epochs_2': 20, 'lr_1': 0.0003797544798678418, 'lr_2': 2.101079931010355e-05, 'batch_size': 16, 'regularization': 'l2', 'reg_alpha_1': 3.6283583803549155e-05}. Best is trial 0 with value: 0.5600802703795851.
[I 2024-12-23 19:03:54,263] Trial 8 finished with value: 0.24231572476581462 and parameters: {'n_units_0': 16, 'dropout_1': 0.2, 'run': 3, 'epochs_1': 40, 'epochs_2': 20, 'lr_1': 0.0003797544798678418, 'lr_2': 2.101079931010355e-05, 'batch_size': 16, 'regularization': 'l2', 'reg_alpha_1': 3.6283583803549155e-05}. Best is trial 4 with value: 0.2332224010264714.
[I 2024-12-23 19:03:54,495] Trial 8 finished with value: 1.3050742823445127 and parameters: {'n_units_0': 16, 'dropout_1': 0.2, 'run': 3, 'epochs_1': 40, 'epochs_2': 20, 'lr_1': 0.0003797544798678418, 'lr_2': 2.101079931010355e-05, 'batch_size': 16, 'regularization': 'l2', 'reg_alpha_1': 3.6283583803549155e-05}. Best is trial 6 with value: 1.0738389804040076.
1/1 [==============================] - ETA: 0s1/1 [==============================] - 0s 419ms/step
1/1 [==============================] - ETA: 0s1/1 [==============================] - 0s 408ms/step
1/1 [==============================] - ETA: 0s1/1 [==============================] - 0s 58ms/step
1/1 [==============================] - ETA: 0s1/1 [==============================] - 0s 56ms/step
[I 2024-12-23 19:03:56,501] Trial 8 finished with value: 0.30975098273043494 and parameters: {'n_units_0': 16, 'dropout_1': 0.2, 'run': 3, 'epochs_1': 40, 'epochs_2': 20, 'lr_1': 0.0003797544798678418, 'lr_2': 2.101079931010355e-05, 'batch_size': 16, 'regularization': 'l2', 'reg_alpha_1': 3.6283583803549155e-05}. Best is trial 4 with value: 0.28953663209472913.
Statistics value = 8.0 p-value = 0.92578125
1/1 [==============================] - ETA: 0s1/1 [==============================] - 0s 406ms/step
1/1 [==============================] - ETA: 0s1/1 [==============================] - 0s 375ms/step
Statistics value = 4.0 p-value = 0.98046875
1/1 [==============================] - ETA: 0s1/1 [==============================] - 0s 437ms/step
Statistics value = 25.0 p-value = 0.19140625
1/1 [==============================] - ETA: 0s1/1 [==============================] - 0s 397ms/step
1/1 [==============================] - ETA: 0s1/1 [==============================] - 0s 384ms/step
1/1 [==============================] - ETA: 0s1/1 [==============================] - 0s 397ms/step
Statistics value = 19.0 p-value = 0.47265625
1/1 [==============================] - ETA: 0s1/1 [==============================] - 0s 453ms/step
1/1 [==============================] - ETA: 0s1/1 [==============================] - 0s 396ms/step
1/1 [==============================] - ETA: 0s1/1 [==============================] - 0s 386ms/step
1/1 [==============================] - ETA: 0s1/1 [==============================] - 0s 403ms/step
1/1 [==============================] - ETA: 0s1/1 [==============================] - 0s 427ms/step
1/1 [==============================] - ETA: 0s1/1 [==============================] - 0s 393ms/step
1/1 [==============================] - ETA: 0s1/1 [==============================] - 0s 415ms/step
1/1 [==============================] - ETA: 0s1/1 [==============================] - 0s 386ms/step
1/1 [==============================] - ETA: 0s1/1 [==============================] - 0s 415ms/step
1/1 [==============================] - ETA: 0s1/1 [==============================] - 0s 418ms/step
1/1 [==============================] - ETA: 0s1/1 [==============================] - 0s 415ms/step
1/1 [==============================] - ETA: 0s1/1 [==============================] - 0s 421ms/step
1/1 [==============================] - ETA: 0s1/1 [==============================] - 0s 47ms/step
1/1 [==============================] - ETA: 0s1/1 [==============================] - 0s 40ms/step
1/1 [==============================] - ETA: 0s1/1 [==============================] - 0s 402ms/step
1/1 [==============================] - ETA: 0s1/1 [==============================] - 0s 409ms/step
1/1 [==============================] - ETA: 0s1/1 [==============================] - 0s 393ms/step
1/1 [==============================] - ETA: 0s1/1 [==============================] - 0s 388ms/step
1/1 [==============================] - ETA: 0s1/1 [==============================] - 0s 380ms/step
1/1 [==============================] - ETA: 0s1/1 [==============================] - 0s 392ms/step
1/1 [==============================] - ETA: 0s1/1 [==============================] - 0s 53ms/step
1/1 [==============================] - ETA: 0s1/1 [==============================] - 0s 74ms/step
1/1 [==============================] - ETA: 0s1/1 [==============================] - 0s 75ms/step
1/1 [==============================] - ETA: 0s1/1 [==============================] - 0s 43ms/step
1/1 [==============================] - ETA: 0s1/1 [==============================] - 0s 58ms/step
1/1 [==============================] - ETA: 0s1/1 [==============================] - 0s 51ms/step
Statistics value = 31.0 p-value = 0.384765625
1/1 [==============================] - ETA: 0s1/1 [==============================] - 0s 484ms/step
1/1 [==============================] - ETA: 0s1/1 [==============================] - 0s 445ms/step
Statistics value = 26.0 p-value = 0.5771484375
1/1 [==============================] - ETA: 0s1/1 [==============================] - 0s 414ms/step
Statistics value = 37.0 p-value = 0.1875
1/1 [==============================] - ETA: 0s1/1 [==============================] - 0s 379ms/step
Statistics value = 27.0 p-value = 0.5390625
1/1 [==============================] - ETA: 0s1/1 [==============================] - 0s 405ms/step
1/1 [==============================] - ETA: 0s1/1 [==============================] - 0s 414ms/step
1/1 [==============================] - ETA: 0s1/1 [==============================] - 0s 369ms/step
1/1 [==============================] - ETA: 0s1/1 [==============================] - 0s 400ms/step
1/1 [==============================] - ETA: 0s1/1 [==============================] - 0s 434ms/step
1/1 [==============================] - ETA: 0s1/1 [==============================] - 0s 400ms/step
1/1 [==============================] - ETA: 0s1/1 [==============================] - 0s 486ms/step
1/1 [==============================] - ETA: 0s1/1 [==============================] - 0s 369ms/step
1/1 [==============================] - ETA: 0s1/1 [==============================] - 0s 457ms/step
1/1 [==============================] - ETA: 0s1/1 [==============================] - 0s 483ms/step
1/1 [==============================] - ETA: 0s1/1 [==============================] - 0s 413ms/step
1/1 [==============================] - ETA: 0s1/1 [==============================] - 0s 375ms/step
1/1 [==============================] - ETA: 0s1/1 [==============================] - 0s 415ms/step
1/1 [==============================] - ETA: 0s1/1 [==============================] - 0s 442ms/step
1/1 [==============================] - ETA: 0s1/1 [==============================] - 0s 49ms/step
1/1 [==============================] - ETA: 0s1/1 [==============================] - 0s 49ms/step
