[I 2024-12-23 16:12:58,272] Trial 16 finished with value: 0.699613155306481 and parameters: {'n_units_0': 4, 'dropout_1': 0.3, 'run': 3, 'epochs_1': 70, 'epochs_2': 80, 'lr_1': 0.007305225733440754, 'lr_2': 0.0001053423348811204, 'batch_size': 16, 'regularization': 'None'}. Best is trial 0 with value: 0.48275019641177624.
1/1 [==============================] - ETA: 0s1/1 [==============================] - 0s 413ms/step
1/1 [==============================] - ETA: 0s1/1 [==============================] - 0s 418ms/step
1/1 [==============================] - ETA: 0s1/1 [==============================] - 0s 47ms/step
1/1 [==============================] - ETA: 0s1/1 [==============================] - 0s 42ms/step
[I 2024-12-23 16:13:01,349] Trial 19 finished with value: 2.5083122936204467 and parameters: {'n_units_0': 20, 'dropout_1': 0.15000000000000002, 'run': 2, 'epochs_1': 60, 'epochs_2': 20, 'lr_1': 0.0071813440944316935, 'lr_2': 0.00013104177285262742, 'batch_size': 12, 'regularization': 'l1', 'reg_alpha_1': 7.936030318091971e-05}. Best is trial 11 with value: 1.1668980868801901.
1/1 [==============================] - ETA: 0s1/1 [==============================] - 0s 459ms/step
1/1 [==============================] - ETA: 0s1/1 [==============================] - 0s 402ms/step
1/1 [==============================] - ETA: 0s1/1 [==============================] - 0s 41ms/step
1/1 [==============================] - ETA: 0s1/1 [==============================] - 0s 55ms/step
[I 2024-12-23 16:13:07,641] Trial 16 finished with value: 0.2606502436520215 and parameters: {'n_units_0': 44, 'dropout_1': 0.15000000000000002, 'run': 3, 'epochs_1': 70, 'epochs_2': 100, 'lr_1': 0.00034086154072914573, 'lr_2': 9.614047329008705e-05, 'batch_size': 16, 'regularization': 'None'}. Best is trial 8 with value: 0.23325338811708746.
Statistics value = 23.0 p-value = 0.2734375
1/1 [==============================] - ETA: 0s1/1 [==============================] - 0s 397ms/step
1/1 [==============================] - ETA: 0s1/1 [==============================] - 0s 388ms/step
1/1 [==============================] - ETA: 0s1/1 [==============================] - 0s 42ms/step
1/1 [==============================] - ETA: 0s1/1 [==============================] - 0s 49ms/step
Statistics value = 23.0 p-value = 0.2734375
1/1 [==============================] - ETA: 0s1/1 [==============================] - 0s 419ms/step
1/1 [==============================] - ETA: 0s1/1 [==============================] - 0s 419ms/step
1/1 [==============================] - ETA: 0s1/1 [==============================] - 0s 54ms/step
1/1 [==============================] - ETA: 0s1/1 [==============================] - 0s 53ms/step
Statistics value = 6.0 p-value = 0.9609375
1/1 [==============================] - ETA: 0s1/1 [==============================] - 0s 421ms/step
Statistics value = 36.0 p-value = 0.2158203125
1/1 [==============================] - ETA: 0s1/1 [==============================] - 0s 418ms/step
1/1 [==============================] - ETA: 0s1/1 [==============================] - 0s 388ms/step
1/1 [==============================] - ETA: 0s1/1 [==============================] - 0s 470ms/step
1/1 [==============================] - ETA: 0s1/1 [==============================] - 0s 60ms/step
1/1 [==============================] - ETA: 0s1/1 [==============================] - 0s 41ms/step
[I 2024-12-23 16:13:25,621] Trial 17 finished with value: 0.687439038615052 and parameters: {'n_units_0': 36, 'dropout_1': 0.25, 'run': 1, 'epochs_1': 50, 'epochs_2': 50, 'lr_1': 0.0004663915875553893, 'lr_2': 1.001146906488453e-05, 'batch_size': 12, 'regularization': 'None'}. Best is trial 0 with value: 0.48275019641177624.
Statistics value = 25.0 p-value = 0.615234375
1/1 [==============================] - ETA: 0s1/1 [==============================] - 0s 409ms/step
1/1 [==============================] - ETA: 0s1/1 [==============================] - 0s 383ms/step
1/1 [==============================] - ETA: 0s1/1 [==============================] - 0s 48ms/step
1/1 [==============================] - ETA: 0s1/1 [==============================] - 0s 57ms/step
[I 2024-12-23 16:13:27,947] Trial 17 finished with value: 0.3052450442224072 and parameters: {'n_units_0': 32, 'dropout_1': 0.15000000000000002, 'run': 1, 'epochs_1': 50, 'epochs_2': 60, 'lr_1': 0.00010182712311136019, 'lr_2': 1.9356450104946525e-05, 'batch_size': 8, 'regularization': 'None'}. Best is trial 2 with value: 0.28805260021606854.
1/1 [==============================] - ETA: 0s1/1 [==============================] - 0s 408ms/step
1/1 [==============================] - ETA: 0s1/1 [==============================] - 0s 435ms/step
Statistics value = 17.0 p-value = 0.578125
1/1 [==============================] - ETA: 0s1/1 [==============================] - 0s 424ms/step
1/1 [==============================] - ETA: 0s1/1 [==============================] - 0s 397ms/step
Statistics value = 19.0 p-value = 0.47265625
1/1 [==============================] - ETA: 0s1/1 [==============================] - 0s 380ms/step
1/1 [==============================] - ETA: 0s1/1 [==============================] - 0s 400ms/step
1/1 [==============================] - ETA: 0s1/1 [==============================] - 0s 384ms/step
1/1 [==============================] - ETA: 0s1/1 [==============================] - 0s 375ms/step
1/1 [==============================] - ETA: 0s1/1 [==============================] - 0s 50ms/step
1/1 [==============================] - ETA: 0s1/1 [==============================] - 0s 39ms/step
1/1 [==============================] - ETA: 0s1/1 [==============================] - 0s 352ms/step
1/1 [==============================] - ETA: 0s1/1 [==============================] - 0s 339ms/step
1/1 [==============================] - ETA: 0s1/1 [==============================] - 0s 37ms/step
1/1 [==============================] - ETA: 0s1/1 [==============================] - 0s 37ms/step
1/1 [==============================] - ETA: 0s1/1 [==============================] - 0s 410ms/step
1/1 [==============================] - ETA: 0s1/1 [==============================] - 0s 401ms/step
1/1 [==============================] - ETA: 0s1/1 [==============================] - 0s 60ms/step
1/1 [==============================] - ETA: 0s1/1 [==============================] - 0s 42ms/step
Statistics value = 9.0 p-value = 0.9755859375
1/1 [==============================] - ETA: 0s1/1 [==============================] - 0s 413ms/step
1/1 [==============================] - ETA: 0s1/1 [==============================] - 0s 415ms/step
Statistics value = 27.0 p-value = 0.5390625
1/1 [==============================] - ETA: 0s1/1 [==============================] - 0s 443ms/step
1/1 [==============================] - ETA: 0s1/1 [==============================] - 0s 396ms/step
Statistics value = 34.0 p-value = 0.2783203125
1/1 [==============================] - ETA: 0s1/1 [==============================] - 0s 432ms/step
1/1 [==============================] - ETA: 0s1/1 [==============================] - 0s 419ms/step
1/1 [==============================] - ETA: 0s1/1 [==============================] - 0s 393ms/step
1/1 [==============================] - ETA: 0s1/1 [==============================] - 0s 411ms/step
1/1 [==============================] - ETA: 0s1/1 [==============================] - 0s 397ms/step
1/1 [==============================] - ETA: 0s1/1 [==============================] - 0s 375ms/step
1/1 [==============================] - ETA: 0s1/1 [==============================] - 0s 46ms/step
1/1 [==============================] - ETA: 0s1/1 [==============================] - 0s 48ms/step
[I 2024-12-23 16:14:23,913] Trial 18 finished with value: 0.3119046661466742 and parameters: {'n_units_0': 4, 'dropout_1': 0.25, 'run': 2, 'epochs_1': 60, 'epochs_2': 50, 'lr_1': 0.0003042053533042828, 'lr_2': 0.00019298826820903913, 'batch_size': 12, 'regularization': 'l1', 'reg_alpha_1': 7.12313164346007e-05}. Best is trial 2 with value: 0.28805260021606854.
1/1 [==============================] - ETA: 0s1/1 [==============================] - 0s 457ms/step
1/1 [==============================] - ETA: 0s1/1 [==============================] - 0s 419ms/step
1/1 [==============================] - ETA: 0s1/1 [==============================] - 0s 55ms/step
1/1 [==============================] - ETA: 0s1/1 [==============================] - 0s 44ms/step
[I 2024-12-23 16:14:34,873] Trial 17 finished with value: 0.26545122454117037 and parameters: {'n_units_0': 28, 'dropout_1': 0.15000000000000002, 'run': 3, 'epochs_1': 40, 'epochs_2': 80, 'lr_1': 0.008520499116629804, 'lr_2': 0.0002944842286938987, 'batch_size': 12, 'regularization': 'l1_l2', 'reg_alpha_1': 4.974053697039879e-05, 'reg_alpha_2': 1.0843603593919683e-05}. Best is trial 8 with value: 0.23325338811708746.
Statistics value = 11.0 p-value = 0.84375
1/1 [==============================] - ETA: 0s1/1 [==============================] - 0s 416ms/step
1/1 [==============================] - ETA: 0s1/1 [==============================] - 0s 402ms/step
1/1 [==============================] - ETA: 0s1/1 [==============================] - 0s 429ms/step
1/1 [==============================] - ETA: 0s1/1 [==============================] - 0s 412ms/step
1/1 [==============================] - ETA: 0s1/1 [==============================] - 0s 48ms/step
1/1 [==============================] - ETA: 0s1/1 [==============================] - 0s 55ms/step
[I 2024-12-23 16:14:40,368] Trial 18 finished with value: 0.5992655874975965 and parameters: {'n_units_0': 20, 'dropout_1': 0.1, 'run': 2, 'epochs_1': 90, 'epochs_2': 70, 'lr_1': 0.00010910502142703562, 'lr_2': 3.002764618689103e-05, 'batch_size': 8, 'regularization': 'l1_l2', 'reg_alpha_1': 6.321202426030285e-05, 'reg_alpha_2': 0.009559600486871545}. Best is trial 0 with value: 0.48275019641177624.
1/1 [==============================] - ETA: 0s1/1 [==============================] - 0s 422ms/step
1/1 [==============================] - ETA: 0s1/1 [==============================] - 0s 428ms/step
1/1 [==============================] - ETA: 0s1/1 [==============================] - 0s 48ms/step
1/1 [==============================] - ETA: 0s1/1 [==============================] - 0s 43ms/step
Statistics value = 10.0 p-value = 0.875
1/1 [==============================] - ETA: 0s1/1 [==============================] - 0s 413ms/step
1/1 [==============================] - ETA: 0s1/1 [==============================] - 0s 406ms/step
Statistics value = 3.0 p-value = 0.98828125
1/1 [==============================] - ETA: 0s1/1 [==============================] - 0s 457ms/step
1/1 [==============================] - ETA: 0s1/1 [==============================] - 0s 448ms/step
Statistics value = 33.0 p-value = 0.3125
1/1 [==============================] - ETA: 0s1/1 [==============================] - 0s 443ms/step
1/1 [==============================] - ETA: 0s1/1 [==============================] - 0s 352ms/step
1/1 [==============================] - ETA: 0s1/1 [==============================] - 0s 351ms/step
1/1 [==============================] - ETA: 0s1/1 [==============================] - 0s 343ms/step
1/1 [==============================] - ETA: 0s1/1 [==============================] - 0s 278ms/step
1/1 [==============================] - ETA: 0s1/1 [==============================] - 0s 360ms/step
1/1 [==============================] - ETA: 0s1/1 [==============================] - 0s 36ms/step
1/1 [==============================] - ETA: 0s1/1 [==============================] - 0s 39ms/step
1/1 [==============================] - ETA: 0s1/1 [==============================] - 0s 395ms/step
1/1 [==============================] - ETA: 0s1/1 [==============================] - 0s 418ms/step
1/1 [==============================] - ETA: 0s1/1 [==============================] - 0s 43ms/step
1/1 [==============================] - ETA: 0s1/1 [==============================] - 0s 42ms/step
[I 2024-12-23 16:15:23,046] Trial 19 finished with value: 0.3143009979395336 and parameters: {'n_units_0': 24, 'dropout_1': 0.15000000000000002, 'run': 2, 'epochs_1': 30, 'epochs_2': 30, 'lr_1': 0.0005308695300482681, 'lr_2': 3.312965424600571e-05, 'batch_size': 12, 'regularization': 'l1_l2', 'reg_alpha_1': 0.0023932297815924685, 'reg_alpha_2': 0.00017221754639746973}. Best is trial 2 with value: 0.28805260021606854.
Statistics value = 35.0 p-value = 0.24609375
1/1 [==============================] - ETA: 0s1/1 [==============================] - 0s 403ms/step
1/1 [==============================] - ETA: 0s1/1 [==============================] - 0s 429ms/step
1/1 [==============================] - ETA: 0s1/1 [==============================] - 0s 411ms/step
1/1 [==============================] - ETA: 0s1/1 [==============================] - 0s 399ms/step
1/1 [==============================] - ETA: 0s1/1 [==============================] - 0s 48ms/step
1/1 [==============================] - ETA: 0s1/1 [==============================] - 0s 48ms/step
1/1 [==============================] - ETA: 0s1/1 [==============================] - 0s 427ms/step
1/1 [==============================] - ETA: 0s1/1 [==============================] - 0s 402ms/step
1/1 [==============================] - ETA: 0s1/1 [==============================] - 0s 43ms/step
1/1 [==============================] - ETA: 0s1/1 [==============================] - 0s 39ms/step
Statistics value = 46.0 p-value = 0.0322265625
1/1 [==============================] - ETA: 0s1/1 [==============================] - 0s 407ms/step
[I 2024-12-23 16:15:40,660] Trial 19 finished with value: 0.6826466704899711 and parameters: {'n_units_0': 28, 'dropout_1': 0.15000000000000002, 'run': 2, 'epochs_1': 50, 'epochs_2': 30, 'lr_1': 0.0011608006220065455, 'lr_2': 0.00019040797923138605, 'batch_size': 16, 'regularization': 'None'}. Best is trial 0 with value: 0.48275019641177624.
1/1 [==============================] - ETA: 0s1/1 [==============================] - 0s 412ms/step
1/1 [==============================] - ETA: 0s1/1 [==============================] - 0s 400ms/step
1/1 [==============================] - ETA: 0s1/1 [==============================] - 0s 407ms/step
1/1 [==============================] - ETA: 0s1/1 [==============================] - 0s 411ms/step
1/1 [==============================] - ETA: 0s1/1 [==============================] - 0s 440ms/step
1/1 [==============================] - ETA: 0s1/1 [==============================] - 0s 56ms/step
1/1 [==============================] - ETA: 0s1/1 [==============================] - 0s 41ms/step
